artist,id,lyrics_owner_id,primary_artist_id,primary_artist_name,song_art_image_thumbnail_url,title,url,pageviews,lyrics
2 Chainz,3105783,1548008,14325,2 Chainz,https://images.genius.com/9523f2da218bbe687d2f1d131628239b.300x300x1.png,Saturday Night,https://genius.com/2-chainz-saturday-night-lyrics,58814,"Saturday Night Lyrics[Intro]
Y'all niggas lame for that, y'all niggas lame for that
Shoot a man in his back, should be ashamed of that
Young niggas banging back, young nigga banging back
Then we gon' fade to black then we gon' fade to black

[Verse 1]
I left the crib walking, drove a Mercedes back
You wasn't blessed with ambition so who you gon blame for that
Tried to get off the Act, still didn't know how to act
Still pull up in the back, sit my ass right in the back
Tell my driver when he open my door to take off his hat
Double saran everything so that you know its a wrap
Double salute anybody that made it out the trap
Some of y'all probably still owe me from back
In the back in the back in the back in the back
I had that work right in front of me fuck all you niggas you wannabes
Most of you niggas is under mes, I'ma give ya ass some to see
My car don't have car keys, my crib got palm trees
Pussy smell like sardine you, need to get up of my lawn please
This a real nigga conversation, real nigga demonstration real niggas
No Cristal or Hilfigers, a bunch of ignorant lil' niggas
A bunch of red young tenders, dark skin queens, Puerto Rican princess's
Scratch my hand my palms itching, hit the dope start twitching
This a new kinda kitchen, marble countertops, see through fridge
3 thousand for the microwave, touchscreen stove lil biiiiitch!!
Please don't make me relapse, make me start back trappin
Everybody in the city, saying that boy Tity done started back snapping
[Chorus]
I hit the trap today, I'm gon' hit the club tonight, yeah
I hit the trap today, I'm gon' hit the club tonight, yeah
I hit the trap today, I'm gon' hit the club tonight, yeah
Tell her let's go have a bite, tell her let's go have a bite
I hit the trap today, I'm gon' hit the club tonight, yeah
I hit the trap today, I'm gon' hit the club tonight, yeah
I hit the trap today, I'm gon' hit the club tonight, yeah
Treat every night like it's Saturday night, like it's Saturday night, yeah

[Verse 2]
I sat in the trap no one cooked at night, I treat my third strike like its Kryptonite
I stopped serving sacks over qualified, have you ever seen a homicide?
Have you ever seen ya partna die? Have you ever been traumatized
Even at graduation i had a bookbag full of yams, tryna multiply
Enough of the negative actions, I got my paycheck off passion
I'm wearing 4 bracelets for fashion, don't think its a race when I pass you
Stop talking that mafia shit, you never met Meech, J-bo or Illz
Luda charged me just to dip, was there when Chaka was swung on by Tip
I'm like oh shit we goon tear up this bitch, pull out a stick when u put up your fist
I'm like these niggas done fucked up my fit, funny how heaven and hell co exist
Funny how life can put you in the mix, I sold the pounds and go hustle the bricks
I booked studio with the trap money, Lil Wayne used to come get the bags from me
You still asking niggas for gas money, I look at these rappers like crash dummies
I look at these bitches that fuck with these rappers like bitch you just fucked with my last homie
Kesha can come get the last from me, Heaven can come get the last from me
Harmony can come get the last from me, Halo can come get the last from me MAMA!
[Chorus]
I hit the trap today, I'm gon' hit the club tonight, yeah
I hit the trap today, I'm gon' hit the club tonight, yeah
I hit the trap today, I'm gon' hit the club tonight, yeah
Tell her let's go have a bite, tell her let's go have a bite
I hit the trap today, I'm gon' hit the club tonight, yeah
I hit the trap today, I'm gon' hit the club tonight, yeah
I hit the trap today, I'm gon' hit the club tonight, yeah
Treat every night like it's Saturday night, like it's Saturday night, yeah8Embed"
2 Chainz,82864,36793,14325,2 Chainz,https://images.genius.com/0855f72cd21e5220ad89c1cc26c16d73.300x300x1.jpg,Money Machine,https://genius.com/2-chainz-money-machine-lyrics,57848,"Money Machine Lyrics[Intro]
I told them, get on my level
Bitch, you could get on this shovel
Coke prices high, than which was if a Tony Montana
I just got me a bezel
My slippers is clean
All I wear Tru Religion
I paid a grip for them jeans
I got a lust for the cream
I need a money machine
I need a money machine
I need a money machine
I see you doing your thing, but it ain't nothing to me
So when you looking at me, I give you something to see

[Verse 1]
I say I'm incredible, most legible
Schedule ain't, but I can make your girl flexible, edible
Put her top and call it putting her on my pedestal
You would never know, unless you worked at the bank
Camel toe, look like steak
And your boy look like great
2 gun bang
And I'm so fly I can sue an airplane
You can tell your girl here, because a cab came
And I keep it 100, I don't need no spare change
Some do it for the fame, some do it for the fortune
Fortunately I'm famous, 26's wheel of fortune
And I been riding foreign since the fucking introduction
[Chorus]
I see you doing your thing, it ain't got nothing to me
So when you looking at me, I give you something to see
I see you doing your thing, it ain't got nothing to me
So when you looking at me, I give you something to see
I need a money machine
I see you doing your thing, it ain't got nothing to me
So when you looking at me, I give you something to see

[Verse 2]
Yo it's my time to shine, so I'm checking my Rollie
A bet with the Lakers, I bought a necklace off Kobe
I be fucking your girl, I was texting her only
I told her, ""I'd like your legs better if they was open""
Ever since the beginning, niggas knew I was focused
Strip club tour started Magic, ended at Strokers
I'm a fucking example of a fucking example
Hit her from the back, nigga, that's a fucking example
I came up on Luke Campbell, I'm so sick I need Campbells
If you know I'm showing up, I hope you come with your camera
Got the city on swole with my Louis bandana
My car is shitting on niggas, I should ride with a Pamper

[Chorus]
I see you doing your thing, it ain't got nothing to me
So when you looking at me, I give you something to see
I see you doing your thing, it ain't got nothing to me
So when you looking at me, I give you something to see
I need a money machine
I see you doing your thing, it ain't got nothing to me
So when you looking at me, I give you something to see
[Verse 3]
I give you something to see when you are looking this way
If you approaching with the drama, then we approach with the K
And when you look in my eyes all you see is the pain
On medication, I can drink 200 a day
When you hot in the A, you get a spot in the A
It's so big that shit look like a spot in the A
These niggas jogging in place and they standing in line
Till somebody rhyme bout beating me, then they start dancing in line
And if swag was a crime, I'd be doing life plus 30
With my ice on early, in all gold knight sterling
Try to cook a brick off a George Foreman
Take a girl, it'll start spoiling
Living room floor look like a nigga going bowling

[Chorus]
I see you doing your thing, it ain't got nothing to me
So when you looking at me, I give you something to see
I see you doing your thing, it ain't got nothing to me
So when you looking at me, I give you something to see
I need a money machine
I see you doing your thing, it ain't got nothing to me
So when you looking at me, I give you something to see

[Outro]
I say it's my time to get it, my time to shine
I need a hustling trophy, it's my kind of grind
It's my time to get it, my time to shine
I need a hustling trophy, it's my kind of grind, bitch2Embed"
2 Chainz,214333,217970,14325,2 Chainz,https://s3.amazonaws.com/rapgenius/UMG_cvrart_00602537507474_01_RGB72_1500x1500_13UAAIM70647.1200x1200-75.jpg,Extra,https://genius.com/2-chainz-extra-lyrics,56559,"Extra Lyrics[Hook: 2 Chainz]
I got extra, I got extra
I got money, I got work
Far as hoes, I got a plethora

[Verse 1: 2 Chainz]
I get money, 12 gauge shotty
I don't like nothing but hoes and tattoos on my body, yeah
I got extras, you want some?
Fucked your girl on accident, that's a hit-and-run
Heaven's sake, it's been a hell of a day
I pray for all my niggas with a federal case, damn
Okay

[Bridge: 2 Chainz]
Southside, I got all this
Snake skin on my hat, albino
I'm rich, like Lionel, I get head like rhino
I'm ridin' on my rivals, survival, bible
Rifle, bullets, for y'all niggas!

[Hook: 2 Chainz]
I got extra, I got extra
I got money, I got work
Far as hoes, I got a plethora
[Verse 2: 2 Chainz]
I just went on the run, 100 piece for a show
I just had a threesome for three weeks in a row, yeah
Last name Chainz, first name 2
I'm T.R.U. to it, you know how I do it
I get head 'fore I screw it, first thing I do
Yeah, you know I'm stuntin' cause I'm gettin' to the money
Put it in her tummy, pu-put it in her tummy
Hit her with the morning dick, ooh, I ain't pissed yet
Yeah, I rep the A, the only thing I flunk is piss tests

[Bridge: 2 Chainz]
Southside, I got all this
Snake skin on my hat, albino
I'm rich, like Lionel, I get head like rhino
I'm ridin' on my rivals, survival, bible
Rifle, bullets, for y'all niggas!

[Hook: 2 Chainz]
I got extra, I got extra
I got money, I got work
Far as hoes, I got a plethora

[Verse 3: Rich Homie Quan]
Okay, I'm rich, like Homie
I got yo bitch, from my homie, 2 Chainz, what it do?
In the living room, full of that paper
Used to have a little room, now that's a house and an acre
My partner in the kitchen room, and he fucking with the bakin'
Chopper lift ya to the moon, nigga, fuck y'all thinking?
If I get her in the room, she gon' suck my babies
Tryna work her moves, tryna trap me with a baby
If you owe me money then, real soon, you better pay me
Me and 2 Chainz just like shoe strings, strapped like laces
Ay, and I'm too clean, riding in a car from the 80s
Rich Homie, no new team, boy, I'm a star like Macy's
Boy, I thank god I made it, got a couple broads in Decatur
I'm in the fast lane driving in the car, going crazy
And I got your main dame, yeah, the one you call your lady
First million dollars, most important thing: saving
And if you wanna book me, hit my agent
I got eight pounds in a old car
On old Nat in front of skate town on the
[Bridge: 2 Chainz]
Southside, I got all this
Snake skin on my hat, albino
I'm rich, like Lionel, I get head like rhino
I'm ridin' on my rivals, survival, bible
Rifle, bullets, for y'all niggas!

[Hook: 2 Chainz]
I got extra, I got extra
I got money, I got work
Far as hoes, I got a plethora8Embed"
2 Chainz,60815,54368,14325,2 Chainz,https://images.genius.com/82908e72685ad4d4fa667a2842fbd939.300x300x1.jpg,Feeling You,https://genius.com/2-chainz-feeling-you-lyrics,55954,"Feeling You Lyrics[Chorus]
2-hour long conversations on the phone, can't get you outta my mind
Baby are you feeling me, feeling you...
Everything you say and everything you do gets me lost in you days at a time
Tell me are you feeling me, feeling you... 2 Chaaaiinzz

[Verse 1]
Breaking up with my ex was the hard part
Had to pull the ass out like the gar-bage
Bout to take this new thang to a pinnacle
You feel me, feeling you I ma-ssage your physical
Thank God... I'm spiritual
She ask me what I'm finna do I say get into you
One leg up followed by the other
Get a little head then I find a rubber
We don't talk on the phone - we Tiger text
That mean she send a few flicks and I send a check
You 'memba Shonda, the one that had a Honda
Good head on her, you can learn a lot from her

[Chorus]
2-hour long conversations on the phone, can't get you outta my mind
Baby are you feeling me, feeling you...
Everything you say and everything you do gets me lost in you days at a time
Tell me are you feeling me, feeling you... 2 Chaaaiinzz
[Verse 2]
In the a.m. I think about her fragrance
When she met me I made her change all her statements
Not what she say... but what she bank
And how she think... I can't complain
On to the next one pro-gression
Keep the past and the present, separate
I got alotta spots like a leopard
One to trap in, one to have sex in
One to stack in, one to get dressed in
I'm getting married Ben Franklin my best man
3 cell phones she got all the numbers
I told her right then it was all or nothing
Yeah I'm on that loud I know you heard of me
Hair-weave killer, emergency
Hair-weave killer, I murder weaves
Hair-weave killer, murder scene

[Chorus]
2-hour long conversations on the phone, can't get you outta my mind
Baby are you feeling me, feeling you...
Everything you say and everything you do gets me lost in you days at a time
Tell me are you feeling me, feeling you... 2 Chaaaiinzz1Embed"
2 Chainz,422269,22533,14325,2 Chainz,https://images.genius.com/8b31226536bddeeb1ff5145959d1792f.300x300x1.jpg,Crib in My Closet,https://genius.com/2-chainz-crib-in-my-closet-lyrics,53178,"Crib in My Closet Lyrics[Intro]
808 Mafia
Metro Boomin want some more, nigga

[Verse 1: 2 Chainz]
Money machine at the bank, I just made me a deposit
Fucked that bitch right on the sink
Is it the pussy or is it the faucet?
I just left the hotel, never let ho in mi casa
All this designer shit it's like a crib in my closet
I got a crib in my closet, got a crib in my closet
Man, all this fuckin' gear it's like a crib in my closet
My Nike shoebox filled with rubber bands
That mean my Nike shoebox is my ATM
Fuck it, I said it, I'm winning, downsouth MC Ren
I might buy some Timbs, or peanut butter MCM
Raised down the street from a crack house
Pull her hair weave 'til the track out
Treat the rap game like a trap game
Tryna make a yellow ho tap out
I got Dolce, I ain't even worn yet, codeine I ain't even po' yet
I could spend millions of dollars, and still won't even be poor yet
Yeah, I'm a motherfucking poet, riding now, motherfucker Ol'Nat
A nigga wearing a Versace shirt, man that's a motherfucking throwback

[Chorus: 2 Chainz]
I got a crib in my closet, got a crib in my closet
All designer shit, I got a crib in my closet
I got a crib in my closet, got a crib in my closet
Man, all designer shit, I got a crib
All designer shit, all designer shit, I got a crib
All designer shit, all designer shit, I got a crib
All designer shit, all designer shit, I got a crib in my closet man
All designer shit, all designer shit, I got a crib in my closet, bitch
[Verse 2: A$AP Rocky]
Since rappin' turn to fashion, I don't know what happen
Or mishappens, matching turned to swagging
He exposed the world to trappin'
Picture posin' tactics
Hold this that click click, finna' blow this backwards
Money, hoes and fabrics
Scrolling past like ''fuck yo photo caption''
If ye ain't got it then you bragging, that's automatic
I see no need for me to Tweet, these bitches know my status
I'm the shit, all designer shit, got all kinds of shit
Got Prada around from 1999 and shit, bet you won't find the shit
I’m on my Anna shit, that’s Wintour
It’s dressed like it’s Met Ball
I’m in Vogue, this winter, the runway, no in store
Got a crib in my closet, Spanish chick in my casa
So much space in my closet, fit your crib in my closet

[Chorus: 2 Chainz]
I got a crib in my closet, got a crib in my closet
All designer shit, I got a crib in my closet
I got a crib in my closet, got a crib in my closet
Man, all designer shit, I got a crib
All designer shit, all designer shit, I got a crib
All designer shit, all designer shit, I got a crib
All designer shit, all designer shit, I got a crib in my closet man
All designer shit, all designer shit, I got a crib in my closet, bitch
[Verse 3: Rick Ross]
I got more sneakers than niggas, over 4000 pairs
Most all white like the Rhode Island mayor
Got a crib in my closet, hustle every day, nigga
If you work with them people, I’m unavailable, nigga
You smell like pork in a Mecca, Lord be my protector
Second row at the fight, bitch get on my level
Larry Merchant my nigga, I got Holyfield money
Finger your girl at Coachella, gotta roll in that for me
You should see me in Lennox, I shop ‘til I drop
Spent so much on the watch, had a seizure and shock
Wake up and ball, watch how I walk
Money all on my mind, call 'em lucrative thoughts

[Chorus: 2 Chainz]
I got a crib in my closet, got a crib in my closet
All designer shit, I got a crib in my closet
I got a crib in my closet, got a crib in my closet
Man, all designer shit, I got a crib
All designer shit, all designer shit, I got a crib
All designer shit, all designer shit, I got a crib
All designer shit, all designer shit, I got a crib in my closet man
All designer shit, all designer shit, I got a crib in my closet, bitch31Embed"
2 Chainz,6148551,498964,14325,2 Chainz,https://images.genius.com/65d11d6b26b91d3772dadba9ef17e1f5.300x300x1.jpg,Feel a Way,https://genius.com/2-chainz-feel-a-way-lyrics,52102,"Feel a Way Lyrics[Intro: 2 Chainz]
Okay
Alright

[Chorus: Brent Faiyaz & 2 Chainz]
A nigga never learned to save
I be ballin' anyway (I be ballin' any—)
God don't make no mistakes
God don't make no mistakes (Boom, boom)
A nigga never learned to save
I be ballin' anyway (Yeah, swish)
God don't make no mistakes
This life is give-and-take

[Verse 1: 2 Chainz]
Needed somethin' wavy to get my point across (Yeah)
I work for myself so I guess I work for a boss
Look up at the scoreboard and tell you who took the loss
Aim it at your Adam's apple, turn it to apple sauce
El captain turned Peter's street into a Motorcross (Skrrt)
Last one with Def Jam but I'm still goin' off (I'm still goin' off)
And it ain't about my masters, I'vе been ownin' mine
Had a white friend mad at mе 'cause I know Farrakhan (Boom)
And you know this is a hit, Barry Bonds
And my shawty gonna ride me like a Peloton (Ride)
Sophomore year I sold more crack than a windshield (Shit)
Dunk contest, jump over Lam' and did a windmill (Jump)
They ask me how I feel, I told 'em, ""Never better"" (Better)
Smokin' on opp, I roll more Ls than Peli Peli
I stay fly, yes I'm fly, land on Mike Pence
I do some stupid shit, don't let 'em dawg me like Mike Vick
[Chorus: Brent Faiyaz & 2 Chainz]
A nigga never learned to save (Yeah, uh)
I be ballin' anyway (I be ballin' anyway)
God don't make no mistakes (Respect it)
This life is give-and-take (Boom, boom)
(Southside)

[Verse 2: Kanye West, 2 Chainz & Both]
Don't let 'em make you feel a way
Could've freed more
If they only knew that they was slaves (Slaves, slaves, slaves)
Man, we gotta get away
Man, your boy done caught a wave
You should hear the way I say (Southside)
Talk, talk, talk to them people
Man, y'all don't even know the language
Man, I ain't finna do no lame shit
This a yacht and that's a long way from a slave ship
How they control our mind? (Mind)
How they control us though? (What?)
How they get us so, what? So emotional?
You think you Nat Turner, what you want the folks to know?
When Larry Jackson called, they let Frank Ocean go
Middle name Mandela (Me and momma sold dope together)
I can't hear you, Helen Keller (Since fifteen, I've been a felon)
A felon can vote, spread the message, exhale accapella
I still throw my diamond up, oh you still reppin' Roc-A-Fella?
Me and Dame in the studio, diamond up (What up Dame?)
Me and Biggs in the studio, time is up (What up Biggs?)
Woo, and I bet they feel a way
Thirteen thousand acres, I don't know where to stay (Southside)
[Chorus: Brent Faiyaz & 2 Chainz]
A nigga never learned to save (Yeah, uh)
I be ballin' anyway (I be ballin' anyway)
God don't make no mistakes (Respect it)
God don't make no mistakes (Boom, boom)
A nigga never learned to save (Yeah, uh)
I be ballin' anyway (I be ballin' anyway)
God don't make no mistakes
This life is give-and-take (Boom, boom)
(Southside)

[Outro]
(MWA Music)9Embed"
2 Chainz,214387,22494,14325,2 Chainz,https://s3.amazonaws.com/rapgenius/UMG_cvrart_00602537507474_01_RGB72_1500x1500_13UAAIM70647.1200x1200-75.jpg,Living,https://genius.com/2-chainz-living-lyrics,52081,"Living Lyrics[Verse 1: 2 Chainz]
Good head get your rent paid
Then I cut a corner like a switch blade
Bitch made nigga talking shit 'bout me
Got a red car so I bought a red bottom
Chillin' at the game sitting courtside
You looking at the flyest nigga on the boat ride
Low life, I'm a multi nigga fo' life
Oh my, had it up to here like a bow tie
Cut it out, sold drugs out my momma's house
So for mothers' day, I bought my mom a house
Chillin' in the club standing on the couch
Nigga, fuck yo couch, nigga, nigga, fuck yo' couch!
Shoes cost more than that shit anyway
Any day, when the semi spray, bet it penetrate
Brrraaatt, better duck, nigga!
Got a lake in my yard filled with dope, nigga!

[Hook: 2 Chainz]
I'm just livin' baby, and you got that right
I'm just livin' baby, I'mma enjoy this night
I'm just livin' baby, I'm just livin'
I'm just livin' baby, I'm just livin'

[Verse 2: 2 Chainz]
Motherfuck the other side, (motherfuck the other side)
Motherfuck the other side, (motherfuck the other side)
Everything official, my pistol's dismissin' missiles
As far as running game, my nigga, I need a whistle
My nigga, I need your sister, oops, I don't think that came out
Still fuck a girl with my chain out
Still do my thing with my thing out
Long ass clip, I could shoot you without aiming
My life, your motherfuckin' entertainment
Dangerous, leave you with the angels
Shoot yo' ass from all types of angles, explain this
Well, it was just bunch of niggas and then just me
They came close and it just skeet
They tried to run and I said ""Come back""
If you think you're alone then there Bobby Womack
Hold that, ridin' that Phantom down Old Nat
Nigga said ""What up, pimp? Where the hoes at?""
[Hook: 2 Chainz]
I'm just livin' baby, and you got that right
I'm just livin' baby, I'mma enjoy this night
I'm just livin' baby, I'm just livin'
I'm just livin' baby, I'm just livin'

[Verse 3: IamSu!]
Ride around on my side of town
You might fuck around and get peeled
I rock Mookee, rock Y3, got Bathing Apes on my heels
Nigga, this ain't no game, there ain't no competition
I knew he was a fake, got good intuition
23 and I'm still livin'
Been all around the world and it's still Richmond
Cause I'm loyal to my soil, good to my hood like oil
Got me in that water, bet it boil
Bitch, I'm a boy, beat the beat up like Roy
Consider your bitch my employ', real to the core
Straight up, I never been fraud, and I put that on my lord
Y'all rap 'bout clothes that you cannot afford
Where's the Versace and where's the Tom Ford?
Everything we rap 'bout, that shit be ours
This bitch a freak, she should get the award, aye

[Hook: 2 Chainz]
I'm just livin' baby, and you got that right
I'm just livin' baby, I'mma enjoy this night
I'm just livin' baby, I'm just livin'
I'm just livin' baby, I'm just livin'9Embed"
