artist,id,lyrics_owner_id,primary_artist_id,primary_artist_name,song_art_image_thumbnail_url,title,url,pageviews,lyrics
2 Chainz,81901,11524,14325,2 Chainz,https://images.rapgenius.com/662aecc043e00e2024c2edca76be933a.300x300x1.jpg,Birthday Song,https://genius.com/2-chainz-birthday-song-lyrics,2329216,"Birthday Song Lyrics[Intro: 2 Chainz]
Yeah birthday, it's your birthday
If I die, bury me inside the Louis store
Ha, uh, uh

[Chorus: 2 Chainz]
They ask me what I do and who I do it for (yeah)
And how I come up with this shit up in the studio (yeah)
All I want for my birthday is a big booty ho (true)
All I want for my birthday is a big booty ho (tell 'em)
When I die, bury me inside the Gucci store (tell 'em)
When I die, bury me inside the Louis store (true)
All I want for my birthday is a big booty ho (yeah)
All I want for my birthday is a big booty ho (2 Chainz!)

[Verse 1: 2 Chainz]
She got a big booty so I call her Big Booty (booty)
Skrr, skrr, wrists movin', cookin', gettin' to it (cookin')
I'm in the kitchen (I'm in the kitchen) yams everywhere (yams)
Just made a juug (just made a juug) I got bands everywhere (bands)
You the realest nigga breathin' if I hold my breath (damn)
Referee with a whistle, brrrt, hold this tech (baow)
Extendo clip (extendo clip) extendo roll (extendo roll)
When yo girl leave me, she need a hair salon (damn)
Hair-Hair Weave Killer goin' on a trapathon (yeah)
See I done had more bombs, than Pakistan (boom)
Dope bomb, dro bomb and a pill bomb (bomb)
See nigga, I'm ballin', you in will call (true)
When I die, bury me inside the jewelry store (2 Chainz)
When I die, bury me inside the Truey store (true)
True to my religion, two everything, I'm too different
So when I die, bury me next to two bitches (two bitches)
[Chorus: 2 Chainz]
They ask me what I do and who I do it for (yeah)
And how I come up with this shit up in the studio (yeah)
All I want for my birthday is a big booty ho (true)
All I want for my birthday is a big booty ho (tell 'em)
When I die, bury me inside the Gucci store (tell 'em)
When I die, bury me inside the Louis store (true)
All I want for my birthday is a big booty ho (yeah)
All I want for my birthday is a big booty ho

[Verse 2: Kanye West]
Ah, Yeezy, Yeezy, how you do it, huh?
It's my birthday, I deserve to be greedy, huh?
She holdin' out, she ain't givin' to the needy, huh?
You go downstairs and fall asleep with the TV on
Y'all been together ten years, you deserve a ménage
'Specially if you put that BMW in a garage
'Specially if you paid a couple payments on her momma crib
Went to her niece's graduation, man, I hate those kids!
Last birthday, she got you a new sweater
Put it on, give her a kiss, and tell her ""Do better""
She said, ""How 'bout I get you jewelry from the West End?""
How 'bout she hit the Westin and get her best friend?
Ha, I'm jokin', I'm just serious, I asked her
""Don't be actin', like no actress, if we preachin', then we practice
Don't be reachin', don't be touchin' shit, we in Kanye West's Benz!
'Cause I will turn you back to a pedestrian, hah!""
[Chorus: 2 Chainz]
They ask me what I do and who I do it for (yeah)
And how I come up with this shit up in the studio (yeah)
All I want for my birthday is a big booty ho (true)
All I want for my birthday is a big booty ho (tell 'em)
When I die, bury me inside the Gucci store (tell 'em)
When I die, bury me inside the Louis store (true)
All I want for my birthday is a big booty ho (yeah)
All I want for my birthday is a big booty ho

[Verse 3: 2 Chainz & Kanye West]
It's your birthday (yeah) it's your birthday (uh)
Bad bitch contest, you in first place
You in first place, you in first place
Bad bitch contest, you in first place
I show up with a check to your workplace
Then hand the valet the keys to the Merces
Tell the DJ play your song, this shit come on
What I'm seeing from the back I can't front on
They ask me what I do and who I do it for
When I die, bury me inside the booty club
Get it, girl, get it, girl, get it, get it, girl
I might switch it up and get your girl

[Chorus: 2 Chainz]
They ask me what I do and who I do it for (yeah)
And how I come up with this shit up in the studio (yeah)
All I want for my birthday is a big booty ho (true)
All I want for my birthday is a big booty ho (tell 'em)
When I die, bury me inside the Gucci store (tell 'em)
When I die, bury me inside the Louis store (true)
All I want for my birthday is a big booty ho (yeah)
All I want for my birthday is a big booty ho
[Outro: 2 Chainz & Kanye West]
Deuce and 'Ye
We like Snoop and Dre
Isn't this your birthday, baby?
You deserve a coupe today, whoa!
You in first place, you in first place
Bad bitch contest, you in first place98Embed"
2 Chainz,72995,89199,14325,2 Chainz,https://images.rapgenius.com/8befd9dc1570de23f6567b535da8b874.300x300x1.jpg,No Lie,https://genius.com/2-chainz-no-lie-lyrics,2131565,"No Lie Lyrics[Intro: 2 Chainz]
EarDrummers, Mike WiLL Made-It
Yah! T.R.U., 2 Chainz!

[Verse 1: 2 Chainz]
I am smokin' on that gas, life should be on Cinemax
Movie, bought my boo bigger tits and a bigger ass
Who he’s? Not I, I smoke strong; that Popeye
Louie V’s in my archives, black diamonds; apartheid
Bread up and my top down, on the block with a block out
Hit your ass with that bla-kow, dope enough to go in yo' nostrils
I take your girl and kidnap her, feed her to my mattress
A skeleton in my closet, it's probably one of these dead-ass rappers
It's probably one of these pussy-ass niggas, don't try me, I'll pull that trigger
Got your car note in my cup, and your rent in my Swisher
That pussy so good I miss ya, head game's so vicious
And all I get is cheese, like I’m takin' pictures

[Hook: Drake]
Yeah, I say fuck you, 'less I’m with ya
If I take you out of the picture, I know real niggas won't miss ya
No lie, no lie, no lie-ee-i-ee-i
No lie, no lie, no lie-ee-i-ee-i
Real niggas say word
You ain't never told no lie, you ain't never told no lie
Real niggas say word
You ain't never told no lie, you ain't never told no lie
Real niggas say true
You ain't never told no lie, you ain't never told no lie
That's a thing I don’t do, nah, I just do it for the niggas
That are tryna see a million 'fore they die, whattup?
[Verse 2: Drake]
2 Chainz and Champagne, you want true? That’s true enough
Forbes list like every year, my office is my tour bus
She came through, she brought food, she got fucked, she knew whassup
She think I’m the realest out and I say, ""Damn, that makes two of us""
Aww, that look like what’s her name, chances are it’s what's her name
Chances are if she was acting up then I fucked her once and never fucked again
She could have a Grammy, I still treat her ass like a nominee
Just need to know what that pussy like so one time is fine with me
Young as an intern, but money like I built the shit
Streets talkin', they'll confirm, go ask them who just killed the shit
Stay keepin' my cup full so I’m extra charged like a state tax
Me and Chainz go way back, we don’t talk shit, we just state facts
Yes, Lord

[Hook: Drake]
Yeah, I say fuck you, 'less I’m with ya
If I take you out of the picture, I know real niggas won't miss ya
No lie, no lie, no lie-ee-i-ee-i
No lie, no lie, no lie-ee-i-ee-i
Real niggas say word
You ain't never told no lie, you ain't never told no lie
Real niggas say word
You ain't never told no lie, you ain't never told no lie
Real niggas say true
You ain't never told no lie, you ain't never told no lie
That's a thing I don’t do
Nah, I just do it for the niggas
That are tryna see a million 'fore they die
Whattup?
[Verse 3: 2 Chainz]
Name a nigga that want some, I’ll out-rap his ass, out-trap his ass
Put his ass in a plastic bag with his trashy ass, take him out
Bring 'em in, them whole things, 2Pac without a nose ring
Thug Life, one wife, a mistress and a girlfriend
I did what they say I wouldn’t, went where they say I couldn’t (Tru!)
YSL belt buckle, y’all niggas sure is lookin'
Y’all niggas sure is lucky, two chains on my rugby
Left hand on that steering wheel, right hand on that pussy

[Hook: Drake]
Yeah, I say fuck you, 'less I’m with ya
If I take you out of the picture, I know real niggas won't miss ya
No lie, no lie, no lie-ee-i-ee-i
No lie, no lie, no lie-ee-i-ee-i
Real niggas say word
You ain't never told no lie, you ain't never told no lie
Real niggas say word
You ain't never told no lie, you ain't never told no lie
Real niggas say true
You ain't never told no lie, you ain't never told no lie
That's a thing I don’t do, nah, I just do it for the niggas
That are tryna see a million 'fore they die, whattup?

[Outro: 2 Chainz]
Word, word, T.R.U62Embed"
2 Chainz,82860,36793,14325,2 Chainz,https://images.rapgenius.com/16919d6a966f3f90880c623c81e0235a.300x300x1.jpg,I’m Different,https://genius.com/2-chainz-im-different-lyrics,1880735,"I’m Different Lyrics[Intro: 2 Chainz & YG]
Yeah
Yeah
2 Chainz
Mustard on the beat, ho!
[Chorus: 2 Chainz]
I'm different, yeah, I'm different
I'm different, yeah, I'm different
I'm different, yeah, I'm different
Pull up to the scene with my ceiling missing
Pull up to the scene with my ceiling missing
Pull up to the scene with my ceiling missing
Pull up to the scene with my ceiling missing
Middle finger up to my competition
I'm different, yeah, I'm different (Yeah)
I'm different, yeah, I'm different (Yeah)
I'm different, yeah, I'm different (Tru)
Pull up to the scene with my ceiling missing

[Verse 1: 2 Chainz]
Pull up to the scene, but my roof gone (Roof gone)
When I leave the scene, bet your boo gone (Boo gone)
And I beat the pussy like a new song (Boom)
2 Chainz, but I got me a few on (Yup)
Everything hot, skip lukewarm (Ugh)
Tell shawty bust it open, Uncle Luke on
Got the present for the present and a gift wrapping
I don't feel good, but my trigger happy (Bah)
Bet the stripper happy, bet they wish they had me
And I wish a nigga would, like a kitchen cabinet
And me and you are cut from a different fabric
I fucked her so good, it's a bad habit (DamN)
Bitch, sit down, you got a bad atti'
Gave her the wrong number and a bad addy (Tru)
You ain't going nowhere like a bad navi'
Ass so big, I told her to look back at it (Whoa)
Look back at it (Whoa), look back at it (Whoa)
Then I put a fat rabbit on the Craftmatic
I am so high ... attic
I am so high, like a ... addict
[Chorus: 2 Chainz]
I'm different, yeah, I'm different
I'm different, yeah, I'm different
I'm different, yeah, I'm different
Pull up to the scene with my ceiling missing
Pull up to the scene with my ceiling missing
Pull up to the scene with my ceiling missing
Pull up to the scene with my ceiling missing
Middle finger up to my competition
I'm different, yeah, I'm different
I'm different, yeah, I'm different (Yeah)
I'm different, yeah, I'm different (Ugh)
Pull up to the scene with my ceiling missing

[Verse 2: 2 Chainz]
2 Chainz, got your girl on the celly
And when I get off the celly, I made her meet at the telly
When she meet at the telly, I put it straight in her belly
When it go in the belly, it ain't shit you can tell me, ugh (Ugh)
Hair long (Long), money long (Yeah)
Me and broke niggas, we don't get along (Nah)
Hair long (Long), money long (Yeah)
Me and broke niggas, we don't get along (Tell 'em)
I paid a thousand dollars for my sneakers
'Ye told you, a 100K for a feature
""Ee-err, ee-err"": sound of the bed (Bed)
Beat it up, beat it up; then, I get some head (Head)
Well, I might get some head; then, I beat it up
I don't give a fuck, switch it up, nigga, live it up (Up)
Yeah, it's going down, so get up (Up)
Might valet-park a Brinks truck (Ugh)
[Break: YG]
Mustard on the beat, ho!
[Chorus: 2 Chainz]
I'm different, yeah, I'm different
I'm different, yeah, I'm different
I'm different, yeah, I'm different
Pull up to the scene with my ceiling missing
Pull up to the scene with my ceiling missing
Pull up to the scene with my ceiling missing
Pull up to the scene with my ceiling missing
Middle finger up to my competition
I'm different, yeah, I'm different
I'm different, yeah, I'm different
I'm different, yeah, I'm different
Pull up to the scene with my ceiling missing72Embed"
2 Chainz,2885798,409643,14325,2 Chainz,https://images.genius.com/30d104032b59eec7970a8903f2c71127.300x300x1.jpg,Good Drank,https://genius.com/2-chainz-good-drank-lyrics,752471,"Good Drank Lyrics[Intro: 2 Chainz]
Uhh, alright
I did it, hahah, yeah

[Verse 1: 2 Chainz]
Used to treat my mattress like the ATM, yeah
Bond No. 9 that's my favorite scent, yeah
Can't forget the kush, I'm talking OG, yeah
Rest in peace to pop, he was an OG, oh yeah
285 I had that pack on me, uh
I cannot forget I had that strap on me, yeah
Rest in peace to my nigga Doe (Troup)
All we ever want to do is ball
That was the easy part, we playing that Weezy hard
We sit in the kitchen late, we tryna to make an escape
Trying to make me a mil', so I'ma keep me a plate
I told 'em shawty can leave, so I'ma keep me a rake
So I'ma keep me a Wraith, my jewelry look like a lake
Today I'm in the Maybach
And that car came with some drapes
You know I look like a safe, I put you back in your place
I look you right in your face, sing to your bitch like I'm Drake
Yeah

[Chorus: Quavo]
Good drank, big knots
Good drugs, I put a four on the rocks (lean!)
Drop top, no hot box
12 tried to pull me over, pink slips to the cops
She said the molly give her thizz face
Put the dick in her rib cage
Whips out, Kunta Kinte
Diamonds clear like Bombay
Take your babies, no Harambe
Play with keys like Doc Dre
3K like André
And your girl, call her, come through
[Verse 2: Gucci Mane]
It's Gucci! Huh (brr!) huh!
Your trunk in the front
Well check this out my top in the trunk
You play with my money
Then check this out, yo, poppin' the trunk
Three mil in a month
But I just did three years on a bunk
Oh, you in a slump
I'm headed to Oakland like  Kevin Da Runt
What is your point?
Square with the stamp, for Kevin Durant
Lay on on my trap
Play with my cap and I'll knock off your hat
I'm taking the cheese and killing the rats
Gucci Mane, call me the cat with the racks
I'm swervin', but I'm in back of the 'Bach
I'm Persian, man I got hoes from Iraq
I'm servin' I pay a bird for that
He nervous, ain’t got no words for that
He hurt and want all of his purses back
He mixing the syrup with the Percocets
She perfect and she got perky breasts
I just want some of that turkey neck
Trapper of the year, I'm from Bouldercrest
You snitch of the year cause you told the bis'
[Chorus: Quavo]
Good drank, big knots
Good drugs, I put a four on the rocks
Drop top, no hot box
12 tried to pull me over, pink slips to the cops
She said the molly give her thizz face
Put the dick in her rib cage
Whips out Kunta Kinte
Diamonds clear like Bombay
Take your babies, no Harambe
Play with keys like Doc Dre
3K like Andre
And your girl, call her, come through

[Outro: 2 Chainz]
Ayy, Mike Dean
This shit hard as fuck, bruh
You a living legend, I appreciate that
Ayy, Guwop, I'm glad you home, cuz
Quavo, you already know man
You got next on these niggas double salute man
True shit, 2 Chainz!
Hair Weave Killer
Daniel Son, the Necklace Don
Chapo Jr
I mean, I can go on for days48Embed"
2 Chainz,160321,149650,14325,2 Chainz,https://images.genius.com/bbc2c1b7e5e85f291275eac6d366366b.300x300x1.jpg,Feds Watching,https://genius.com/2-chainz-feds-watching-lyrics,579253,"Feds Watching Lyrics[Intro: Pharrell & 2 Chainz]
Uh, oh, oh, oh
Tomorrow, tomorrow
Tomorrow, tomorrow (Yeah)
Tomorrow, tomorrow (I’m talking right now)
Tomorrow, tomorrow (I’m talking right now)
Ain’t no such thing as tomorrow
Tomorrow, tomorrow
Tomorrow, tomorrow
Uh, the way we living today
I’m talking right now
Tomorrow, tomorrow
Do, do, do, do, do
(2 Chainz!)

[Verse 1: 2 Chainz]
Dreads hang on designer everything
Mr. Comme des Garçons, Mr. Alexander Wang
Mr. Chain, pinky ring, flow insane, ho insane
Man, these shoes I got on, these the hardest I've done seen
It look clean when you pour it; I remix it make it dirty
If she got good head and text me I text back and tell her ""hurry""
This that category 5 when I walk up in the strip club
Throw it high, make you and George Washington head butt
OG's never fed us, now young niggas fed up
Ballin' so hard I deserve a and one
Baking soda marketing, I'm getting it ain't I? Obviously
You a bitch, you a ho, that's just my philosophy
And I'm known to kick it like the captain of a soccer team
Billie Jean red leather same color Red Lobster
And she brain wash ya -- head doctor
I'ma be fresh as hell if the Feds watching
[Hook: 2 Chainz & Pharrell]
I'ma be fresh as hell if the Feds watching
I'ma be fresh as hell if the Feds watching
I'ma be fresh as hell if the Feds watching
Drop top, head bopping
I'ma be fresh as hell if the Feds watching
I'ma be fresh as hell if the Feds watching
I'ma be fresh as hell if the Feds watching
Drop top, head bopping

[Verse 2: 2 Chainz]
Grams to Grammys, two guns Yosemite
Niggas put their Glock on your ass, fuck that Heather B
Pumping that amphetamine, all this D I'm peddling
I be somewhere settling, somewhere that you have never been
To the top you never been, you might need a respirator
Money on the rise like I'm counting on an elevator
You gon' need a detonator swimming with them barracudas
Close the docket on that ma'fucka prosecutor
This Armani, this Givenchy, I parachute you
I'm so fly I jumped out the air wearing Gucci (Tell 'em!)
I'm raw, talking California Rolls
Smoking California weed with California hoes (Truu!)
Sending flicks to my partners in the state pen
I just got some pants made out of snake skin
See them shades you got on called Ray-Bans
And the shades I got on cost eight bands (damn)
[Hook]
I'ma be fresh as hell if the Feds watching
I'ma be fresh as hell if the Feds watching
I'ma be fresh as hell if the Feds watching
Drop top, head bopping
I'ma be fresh as hell if the Feds watching
I'ma be fresh as hell if the Feds watching
I'ma be fresh as hell if the Feds watching
Drop top, head bopping36Embed"
2 Chainz,3105427,1489243,14325,2 Chainz,https://images.genius.com/9523f2da218bbe687d2f1d131628239b.300x300x1.png,4 AM,https://genius.com/2-chainz-4-am-lyrics,490369,"4 AM Lyrics[Intro: 2 Chainz]
Yeah, yeah, yeah
M-M-M-Murda
Yeah, yeah
Damn right, bro

[Verse 1: 2 Chainz]
4 AM, I'm just gettin' started
For my birthday I threw me a surprise party
Reminiscin' 'bout the trap, playin' the first Carter
My life changed when I had my first daughter
Got my first quarter flippin' 50 dollar slabs
Your nigga's lookin' at the bills, askin' you for half
Cut from a different cloth, take pride in results
Anytime she wanna dip I'm providin' the sauce
You on side of the boss, so you kind of the boss
You keep playin' with me, I end up signing your boss
Drop an EP on a nigga for the free-free on a nigga
Yeah you ZZ on a nigga, king like BB on you niggas
Rock with Champagne P
If it wasn't for the struggle then I wouldn't be me
Call me Deuce or Dos, anything but broke
Got my aim from the scope, got the game by the throat, damn!

[Chorus: Travis Scott]
Okay, you popped up on me by surprise (Yeah, yeah)
You see I never took you for the poppin' type (Straight up)
Damn, it's 4 AM so please believe the hype (It's lit)
Hit the lights (Yeah), I'm way over top
Pop it, flick it
Drop a pin, send a location (Skrrt, skrrt)
I'ma pull up in that bullet-coupe spaceship (Skrrt, skrrt)
Drop off a bag of some dangerous (Yeah)
I'ma hit you, 4 AM, see if you make it (Yeah)
[Verse 2: 2 Chainz]
I dropped ColleGrove out the sky, ooh
In a group with the best rapper that's alive, ooh
Never turn my back on my slime, ooh
I ain't wanna fuck the bitch but she was fine, ooh
Hold up baby, let me take my time, ooh
Hard to get some head and try to drive, ooh
Jumpin' out the cake and that's surprisin', ooh
Pickin' up the duffel bag like exercisin', ooh
Bought mama new house 'cause she deserve it, ooh
Practice makes perfect but nobody's perfect, ooh
Escobar is not open for service, ooh
Send you to Dr. Miami for your surgery, ooh

[Chorus: Travis Scott]
Okay, you popped up on me by surprise (Yeah, yeah)
You see I never took you for the poppin' type (Straight up)
Damn, it's 4 AM so please believe the hype (It's lit)
Hit the lights (Yeah), I'm way over top
Pop it, flick it
Drop a pin, send a location (Skrrt, skrrt)
I'ma pull up in that bullet-coupe spaceship (Skrrt, skrrt)
Drop off a bag of some dangerous (Yeah)
I'ma hit you, 4 AM, see if you make it (Yeah)

[Verse 3: 2 Chainz & Travis Scott]
Ooh, Riccardo Tisci on the crewneck
Ooh, on a killin' rapper spree and nigga, you next
Ooh, they talkin', chillin', watchin' Netflix (Straight up)
Ooh, I used to trap and watch bootlegs
Ooh, I'm on my wave like a durag
Ooh, I see your boo, now where your crew at?
Ooh, talkin' tequila for the pipe-up
Ooh, I hope you got a clean vagina, yeah
Drench god, drench god, really
Representin', we the squad, really (Oh, yeah)
Tec got the Rollie, now I get it
I used to sell drugs for a living
Got me a job sellin' records
Had to use my jeweler for a reference
Might buy a charm with the extras
Might use her legs for a necklace
[Chorus: Travis Scott]
Okay, you popped up on me by surprise (Yeah, yeah)
You see I never took you for the poppin' type (Straight up)
Damn, it's 4 AM so please believe the hype (It's lit)
Hit the lights (Yeah), I'm way over top
Pop it, flick it
Drop a pin, send a location (Skrrt, skrrt)
I'ma pull up in that bullet-coupe spaceship (Skrrt, skrrt)
Drop off a bag of some dangerous (Yeah)
I'ma hit you, 4 AM, see if you make it (Yeah)

[Outro]
Don't stop trappin', boy
Got 'bout 12 racks this mornin'
Got 'bout 12 racks
Started last night, still goin'
12 racks strong
Got the pitbull in the corner, she pregnant
Got the crackhead in the corner, she pregnant
Everybody in here pregnant, 'cept my partner and them
But we gettin' this money though, I'm tellin' you that31Embed"
2 Chainz,2255131,672397,14325,2 Chainz,https://images.genius.com/d26ea9c73e15e583b4e82ce9d1405d23.300x300x1.jpg,Watch Out,https://genius.com/2-chainz-watch-out-lyrics,453124,"Watch Out Lyrics[Intro]
Yo, okay
All my niggas with me
All my niggas with it
All my niggas ballin'
All my niggas athletic
All my niggas A1
All got street cred
All my niggas ballin'
All my niggas athletic

[Verse 1]
Pulled up in a Phantom
Pulled off with a dancer
Got a pocket full of money
Kinda hard to keep my pants up
Nigga tryna run them bands up
Fuck a bitch with my hands up
Lil Quay fuck the Xans up
Kinda hard to understand her
Duffle bags in the Escalade
Call the bitch, there a bread truck
Got the bitch going retarded
Call Uber for a spare truck
All these niggas never scared us
All these niggas never ran up
Bitch tryna put the head on me
Niggas tryna put the feds on me!
Niggas tryna take meds on me
Everything for the players only
Niggas sunny like Arizona
Gunshots just for sayin' something
Spraying shit like aerosol
You a foul and that's a fair ball
Nigga can't reach the goals
Keep shootin' them damn air balls
[Hook]
Watch out, lil bitch
Watch out, lil bitch
Watch out, lil bitch
Uh, watch out, lil bitch
You getting mad
I'm getting rich!
You getting mad
And I'm getting rich!
Watch out, lil bitch
Watch out, lil bitch
Watch out, lil bitch (Stiff arm)
Hey, watch out, lil bitch
You getting mad
I'm getting rich
You getting mad
Bitch, I'm getting rich

[Verse 2]
Watch out, lil ho
My partners still smoke on parole
They say that I'm crazy
I used to talk to a stove
I tell it to lock, shit, I tell it a lot
Go to the dealership, fishtail off the lot
You know I'm comin' straight out the block
You know I'm comin' straight of the top
Shawty said she want 5 million
'Cause I told her to leave and called her a thot
Shit, you can like it or not, damn
I'm comin' straight out the pot
Still got some Act' in my stock
Nigga I ain't gotta lie
Nigga I ain't gotta try
You wavin' that thing in the sky?
We wavin' that thing at your body
We wavin' that thing at your eye!
Look at the watch on my wrist
Got 'em all watchin' my wrist
Told that lil bitch I'll pass
Nigga watch the assist
I run the trap like the marathon
You niggas softer than silicone
You know what it's like when the feelin' gone
I know what it's like when the ceilin' gone
I had a sit down with Farrakhan
Turn the White House to the Terrordome
I used to serve at the Chevron
I used to serve with my necklace on, bitch!
[Hook]
Watch out, lil bitch
Watch out, lil bitch
Watch out, lil bitch
Uh, watch out, lil bitch
You getting mad
I'm getting rich
You getting mad
And I'm getting rich
Watch out, lil bitch
Watch out, lil bitch
Watch out, lil bitch
(Stiff arm)
Hey, watch out, lil bitch
You getting mad
I'm getting rich
You getting mad
Bitch, I'm getting rich

[Directed by Motion Family]34Embed"
