artist,id,lyrics_owner_id,primary_artist_id,primary_artist_name,song_art_image_thumbnail_url,title,url,pageviews,lyrics
2 Chainz,2433471,104344,14325,2 Chainz,https://images.genius.com/2619f4552370c540bb233c980a76a442.300x300x1.jpg,Bounce,https://genius.com/2-chainz-bounce-lyrics,196412,"Bounce Lyrics[Intro: Lil Wayne]
3 Chainz, oww

[Verse 1: Lil Wayne]
Caught up in my bullshit, put your head on backwards
And skate off after, engage in laughter 'bout what just happened
Fingers in napkins get sent to mammies, is that too graphic?
Catch you in traffic, you sitting Daffy like stealing candy
My ceiling’s absent, my wheels are massive, my friends assassins
All of us bastards, our mothers queens and our women dancers
My rivers rapid, my fins are splashin’, my gills are flappin’
I bit some matches then sipped some gas and went kiss a dragon

[Verse 2: 2 Chainz]
I’m really rappin’, no finger snappin’, I’m pistol packin’
Y’all niggas slippin’, my swag is drippin’, so here’s a napkin
What’s really happnin’? Verbal attackin’, I’m showing passion
Know what I mean, see I’m the king like I’m from Akron
I’m going overboard, somebody call the captain
And when it come to getting checks, I always want the fat ones
I’m so high I can sing to a chandelier
My flow a glass of Ace of Spade and yours a can of beer

[Verse 3: Lil Wayne]
Too many bitches, too many blunts, too many buttons
Not enough bullets, them niggas buggin’, the SWAT is comin’
AK on shoulder, no shoulder shruggin', aim at ya nugget
My weed sticky like acupuncture and magnets, honey
Knock on the side door three times and have your money
Or get to steppin' like Kappas stompin', I'll slap a junkie
I’m having lunch with Italian Sonny, don’t ask the subject
Lord, why you took Rabbit from me? He say, ""Don't ask me nothing""
Too many bodies, too many bangers, too many bundles
Not enough bullets, these niggas buggin', I heard they stung you
It’s gon' be trouble, we come through and catch you while you cuddle
Them shotgun barrels like tunnels nigga, don't even mumble
[Verse 4: 2 Chainz]
I’m back to ballin', I'm in the back full of magnums only
Pull on the scene and I fuck your queen playing Pastor Troy
Our weed ready, turkey spaghetti and caster oil
That's codeine, turn your guillotine to a fashion show
In four minutes I'll turn this into forensics
In a foreign car with a foreign broad that’s long winded
Paper long and you taking long, you just don't get it
Hung the phone up on Satan, told me he want a song with me
Hotter than Mississippi in summer of 1950s
In a van full of some niggas and white bitches
Get pulled over for swervin’ like, ""Hi, officer""
When he ask me why I was swerving, ""I’m high, officer""

[Hook: 2 Chainz]
I can make it bounce by myself
I can make it bounce by myself
I can make it bounce by myself
I can make it bounce by myself
I can make it bounce by myself
I can make it bounce by myself
I can make it bounce by myself
I can make it bounce by myself

[Verse 5: Lil Wayne]
Got a mansion, a condo, a cabin, I sleep in my Phantom
So high dancing with the stars to the Star Spangled Banner
I change your channel, I change your pattern, I ring your Saturn
I bang your madam, she get on top and I shake the ladder
I make her straddle then gather and calculate the data
I listen up for the snakes or the baby rattle
I play the shadows, don’t play no games, I straight get at ‘em
I’m on the chronic all day like it’s my favorite album
[Verse 6: 2 Chainz]
A plate of salmon, the Cayman Islands, a stripper dancer
If I don’t get the car first, I’ll have a temper tantrum
I’m innovative, I demonstrated, this nickle plated
I don’t care if you owe me a nick, nigga you need to pay me
I kiss ya lady, eat her pussy then kiss the baby
Get situated, get keys off table then leave her 80
I really made it, get it maid, Schwarzenegger
Won’t wrestle niggas, I spatula all you action figures

[Verse 7: Lil Wayne]
I’m so high the blunt feel like a dumbbell
These niggas tiny like a spider on a Spud Webb
I got some upscale cocaine on my thumbnail
I feed it to my fun girls, they say fuck yeah

[Verse 8: 2 Chainz]
I’m doing this shit like whatever
When I go I’mma leave for the better
I told her you dig like a shovel
I want a Ferrari in yellow
Just so I can match all my yellow bitches
I been a playa since elementary
I got more bars than a penitentiary
I got a clip that hang several inches
[Hook: 2 Chainz]
I can make it bounce by myself
I can make it bounce by myself
I can make it bounce by myself
I can make it bounce by myself
I can make it bounce by myself
I can make it bounce by myself
I can make it bounce by myself
I can make it bounce by myself16Embed"
2 Chainz,3040308,1849231,14325,2 Chainz,https://images.genius.com/9523f2da218bbe687d2f1d131628239b.300x300x1.png,Realize,https://genius.com/2-chainz-realize-lyrics,191667,"Realize Lyrics[Verse 1: 2 Chainz]
I'm gonna cause pandemonium
Pick up the paper, custodian
This how Prince met Apollonia
Tryna fill up California kings
Hydrocodeine with the Visine
Master bedroom on the right wing
This a Philippe not a Breitling
Fuck her to sleep, she had pipe dreams
Yeah, this is the king of the trap
Yeah, I pull it straight out the hat
Yeah, everyone better take cover
Yeah, got rappers under attack
Uh, my daughters inherit arrogance
And they intelligent, that's a fact
Bought me a car February 1st
You already know it was black on black
I cover my scars with the tats on tats
You better back back, rat-tat-tat-tat-tat
I pass you a joint, better pass it back
I went to Montgomery, with packs on back
Sent her to the store for some plastic bags
Sent her to the store for some rubber bands
I started pitching so easy
I throw the work to you underhand
Underworld, underground, underline
I'm underdog and you under mine
This here ain't no once upon a time
This really happened for real
Can't even trust our own government
Aw man fuck all that humble shit
Mumbling
Man fuck all that mumble shit
[Chorus: Nicki Minaj]
Realize
A lot of these niggas tell real lies
They not about shit in real life
And thats something that I had to realize (Realize)
I had to reco-reco-recogni-i-ize it
(reco-reco-recogni-i-ize)
They see me winning and now they dont liiike it
(Yeah, I know they dont like it)
Act like they love me, but hate me in pri-i-vate
I had to reco-reco-recogni-i-ize it

[Verse 2: Nicki Minaj]
Yo
I went and copped a ring
I call this rock, Dwayne
Johnson, stop the playin'
Man, I cannot complain
I left my shades in Atlanta so I told my pilot to stop the plane
He bust a U in the air
She say she doin' it, where?
She wanna sit in my chair
But she could never be my heir
Checks, clear, Bible, swear
They ain't buggin', I go off
Asahd Khaled with the cloth
Dwayne Carter of the north
Dwayne Wade in the fourth
New dream house for mommy
Keep 'Caiah in Armani
Putting my nieces through college
This for Kellise and Imani
Look at these niggas I put on
All of these niggas I'm good on
My own two, what I stood on
That's why their necks what I'm keepin' my foot on
I've been winning 8 years consistently, at least respect it
Papoose wrote a Ether record
But I broke Aretha record
See this is chess, not checkers
You can not check the checkers
Did Nas clear that ""Ether"" record?
Nah, but I broke Aretha record
[Chorus: Nicki Minaj]
Realize
A lot of these niggas tell real lies
They not about shit in real life
And thats something that I had to realize (Realize)
I had to reco-reco-recogni-i-ize it
(reco-reco-recogn-i-ize)
They see me winning and now they dont liiike it
(Yeah, I know they dont like it)
Act like they love me, but hate me in pri-i-vate
I had to reco-reco-recogn-i-ize it15Embed"
2 Chainz,3508546,104344,14325,2 Chainz,https://images.genius.com/4d2d082ef0adedaa3201ef76664c0745.300x300x1.png,PROUD,https://genius.com/2-chainz-proud-lyrics,164057,"PROUD Lyrics[Intro: 2 Chainz]
Yeah, do it for the hood, nigga, rep
Yeah, Soufside with an F 'cause I'm fresh
Do it for the hood, nigga, rep
Soufside with an F 'cause I'm fresh
Tryna make my momma proud, uh
I ain't tryna let my momma down (yah)
I'm just tryna make my momma proud, uh
I ain't fuckin' 'round with you (uh, uh, uh)

[Verse 1: 2 Chainz]
T.R.U. University, I pull it up and murk a beat
Momma house was filled up with bags of Hercules (strong)
Soon as I finished pissin', I put the seat down
Or my momma'd be cussin' my damn ass out
Only child, no siblings, no besties
I couldn't do nothin' right like a lefty (woo)
Bought my momma's first house with the juug money (alright)
Bought my momma's second house with the club money (show)
Me and momma used to trap out the same house (same house)
Used to eat and go to sleep on the same couch (same couch)
Me and momma got busted at the same time (same time)
Went to court and told judge the damn same lies (same lies)
I can tell momma proud of her only son
2 Chainz, I have always worn more than one
Yeah I'm real, I'm ill, you know, you gotta feel
You poppin' pills, I'm rarer than two dollar bills
[Chorus: 2 Chainz]
Yeah, I'm just tryna make my momma proud (make my momma proud, yeah)
I ain't tryna let my momma down (down, down, down)
Yeah, I'm just tryna make my momma proud, yeah (proud, yeah)
I ain't tryna let my momma down (down, down, down)
Yeah, momma ain't raise no ho, one more time
Yeah, my momma ain't raise no ho
Yeah, yeah, yeah, momma ain't raise no ho
Yeah, yeah, momma ain't raise no ho

[Verse 2: YG]
4Hunnid! My momma ain't raise no ho (no ho)
'Cause my momma ain't no ho (no ho)
My momma ain't raise no ho (no ho)
Drop a pin and in ten we at your door, nigga
Ho bitches gettin' fucked on the floor
They cold-hearted so you gotta do 'em cold
These hoes and my momma can't get along (why?)
'Cause my momma ain't no ho
I was runnin' up a check with the homies on the disk
I was fuckin' up the pork, I ain't ever do the feds
Got some YGs from the gang, they'll do you for a check
And you know I'm gang gang 'cause that's the only thing I rep
Ayy, momma
When I leave the house it's for them dollars
You are the reason I bought that choppa
'Cause I know you wanna see me come home proper
Soon as I get right I said I gotcha then I gotcha
4Hunnid!
[Chorus: 2 Chainz]
Yeah, I'm just tryna make my momma proud (make my momma proud, yeah)
I ain't tryna let my momma down (down, down, down)
Yeah, I'm just tryna make my momma proud, yeah (proud, yeah)
I ain't tryna let my momma down (down, down, down)
Yeah, momma ain't raise no ho, one more time
Yeah, my momma ain't raise no ho
Yeah, yeah, yeah, momma ain't raise no ho
Yeah, yeah, momma ain't raise no ho

[Verse 3: Offset]
Momma taught me how to get that bankroll (momma)
Yeah, vault up in my loft in case the bank closed (vault, yeah)
Momma ain't have it all, we wore the same clothes (have it all)
I kicked the door, I kicked the door, I risked it all for dough (kicked the door)
I found that .44, it turned me to an animal (4, 4)
Got that wide load, niggas wasn't even compatible (wide load)
Choppa firin', it soundin' just like a rattler
.223 caliber, you ain't in my caliber (oh, oh)
Momma told me pray 'cause they'll keep givin' me these bucks (bucks)
Sit on that G6, I'm flyin' high, Aladdin on the rug (momma)
I put Goyard on my momma (Goyard)
Every nigga, not cha partner, son, when you come up (come up)
All them bitches in your face, son, they are piranhas
Stay up out the way, but beat him if he run up (run up)
Mike Jack in his prime with Madonna
I'm just tryna bring her to my momma (momma)
[Chorus: 2 Chainz]
Yeah, I'm just tryna make my momma proud (make my momma proud, yeah)
I ain't tryna let my momma down (down, down, down)
Yeah, I'm just tryna make my momma proud, yeah (proud, yeah)
I ain't tryna let my momma down (down, down, down)
Yeah, momma ain't raise no ho, one more time
Yeah, my momma ain't raise no ho
Yeah, yeah, yeah, momma ain't raise no ho
Yeah, yeah, momma ain't raise no ho

[Outro: 2 Chainz]
Do it for the hood, nigga, rep
Southside with an F 'cause I'm fresh
Do it for the hood, nigga, rep
Southside with an F 'cause I'm fresh14Embed"
2 Chainz,82861,36793,14325,2 Chainz,https://images.genius.com/0855f72cd21e5220ad89c1cc26c16d73.300x300x1.jpg,Extremely Blessed,https://genius.com/2-chainz-extremely-blessed-lyrics,143687,"Extremely Blessed Lyrics[Intro: The-Dream]
Baby let's roll away
Get lost in the day
I love that you love what you do
And just like any girl, baby I'll love you the same
I know you gotta go, the DJ is calling you to the stage
Go ahead baby, do your thing

[Hook: The-Dream]
Honey complexion
Body of a goddess
22s on the Lexus, named Alexis
By the way of Texas
Big face Rolexes
While she's undressing, man I'm stressing
She's extremely blessed
Extremely blessed

[Verse 1: 2 Chainz]
Give us this day our daily bread
If you a chicken head, go somewhere and lay some eggs
I make you, make your bed, take that head
I got a move that will break your leg, know what I’m talking about
Known to kill pussy, nigga chalk it out
Our first date was the Waffle House
Different day, different escapades
If they don’t like it they opinions like Escalade's
Everybody got one
[Hook: The-Dream]
Honey complexion
Body of a goddess
22s on the Lexus, named Alexis
By the way of Texas
Big face Rolexes
While she's undressing, man I'm stressing
She's extremely blessed
Extremely blessed

[Verse 2: 2 Chainz]
Yeahh
She slow grinded the whole time
I told her have a seat, you sitting on a gold mine
Big ass, long hair, thick thighs
Eat Lobster tail like French Fries
I’m the type to buy you a car for the fifth time
This skinny nigga doing big time
Oh wait, dinner dates I demonstrate how to penetrate
If you ain’t wit it, then its elimi-date

[Hook]
Honey complexion
Body of a goddess
22s on the Lexus, named Alexis
By the way of Texas
Big face Rolexes
While she's undressing, man I'm stressing
She's extremely blessed
Extremely blessed
[Outro: The-Dream]
Baby let’s roll away
Get lost in this day
Say it’s okay
Come to me
Extremely blessed6Embed"
2 Chainz,101276,157488,14325,2 Chainz,https://images.genius.com/bc2b94afa033ba0fe76f4c8d72b6c6c6.300x300x1.webp,GOOD Morning,https://genius.com/2-chainz-good-morning-lyrics,139181,"GOOD Morning Lyrics[Hook: Andrea Martin]
Im getting this nigga in the morning
He gon' think he been chiefing, just too long when
He see me in the evening, wanna catch all these feelings
Well let me be the first to get mine, Ohh!
[Verse 1: 2 Chainz]
Okay I’m chillin’ in my camo, flippin’ through the channel
On my GOOD Music shit, my logo’s a Lambo
Four doors of ammo, this ammunition I’m pitching
To make your body switch another position
And listen, my weed loud, fuck her and speed off
Tell 'em I bare arms, I'm cuttin my sleeves off
Lettin' my tats show and I sag my pants
Im letting my ass show, I'm hot as tabasco
I study, Castro, yeah, my plug from Cuba
Inside of the car is like a damn computer
Inside of the crib is like a damn museum
You ain't seen these before, you better get 'em on film
Tryin to take these fat pockets, man your chances are slim
Disrespect, you stomp em out, man give em a Tim
You ain't did what I did, see I know I'mma win
And they dont have slow-motion so I did it again
Woah!

[Hook: Andrea Martin]
Im getting this nigga in the morning
He gon' think he been chiefing, just too long when
He see me in the evening, wanna catch all these feelings
Well let me be the first to get mine, Ohh!
[Verse 2: 2 Chainz]
Okay I'm sittin' on the plane, flying over graves
I am so high, nigga I can talk to rain
My outfit's insane, ain't that evident?
My chain had another chain like it was pregnant
My favorite dish is turkey lasagna
Even my pajamas designer
She got a fat ass I make her rewind
Back seat so big I press recline
Got a dirty sprite in my cup holder
Rappers like road kill, they get run over
They get done over, it's just one solider
This flow will make you fall like its October
Me and your girl, nigga opposite of sober
Celine Paris chain charm look like a cobra
Young Casanova, Baby Romeo
I got my girl geeked, she look like she from Tokyo
[Hook: Andrea Martin]
Im getting this nigga in the morning
He gon' think he been chiefing, just too long when
He see me in the evening, wanna catch all these feelings
Well let me be the first to get mine, Ohh!18Embed"
2 Chainz,4327593,104344,14325,2 Chainz,https://images.genius.com/cd1e1cdfbdffa4d13f5e9736651c14c9.300x300x1.jpg,Rule the World,https://genius.com/2-chainz-rule-the-world-lyrics,134026,"Rule the World Lyrics[Intro: Ariana Grande & 2 Chainz]
Yeah
Uh-huh
(Hitmaka)
2 Chainz

[Chorus: Ariana Grande & 2 Chainz]
Top down on the Dawn like I'm used to it (Yeah)
Prayin' he make it home like I'm used to it
Prayin' he make it home, I got used to it (Used to it)
Prayin' he make it home like I'm used to it
Top down on the Dawn like I'm used to it
Prayin' he make it home, I got used to it
Prayin' he make it home like he used to
I realized we could rule the world
I realized we could rule the world (Oh yeah, oh yeah)

[Verse 1: 2 Chainz]
Yeah
Fell in love with a real one, this a dedication (Wow)
Had 'em patiently waitin' for a revelation
Even when I ain't around, ain't no separation
Your skin's smooth, your eyes brown and you're far from basic
Then we go to different places with no suitcases (Wow)
But when we come back, we got suitcases (Yeah)
Right now I use love for a medication (Love)
Back in the day I'd shoot Cupid with no hesitation (Bow, bow)
I got more than 40 acres for my reparations
Pussy on my navigation, that's my destination (Tell 'em)
Please don't never tell on me, baby (Never tell)
That mean don't call 12 on me, baby (Don't call 12)
As long as the meal prepared for me, baby (It's prepared)
The mills I prepare, I share with you, baby (Share)
Of course they gon' like this shit, look at it (Look)
Everybody ain't happy, then look at me
[Chorus: Ariana Grande & 2 Chainz]
Top down on the Dawn like I'm used to it (Used to it)
Prayin' he make it home like I'm used to it
Prayin' he make it home, I got used to it
Prayin' he make it home like I'm used to it (Yeah)
Top down on the Dawn like I'm used to it
Prayin' he make it home, I got used to it (Wow)
Prayin' he make it home like he used to (Wow, tell 'em, baby)
I realized we could rule the world
I realized we could rule the world (Oh yeah, oh yeah)

[Verse 2: 2 Chainz]
Why don't we ride four deep
Rode so far, we on E
She on E, she on me (Yeah, yeah)
Let's try that way... okay
Shawty came in, walkin' like a model
Shaped like a bottle
She know if she mess with me, it's gon' be trouble
I'ma bust that bubble
I'ma always love her, mess up all the covers (Yeah, yeah)
Watch me break it down like a foldin' chair
See me in the Chain Reactions, I got 40 pair
Sorry I ain't answer the phone, I was slappin' ass
Last night ain't answer, I was pullin' hair
Y'all know me, so lowkey
All this ice on, I got cold feet
My shawty bad, she a trophy
She like to lay on me and call me cozy (Yeah)
[Chorus: Ariana Grande & 2 Chainz]
Top down on the Dawn like I'm used to it
Prayin' he make it home like I'm used to it
Prayin' he make it home, I got used to it (Pray for me)
Prayin' he make it home like I'm used to it (Alright)
Top down on the Dawn like I'm used to it (Skrrt)
Prayin' he make it home, I got used to it (Skrrt)
Prayin' he make it home like he used to
I realized we could rule the world
I realized we could rule the world (Oh yeah, oh yeah)

[Outro: 2 Chainz & Ariana Grande]
Skrrt (Yeah)
Yeah
I'ma trap it out one way or another (Yee)
Yeah (Oh)
One thing about love, they say it's blind
No matter where you're from
You gon' bump into it one day
Tru14Embed"
2 Chainz,4346683,271096,14325,2 Chainz,https://images.genius.com/bb666b22fc8cb068a2f653610fe1a3ac.300x300x1.jpg,Momma I Hit a Lick,https://genius.com/2-chainz-momma-i-hit-a-lick-lyrics,129680,"Momma I Hit a Lick Lyrics[Intro: Kendrick Lamar]
I want it, I want it, I want it-it-it-it

[Chorus: Kendrick Lamar & 2 Chainz]
Chilly, chilly, chilly, chilly (Yeah, what?)
Wake up, Count Chilly (What?)
I'm up, Count Chilly (Up)
Tell my mama I hit a lick
Tell my mama I hit a lick (Lick)
Huh, mama, I hit a lick
Mama, I hit a lick

[Verse 1: 2 Chainz]
I’m comin', baby, send the address
Progress, never digress (Never)
Your last one didn't pass the fly test (Test)
I eat rappers, no digest
Fuck a piece, I want the whole pie graph (Yeah)
Money taller than a giraffe (Tall)
Feng shui by the mic stand
Have you ever had two one-night stands? (Have you ever?)
I’m a emperor, very sinister
Somewhere smokin' on indica (Mmm)
Fox on me like Vivica (Mmm)
I pray for before meals, spiritual
Wack ace, bet a big face (Yeah)
They want my spot, they wanna switch place (Yeah)
They want the gas, wanna sip Ace (Yeah)
Baow, baow, straight to the face (Bow)
I'm takin' my lawyer the whole briefcase (Whole)
Makin' a play in the police face
They was like, ""Man, he fresh""
I was like, ""Go, DJ"" (Go)
When they played your new shit
I was like, ""No, DJ"" (No)
You can go on and skip that
I buy a house and flip that
[Chorus: Kendrick Lamar & 2 Chainz]
Chilly, chilly (Chilly), chilly (Chilly), chilly (Count it)
Wake up, Count Chilly
I'm up, Count Chilly
Tell my mama I hit a lick (Hit it)
Tell my mama I hit a lick
Huh, mama, I hit a lick (Huh)
Mama, I hit a lick

[Verse 2: Kendrick Lamar & 2 Chainz]
(Ahh)
Fall off in this bitch, I ball off in this bitch
My commas hit the floor, you crawl off in this bitch
I threw a hundred more, you stall off in this bitch
And then I vámonos, applaud me in this bitch
C-notes, B-notes, P-notes all up in this bitch
Man, y'all not in this bitch, y'all are not familiar
Y’all are immigrants, the law not in this bitch, I
Fuck the opp, no competitor
Got into it with my bitch last night
She was right, but I had to get at her
Two popped bands and they dance on my waist
Hit the face, that’s the editor
I don't take pics on a jet, lil nigga
This shit regular, G5s all in my backyard
Sit you roody-poos in the nosebleed
Now my pockets holding big protein
Big, big protein (Protein)
I leveled up past Fab Five
Your favorite rapper Desperate Housewives
Playin’ with me get you chastised
Milk 'em all 'til I'm satisfied
They didn’t fall for it, strategize
Switch the flow 'cause they know niggas like identity theft
Oh, you got like me? (Say less)
Oh, you pop like me? (Say less)
Mask keep a nigga (In check)
Huh, swag keep a nigga (With checks)
Huh, tags on my wall (Success)
Huh, played the underdog, now flex (Now flex)
[Chorus: Kendrick Lamar & 2 Chainz]
Chilly (Chilly), chilly (Chilly), chilly (Chilly), chilly (Chilly)
Wake up, Count Chilly
I'm up, Count Chilly
Tell my mama I hit a lick (Lick)
Tell my mama I hit a lick
Mama, I hit a lick
Mama, I hit a lick

[Outro: 2 Chainz]
Mama, I hit a lick
Mama, I hit a lick28Embed"
2 Chainz,2283062,1318901,14325,2 Chainz,https://images.genius.com/a771c33c5fa797946a0d362db0a592ce.300x300x1.jpg,El Chapo Jr.,https://genius.com/2-chainz-el-chapo-jr-lyrics,127644,"El Chapo Jr. Lyrics[Produced by Two7teen]

[Chorus]
I'm the king of the trap, El Chapo Jr
I'm the king of the trap, El Chapo Jr
El Chapo Jr, El Chapo Jr
El Chapo Jr, El Chapo Jr
I'm the king of the trap, El Chapo Jr
Anywhere on the map, I bring it to you
El Chapo Jr, El Chapo Jr
El Chapo Jr, I'ma bring it to ya

[Verse 1]
I wear Versace like it's Nike, you don't like it do you
I bet you feel this bankroll if I bump into you, oh yeah
Chopper bullets flying errywhere, pop pop pop
Got them chopper bullets flying errywhere, uh
.223 chopper clip as long as Stacey Augmon
In the restaurant I order 2 fried lobsters
Napkin on my Balmains, smokin' with lil mama
Like fuck your baby daddy, his daddy should've worn a condom
All these grams on me, all these bands on me
Make her want to dance on me and put her hands on me
Sprinter van on me, I got them xans on me
Driveway so damn long by the time I leave I'm damn asleep
[Chorus]
I'm the king of the trap, El Chapo Jr
I'm the king of the trap, El Chapo Jr
El Chapo Jr, El Chapo Jr
El Chapo Jr, El Chapo Jr
I'm the king of the trap, El Chapo Jr
Anywhere on the map, I bring it to you
El Chapo Jr, El Chapo Jr
El Chapo Jr, I'ma bring it to ya

[Verse 2]
I done put so many on I can't fall off
Trying to see how much the West End Mall costs, oh yeah
I might buy a Maybach and paint it all gold
Buy a crib fill the rooms up with all stoves
Wish I could tell you what she doing to me
Pocket full of money that's bluer than the sea
I feel like I just paid off the plug
Drop the top off the whip, hair-line receding
High last night so I woke up this evening
Can't pimp me so don't you tip me
Rims on the car make it six feet
So I can park the car wherever the blimps be
I want a bird for my birthday, I drink syrup with no pancakes
Yeah, bitches round my pool, I make them hoe look like my landscape
Yeah, El Chapo J R R, multicolor A.R. rules
Looking like I play ball, tell 'em keep they day jobs
[Hook]
I'm the king of the trap, El Chapo Jr
I'm the king of the trap, El Chapo Jr
El Chapo Jr, El Chapo Jr, El Chapo Jr, El Chapo Jr
I'm the king of the trap, El Chapo Jr
Anywhere on the map, I bring it to you
El Chapo Jr, El Chapo Jr, El Chapo Jr, I'ma bring it to ya3Embed"
