artist,id,lyrics_owner_id,primary_artist_id,primary_artist_name,song_art_image_thumbnail_url,title,url,pageviews,lyrics
2 Chainz,214295,143803,14325,2 Chainz,https://s3.amazonaws.com/rapgenius/UMG_cvrart_00602537507474_01_RGB72_1500x1500_13UAAIM70647.1200x1200-75.jpg,Beautiful Pain,https://genius.com/2-chainz-beautiful-pain-lyrics,35983,"Beautiful Pain Lyrics[Intro: 2 Chainz]
Beautiful... Pain

[Verse 1: 2 Chainz]
Niggas studying shawty know what a hundred do
Actually the nigga backing me is right in front of you
Raising a daughter sometimes depending what her father do
Niggas stunt on you, front on you
Niggas can't even ball but bunt on you, them niggas lame
I hope you get testicular cancer in the brain, dickhead
By the time you get that
I be somewhere with a six pack and a six pack
Her lips and her hips thick
My boxers are covered in her lipstick
Her pussy fat but ain't good, so that's a misprint
I'm a misfit, I did it and beyond
Shiny watch look like the old Diddy on my arm
Highly flammable, barely keep getting in Canada
Run this rap shit, I got stamina
You an amateur, I aim at 'cha, I bang at 'cha, hope a plane hit 'cha
Fuck you and whoever came witcha
Trying to express the beautiful pain witcha
Like a tattoo of a framed picture
Of a dead homie, maybe a family member
I got some gambling scriputres like um
[Bridge: 2 Chainz]
Scared money don't make no money
Bet now motherfucker gonna take them from me
Got ounces of loud you can hear me smoking
I be coughing on the crowd you can hear me choking nigga

[Hook: Lloyd]
Oh I feel so fly
Came so far, but I still wanna fly
So come on in this car, this yacht, this plane
See what this beautiful pain, provide
Baby look into my eyes

[Verse 2: Ma$e]
Shamon.. hm-mmm
You talk about hurting try washing clothes with no detergent
Daddy deserted so now we syrup sandwich serving
Dreaming we had a furnace so cold sleeping on the curtains
What can I say it got me highly motivated, mama two job working
But now the companies are merging
Need a two week notice before they say don't need your service
I'm too young to have burdens, but still feel I should be further
But who I'm I kidding I had bridges but I just burned them
My mama need earnings, ain't had no time I had learning
Call me a hypocrite, backslider, you name it I done heard it
The way they speak of me you think I'm already murdered
It's hard to be laid back, my haters so assertive, but
I gave my life up, I gave my rights up
I gave my dice up and I gave my dykes up
I gave my vice up and every club that lights up
And this is were the intern with no perm lights up
[Interlude: Ma$e]
You don't see my pain
I guess it's beautiful pain
It gotta be beautiful pain
Sometime you don't gotta say much

[Hook]

[Verse 3: Lloyd]
Life is a game of inches
Every move leads to something better
There is no time to play the benches
Gotta get in the game and live forever, and ever

[Interlude x5]
I'll be the man or I rather die

[Bridge + Hook]2Embed"
2 Chainz,4327612,54639,14325,2 Chainz,https://images.genius.com/bb666b22fc8cb068a2f653610fe1a3ac.300x300x1.jpg,Money in the Way,https://genius.com/2-chainz-money-in-the-way-lyrics,35050,"Money in the Way Lyrics[Intro]
Hit 'em with the Jab
Buddah Bless this beat

[Verse 1]
Psychedelic flow, I'm the dope and the antidote
Fade down the street from the pocket store, what you know?
Goin' back and forth, in and out, movin' lateral
Tools like mechanics, take your women for collateral
Put her on the saddle with a paddle and an Adderall (Yeah)
Just tryna string it out like Latimore (Alright)
Old Tommy ass nigga, you are unemployed (You)
I'll buy my girl a building with the furniture (Tell 'em)
You still gettin' their hair done, I'm on the tummy tuck (Hah)
Yeah, I'm 2 Chainz, I'm known to double up (Double up)
In the double R with a double cup (Double cup)
Yeah, double parked at the W (W)
I'm from the South Side, go'n and throw it up (Throw it up)
Bein' around lame niggas give me phobia (Damn)
Every verse I do need a coroner (Coroner)
They say I'm heavy handed when I'm pourin' up

[Chorus]
'Bove sea level (Yeah), I'm on G level (G)
Long as she naked (She), I don't see nothin' (Alright)
The money in the way, fuck what they got to say
I throw it up, it's fallin' down, it's definitely in the way (Definitely)
More than three niggas (Three), talkin' big flexin' (Big)
Hung the phone up (Hung up on her), and she still textin'
The money in the way, fuck what they got to say
I throw it up, it's fallin' down, it's definitely in the way
[Verse 2]
It's definitely in the way, the bezel get replaced (Uh)
Whatever's in the safe, I put it in your face (Yeah)
They say life a bitch, we goin' on a date (Tell 'em)
I came from canned goods, I came from paper plates (I did)
God don't make mistakes, but he'll make a way (He will)
I got a pinky ring that cost 'bout 80K ('Bout 80)
You was led astray, I'm 'bout to set the pace
I think I'm booked up, but let me check the date (Let me check)
Watch my footsteps, yeah, ankle weights (Big)
Bought a new scale, tryna calibrate
Tryna add it up, I'm tryna allocate
Rockin' reptile, talkin' alligate'
You can clap that, talkin' patty cake (Bah)
School of hard knocks, you ain't graduate
Surround the bedroom with some yellow tape
And some chalk lines, they gon' investigate

[Chorus]
'Bove sea level (Yeah), I'm on G level (G)
Long as she naked (She), I don't see nothin' (Alright)
The money in the way, fuck what they got to say
I throw it up, it's fallin' down, it's definitely in the way (Definitely)
More than three niggas (Three), talkin' big flexin' (Big)
Hung the phone up (Hung up on her), and she still textin'
The money in the way, fuck what they got to say
I throw it up, it's fallin' down, it's definitely in the way3Embed"
2 Chainz,4327619,54639,14325,2 Chainz,https://images.genius.com/bb666b22fc8cb068a2f653610fe1a3ac.300x300x1.jpg,Forgiven,https://genius.com/2-chainz-forgiven-lyrics,34985,"Forgiven Lyrics[Intro: Marsha Ambrosius]
And we'll introduce you to the starting lineup
We're gonna introduce now the North Clayton Eagles
Coached by James Gwynn
His starters, number 21, Tauheed Epps
Yeah

[Chorus: Marsha Ambrosius & 2 Chainz]
Prayer for our sins, I...
Prayer for our souls, the...
Tears that we're cryin'
Let 'em all be forgiven
Let it all be forgiven (When your dream, when your dream, dream, dream)
Just let it all be forgiven

[Verse 1: 2 Chainz]
When your dreams turn to nightmares
Transactions turn to Nike Airs
Went to Greenbriar Mall and bought five pairs
I stayed in the Creek, junkies used to preach
In the dope game, tryna reach my peak and go undefeated
I pleaded with the judge, this my first offense
High school b-ball, I'm tryna get a scholarship
No ACC, SEC, ClayCo APD
On a bumpy road like an ATV, EBT
Used to give me peace
I smile on the outside, inside discreet
As far as the past, wish I could press delete
Let my dogs off the leash
Rather buy it than lease or get murdered in the streets, fine line
[Chorus: Marsha Ambrosius, 2 Chainz, and JAY-Z]
Who can learn
Pray for the children (I pray)
I pray for our healing (I pray)
I know you feel it (I know you feel it)
Just let it all be forgiven (Lord forgive him, yeah)
Just let it all be forgiven (Lord forgive him, yeah)
Your sins, let 'em all be forgiven (Lord forgive him)
Dead lies, that is how we livin' (Lord forgive him, that is how we livin', yeah)
Just let it all be forgiven

[Verse 2: 2 Chainz]
Got a phone call from Lil' Fate
Somebody shot his son, he didn't make it
My head achin', hands started shakin'
Foul beyond flagrant
He said, ""Bro, what I'm supposed to do?""
I paused, remorseful
We been partners since public school
Kids ain't supposed to die before us
As a parent, it's apparent, ain't no parents
Seeing stops once we leave the carriage
Cold of the streets react with the heat to create balance
One of the biggest revenge is prayer
Me, Shondrae, and 'Cris was there
Guess Flesh won't spend Christmas there
But in spirit, know you hearin' it loud and clear
Whole family miss you as we stare off in the atmosphere
No fear
[Chorus: Marsha Ambrosius & JAY-Z]
Prayer for our sins, I...
Prayer for our souls, the...
Tears that you're cryin'
Just let 'em all be forgiven (Lord forgive him)
Let 'em all be forgiven (Lord forgive him)
Just let 'em all be forgiven (Lord forgive him)
Your sins let 'em all be forgiven (Lord forgive him)

[Outro: 2 Chainz, Marsha Ambrosius, & Francis Farewell Starlite]
Hey, I don't know need to hear this
Dead lies, that is how we livin'
But if you're doin' somethin' to make...
Just let 'em all be forgiven
If you're doin' somethin' to make your parents have to bury you
You may want to slow down
Everything got a consequence, whether good or bad
Rest in Peace Chalyne
Bigg, I love you, bruh
You know what I'm sayin'?
My other partner lost his son too, right before the 18th birthday
We out here bullshitin', for what?
Pray for my soul
You don't get another life
This ain't no practice life
Pray for my sins
These tears that I'm crying, let them all be forgiven
Let them all be forgiven
That's it, that's it
[Outro]
In all his majesty and might, his brilliance and his beauty
His black and his blue
""Boy,"" still slips from their lips when they address him
Still linger in the velvet of his dreams, the scene unseen
Black boy fightin' for manhood in a world that still sees through Jim Crow lens
Oh, them love him in his place
Separate, away, torn, disconnected, passive, submissive, and shufflin'
Oh, now just turn that shufflin' into dancin'
'Cause you know them love black boys dancin'
And singin' and ballin'
You know them love black boys' strength
But don't love black boys
Let me see your hands
*Gunshot*3Embed"
2 Chainz,3105799,1548008,14325,2 Chainz,https://images.genius.com/9523f2da218bbe687d2f1d131628239b.300x300x1.png,OG Kush Diet,https://genius.com/2-chainz-og-kush-diet-lyrics,33951,"OG Kush Diet Lyrics[Intro]
Sunbathing with a Rollie on, tan all on my tattoos
All my 16s cashews, V12 when I pass you
Reminiscing about the Motorollas
Weed stronger than a Coca-Cola
Wait up, bitch, hold up, hold up
You ain't there to hold the pole up

[Chorus]
OG kush diet, OG kush diet
OG kush diet, OG kush diet
My partna just died, my partna just died
Nothin' else to do but get high, fuck

[Verse 1]
I'm 'bout to pour out some liquor
I'm 'bout to pour out some lean
I got blue cheese in my jeans
I bought my queen Celine
I got my team Supreme
It ain't no in between
You either in or you out, I took a different route
I had to figure it out, I went to picking them out, you, you

[Refrain]
Fuck what you think, fuck what you think
Come to the bank, come through like Brinks
I might take a can of paint and go paint the white house
I might take a can of paint and go paint the white house
[Verse 2]
Presidential prolly tickled, laughing 'bout who popped the pistol
That's the issue, just got a rental, just for instrumentals
I'ma keep the bitch 'til December
And park it on Broadway, away from the hallway
Away from the 'partments, away from the arcades
We don't play games with them boys
We bring the pain to them boys
I caught a plane with them boys
I taught the game to them boys
I am ashamed of them boys
Blame it on fame, blame it on whatever you wanna blame
I'm smart and insane, imagine a genius that don't have a brain
That live off of resources, that learned off of geek sources
I do play with 3 persons, I got it from researching
I'm fresher than detergent, I'm fresher than each person
I walk out and eat Church's, gig without rehearsing
Watch how I resurface, watch how I rework it, gas

[Chorus]
OG kush diet, OG kush diet
OG kush diet, OG kush diet
My partna just died, my partna just died
Nothin' else to do but get high, fuck

[Refrain]
Fuck what you think, fuck what you think
Come to the bank, come through like Brinks
I might take a can of paint and go paint the white house
I might take a can of paint and go paint the white house
[Verse 3]
Yeah, your favorite rapper's got no talent
Homeboy got coke habits
Used to drive a Porsche 'til I found out it was made by Volkswagen
This here is a toe tag 'em, Tity Boi gon' and toe tag 'em
Go ahead, hook they ass up to the tow truck
Let them know this a throat slashing
Your baby mama got no passion
Her best friend act old fashioned
Tell her take them panties off when she walk around my boat laughing
I'm V.I.P. at the yacht club, nigga you look like you not loved
Stars in my double R so clean I drive in white gloves
Sea bass with the white sauce, hopped out, get wiped off
Presence been felt everywhere
Except let me see, yeah the White House
Space age like 8 ball, MJG, Nate Dogg
Sippin' quavo, ridin' offsets, guess I'm 'bout to take off

[Chorus]
OG kush diet, OG kush diet
OG kush diet, OG kush diet
My partna just died, my partna just died
Nothin' else to do but get high, fuck

[Refrain]
Fuck what you think, fuck what you think
Come to the bank, come through like Brinks
I might take a can of paint and go paint the white house
I might take a can of paint and go paint the white house4Embed"
2 Chainz,423230,10141,14325,2 Chainz,https://images.genius.com/8b31226536bddeeb1ff5145959d1792f.300x300x1.jpg,Trap Back,https://genius.com/2-chainz-trap-back-lyrics,33828,"Trap Back Lyrics[Verse 1]
Listen up, fuck niggas
Let em' know I'm still up in this bitch poppin'
Do so many shows in arenas, my nigga, I need me a locker
Look at my car, how did it get on them sixes?
This flow come from Drizzy
He got it from Migos, they got it from Three 6
Look at my bitches, look at my wristses
Realest nigga in the game, my nigga, ain't no counterfeited
Bitches is thick as Deelishis, doing the dishes
100 million on my wishlist
Taking penitentiary chances, just to drink lean in them Benzes

[Verse 2]
I want my trap back, I said I want my trap back
I'm from apartments
Used to walk around with work in my backpack
G's all on that shit, G's all in that bitch
12 calling me by my government
Running shit, gunning, she shopping in London and loving it

[Interlude]
- I, oh, okay, I think we've had enough... here
- Shush up for one second. You shu-shu-shut. Shut your mouth
- I needed someone to move the--
- Wait, shut your mouth. Shu-shut your--shut your mouth
- I'm sorry. What did you just say?
- You're just coming off stupid
- I'm coming off as stupid? You're wearing tuxedos to a job that requires you to clean bathrooms. Please leave this office, we're done with this interview
- Do we get any sort of souvenir?
- GET OUT OF MY OFFICE!
[Verse 3]
I want my trap back, I said I want my trap back
They sayin' that money talk, nigga
So you already know that I want my cash back
You niggas ain't talking about shit, Harley Levin
You would've thought that there was some
Kilos on my bus but they didn't find a thing
Hair, man, like Brillo, my flow Armadillo
Catch me first class on Delta with Versace all in my pillow
I been seen a kilo, the dope man my hero
Remember I had that Box Chevy? I set that bitch on some P zeros
You know that I'm rocking Buscemis, and I'm as raw as sashimi
Her head is so cold, my nigga, I think that she gon' need a beanie
Rolling and smoking zucchini, dropping the top on the whips
Making them look like bikinis
I am now balling so hard, I should be on my own boxes of Wheaties, ugh13Embed"
2 Chainz,60822,54368,14325,2 Chainz,https://images.genius.com/c09ed4b9190576260459880172143b0f.300x300x1.jpg,Stunt,https://genius.com/2-chainz-stunt-lyrics,33108,"Stunt Lyrics[Intro]
2 Chaaaaaiiiinnnzzzz

[Hook]
All I do is stunt (stunt), stunt (stunt) stunt (stunt), stunt (stunt)
Stunt (stunt), stunt (stunt), stunt yeahhhh
All I do is stunt (stunt), stunt (stunt), stunt (stunt), stunt (stunt)
Stunt (stunt), stunt (stunt), stunt yeahhh
I get it every day I got bills every month
Oh yeah I'm doing good but I'm prepared for the worst
All I do is stunt (stunt), stunt (stunt), stunt (stunt)
All I do is stunt (stunt), stunt (stunt), stunt (stunt)

[Verse 1: 2 Chainz]
Ok I'm stunting on you hoes, denim True Religion
9-1-1 I'd like to report my ceiling missing
They tried to take my swag, I got condoms in my condominium
What you know about that, I'm balling like leukemia
Horsepower told the Porsche giddy-up
Stunt so hard somebody call the media
And I'm a star my neighbor is a meteor
I'm off in Neiman's 'bout to buy a Fendi fur
Sent my girl to the store for some rubber bands
Them niggas over me didn't understand
If I say it then I did it then I fucking meant it
All I do is stunt, bitch I'm 'bout to pop a wheelie!
[Hook]

[Verse 2: Meek Mill]
All I do is stunt (stunt), stunt, I get anything I want
Started in the back now I'm that nigga in the front
Shout out to Rozay, nigga look at what you done
All this shit I spit so sick, and my pockets got the mumps
And my neck it be so cold, boy my money old
And my Presi' glow, everybody know
I'm a, perc popping, Polo drawers rocking
Bad bitch getting muthafucka I'm a problem
Yeah it's mine, I spend it, I'm riding around and I'm getting it
I'm riding around in my city wit' the top down in my Bentley
And my windows up, nigga what, going hard and I don't give a fuck
Put mirror tint all on that bitch so when niggas hate they see theyself

[Hook]4Embed"
2 Chainz,50813,17688,14325,2 Chainz,https://images.genius.com/82908e72685ad4d4fa667a2842fbd939.300x300x1.jpg,Boo,https://genius.com/2-chainz-boo-lyrics,32918,"Boo Lyrics[Hook]
I just call her boo
I don't know her whole name
Keep it on the low mane
All we eat is lo mein
Came from the block
Now I gotta whole thang
And you betta put a low jack on yo ho mane
I just call her boo
I don't know her whole name
Keep it on the low mane
All we eat is lo mein
Came from the block
Now I gotta whole thang
And you betta put a low jack on yo ho mane

[Verse One: 2 Chainz]
I just call her boo
I think her name is Shawna
What I really know bout the girl that drive the Honda
I just call her boo
I think her name is Esha, might be Tasha might even be Keisha
All I really know her baby daddy wanna feature
And when they ran up on me she damn near had a seizure
See I just call her boo
I think her name is Ana
I met her in Miami, she say she from Atlanta
I just call her boo and she finish school
And she like to drink and like to smoke my reefer too
See I just call her boo
I think her name was Tonya
I know she from Decatur, she got a stupid onion
[Hook:]
I just call her boo
I don't know her whole name
Keep it on the low mane
All we eat is lo mien
Came from the block
Now I gotta whole thang
And you betta put a low jack on yo ho mane
I just call her boo
I don't know her whole name
Keep it on the low mane
All we eat is lo mien
Came from the block
Now I gotta whole thang
And you betta put a low jack on yo ho mane

[Verse 2: Yo Gotti]
Shawty stupid dumb thick I just call her red
Now that I think about it maybe I should call her head
She got that super fire I can't even lie
She like a water park she ain't never dry
And I just call her bae and she just call me gotti
Don't need no relationship we just fuckin shock
She got her own bread shawty scoop me in a drop
Her mama own some day cares her brother got them blocks
And she a college girl sophomore I hit her in the dorm
On the hard floor she got her shit together so I respect her more
So if she ask me for some money she is not a whore
[Hook]
I just call her boo
I don't know her whole name
Keep it on the low mane
All we eat is lo mien
Came from the block
Now I gotta whole thang
And you betta put a LoJack on your ho, mane
I just call her boo
I don't know her whole name
Keep it on the low mane
All we eat is lo mien
Came from the block
Now I gotta whole thang
And you betta put a low jack on yo ho mane

[Verse 3: 2 Chainz]
I hate lame niggas so this a hate crime
Rich nigga shit I'm throwin' up them bank signs
Gotta Glock 40 in my waist line
Just bought a new crib by the lake side
What is life like its love and I love my girl
Show up life a big spenda im tryna fuck the world
Yeah fuck em girl you ain't gotta go back
Call em tell em that yo pussy got kidnapped
And she layin with her forehead on my six pack
Yeah we got something in common we like big stacks
Yeah I know her name but I like to call her boo
You shoulda put a chirp on her so she wouldn't move
[Hook:]
I just call her boo
I don't know her whole name
Keep it on the low mane
All we eat is lo mien
Came from the block
Now I gotta whole thang
And you betta put a low jack on yo ho mane
I just call her boo
I don't know her whole name
Keep it on the low mane
All we eat is lo mien
Came from the block
Now I gotta whole thang
And you betta put a low jack on yo ho mane3Embed"
2 Chainz,62422,33431,14325,2 Chainz,https://images.genius.com/c09ed4b9190576260459880172143b0f.300x300x1.jpg,One Day at a Time,https://genius.com/2-chainz-one-day-at-a-time-lyrics,32224,"One Day at a Time Lyrics[Intro]

[Hook]
I like to take it one day at a time
I like to take it one, ooh
Yea, I like to take it one day at a time
I like to take it one

[Verse 1: 2 Chainz]
Broken home, tell me what the fuck is wrong
Now I gotta charge a brick for a song
Trap guy, turned into a rap guy
No suit on but I still got trap ties
Argyles, pastels and some neckties
Shawty on the pill, X-file
40 hit 'em, leave 'em wet, baptised
And you know I'm a sucker for long hair and wet thighs
Mamacita baby, this is kamasutra
I got a present for you boo you looking at the future
As far as the past, nevermind that
I don't know who's finer, you or this wine glass
And you must rewind that if you don't get it
Got a taste of the good life and tracks is what I'm eatin
My chromosomes read Georgia Dome
Icy watch, I don't mind spending time alone
[Hook]
I like to take it one day at a time
I like to take it one, ooh
Yea, I like to take it one day at a time
I like to take it one

[Verse 2: Jadakiss]
Yo, get the clip out of the ashtray, put it in the air
Grab my cellphone, call my engineer
Yea, last night I was on one
Quick carwash, then I make a mall run
I'm a different brother
Louie store spending chips on some kicks I already got, different color
40 cally chrome, on deck
Gotta meet with my connect later on down in Malecone

All the Kush gone, gotta collect
On this mean five team parlay that a bush gone
Weed man coming with a half a zip
30 minutes in the trap is a half a brick
Always hustle to get it
I never ask for shit
If it's family or money I might have to flip
I'mma say it if it's on my mind
I like to take it one day at a time
[Hook]
I like to take it one day at a time
I like to take it one, ooh
Yea, I like to take it one day at a time
I like to take it one

[Verse 3: 2 Chainz]
Never on the guest list
Always unexpected
In so many checks
I should make a checklist
Looking at these emcees' like they should make a deathwish
Got my girl in the kitchen, cooking ambidextrious
Left wrist, right wrist
Whip that, white bitch
This is a lifestyle, I didn't have to write this
Look at my Hublot, watch how the light hit
Look at my new ho, watch how the light hit
I done did it all, except die nigga
Too dehydrated to cry nigga
I was struggling, had a time limit
I wish this Aquafina bottle had wine in it
I wish that pussy had a sign in it
That said,""Warning: If you hit it then you mine nigga""
Damn, that crazy bitch on that crazy shit
If you don't make money it don't make sense
[Hook]
I like to take it one day at a time
I like to take it one, ooh
Yea, I like to take it one day at a time
I like to take it one1Embed"
