artist,id,lyrics_owner_id,primary_artist_id,primary_artist_name,song_art_image_thumbnail_url,title,url,pageviews,lyrics
BROCKHAMPTON,3353056,3251272,323651,BROCKHAMPTON,https://images.genius.com/9956aa4c4965212522d2a54f2fd694e2.300x300x1.png,BLEACH,https://genius.com/Brockhampton-bleach-lyrics,913590,"BLEACH Lyrics[Chorus: Ryan Beatty]
Who got the feelin'? Tell me why I cry when I feel it
Tell me why, tell me why
Who got the feelin'? Tell me why I cry when I feel it
Tell me why, tell me why (Why?)

[Verse 1: Matt Champion]
Phone ringin', never outgoin', homebody
Never outgoin', put my doubts on when these walls up
Tearing at the black tie, finish addin' notches to my belt loop
They say help you, I can't help you
Why I can't speak out? Is wideout, wideout
Keep it deep inside my mind, it's off-kilter, off-kilter
I turn memory to fantasy, for that better pleasure, fuck
Time machine gonna make it better, maybe better for ya
I can't make this up, I can't take it back
Feel like a monster, feel like a deadhead zombie
Feelings you don't want me, I ain't givin' up, you should set it off
Tell me “Time's up,” let the water run, let my body run

[Chorus: Ryan Beatty]
Who got the feelin'? Tell me why I cry when I feel it
Tell me why, tell me why
Who got the feelin'? Tell me why I cry when I feel it
Tell me why, tell me why (Why?)
[Verse 2: Merlyn Wood]
Said she wanna get high off a nigga
I wanna die durin' sex or religion
God and pussy only know my intentions
Waking on the tour bus then I'm swimmin'
You'd be hurtin' if you trust me but you isn't
Honestly, that's probably the right decision
Pick up, listen, if you wanna get rich
No sleep, how real bad man wake up

[Verse 3: Ameer Vann]
I found false hope in all kinda places
Hotel rooms and temporary feelings
I put my clothes on and try to check out
I try to hide from the sun, let it set now
Don't let God see me, I got a lot of demons
And I've been sleepin' with 'em
And now I'm tangled in the sheets and sinkin' deeper with 'em
I'm going deeper in it, find me drownin' in it

[Verse 4: Dom McLennon]
They said, ""Do you make mistakes or do you make a change?""
Or ""Do you draw the line for when it's better days?""
You taste the wind for when it's cold enough to kill our flame
I wonder who's to blame
They ask me, ""Do you make mistakes or do you make a change?""
Or ""Do you draw the line for when it's better days?""
We taste the wind for when it's cold enough to kill our flame
I wonder who's to blame
[Chorus: Ryan Beatty]
Who got the feelin'? Tell me why I cry when I feel it
Tell me why, tell me why
Who got the feelin'? Tell me why I cry when I feel it
Tell me why, tell me why (Why?)
[Bridge: Joba]
Everything I have (Is a mirror)
And everywhere I stand (Isn't solid ground)
People don't make sense (To me anymore)
I'm hiding out, again, tryna figure it out, yeah
I'm tryna figure it out, uh
I'm tryna figure it out, yeah
I'm tryna figure it out
[Refrain: Kevin Abstract]
I forgot my passport for sure, all for a pretty sky
I forgot my passport for sure, all for a pretty sky
I forgot my passport for sure, all for a pretty sky
I forgot my passport for sure, all for a pretty sky

[Outro: bearface & Ryan Beatty]
Everything you wear, I'll be the one to care
Softly, you braid your hair, all the angels stare, yeah
Tell me why, tell me why (Why?)119Embed"
BROCKHAMPTON,4645514,6715497,323651,BROCKHAMPTON,https://images.genius.com/2fdd0eeccc6637359465b84e1e5fabda.300x300x1.png,SUGAR,https://genius.com/Brockhampton-sugar-lyrics,892367,"SUGAR Lyrics[Chorus: Ryan Beatty]
Spendin' all my nights alone, waitin' for you to call me
You're the only one I want by my side when I fall asleep
Tell me what I'm waitin' for, tell me what I'm waitin' for
I know it's hard but we need each other
Know it's hard but we need each other

[Verse 1: Dom McLennon]
I move mountains on my own, don't need nobody help
Changed your mind when I changed my life, better start believin' in myself
And we all out lookin' for, lookin' for God so we never see it in ourself
Shit, divine intervention move in stealth
It's hard to tell what the prayer compelled
You can find me dancin' in between the raindrops
Tryna find a way to make the pain stop
Overtime, on the graveyard
Got a nigga feeling brainwashed
My instability's trademark
Copy-written in all my decisions
This is not supposed to be a way of livin'
Turned my temple down into a prison, shit

[Chorus: Ryan Beatty]
Spendin' all my nights alone, waitin' for you to call me
You're the only one I want by my side when I fall asleep
Tell me what I'm waitin' for, tell me what I'm waitin' for
I know it's hard but we need each other
Know it's hard but we need each other
[Verse 2: Matt Champion]
Yeah, back on Vincent with the braces on
Used to slide out the back without the neighbors knowin'
Pose for the picture with the pearly whites
Dead lens zoomin' in, catchin' all my strikes
Used to trade Jordan for some molly
And she gave me all I need for the night, forties suffice
Morally alright, but I need some advice
And I know that I'm actin' foolish
Chris would pick me up around noon-ish
Half a blunt, yeah, we coolin'
Twist it up, puttin' on OutKast
Hunnid, Texas heat, and yeah, we cruisin'

[Pre-Chorus: bearface]
But when I love you right, I love you right
All by yourself
But I'll make it bright, baby, I want you to know
I'ma be there for you, I'ma make you see that
I want you, I want you

[Chorus: Ryan Beatty]
Spendin' all my nights alone, waitin' for you to call me
You're the only one I want by my side when I fall asleep
Tell me what I'm waitin' for, tell me what I'm waitin' for
I know it's hard but we need each other
Know it's hard but we need each other
[Bridge: Kevin Abstract]
Back and forth
I'll take that if that's all you askin' for
With my legs up on the dashboard
Only thing in my pocket is my passport, pa-passport
Back and forth
I'll take that if that's all you askin' for
With my legs up on the dashboard
Only thing in my pocket is my passport, pa-passport
Back and forth
I'll take that if that's all you askin' for
With my legs up on the dashboard
Only thing in my pocket is my passport, pa-passport

[Outro: bearface]
So, do you love me, love me, love me?
Do you love me, love me, love me?
Do you love me, love me, love me?
Do you love me, love me? Oh
Do you love me, love me, love me?
Do you love me, love me, love me?
Do you love me, love me, love me?
Do you love me, love me? Oh84Embed"
BROCKHAMPTON,3199020,3355833,323651,BROCKHAMPTON,https://images.genius.com/3c584c66d45802fc4a989b2d8a678072.300x300x1.jpg,SWEET,https://genius.com/Brockhampton-sweet-lyrics,765175,"SWEET Lyrics[Music Visual Intro Annotation]

[Verse 1: Matt Champion]
Stripped down to my skin and my bones
I love huskies but I feel like a wolf (Howl!)
In a pack but I feel all alone
I'm scatterbrained man, better offer the Clon'
In Tejas apartments with racists doin' weird shit
Like, this'll make the biopic (Haha!)
Rile 'em up, hit Zaxby's, get the wing and tings (Yum!)
Real quick bills still stacking to the ceiling (Uh-oh...)
What you mean, it ain't working? (What?)
What you mean, you ain't finding yourself? (Oh, I am, I'm trying)
What you mean, you ain't got no cash? (I got a little bit...)
What you mean? What you mean?
Shouldn't your pockets be big just like a fat chick? (Uh-huh!)
Shouldn't your mama be done paying the house off? (I guess?)
Shouldn't you have a real big-ass ego? (No?)
Shouldn't these girls be flockin' just like seagulls? (Eh...)
[Chorus: Kevin Abstract]
Twistin' me up like licorice
Think I need someone who can handle it
Ice on my boys and my wrist is fixed
I don't need nobody tryna give me shit
Twistin' me up like licorice
Think I need someone who can handle it
Ice on my boys and my wrist is fixed
I don't need nobody tryna give me shit
[Verse 2: Dom McLennon]
The original lick-splickety, higher than Yosemite
Breaking the mold mentally, master with no limiting
Making 'em say ""ugh!"", they worshipping our force viciously
Watching the floor tip in your temple of authenticity
Often they say I’m off it, I offer my crossed empathy
They forgot what we on, I’ll remind 'em with hostility
Hot-diggity damn, everyone running scams
Gotta cover your clams and take another glance
Running a clinic, no scans, ain't no one claimin' yo mans
It's all pertaining to plan, call me the architect
Lap you in a UFO, I haven't started yet
Still gotta figure out exactly where to park it at
Moses with the pen, each line an ocean I can part it at
But that's too deep

[Verse 3: Merlyn Wood]
Don't call me stupid
That ain't the way my name pronounced
Don't call me Cupid
I got too many hoes right now
Poolside in Houston
Tryna see if Beyoncé will take me for adoption
Broke-ass rich suburbs
A civilian shot in 3rd Ward, we just by the fountain
This is Merlyn Wood, man
Everywhere I go is The Woodlands
I need a honey-butter
Vodka in a Sprite can
When I'm in the Whataburger
All the kids know who I am
I need a honey-butter
Pouring lean in my Sprite can
[Chorus: Kevin Abstract]
Twistin' me up like licorice
Think I need someone who can handle it
Ice on my boys and my wrist is fixed
I don't need nobody tryna give me shit
Twistin' me up like licorice
Think I need someone who can handle it
Ice on my boys and my wrist is fixed
I don't need nobody tryna give me shit

[Verse 4: Ameer Vann]
I got a record but I'm clean as they come
I'm Godzilla, when they see me, they run
On 37th, used to run from the Bloods
The undercovers gotta duck when they come
I moved out and in a couple of months
I'ma be a pop star, they call me a thug
I used to write raps on the back of the bus
Now I'm in the front seat shifting the gears

[Verse 5: Joba]
It's funny how things can change
Three hundred dollars to my name led to Hollywood
I was living off ramen and change
Five hundred dollars on these dinners, never have to pay
Growing up my teachers told me
""You better get them grades up if you wanna finish high school
And after high school, you better get a degree
'Cause it's a dog-eat-dog world, you could live in the street""
Flashback, I had my Walkman in the minivan
Listening to *NSYNC, saw my name on the CD
Bleach blond tips, wanted to be JT
Wanted to do big things, had to fulfill a dream
One might say I was doomed from the get-go
But those same people assume, 'cause they'll never know
What it's like to be called to what's not set in stone
I am one with the ebb and flow, that's all I know
[Chorus: Kevin Abstract]
Twistin' me up like licorice
Think I need someone who can handle it
Ice on my boys and my wrist is fixed
I don't need nobody tryna give me shit
Twistin' me up like licorice
Think I need someone who can handle it
Ice on my boys and my wrist is fixed
I don't need nobody tryna give me shit
Twistin' me up like licorice
Think I need someone who can handle it
Ice on my boys and my wrist is fixed
I don't need nobody tryna give me shit
Twistin' me up like licorice
Think I need someone who can handle it
Ice on my boys and my wrist is fixed
I don't need nobody tryna give me shit45Embed"
BROCKHAMPTON,3087184,3531865,323651,BROCKHAMPTON,https://images.genius.com/833d504f7f132008025eefc4527c0134.300x300x1.jpg,GOLD,https://genius.com/Brockhampton-gold-lyrics,660067,"GOLD Lyrics[Chorus: Kevin Abstract]
Keep a gold chain on my neck
Fly as a jet, boy, better treat me with respect
Keep a gold chain on my neck
Fly as a jet, boy, better treat me with respect
(Keep a gold chain) Keep a gold chain on my neck
Fly as a jet, boy, better treat me with respect
(Keep a gold chain) Keep a gold chain on my neck
Fly as a jet, boy, better treat me with respect

[Verse 1: Matt Champion]
Rock the boat like a one-eyed pirate
Rick James, I get glitter on my eyelids
2 A.M., 85 on the highway
Whole world get a little misguided
Where the spotlight? Put me in the spotlight
Trust no one that put you in the wrong light
High scream when I hit her with the long pipe
Mmm, ice cream when I hit her with the sweet thang
Do my thing, no, I do not do speaking
Get my shot, point it out like Ruth, man
I'ma win a bitch and I got a mood swing
I'm the realest, bitch, now I got a mood swing
I got bipolar confidence
Wake up like ""shit"" then I feel like the shit
So I guess I'm the shit
Yeah, guess I'm the shit
[Chorus: Kevin Abstract]
Keep a gold chain on my neck
Fly as a jet, boy, better treat me with respect
Keep a gold chain on my neck
Fly as a jet, boy, better treat me with respect
(Keep a gold chain) Keep a gold chain on my neck
Fly as a jet, boy, better treat me with respect
(Keep a gold chain) Keep a gold chain on my neck
Fly as a jet, boy, better treat me with respect

[Verse 2: Ameer Vann & Merlyn Wood]
Grab life by the horns when I whip the Lambo
Black on red like I whip the sambo
Clip's so long it'll make you mambo
Watch you tango, dutty wine
She grind on my dick like a hundred times
Shawty love me long when I grip her sides
And slip inside like a Slip 'N Slide
My electric eel do electric slide but—
I just wanna feel on the booty
All on me, all on me, all on me
Make it slow clap like Rudy!
All on me, all on me, all on me
I just wanna feel on your booty
Grab the camcorder, we can make it a movie
Bring a friend with you if you like how I do it
Gold chain swingin' and she like how I shoot it
[Chorus: Kevin Abstract & Merlyn Wood]
Keep a gold chain on my neck
Fly as a jet, boy, better treat me with respect
Keep a gold chain on my neck
Fly as a jet, boy, better treat me with respect
(Keep a gold chain) Keep a gold chain on my neck
Fly as a jet, boy, better treat me with respect
(Keep a gold chain) Keep a gold chain on my neck
Fly as a jet, boy, better treat me with respect (Damn)

[Verse 3: Merlyn Wood]
Damn, I'm frosty, blood diamond, I'm flossing
Navy camo, I'm drowning, but you don't see what it cost me
Turmoil like the Saudi's, hand-me-downs never fit me
Party never fit me, punani never fit me
Damn, time-travelin', Honda-swervin', that's so Merlyn
That's so Merlyn, that's so Merlyn, that's so Merlyn
Damn, time-travelin', Honda-swervin', book learnin'
That's so Merlyn, that's so Merlyn, that's so Merlyn

[Verse 4: Dom McLennon]
Swan dive down the 405
Land at the bottom of El Toro High
With the precision of a cut from a Zoro knife
The boy spit like he made out of 409
So that's clean, bitch
You can't play with my team, bitch
We rock pink now on Wednesdays
Green looks good with your envy
Mix with white 'cause you salty but this stainless
I'm like platinum and it's painless
I just skip on the beat like I'm Pee-Wee Herman
Hands up for all my sermons
My wheel's turnin', now I'm more efficient than ever
I feel like Ratatouille when I'm whipping that cheddar
You see, you better find your thickest of sweaters
'Cause this ice might fuck around and change your whole life
'Cause we about to take flight
[Chorus: Kevin Abstract]
Keep a gold chain on my neck
Fly as a jet, boy, better treat me with respect
Keep a gold chain on my neck
Fly as a jet, boy, better treat me with respect
(Keep a gold chain) Keep a gold chain on my neck
Fly as a jet, boy, better treat me with respect
(Keep a gold chain) Keep a gold chain on my neck
Fly as a jet, boy, better treat me with respect

[Outro: Joba & Jabari Manwa]
Keep a gold chain (fly, fly as a jet)
I keep a gold chain (fly, fly as a jet)
Keep a gold chain (I said I keep a, gold chain)
Keep a gold chain (I keep a gold chain)
Keep a gold chain (I said I keep a, I said I keep a)
(I keep a gold chain, a gold chain)
Keep a gold chain
(I said I keep a, I keep a)
Keep a gold chain (fly, fly as a jet)59Embed"
BROCKHAMPTON,3198129,3355833,323651,BROCKHAMPTON,https://images.genius.com/0903aafdfb4e68d697109719053584fa.300x300x1.jpg,JUNKY,https://genius.com/Brockhampton-junky-lyrics,625649,"JUNKY Lyrics[Video Intro: Robert Ontenient]
Me Ilamo Roberto y estamos buscando a Jaden Smith
[Verse 1: Kevin Abstract]
I spit my heart out, lookin' out for my best interests
He gave me good head, peepin' out while the windows tinted
I speak in tongues and I arrive without a damn mention
It's kinda sick, and I was born in 1996 and
1999 the only year that I remember
I slip through the cracks without havin' a damn temper
I bleach my hair because these bitches all about they bitchin'
I say shit when I rap, and y'all niggas barely listen
I do the most for the culture, nigga, by just existing
Delete my tweets 'cause I'm ashamed of being a fuckin' Simpson
I told my mom I was gay; why the fuck she ain't listen?
I signed a pub' deal and her opinion fuckin' disappearin'
I'm payin' bills for my sister and tryna fund a business
Is it homophobic to only hook up with straight niggas?
You know, like, closet niggas, masc-type?
""Why don't you take that mask off?"" That's the thought I had last night
""Why you always rap about bein' gay?""
'Cause not enough niggas rap and be gay
Where I come from, niggas get called ""faggot"" and killed
So I'ma get head from a nigga right here
And they can come and cut my head off, and
And my legs off, and
And I'ma still be a boss 'til my head gone, yeah
[Bridge: Ameer Vann]
Break the wheel, pack the steel, hold my niggas down
Twistin' on that syrup ‘til I hear crackin’ sounds
Break the wheel, pack the steel, hold my niggas down
Twistin' on that syrup ‘til I hear crackin’ sounds
Break, break, break the steel, hold my niggas down
Twistin' on that syrup ‘til I hear crack, crack, crack
Break the wheel, pack the steel, hold my niggas down
Twistin' on that syrup ‘til I hear crack

[Verse 2: Ameer Vann]
I don't trust nobody 'cause they don't deserve it
Niggas run in your house, they know you doin' dirty
(Go 'head, now)
I got my hand on an ounce, and I got money servin'
I just bought me a fifth and now I'm speedin', swervin'
(Go 'head, now)
I took an eighth of them shrooms, and now I'm hearin' voices
I took like two of them pills, I can't remember nothing
(Go 'head, now)
I ain't under control, I'm losin' motor function
I need an intervention, I need an exorcism
I need a therapist, paranoia and drug addiction
It's very scary, my momma don't even recognize me
I'm goin' crazy, don't need nobody to say they love me
My acts of desperation, I'm on an empty stomach
So fuck the consequences, I ain't runnin' from them
[Verse 3: Merlyn Wood]
Feelin' like a goner, put my life in locker
Hotbox in the Hummer
Hot bars in the summer (Merlyn, Merlyn!)
If I had the option, I would do it all again
If I had the option, I would do it all again
I just wanna feel like I did the right program
I just want to appeal to my dad and my cousins (Again)
When I cut the veil, I do not think 'bout diplomas
Love is knowin' that you didn’t do it by your lonesome
So I forgive my mommy, daddy, auntie, and my uncles
For guilt-tripping feelings whenever they call my number
They see men dream, they see men fallin'
But when I dream, I'm smashing on a Lana

[Bridge: Matt Champion & Joba]
Both pessimistic, drug addicted, caught in our feelings
We spit venom then stare at the ceiling, wondering, ""why?""
My mom's no alcoholic, she just wanna drown her sorrows
Love her to death and soon enough, I'll give back all I borrowed
Both so submissive, take turns dominating, the light has been faded
This hate-fueled love, we don't fake it, no givin', just takin'
[Verse 4: Matt Champion]
I took some steps to be a bigger person
I should've thrown ya off the highway, the cars swerving
Ain't no burden, ain't no sermon, ain't no motherfuckin' plaque
I hate these hospitals and police and the smell of death—all that
I hate these shady folk that want it ladylike
But don't treat lady right, but they be sayin', like (""Just the tip!"")
And yeah, you mad 'cause she ain't fuck, mad 'cause she ain't suck
Beat your ass before you got time to say ""Why not?""
Here to catch you slip up, wish you could just rewind
Timing all fucked up, thought you had just lucked up
Where the respect? Is your ass human?
I look you in your eyes, say, ""Fuck you, are you fuckin' stupid?""
Respect my mother, 'spect my sister, 'spect these women, boy
I get my 9-9, I don't own one, hit the store to blow your brains off
Better hope my aim off, better hope the range off
Better hope my tame off before I blow your brains off, boy
[Outro: Dom McLennon]
Ugh, no hands with the stunts
Jump off the roof like I do what I want
All of my life in my past wanna haunt
And my sight of the future beginning to taunt my ambition
Man on the moon, I'm marooned, I ain't trippin', I'm on a mission
Every time that I speak, they ain't skippin'
Turned my inspiration to a vision, that's a given, no slippin'83Embed"
BROCKHAMPTON,3105970,1169219,323651,BROCKHAMPTON,https://images.genius.com/2eda17746ba4fbca1c1dc6ce5e8379b4.300x300x1.jpg,STAR,https://genius.com/Brockhampton-star-lyrics,598560,"STAR Lyrics[Music Video Intro]
Me llamo Roberto
Y yo quiero ser famoso

[Verse 1: Dom McLennon]
I might go Interstellar
I feel like Matthew McConaughey
I don't care for what they gotta say
Tony Perkis how I drop the weight
Jason Bourne with the headshot
Jason Statham with the whip game
Liam Neeson with the rescue
I go Gunnar with the leather face
Bruce Campbell with the chains
Tobin Bell with the saw
Anthony Hopkins, I'm eatin' 'em raw
They don't know who we are
Molly Shannon, I'm a superstar
Ride or die like it's Seabiscuit
Tryna stack like Tobey
John Wick, I don't leave a witness
Chris Paul, I'm assistin'
Ameer go Blake Griffin
Give me forty-eight minutes
We go '04 Pistons
Catch a fade like Robert Horry
Only time to get the spotlight
Deray, how I'm top flight
Go Obama when I drop mics
[Verse 2: Ameer Vann]
I'm the Black Tom Hanks
You can call me Nigga Banks
Secret Agent Cody Banks
Quarter pound of the dank
On the scale and it stank
Put my mama in a Range
I just bought a new Wraith
Nic Cage with the face-off
John Travolta when I take off
Brad Pitt, start a fight club
Turn the trap into the nightclub
I'm like Prince with the white doves
Paint a picture with the white dust
Lionel Richie with the white bitch
Try to tell it to her nicely
But she never wanna listen
Beat the pussy to submission
Tom Cruise on a mission
Pull a R&B singer
Bring her back to South Central
I shine just like a popstar
M.J. my initial
Kobe Bryant with the spin moves
If these niggas got issues
H-Town with Beyoncé
Turn her to my prom date
Kingpin like JAY-Z
Dance moves like JT
[Verse 3: Kevin Abstract]
Heath Ledger with some dreads
I just gave my nigga head
Standing on my two legs
Fuck what that nigga done said
Bruh, I don't fuck with no white boys
'Less a nigga Shawn Mendes
I been off and I been dead
Bad as hell, I don't bench-press
High school, they ain't fuck with me
Now, the critics don't fuck with me
My own fam ain't fuck with me
But Viceland did fuck with me
I'm the only popstar with no money
Can't drive, so I'm still running
Uber taking all my show money
But that's okay, I got more money
Not enough to get my teeth fixed
So my boyfriend in the street, bitch
In the moonlight, I get seasick
Did you see all the art that we did?
Did all that shit in a weekend
We was up all late tweakin', yeah
Ice Cube on a Friday, Chris Tucker on a Friday
Michael Cera on a Friday, Jonah Hill on a Friday
Rockin' Leo's blood diamonds
Sucked off on the highway
Police right behind me like a nigga stole his OJ
Okay, I don't play, got the same last name as O.J.58Embed"
