artist,id,lyrics_owner_id,primary_artist_id,primary_artist_name,song_art_image_thumbnail_url,title,url,pageviews,lyrics
BROCKHAMPTON,3113508,169140,323651,BROCKHAMPTON,https://images.genius.com/63f4ae252959cf8e0fbbee735bba6bcd.300x300x1.jpg,FAKE,https://genius.com/Brockhampton-fake-lyrics,191039,"FAKE Lyrics[Chorus: Kevin Abstract]
Yippy-yay, yippy-yay, hit me on my cellular phone
Yippy-yay, yippy-yay, I'll be right back with the dope
Yippy-yay, yippy-yay, I know, you niggas need some more
Take that shit from me some more, I just need to be alone
Yippy-yay, yippy-yay, hit me on my cellular phone
Yippy-yay, yippy-yay, I'll be right back with the dope
Yippy-yay, yippy-yay, I know, you niggas need some more
Take that shit from me some more, I just need to be alone
[Verse 1: Ameer Vann]
Nigga, talk shit, I'll single you out
If you've got a problem, we can figure it out
I'm from H-Town, but the gold in my mouth
Southside niggas put a hole in your house
A hole in your spouse
Better think twice 'fore you open your mouth
It's getting real close to the first of the month
Niggas hit licks, for the gas and the blunt
Send 'em to the doc, gotta open them up
Niggas load guns in the back of the truck
Niggas hate money 'til they laced with gold
Gotta get a gun for your hateful foes
Flex too hard and your casket close
You don't want your momma come
And get you from the morgue
Tall white T, blood on the floor
Oh, don't say that
[Chorus: Kevin Abstract]
Yippy-yay, yippy-yay, hit me on my cellular phone
Yippy-yay, yippy-yay, I'll be right back with the dope
Yippy-yay, yippy-yay, I know, you niggas need some more
Take that shit from me some more, I just need to be alone
Yippy-yay, yippy-yay, hit me on my cellular phone
Yippy-yay, yippy-yay, I'll be right back with the dope
Yippy-yay, yippy-yay, I know, you niggas need some more
Take that shit from me some more, I just need to be alone

[Verse 2: Dom McLennon]
Ohh-ohh-ohh, I feel like Master P
I ain't no slave, ain't lettin no one try to master me
I'm getting tested, tested, but nobody passing me
Ain't sugar coating shit, don't need them extra calories
It's a machine, that's why we work inside the factory
Put 'em up for me, display it, like it's a gallery
Don't need your salary, gold on me, like it's alchemy
Giving niggas the battery when they witness the mastery
Oh, don't say that, don't talk to me, we don't play that
They got chalk for me, I make outlines, like it's pottery
I got a squad full of fucking oddities
I got squash, apricots and broccoli
We turn weird shit to a commodity
I'm on a odyssey for real quality
It's like, oh
[Chorus: Kevin Abstract]
Yippy-yay, yippy-yay, hit me on my cellular phone
Yippy-yay, yippy-yay, I'll be right back with the dope
Yippy-yay, yippy-yay, I know, you niggas need some more
Take that shit from me some more, I just need to be alone
Yippy-yay, yippy-yay, hit me on my cellular phone
Yippy-yay, yippy-yay, I'll be right back with the dope
Yippy-yay, yippy-yay, I know, you niggas need some more
Take that shit from me some more, I just need to be alone
[Verse 3: Merlyn Wood]
I look like a Somali pirate (Don't say that!)
Failed middle school and college (Don't say that!)
Daddy say I'm an asshole (Don't say that!)
Dick complexion of a Backwoods (Ew, don't say that)
She text me, dry as the Sahara (Aw-wah!)
After she get in that casa Merlyn (Straight up!)
I was in that mouth like flouride
That pussy tight as a hair tie (Ah! Ooh, ooh)
Scrunchie, I'm so horny, baby, bitch, your house, pussy, baby
When I get the munchies I steal, I don't share roaches, baby
Bum with the good haircut
Bum with a good haircut, mattress and magic dick

[Chorus: Kevin Abstract]
Yippy-yay, yippy-yay, hit me on my cellular phone
Yippy-yay, yippy-yay, I'll be right back with the dope
Yippy-yay, yippy-yay, I know, you niggas need some more
Take that shit from me some more, I just need to be alone
Yippy-yay, yippy-yay, hit me on my cellular phone
Yippy-yay, yippy-yay, I'll be right back with the dope
Yippy-yay, yippy-yay, I know, you niggas need some more
Take that shit from me some more, I just need to be alone14Embed"
BROCKHAMPTON,4783232,126836,323651,BROCKHAMPTON,https://images.genius.com/2fdd0eeccc6637359465b84e1e5fabda.300x300x1.png,VICTOR ROBERTS,https://genius.com/Brockhampton-victor-roberts-lyrics,189681,"VICTOR ROBERTS Lyrics[Verse: Victor Roberts]
My fuckin' Power Rangers couldn't protect me from that LAPD kick door
Motel, pig-pork
Swim through the living room, straight to the bedroom, lookin' for bricked dope
My papa looked at my mama, lookin' at that closet like
""There that shit go""
Two keys and a thumper, 10K with the mustard
A whole family and no buster, this don't add up
My padre facin' them three strikes
And my mama just smacked the pipe
Crack smoke got crash tight, this shit still bad, 'cause
The boys peeped a Brillo pad and some glass tucked
And it's lookin' like my parents was up in here runnin' all through that stash dumb
But the fact, crack different than coke
Plus the smoke wasn't close enough to choke me
Lowered scrutiny so mom could kick big facts for bruh
The truth is we held the bag for this kid we took in
Tryna part with his old ways, maybe we all mistook him
'Cause I knew something was fucked up when he said
""Don't open or look in this here satchel that I'll be back for in just a couple of minutes""
Then hella hours later, like do I cook dinner now or later?
Worried about cold food for a cold fool
Motherfucker put my family in danger
I blame myself, pardon my anger
I never looked inside his stuff so he never really needed to hide his stuff
When you showed me what was really inside this stuff
I never had a clue
Now I know as police, you gotta do what you gotta do
But this my family, all I got is us, my nigga
My own mother just shot at us, my nigga
This is why we here
And I don't fuck with niggas I don't know
But I had a heart to help this kid in danger, tears in anger
Gemini gettin' violently
Police silence don't help anxiety
My daddy's priors tame all of his wildin'
All of these pilots, not one of them flyin'
Y'all planning on trying?
This flight is diving, nose tucked
Po-po stuck, play your part
All this commotion and neighbors listenin' like, ""Oh fuck""
Shit finna spark
All this emotion, need a decision made with some heart
'Cause ours is broken, they tryna lock the third notch on my pop's choker
This shit ain't kosher
Moms is oh for if CPS get sent them pages
I ain't gon' see my parents for ages
All this erosion, no more protection
Shit don't feel safe
What graduation? What degrees?
What dissertation? What imagination?
Imagine my whole world taken away from me
All over some bass and misconstrued melodies
My heart racin', clutchin' my red Ranger, pacin'
I can barely breathe
And mister policeman, told policeman, we got what we need
Just let 'em be
[Chorus: Ryan Beatty]
Thank God for my bitches still sticking with me
Thank God, when I talk, I know you listen to me
Thank God that I'm built for the distance
Thank God for me, thank God for me
Thank God for my bitches still sticking with me
Thank God, when I talk, I know you listen to me
Thank God that I'm built for the distance
Thank God for me, thank God for me

[Bridge: bearface]
And if you're hurting, love yourself with my heart
And if you're hurting, love yourself with my heart

[Chorus: Ryan Beatty]
Thank God for my bitches still sticking with me
Thank God, when I talk, I know you listen to me
Thank God that I'm built for the distance
Thank God for me, thank God for me
Thank God for my bitches still sticking with me
Thank God, when I talk, I know you listen to me
Thank God that I'm built for the distance
Thank God for me, thank God for me

[Outro: Ryan Beatty]
Thank God for me, thank God for me
Thank God for me
Thank God for me, thank God for me
Thank God for me
Oh, oh
(Nobody)22Embed"
BROCKHAMPTON,6523280,5748418,323651,BROCKHAMPTON,https://images.genius.com/b8ae287ef6a128f63e5296557eacd1c7.300x300x1.jpg,COUNT ON ME,https://genius.com/Brockhampton-count-on-me-lyrics,177379,"COUNT ON ME Lyrics[Intro: A$AP Rocky]
You look so different to me
It's like you barely even, listen

[Verse 1: A$AP Rocky]
You look so different to me
It's like you barely even know me
You was missin' for me
Swear I'm tired of feelin' lonely
Like Field Mob song, Trill Mob boy
She been MIA far too long, so far
Now catch the compensation
Change the conversation, dollars all I'm chasin'
Ain't talkin' money, fuck is you sayin'?
I'm non-comprehensive, money finish sentences
No, I ain't sensitive, nigga, just highly offended

[Chorus: Jabari Manwa, Ryan Beatty, JOBA & Shawn Mendes]
It'll be okay, no matter what thеy say about us
It'll be okay, no matter what they say about us
I know that it'll bе okay
You ain't even need no money
You can count on me
It'll be okay, no matter what they say about us
It'll be okay, no matter what they say about us
I know that it'll be okay
You ain't even need no money
You can count on me
[Verse 2: SoGone SoFlexy]
Let's not fake the funk
She say I pour too much in my cup
Fuck the opposition, plus I'm still ridin' with it tucked
They say I should change the way I'm livin'
But just can't get enough
Still be quick to up that chopper on his block and hit him up
My little brothers don't come home 'til November
I told 'em we gon' live it up
Can't do shit but pray for J Ron 'cause that nigga don't give a fuck
Not at all, nigga
Had my back against the wall, nigga
Momma told me I'd see it all, nigga

[Verse 3: Matt Champion]
Yeah, who love you at your lowest of lows?
I know, I mean
I'm in the backyard thinkin' I need
That smoke puffing outta my teeth
I'm good, I got my green
Sittin' back, sippin', ocean breeze
I don't got it baby, ask them boys
All that hating turn to white noise
Tryna get red carpet fly
I don't flex my life, I don't lie
Treat life like I might die
Don't like myself sometimes
But I bet that come with time
Ever feel like your head got screws a little bit loose?
Goddamn, give a fuck if I lose
Ain't no fool, he got déjà vu
I'm the man, I'm the dog, got juice
Just know I fucked up, too
Talk like you got it figured it out
And I wish I did too
[Chorus: Jabari Manwa, Ryan Beatty, JOBA & Shawn Mendes]
It'll be okay, no matter what they say about us
It'll be okay, no matter what they say about us
I know that it'll be okay
You ain't even need no money
You can count on me
It'll be okay, no matter what they say about us
It'll be okay, no matter what they say about us
I know that it'll be okay
You ain't even need no money
You can count on me

[Outro: Jabari Manwa]
Count on me
Count on me15Embed"
BROCKHAMPTON,4671170,6707719,323651,BROCKHAMPTON,https://images.genius.com/2fdd0eeccc6637359465b84e1e5fabda.300x300x1.png,LOVE ME FOR LIFE,https://genius.com/Brockhampton-love-me-for-life-lyrics,172251,"LOVE ME FOR LIFE Lyrics[Verse 1: Kevin Abstract]
What I gotta do?
Keep it real with you
Stuck inside my truth
Spendin' all my loot
Diamond on my tooth
R.I.P. my brother Luk
When I spit, let it hit, hit a double U
Couple rainbows, my lil' halo
Think it's J-Lo, bro don't say so
Homie don't play, no
Takin' my day slow
Takin' my ray, throw
Talkin' to angels
Speedin' a pave' though
Changin' a page though
Lookin' like ace, talkin' 'bout spade, you are afraid though
Spendin' my queso
All on some fake clothes
When I change, never say, this is my blaze throat
South Central
All my homies know
If I could go, I would just wait though

[Verse 2: Joba]
Anyways, gotta go, disregard what I say
Grain of salt, sprinkle some over the shoulder, ayy
Lucky Strike, filterless, don't push me, 'kay?
Sensitive, abrasive, stab you in the face
Keep a blade, heaven sakes, had to raise the stakes
Dracula, in a cave, a bit lonely, mane
Grab a stake, have a cape, it don't work no more
Fly away, different ways, hit the liquor store
Better days, follow me like the saddest song
Grab a case, hideaway, fill my loads with bleach
Couple stains ain't a game, they both hauntin' me
Lot to say, people hate, wearin' blindfolds
Now where did I go? Where do we go?
How do we grow? How should I know?
Feel responsible, intolerable, displaced (Uh-huh), insane
[Verse 3: Merlyn Wood]
Piss 'em off, piss 'em off, piss 'em off
Shit, I better set it off
I just made a deposit, CDG in my closets
Fuel ain't really made of fossils
Dirt on me, I'm finna blossom
Spying on your ho from a SpaceX rocket
She wanna know why my wrist so rocky
Flash splash on me, photocopy
My weed, my weed at the party
Shoot me a sheriff for Trayvon Martin
King, Ali, and Bobby Marley
Dirt on me, I'm finna blossom
Dirt on me, I'm finna blossom
You know

[Refrain: bearface]
I wish you'd love me for life
Love me for life, love me for life, wish you would lie
I wish you'd love me for life
Love me for life, love me for life, I will
Love, love me for, yeah
Love me, love me for life
Love, love me for life
Love, love me for life
Love, love me for
Love, love me for life
Love, love you for
Love you for12Embed"
BROCKHAMPTON,3957003,6663815,323651,BROCKHAMPTON,https://images.genius.com/5da37b77be2204a52bd0433c6650f563.300x300x1.png,BERLIN,https://genius.com/Brockhampton-berlin-lyrics,171777,"BERLIN Lyrics[Chorus: bearface]
She said, ""Baby boy, why you looking grimy as shit?""
I'll make the wristwatch flood, let diamonds fill my sink
If I got colors on my neck, what would my mama think?
We got the weapon tucked on us, make these boys extinct
Now look, look

[Verse 1: Dom McLennon]
Trade in that noose they put around us for a Cuban link
So my ancestors can see me shining, tell me what you think
I remember the illusions that they tried to move to me
That pollution still ain't stunt my evolution
What you choosing?

[Verse 2: Matt Champion]
No chip on my shoulder, hunnid leagues under the sea (Hoo!)
We live life like cheetah power up like Hummer diesel
Golden chain for niece and nephew
Pessimistic, I do not hang 'round them boys
Metaphysics, need another dimension I can enjoy

[Chorus: bearface]
She said, ""Baby boy, why you looking grimy as shit?""
I'll make the wristwatch flood, let diamonds fill my sink
If I got colors on my neck, what would my mama think?
We got the weapon tucked on us, make these boys extinct
Now look, look
Baby boy, why you looking grimy as shit?
I'll make the wristwatch flood, let diamonds fill my sink
If I got colors on my neck, what would my mama think?
We got the weapon tucked on us, make these boys extinct
Now look, look
[Verse 3: Dom McLennon]
Reporting for the operation
I learned that the beauty is in the creation
I added my detail for decoration
So baby boy, what's the occasion?
You dressed like you 'bout to take over a nation
Avoiding social litigation
When that admiration turns into abrasion
Y'all can find another station
Otherwise, stay tuned, evolution coming soon
Rolling deeper than a dune
Howling at the moon, I'll be back in June
Told my baby I'd be back in November
Did some Beatles shit to kick off this September
Crazy 'cause in 2010, I had some old friends
That thought I'd be another—[censored]
Go fucking figure

[Bridge: Kevin Abstract]
If I pull up out the tool
Riding still up on the roof
Seems like only legends do
(Check this, hot lookin' babes!)
Bitch, and that's the fucking move
(I feel you, when she said—)
[Chorus: bearface]
She said, ""Baby boy, why you lookin' grimy as shit?""
I make the wristwatch flood, let diamonds fill my sink
If I got colors on my neck, what would my mama think?
We got the weapon tucked on us, make these boys extinct
Now look, look
Baby boy, why you lookin' grimy as shit?
I make the wristwatch flood, let diamonds fill my sink
If I got colors on my neck, what would my mama think?
We got the weapon tucked on us, make these boys extinct
Now look, look

[Verse 4: Joba]
Good riddance, goodbye
Out of sight, out of mind
Cutthroat every time
This time, I get what's mine
Where the hell is your backbone?
Ducking me like whac-a-mole
Looking like an inflatable at a car show; a spectacle
Lick my finger, bet I found the wind
I follow that shit wherever it blows
You hung yourself, that's not my fault
I just supplied the rope, ugh!
Most thoughts, I don't think twice
Make decisions I'll die by
Never asked for the drama
But I'll turn it into dollars
Dollars, dollars, dollars
[Outro]
""Do you think about me?""
Ohh, ohh11Embed"
BROCKHAMPTON,3353057,3355833,323651,BROCKHAMPTON,https://images.genius.com/9956aa4c4965212522d2a54f2fd694e2.300x300x1.png,ALASKA,https://genius.com/Brockhampton-alaska-lyrics,170631,"ALASKA Lyrics[Verse 1: Ameer Vann]
I used to work for people
I made a couple hundred dollars, wasn't worth it even
I'm worth a hundred thousand
Not dollars but diamonds, I am mud out the bayou
Rip a page out the Bible, come and crucify me
I'm a long way from home and this ain't Yellowstone
I trade a white bitch for catfish and yellow bones
This from the catacombs, this for the broken homes
From the south side of cities where my granny home
I moved to California, I bring a Grammy home
I call up bill collectors, ""leave my fucking family 'lone""
We left the corner store on the way to caviar
The coupe is mustard colored, what the fuck is Grey Poupon?

[Verse 2: Kevin Abstract]
Young K.A., never quit your day job, uh
I bring the love to work, I need the day off, uh
I need the [censored], this hard work should pay off, uh
The lights stay off until my mind is made up, uh
A young Zuckerberg, I wake up and make stuff, uh
These niggas copy us, they really need to pay us, uh
I'm from the city where your neighbors fight back
You talking shit, we bring that work right to your lap
I love my niggas like white people love rap
We make the shit you'll probably never say on track again
[Breakdown: Joba]
Walked through doors all my life, just to close them
Tore down walls all my life, here's to the other side
A whole new life
(Feeling the brand new feeling, feeling the brand new feeling)
A whole new life
(Feeling the brand new feeling, feeling the brand new feeling)
A whole new life
(New feeling, brand new feeling, brand new feeling)
A whole new life
(New feeling, brand new feeling, brand new)
(brand new, brand new)

[Verse 3: Kevin Abstract & Joba]
(A whole new life)
Back when I was hustling, ain't get no love from them (uh)
(A whole new life)
I paid my own bills and came up with the illest shit (uh)
(A whole new life)
I was tryna find a way to get my family out of it (uh)
(A whole new life)
Spent my days in basements tryna write a motherfuckin' hit
Nowadays he's stumbling, they show such love to him
I shut it down to every show, we set the precedent
I'm just tryna show these niggas, life is on some other shit
Keep your head high, smile when the trouble rumblin'
[Break]

[Verse 4: Matt Champion]
I don't do what they say, it's unorthodox
Like bears sharing porridge inside with Goldilocks
Like Ozzy with no Sharon, he just called his parents
So fuck what I'm doing and fuck these damn critics
You should think for yourself, that shit is cancerous
Get my head rubbed by fingers of fuckin' hand models
Middle finger, fuck the hair up at all our concerts
Maybe if I cared less, I'd wear a hair net
But now my eyes, ten million by twenty five
Dropped out of Lone Star, booked flight from Lone Star
Was working a couple jobs and quit, became a star, uh30Embed"
BROCKHAMPTON,3353062,5623240,323651,BROCKHAMPTON,https://images.genius.com/9956aa4c4965212522d2a54f2fd694e2.300x300x1.png,STAINS,https://genius.com/Brockhampton-stains-lyrics,169641,"STAINS Lyrics[Verse 1: Ameer Vann]
I spent like a year and a half on the Greyhound bus
On the way to see this girl
Take a flight back just to keep my job
Used to fly standby, late to the airport
Where the buddy pass? Stuck in the traffic
Whole lotta hours, real long distance
But I've grown since then
Learned to be on my own since then
Marble floor in my brand-new crib
This the life that I wanted still
Got a hole and it burn my chest
Mash the chip that's still in my shoulder
Ain't a day that I still been sober
These the things that I'm tripping over
[Interlude: Ashlan Grey]
Y'all motherfuckers made three albums, still talking about the same shit. The one gay, the one selling drugs, the one that's, uh, tryna act like Lil Wayne. What the fuck is this shit, man? Y'all better turn this shit off when y'all get in the whip. When y'all enter my whip, y'all better not play this shit, 'cause this gon' go right the fuck off

[Verse 2: Matt Champion]
Now them boys hooked on heroin
Parents always asking like, ""Where y'all get it from?""
Rehab poppin' like when Amy had the single out
Single out the reasons how I quit before I fell down
I used to pick Ameer up
Talk about what's got us fucked up
We vent 'til the sun up, ayy
Hopefully, we get our funds up, ayy
And if I didn't know y'all, maybe I would have a desk job
Ticking 'til I off myself...
[Bridge: Matt Champion]
Used to drive around for some hours (Oh-oh)
Used to get paid by the hour (Oh-oh)
Now I'm just pickin up my check (Oh-oh)
Now I'm just pickin up a sweat (Yeah)
Used to drive around for some hours (Oh-oh)
Circle round the block for some hours (Oh-oh)
Now I'm just pickin up my check (Oh-oh)
Now I'm just pickin up a sweat (Yeah)

[Chorus: Joba]
Be there any minute, I'll be on it, in it, baby
Be there any minute, I'll be on it, in it, baby
Be there any minute, I'll be on it, in it, baby
Be there any minute, I'll be on it, in it, baby

[Verse 3: Dom McLennon]
I spent like a year and a half feeling sorry for myself
'Cause I thought love ain't make sense anymore
If I drank, you would probably see a fifth on the floor
And a hole in the door, rest a few more
Scared of the past I’ve been tryna avoid from before I was born
Running from the shoes that my grandfathers wore
Tryna pick a better battle I saw on the wharf
Feel the sun in my pores but I still got clouds in my head, now
Rain for a little bit, stay for a little bit
Moved along with my head, down
That's what momma taught me, and I never let them fuck me
When they handed me a dead king's crown
Told 'em think of what you doing before I'm the one you're choosing
I just wanna be a human when I share myself
Hear the things I'm saying and I scare myself, goddamn
[Chorus: Joba]
Be there any minute, I'll be on it, in it, baby
Be there any minute, I'll be on it, in it, baby
Be there any minute (Ooh), I'll be on it, in it, baby
Be there any minute, I'll be on it, in it, baby
Be there any minute, I'll be on it, in it, baby
Be there any minute, I'll be on it, in it baby
Be there any minute (Ooh), I'll be on it, in it, baby
Be there any minute, I'll be on it, in it, baby25Embed"
BROCKHAMPTON,3957015,6707719,323651,BROCKHAMPTON,https://images.genius.com/5da37b77be2204a52bd0433c6650f563.300x300x1.png,HONEY,https://genius.com/Brockhampton-honey-lyrics,160698,"HONEY Lyrics[Intro: Kevin Abstract]
My arms are always open, your fears always rollin'
In the deep, and you can't control it
What you want, what you want? Emotion?
My arms are always open, your fears always rollin'
In the deep, and you can't control it
What you want, what you want? Emotion?

[Verse 1: Kevin Abstract]
I need to step out with no frustration
I need a permanent getaway vacation
They got a permanent hit list, my nigga
A million reasons to get rich, my nigga
50 did it right

[Verse 2: Merlyn Wood]
I could've been homeless
I thought I moved to orphanage for the summer
I could've been homeless
Before I had a goal, I had a course

[Bridge: Kevin Abstract]
A million reasons to get rich, my nigga
A million reasons to get rich, my nigga
A million reasons to get rich, my nigga
Nigga, nigga, nigga, nigga
[Verse 3: Dom McLennon]
My people still dry snitchin' whenever they touch the mic
That's what happens when a therapist isn't somewhere in sight
Take flight, never leaned to the left, or the right
'Cause they turn the other cheek when our niggas start to die
When our women start to die, when our children start to die
I don't feel their empathy, we been displaced too many times
Every summer in the city start to feel like Columbine
'Cause you gotta get yours, and I gotta get mine
One time for the paragons of the paradigm
When you underground, they gon' only try to undermine
Use the track as a gymnasium to get into the stadium
You couldn't match my alien, I'm glowing like uranium

[Segue: Kevin Abstract and Dom McLennon, Beyoncé]
One time for the— one time—
One time— nigga, one time— nigga
One time— nigga, one t—
Nigga (Yes) nigga, nigga (Yes)
A million reasons to get rich, my nigga
50 did it right, 50 did it right (Yes)
Wish I could call every successful black rapper for advice
How the fuck do I make this shit last my whole life? (Yes)
What if they don't want to come to the concert tonight? (Yes)
[Segue reversed] (Yes)
Nigga (Yes) nigga, nigga (Yes) nigga
[Bridge: Matt Champion, Beyoncé, Kevin Abstract]
(Oh) Tuggin' on my pinky ring (Yes)
Smelling like chrysanthemum
(Honestly, I just want that) (Yes)
I just want that, I just want that, I just want that, I just want that
(Oh) Tuggin' on my pinky ring (Yes)
Smelling like chrysanthemum
(Honestly, I just want that) (Yes)
I just want that, I just want that, I just want that, I just want that
(Just give me what I need)
(Oh) Tuggin' on my pinky ring (Yes)
Smelling like chrysanthemum
(Honestly, I just want that) (Yes)
I just want that, I just want that, I just want that, I just want that
All my jewelry, and all my niggas (Yes)
All my jewelry, and all my niggas got that, yeah  (Yes, yes)

[Outro: Kevin Abstract, Beyoncé]
Ooh, ooh (Yes, yes)
And you know I got it (Yes)
Just give me what I need (Yes, yes)23Embed"
