artist,id,lyrics_owner_id,primary_artist_id,primary_artist_name,song_art_image_thumbnail_url,title,url,pageviews,lyrics
BROCKHAMPTON,3956969,17374,323651,BROCKHAMPTON,https://images.genius.com/7fe17e1f458b62844614167e608084d4.300x300x1.jpg,NEW ORLEANS,https://genius.com/Brockhampton-new-orleans-lyrics,344571,"NEW ORLEANS Lyrics[Intro: Matt Champion]
""—perfectly fine, that's fine!""
[Verse 1: Dom McLennon]
Said nigga brother, nigga brother, what you living for?
Is you gon' finish what you started? What you quitting for?
They told me God gave me a mission
But I'm missing the supplies to complete it
I ain't the one you should read in, I'm used to being defeated
So nigga, brother who you standing with?
I'm independent 'cause these parties never planned for this
Brother nigga with a brain, unintentionally swerving in every lane
The feeling's never the same, you chase what you couldn't gain
I'm so accustomed to flames, I couldn't tell you what's fire
Situation is dire, hear them calls from the choir
The disposition acquired from my position on Earth
It's telling me ""Decapitate everything for what it's worth!""
When I die, these words gon' need separate caskets and a hearse
I don't rhyme, I freeze time and let these hands just do the work
I'm in tandem with my curse, going manic since my birth
See the canvas as a planet I'm commanding with my nerves, ah

[Chorus: Kevin Abstract]
Tell 'em boys, don't run from us
I been down too long, cousin
I been down too long, brother
Tell the world, I ain't scared of nothing
Tell the world, I ain't scared of jumping
Tell my boy I want a crib in London
Tell the world to stop tripping, I'll
Build a different house with some different functions
Tell 'em boys, don't run from us
I been down too long, cousin
I been down too long, brother
Tell the world, I ain't scared of nothing
Tell the world, I ain't scared of jumping
Tell my boy, I want a crib in London
Tell the world to stop tripping, I'll
Build a different house with some different functions
[Bridge: bearface]
Try to treat man like baby
Feel the teeth sink in like rabies
Ah ah-ah, ah, ah-ah-ah ah
Ah ah-ah, ah, ah-ah-ah ah
Boy, you know you don't look fly
Them gold chains turn your neck green, bye
Ah ah-ah, ah, ah-ah-ah ah
Ah ah-ah, ah, ah-ah-ah ah

[Verse 2: Matt Champion]
Nothin' different now (woo!) all around now (woo!)
Who you keep around now? That's a big reflection
Don't like how they talkin' to me, why they walkin' to me?
Wear your shit upon your sleeve, stop projectin' on me
Sense is your surround sound, what's your take on me?
Kill the ego now, what that make of me?
Angle widescreen, couple sips of Tanqueray
I'ma throw a couple punches, I'ma do it anyway
Chin up little son, I slide in like the macarena
Lose time, pen it, style spiced on, jalapeño
Supersonic, move through tunnel, two-wheel cycle, slightly
Silence crowd better than 9 millimeter with extended suppressor
Bustin' out the function, highly comfortable
Got this Martine on my body, man, my sweat lethal
Sweet kisses like the candy out the carnival
I'ma call my own shots, hit the audible
[Verse 3: Joba]
Impending death is the only sign of life
I'm throwing Hail Marys 'til I die
Throw it up, all I have is peace of mind, throwin' up
Have my wings clipped, I don't need them shits
Learn to fly again
Fast track to last place, I swear
I've never been up top but I'm up here somewhere
Out here, nobody can tell me shit
Shit, never mind what I did back then
You should take a look at yourself instead
Maybe you can find yourself, love yourself
Here's to health and here's to wealth, all together now

[Chorus: Kevin Abstract & Jaden]
Tell 'em boys, don't run from us
I been down too long, cousin
I been down too long, brother
Tell the world, I ain't scared of nothing
Tell the world, I ain't scared of jumping
Tell my boy, I want a crib in London
Tell the world to stop tripping, I'll
Build a different house with some different functions
Tell 'em boys, don't run from us
I been down too long, cousin
I been down too long, brother
Tell the world, I ain't scared of nothing
Tell the world, I ain't scared of jumping
Tell my boy, I want a crib in London
Tell the world to stop tripping, I'll
Build a different house with some different functions
[Verse 4: Merlyn Wood]
Hoo! Voodoo Man
Momma took me to the church and I sang a hymn
Co-colonized Chris-ti-an
Now I'm losing my reli-gi-on
God damn, so narcissistic this millennium
Fuck you and the bubble that you livin' in
I don't go to church, but I'm so spiritual
Pulled my life out of dirt, that's a miracle
If Jesus was a pop star, would he break the bank?
All these diamonds in my face, I'm shining like the day
I'm living in my prime, man, what can I say?
If the service is an hour, I'm an hour late30Embed"
BROCKHAMPTON,3353060,3251272,323651,BROCKHAMPTON,https://images.genius.com/9956aa4c4965212522d2a54f2fd694e2.300x300x1.png,SISTER/NATION,https://genius.com/Brockhampton-sister-nation-lyrics,337648,"SISTER/NATION Lyrics[Part 1: SISTER]

[Intro: Merlyn Wood]
Drink of the apple pie with it, yeah, yeah, yeah
I don't got no chains in my denim, yeah, yeah, yeah
I don't listen what the blogs tell me, yeah, yeah, yeah
I know niggas got their own agenda, yeah, yeah, yeah
[Verse 1: Joba]
I've got [censored], but you would never know
I like to hide them, so much I lose myself
That's why I'm pure to some, a psychopath to others
And grew up in counseling, flipping off my counselors
They gave me mood stabilizers
But when I came off 'em, I was violent
Took the drugs that I wanted, which didn't help with the voices
They just grew louder and louder
Like all the people who'd just chatter and chatter
I juggle all my personalities

[Interlude: Robert Ontenient]
Estoy tan harto y cansado, no puedo seguir haciendo esto
Ojalá pudiera rendirme pero tengo que seguir siendo fuerte para mi familia y mis amigos

[Verse 2: Kevin Abstract]
I found myself getting better by the fucking minute
'Member when my momma always had to save the minutes
Got some D's, dropped out, wanted to be Russell Simmons
Gotta keep workin', my head on Innervisions
Where the kitchen at? Keep the lyrics written
Raid my cell and dope, askin' for forgiveness
I just ran into somebody sellin' lemonade
Kiss your kids tonight before them bitches run away
[Chorus: Kevin Abstract]
Get your man, get your man all up off me
Think again, want a hundred bands around me
In December, I don't care what they call me

[Refrain: Kevin Abstract]
This for all my broke niggas, this for all them jokes, nigga
That you niggas made when I was still livin' at home, nigga
Did it on my own, nigga, grew up and I bossed out
Grew up and I bossed out, grew up and I bossed out

[Verse 3: Matt Champion]
I see you peekin’ through bushes
And tryna get secret ingredients from us
I know that you do it 'cause you see us boomin'
Like C4 when you hit that detonator
Lucky-lucky on the elevator
Eat my dust, baby, I’ll see ya later
I could always call your bluff
You already said enough
Take a risk, bitch
Still sittin' on your ass, waitin' for a handout
Giving nothin', put your hands down
""Ooh, yeah, this for the culture!""
""Ooh, yeah, this important!""
Fuck off with that slang shit
Fuck off with that networking
Keep your mouth where the money at
[Bridge: Dom McLennon]
Yellow lights on my dashboard
Red flags in the rearview
I know I'm the one that made you upset
But all I wanna do is see you
You know that lately I don't think straight
But I don't really know what I'm doing now
'Cause everybody got me fucked up
I'm struggling while on the move now
Yellow lights on my dashboard
Red flags in the rearview
I know I'm the one that made you upset
But all I wanna do is heal you
You know that lately I don't think straight
But lately I don't know what to do now
'Cause everybody got me fucked up
I'm struggling while on the move now

[Chorus: Kevin Abstract]
Get your man, get your man all up off me
Think again, want a hundred bands around me
In December, I don't care what they call me
Get your man, get your man all up off me
Think again, want a hundred bands around me
In December, I don't care what they call me
Get your man, get your man all up off me
Think again, want a hundred bands around me
In December, I don't care what they call me
Get your man, get your man all up off me
Think again, want a hundred  bands around me
In December, I don't care what they call me
[Part 2: NATION]

[Verse 1: Kevin Abstract]
Barely got control of it, must've got a hold of it
Threw me to the ground and left a scar right on my nigga-lips
I look in my closet when I think about the past life
Never good in my wallet, tryna see if I got my cash right
Fuck a flight, they ain't never wanna treat my bag right
Fuck a job, they ain't never treat my mom and dad right

[Verse 2: Ameer Vann]
I hate them quiet suburbs, I hate those picket fences
I hate the separation, first thing they called me; ""Nigga""
I fight, I got suspended, my teachers saw me hit him
So they ain't listen to me, and from that moment on
I would learn that I was different, I would grow to see the difference
Second-guessing my decisions, Black bodies come up missing

[Chorus: Kevin Abstract]
I feel like all my days are coming to a blend
I feel like all my days are coming to a blend

[Verse 3: Dom McLennon]
I would walk through the halls at my own pace
Every lunch, I would flow, having no place
All the books in my bag 'til my bones ache
Wonder how the world would be if I had no face
If I had no heart, if I had no skin
And I was just thoughts, reminiscing
The things I always brushed off
Had my father try to tell me I was just soft
And when I look at the things that I've been through
And the things I survived, and at what cost?
All the love in my life that I just lost
All this shit persevere to the pole vault
In the lies of the law, I'm a problem
In the eyes of the blogs, I'm a paycheck
In the eyes of the world, I'm a icon
In the eyes of my own, I ain't start yet
In the eyes of the law, I'm a problem
In the eyes of the blogs, I'm a paycheck
In the eyes of the world, I'm a icon
In the eyes that I own, I ain't start yet, I ain't start yet

[Bridge: Merlyn Wood]
Power, African power!
Power, African power!
Power, African power!

[Chorus: Kevin Abstract]
I feel like all my days are coming to a blend
I feel like all my days are coming to a blend
Ugh, I feel like all my days are coming to a blend
I feel like all my days are coming to a blend47Embed"
BROCKHAMPTON,3793863,3881576,323651,BROCKHAMPTON,https://images.genius.com/a967c10f17a9822371d487ed2a939cce.300x300x1.jpg,TONYA,https://genius.com/Brockhampton-tonya-lyrics,302309,"TONYA Lyrics[Intro: bearface]
And mother, I am sorry, I never pick up, mm-hmm
Because I'm afraid to disappoint ooh, ooh-ah, ooh, no

[Chorus: serpentwithfeet]
Hey, and I've been feelin' like I don't matter how I used to
Hey, and I've been feelin' like I don't matter how I used to

[Verse 1: bearface]
We were sat outside on the Harvard floor
With our feet in dirt, and our hearts in awe
I be losin' sleep thinkin' 'bout missed calls
And I see the names circling our thoughts
And I think about if we lose it all
And I turn to shit that you'd never want
Like the smoke, the drink, anything at all
And I'll say again, ""Sorry I don't call""
There's no money on my mind
But my money or my mind
What's the first to fall?
I never wanted this shit, yeah

[Chorus: serpentwithfeet]
Hey, and I've been feelin' like I don't matter how I used to
Hey, and I've been feelin' like I don't matter how I used to
[Verse 2: Kevin Abstract]
Sometimes, it be so spot on it hurts
Like when Auntie couldn't decide between going to work or church
I've been in my feelings on an island in the dirt
I feel like brothers lie just so my feelings don't get hurt
I said, ""I'll try vacation, I'll try to run away""
I deleted Facebook, I'll trade fame any day
For a quiet Texas place and a barbecue plate
I'll switch my place if that's good for you, is that good for you?
My ghost still haunt ya, my life is I, Tonya
A big-eyed monster, only face to conquer
I hated songs about fame 'cause that stuff meant nothin'
Until them headlines came, then first flight I'm stuck in

[Bridge: Joba]
And maybe it means nothing
But I have to say I think about you often
And if you want no part with me
I'll walk away, I know that I have wronged you
And maybe it means nothing
But I have to say I think about you often
And if you want no part with me
I'll walk away, I know that I have wronged you

[Verse 3: Dom McLennon]
I took a plane to somewhere that I've never been
Too many times without my sister and my brother
Dad or mother by my side but they're in spirit
I always hear it, I know they feel it
My momma always had these dreams that used to keep her up at night
I smoke to keep them all away and make use of the time
I'm void of feelin'
The reasons I'm so out of touch now start revealin'
But I'm not ashamed, I'm not afraid of who I am
Or how I trust my mental, yeah, it's not perfect
But I guess that's just the shit I'm into
I fantasize about a time when everything was simple
My shelter sheltered me from things I needed to commit to
The way it stands to me
A victim of Stockholm in my friendships and family
[Verse 4: Merlyn Wood]
What's costin' your time? What's the reason that you whine?
What's in your wallet? Dead whites in mine
So sour, in this light of lime
Daddy said ""Study or get that cash""
Mommy said ""Your career ain't gon' last""
Loose change, call a cab, move out their pad
I just need a chance to move past my past
Don't think too fast, private jets still crash
And I'll still fly coach, and I'll still hit a roach
And I'll still see roaches at the crib where my folks at
Touch your dreams 'fore you touch me and provoke a man
(Somebody's gonna have to tell the truth and I'm gonna tell it!)

[Outro:  serpentwithfeet & Matt Champion]
I will
I will
(I don't matter)
I will
(Ahh)
Can I tell you how?
Can I tell you now?
I will51Embed"
BROCKHAMPTON,3353058,3355833,323651,BROCKHAMPTON,https://images.genius.com/9956aa4c4965212522d2a54f2fd694e2.300x300x1.png,HOTTIE,https://genius.com/Brockhampton-hottie-lyrics,290809,"HOTTIE Lyrics[Chorus: Kevin Abstract]
Put the bag in the cup, add it up, add it up
Put my friends in the truck, add it up, add it up
If you think you know me now, that's enough, that's enough
If you think you know me now, that's enough, that's enough
Put the bag in the cup, add it up, add it up
Put my friends in the truck, add it up, add it up
If you think you know me now, that's enough, that's enough
If you think you know me now,  that's enough, that's enough

[Verse 1: Dom McLennon]
Do you see what you contribute to my consciousness?
Voices feelin' so ominous
I can't place a pen for you, they mark it out as anonymous
I would shift the whole continent
If it helped you 'round with some confidence
Thinkin' bout all the consequence
Gotta try to break what's monotonous

[Verse 2: Joba]
How could I be better?
I paid the price in full, just to clear the record
Rewound just to fast forward
On the eight-track I stole from my grandmama

[Verse 3: Merlyn Wood]
Catastrophic, where the stoppin'?
Man, I wish I had a rocket
Wish I ain't feel microscopic
Wish my thoughts was telepathic
But instead I'm always babbling
Love rappin' like it's my girlfriend
Every tour is like a catfish
Just kidding, I love you assholes
[Chorus: Kevin Abstract]
Put the bag in the cup, add it up, add it up
Put my friends in the truck, add it up, add it up
If you think you know me now, that's enough, that's enough
If you think you know me now, that's enough, that's enough

[Verse 4: Joba]
It's hard to air out in deep water
You keep calling, I ignore it
Cleared my conscience in absurd ways
I do the things you hate, I'm changing every day

[Bridge: Matt Champion]
I just wanna know, know (I just wanna know where the party at)
I just wanna know, know (24/7 thinkin' 'bout you)
I just wanna know, know (I just wanna know when we leavin', boo)
I just wanna know, know (24/7 thinkin' 'bout you)
I just wanna know, know (I just wanna know where the party at)
I just wanna know, know (24/7 thinkin' 'bout you)
I just wanna know, know (I just wanna know when we leavin', boo)
I just wanna know, know (24/7 thinkin' 'bout you)

[Chorus: Kevin Abstract]
Put the bag in the cup, add it up, add it up
Put my friends in the truck, add it up, add it up
If you think you know me now, that's enough, that's enough
If you think you know me now, that's enough, that's enough
Put the bag in the cup, add it up, add it up
Put my friends in the truck, add it up, add it up
If you think you know me now, that's enough, that's enough
If you think you know me now, that's enough, that's enough30Embed"
BROCKHAMPTON,3353064,1544762,323651,BROCKHAMPTON,https://images.genius.com/9956aa4c4965212522d2a54f2fd694e2.300x300x1.png,TEAM,https://genius.com/Brockhampton-team-lyrics,283423,"TEAM Lyrics[PART 1: EVANIE]
[Verse: bearface]
Evanie
Did you lie to him since you were seventeen?
How's he holding up?
Evanie
Do you cling to him like you would onto me?
Bet he needs you more than I
Evanie
Did you hide your neck to save him from his sleep?
I know how that feels
Evanie
Every chance you take, you make me want to flee
Can't you see?

[Chorus: bearface]
You should move on
I swear you'll be fine
Whenever you want
I'll be your ride
And when you're alone
And his love is gone
Maybe you'll see that your company
Was the worst thing for him
Your sin
[PART 2: TEAM]

[Verse 1: Kevin Abstract, Ameer Vann]
Little old me, I thought my world was progressive
'Cause my president was Black, twenty-five lighters on the dresser
I had guilt-trip on my back and a bulletproof vest
Inside my Uncle John's Toyota was a walking Crayola, ah—
(Gimme that mic, nigga)
I got a hard time, I gotta watch myself
The way I move through a room full of suits, ain't no—
Ain't no Constitution, I hate uniforms (Hahaha!)
I hate handcuffs, I can't stand up (Shut up, nigga!)
They throw me in the crowd and tell me, ""Boy, I'd lose that smile""
But see, I got it from my dad, and that's the reason why we had
I raise my Black fist, I got big lips
I'm strong as Samson, they cut my fucking locks
I lose my fucking strength
[Verse 2: Dom McLennon]
Fuck, I'm running out of zips
My life been feeling tense, I won't be on the fence
I put my phone on Airplane Mode 'cause I'm on autopilot
I need a lot of patience, I need a lot of silence

[Verse 3: Matt Champion]
I hope this holy water burn because I ain't worth this life
I ain't worth the light of day, but for some, I light the way
Nude along the banister, kitchen smell of lavender
Swimming in my Wranglers, I am another caliber
[Outro: bearface]
Ooh, yeah
La-da-da-da-da-da-da-da
Soon, no no, no no, yeah, yeah
No, no, no, no, no, no
No, no, ooh
Soon, come on
No, no, no, no, no, no
No, no, ooh
No

[Intro to ""HEAT"" begins]32Embed"
BROCKHAMPTON,3957199,6663815,323651,BROCKHAMPTON,https://images.genius.com/5da37b77be2204a52bd0433c6650f563.300x300x1.png,WEIGHT,https://genius.com/Brockhampton-weight-lyrics,264586,"WEIGHT Lyrics[Verse 1: Kevin Abstract]
They split my world into pieces, I ain't heard from my nieces
I been feeling defeated, like I'm the worst in the boyband
I ain't sleep in some weekends, tryna headline both weekends
Lead my niggas, y'all sheepin', I keep the world in my hands
I know accounts should be deleted
I know some niggas should stop hitting my phone
Whenever they needing money or favors done
'Cause I'm still worried 'bout when Ashlan finna put the razor down
So I don't really give a fuck about what story they done spun
And I ain't done (No, no)
Yeah (Tell something)
And I ain't done, you heard me?
I ain't done (Yeah, I'm screaming oh, oh, oh, oh-oh)
I really miss the old days before the cosigns
I really miss them cold days before the road signs
I really miss when I ain't know which way I was supposed to head
And I was pressed because my shawty gave me cold signs
I was writing poems 'bout her dawg in study hall
And she was mad 'cause I never wanna show her off (Scared)
And every time she took her bra off my dick would get soft
I thought I had a problem, kept my head inside a pillow screaming

[Bridge: Kevin Abstract]
I don't wanna waste no more time
I'm ready to go
I put my life on standby
I can leave you alone
[Scratches: Kevin Abstract]

[Verse 2: Joba]
'Cause we're born with a dollar sign attached to our temple
Life is a dish served cold most times
And all my life I've taken handfuls
Force-fed by the hand that feeds us
But not all hands created equal
I stand by, waiting for something good to come
In due time, the skies will split for the sun to smile

[Verse 3: Dom McLennon]
My mother called me today
She said she thought she felt my energy a country away
I apologized for not calling enough due to weight
But couldn't tell you if I kept it in my head to decay
I asked her, ""Why this world love echoing hate?""
She said, ""Don't let those who don't know you start dictating your fate""
I think the hardest part of love could be rebuilding the breaks
Conditioned to omit them until our foundation will shake
It's no debate
The road to peace is filled with snakes, you gotta keep your cool
And recognize the wolves that wanna try and leave you wool
Don't let 'em treat you like a window, you know you're a jewel
This world is cruel and not as simple as they teach in schools
Sometimes you gotta step away and check your own intentions
And analyze if what they do can compromise your vision
If people trust you, they don't need to question your decisions
You never needed them if they make you another villain
[Interlude: Joba, Sammy Jo & Tune Up]
Pressure
""They tried to take the bike. And they took my friend's bike and then my friend was gonna get it back but then he didn't get it back and then we had to go to the police station. And then, um, then some  (Pressure) random stranger brought back his bike. We just, you know, and we didn't tell our mums so we got in trouble (Pressure makes me—) because they found out like a day later.""
Do you want to start the game again?

[Bridge: Joba]
Pressure makes me lash back, wish I could get past that
I can't take a step back, makes me wish you'd pass that
Pressure makes me lash back, wish I could get past that
I can't take a step back, makes me wish you'd pass that
Take it all, or leave it
Pressure makes, pressure makes, pressu—
Wish I could, wish I could, wish I—
I can't take, I can't take, I can't—
Makes me wish, makes me wish, makes me—
Pressure makes, pressure makes, pressu—
Wish I could, wish I could, wish I—
I can't take, I can't take, I can't—
Makes me wish, makes me wish, makes me—

[Outro: Joba]
Sipping on my pain, smoking by my pain
Ingesting my pain, I just wanna play
Sipping on my pain, smoking by my pain
Ingesting my pain, I just wanna play
Take it all, or leave it
Sipping on my (Sipping on my), smoking by my (Smoking by my)
Ingesting my (ingesting my), I just wanna (I just wanna)
Sipping on my (Sipping on my), smoking on my (Smoking by my)
Ingesting my (ingesting my), I just wanna (I just wanna)36Embed"
