artist,id,lyrics_owner_id,primary_artist_id,primary_artist_name,song_art_image_thumbnail_url,title,url,pageviews,lyrics
BROCKHAMPTON,6289403,6612308,323651,BROCKHAMPTON,https://images.genius.com/b0f51c752740cee7ae29a41466ee4ee1.300x300x1.png,THE LIGHT,https://genius.com/Brockhampton-the-light-lyrics,118856,"THE LIGHT Lyrics[Intro: Joba]
I give, my mom so, —mess
In the same house my dad died in, all alone
Tryin' not to be paranoid, tryin' not— as they're calling it
'Cause every headline is a reminder that the world's fucked
So I'm just tryin' to see the light
In between the clouds
Still love that sunshine

[Verse 1: Joba]
When I look at myself, I see a broken man
Remnants of my pops, put the Glock to his head
Nothing ever go as planned, couldn't make amends
Forcibly pretend I don't give a damn
At a loss, aimless, six feet deep
Suffocatin', can't face it
Can't change it, ain't make it
Master plans by the Maker, I see no savior
Morbid reflection and stainless steel, alcohol and pills
Deadly combinations left with nothin' else to feel
A floral haven, hope it was painless, I see you in the faces
Places and my making, reflections off a broken mirror
Fragments of my fear glarin' back like, ""Who's there?""
I can't stand myself, beside myself, I see you there
I know you cared
Felt numb since September when I heard the news
What I'd do to speak one last time
Think I always will be haunted by the image of a bloody backdrop Skull fragments in the ceilin', felt your presence in the room
Heard my mother squealin'
Master of disguises, ash to ash, dust to dust
Voids behind my eyelids, blacking out, bleeding out
Silence louder than a twisted tongue lying
As sick as our secrets
Shadow people and needles fading through a peephole
Bedtime stories from purgatory, I miss you
[Bridge: Joba]
For the record, I can fly
Around the world absorbing light
Something's missing deep inside
The light

[Verse 2: Kevin Abstract]
Somethin' changed in Texas, guess I missed the message
Look, I missed my exit, I'm living like a Jetson
I was broke and desperate, leanin' on my best friends
Only shot callers I was around was bartendin'
Ain't no love in this game, mama, this is not tennis
Take your shoes off, we just did the carpets in
I can the take the hatin', I can take the praisin'
It's all noise to me, I'll turn into Satan
Y'all stuck in The Matrix
Red pill, blue pill, all these different faces
All these different cases, shit, y'all done seen me naked
So I'ma wear what I want now and I ain't finna fake it
Thank God I made it, thank God I seen God last summer
I was standing on the bridge, I seen all y'all under me
Know you are struggling, niggas out here juggling
Losin' jobs and losing God, then everything is tumbling
Feel Heaven rumbling, the rapture is coming
I love the attention, I'm a bastard in public
I still struggle with tellin' my mom who I'm in love with
Subtleties in between, way these diamonds gleam
When Thanksgiving come around, I still don't see 'em
When Christmas come around, nigga, I still don't see 'em
Told the world who I was before I got to know Ian
They gave my people money in exchange for their freedom
I would give it all back for a chance to free 'em16Embed"
BROCKHAMPTON,3199033,3049243,323651,BROCKHAMPTON,https://images.genius.com/b0538ae7632778530f7e47672eb74a97.300x300x1.png,FIGHT,https://genius.com/Brockhampton-fight-lyrics,118438,"FIGHT Lyrics[Verse 1: Ameer Vann]
My male role models drug dealers and thugs
My father learned how to solve problems with guns
And when I grew up, I learned what racism was
And what teaching it does, and like my teachers would say:
""Little Black boys have a place in the world
Like hanging from trees, or dead in the street""
Like I seen on TV
All them boys they killed, they looked just like me
Not like Brandon or Chandler, but Malik and Kareem
I was born with a target, and it stuck to my skin
And I learned in social studies, I was one of them men
Who were locked in the chains, but not locked in the pen
But I'm bigger than that, I'm the beginning and end

[Verse 2: Dom McLennon]
I'm the sun and the moon
I'm the light and the dark, I am life in the tomb
I'm the pharaoh and slave, gentrifying my spirit
It's like a knife in the womb, refuse to act like a parrot
Or to dance like a monkey; see, your stance is apparent
That's why I'm here for the money, don't care to cater to merit
Y'all fetishizing my spirit, I see your culture’s dependent
On what you didn’t inherit, won't let my world be attempted
I'm staying distant
[Chorus: Kevin Abstract, Merlyn Wood]
Who gonna be the reason why I get high?
Who gonna be the reason why I turn over?
Who gonna be the gunner that I don't trust?
Who gonna be the gunner that get they ass whooped?
Who gonna be the reason why I get high?
Who gonna be the reason why I turn over?
Who gonna be the gunner that I don't trust?
Who gonna be the gunner that get they ass whooped?
Who gonna be the reason why I get high? (Bloodsucka!)
Who gonna be the reason why I turn over? (Bloodsucka!)
Who gonna be the gunner that I don't trust? (Bloodsucka!)
Who gonna be the gunner that get they ass whooped? (Bloodsucka!)
Who gonna be the reason why I get high? (Bloodsucka!)
Who gonna be the reason why I turn over? (Bloodsucka!)
Who gonna be the gunner that I don't trust? (Trustsucka!)
Who gonna be the gunner that get they ass whooped? (Bloodsucka!)

[Bridge: Kevin Abstract]
Bum, bum, beat 'em, I would never wanna be 'em
If I catch 'em slipping, they gon' have to meet the eagle
Bum, bum, beat 'em, treat these niggas how I see 'em
I don't need you either, send you right back where I seen you
Bum, bum, beat 'em, I would never wanna be 'em
If I catch 'em slipping, they gon' have to meet the eagle
Bum, bum, beat 'em, treat these niggas how I see 'em
I don't need you either, send you right back where I seen you
[Outro: Ameer Vann & Merlyn Wood]
In the game, in the game, in the game, in the game (Bloodsucka!)
In the game, in the game, in the game, in the game (Bloodsucka!)
Running thangs, running, run, running, run, running thangs (Bloodsucka!)
Running thangs, running, run, running, run, running thangs
In the game, in the game, in the game, in the, in the
In the game, in the game, in the game, running thangs
Running thangs, running, run, running, run, running, run
Running thangs, running, run, running, run, running thangs18Embed"
BROCKHAMPTON,6575392,498964,323651,BROCKHAMPTON,https://images.genius.com/b0f51c752740cee7ae29a41466ee4ee1.300x300x1.png,WINDOWS,https://genius.com/Brockhampton-windows-lyrics,118314,"WINDOWS Lyrics[Intro: SoGone SoFlexy]
Shit, I was just talking 'bout
Just, that grind, the trenches, just
You know what I'm sayin', just all that
I mean, you-you don't get the vibe of it?

[Verse 1: SoGone SoFlexy]
Feels good to get this shit out the mud, nigga
Made it from hard times, it's still love for the slums, nigga
We rob niggas just because, nigga
And I'll serve you anything, but nothin' less than a dub, nigga
And how it feel to be a dub, nigga?
I'm tryna be a better man but nothin' less than a thug, nigga
I kill shit, just check my background (Bah)
This murder gang shit my campground
Check my résumé or ask 'round (Yeah)
We just simply never back down (Nah)
I caught a charge, now I'm back out
I bet this carbon blow his back out
Gettin' money, that's a fact now (Merlyn)
Bitches, they don't know how to act now (Merlyn)

[Verse 2: Merlyn Wood & Kevin Abstract]
The poor more polite, but thе flow not nice (No)
Watch for your wife, I might take hеr out your life (You know)
She wet my white tee, now it's like a wet wipe (Wet it)
Respect my Tribe, I'm a dog like Phife (Get it?)
You love me like a check, but my name not Nike (Get it?)
Bitch, my number not a lottery
I'm like, ""Don't even talk to me"" (Stop)
Honestly, wouldn't fly a Melbourne chick to Sydney, no (Go Merlyn,  Go Merlyn)
All of these bars bought chains, prison industries (Go Merlyn, Go Merlyn, Go Merlyn)
True, America did my people foul, then give me shot for free (Go Merlyn, Go Merlyn)
While I watch Washington's wooden teeth in her booty cheeks
Kings of last century, was living like peasantry
I don't even like sleep, time is the only luxury
[Verse 3: Matt Champion]
Sendin' a fuck you to you all
I'ma ship it, laminate it, got this shit straight off the lot
We ain't renting no AVIS
Got the neighbors going crazy
It's me, Bari, and Flexy
I can see through your bullshit, like your face was made of plexi' (Haha)
I could fuck around and get to soundin' like I'm whinin' man
Only crybaby is the one inside the buggy, man
Who, I'm the bogeyman
You, never sleep again
Nightmares, it's fright-filled the moment Freddy tuck you in
Stack my money higher than the foam atop a tidal wave
Lonely like the point guard at the key, got the isolate
Light it up, light it up, we bring the light show
Who the hell invited all they friends?
Fuck if I know (Yeah, yeah, yeah)

[Chorus: Jabari Manwa]
They at your window (Them boy calling for you)
They at your window (Them boy coming for you)
They at your window (You better not tell no lies)
They at your window (You know them boys outside)
They at your window (Them boy calling for you)
They at your window (Them boy coming for you)
They at your window (You better not tell no lies)
And they ain't coming to play
You should not tell no lies
[Verse 4: Dom McLennon]
My pen could be a fortune teller or an ATM
It's got intentions of its own, I can't even pretend
Every moment is a fight nobody can defend
The circumstances should've never been there to begin
I watch the clocks melt as the Devil dances
The chances are slim to none that you could understand this
Lost language we incantin', pain campin'
Amongst the stillborn raindrops is where I'm standin'
I wake up breakin' up an eighth just to function
Rather be in neutral than continue to get sunken
All my niggas made it out the motherfuckin' dungeon
Tank has been on E, but I gotta keep runnin'
What you finna lean on when our system is crumbling?
Everybody's reaching but they really end up fumbling when they touchdown
Y'all don't appreciate in value like a bust down
My shit authentic, they can never get enough now

[Chorus: Jabari Manwa]
They at your window (Them boy calling for you)
They at your window (Them boy coming for you)
They at your window (You better not tell no lies)
And they ain't coming to play
You should not tell no lies

[Verse 5: Joba]
I can see the eye upon me when I close mine
Drug-induced comatosis leaking through me blind
The body is the temple, I invite spirits
We crack riddles and giggle behind closed blinds
Born to bleed, the brave and free
Got needs they gotsta feed, I breathe to see defeat
Fuck police and authority
Never means nothing, mind-fucking myself to sleep
Had to take it to the streets
Capitalistic greed plague all society like COVID-19
Those dirty hands that feed don't buy it
Government officials, don't give a fuck about the children
What do you believe?
Nothing's ever what it seems 'til you can't deny it
Flashpoints and flashbangs dictate defiance
History stuck on repeat in the loop of sirens
Terrorizing, always lying
Goddamn tyrants
Don't play with knives, kid
[Bridge: Ryan Beatty]
I tried to warn you
These boys, they don't know you
Outside, comin' for you
'Cause they don't love you and they don't know you
I tried to warn you
These boys, they don't know you
Outside, comin' for you
'Cause they don't love you and they don't owe you shit

[Interlude: Imondre Goss & Kevin Abstract]
Fuck the world and all that inhabit it
Fuck the world and all that inhabit it
Sometimes it's like
Fuck the world and all that inhabit it
Yeah, nigga
We back up in this thing (Road)
Sometimes it's like, all or nothin' (Road)
Fuck the world and all that inhabit it
Sometimes it's like
Fuck the world and all that inhabit it
Sometimes it's like

[Verse 6: bearface]
Just pick me up in the four-door
I'll bless the beat with smoke and rain ash like Mordor
The warlord's comin', check the lamb for the slaughter
The envy so green it should be flying a saucer, yeah
And when the pressure is on, they gone
Ghost ride whippin' not your friends no more, so long
Snake sneakin' I'm feeling like I'm missin'
But never that I'm still here bitch, so God's winnin'
Lord willing (Lord willing)
There's no ceiling (No ceiling)
They all pussy (All pussy)
Get out your feelings (Get out your feelings)
Can try and run it up but baby I'm chillin' (Uh-huh)
I make my money, then dip, stay killin'
Stay killin', stay killin', stay killin'

[Outro: Kevin Abstract]
Why you always start prayin' when that trouble come around?
(Why you always start prayin' when that trouble come around?)
There them boys go again
The Roadrunner7Embed"
BROCKHAMPTON,3957005,6707719,323651,BROCKHAMPTON,https://images.genius.com/5da37b77be2204a52bd0433c6650f563.300x300x1.png,WHERE THE CASH AT,https://genius.com/Brockhampton-where-the-cash-at-lyrics,111305,"WHERE THE CASH AT Lyrics[Intro]
There's not a soul in here

[Verse 1: Merlyn Wood]
Pull to your house and dump like the trash man
All up in your grill, but I'm not a fan
Merlyn, I do no hat trick, just show me where the cash at
Then show me where the hash at, fuck that
Show me where the cash at
(There's not a soul in here)
I would rather be on acid, rather make investments
They'll come out of that debt, we'll come out of those bedsheets
I'm like the IRS, pull up to your address
I was trying my best to seizure, but pull it like Keisha
(There's not a soul in here)
Johnny Dang gon' ice my diamonds, up out that freezer
I used to be broke, I don't got amnesia
I used to deal with both, now it's black victims
She know not to call collect if she go to prison
(There's not a soul in here)

[Chorus: Merlyn Wood]
Pull to your window and drizzle with that pitter-pat (Ba-dam!)
G-P to S and figure where you niggas at (Show out)
""Where the cash at?"" Used to ask that (Ayy, clip, ho out, throw down, ho out, know 'bout, throw down, hold out)
""Where the cash at?"" Used to ask that
(There's not a soul in here—)
Pull to your window and drizzle with that pitter-pat (Ba-dam!)
G-P to S and figure where you niggas at (Show out)
""Where the cash at?"" Used to ask that
(Ayy, clip, ho out, throw down, ho out)
(Now 'bout, throw down, hold out)
""Where the cash at?"" Used to ask that
[Verse 2: Matt Champion]
At night, I bring them out, I was sleeping upside-down
Keep you up, I come around, they stay right up on my tail
Send me a pic whenever it slip, hoping this outflow my scales
Full throttle whenever I blaze, fifty mil', put it all in my will (There's not a soul in here—)
Human, I see through your eyes, until my CCC wide open to my skin
They can see they run, they feel like they been kicking DDR
Bustin' out the bar, human of the tour
They grip three types of the gas, miss the days I can't get back (There's not a soul in here—)

[Chorus: Merlyn Wood]
Pull to your window and drizzle with that pitter-pat (Ba-dam!)
G-P to S and figure where you niggas at? (Show out)
""Where the cash at?"" Used to ask that (Ayy, clip, ho out, throw down, ho out, know 'bout, throw down, hold out)
""Where the cash at?"" Used to ask that
(There's not a soul in here—)
Pull to your window and drizzle with that pitter-pat (Ba-dam!)
G-P to S and figure, where you niggas at (Show out)
""Where the cash at?"" Used to ask that (Ayy, clip, ho out)
""Where the cash at?"" Used to ask that9Embed"
BROCKHAMPTON,3353053,5259561,323651,BROCKHAMPTON,https://images.genius.com/9956aa4c4965212522d2a54f2fd694e2.300x300x1.png,LIQUID,https://genius.com/Brockhampton-liquid-lyrics,110017,"LIQUID Lyrics[Verse 1: Ameer Vann]
I grew up all alone, my mom and dad fighting
I moved around a lot, I did a lot of fighting
I met my friend Ian, I seen a lot of cyphers
I did a lot of writing

[Verse 2: Dom McLennon & Kevin Abstract]
Watch my uncles duck indictments
I'm used to ramen noodles, victims of mental illness
Products of neighborhoods with broken souls and wounded spirits
Don't judge me by appearance, I moved to California
Started getting paid, (Nigga, you broke) shit's already boring

[Verse 3: Merlyn Wood]
Dash into the money like a hyphen, fuck a pipe dream, man
Had this shit when I was in my diapers
Burnin' through my diapers, hot shit, that was hot shit
Back when niggas looking for the Loch Ness

[Verse 4: Matt Champion & Dom McLennon]
Stuck 'round dip spittin' assholes, make they mamas bashful
Got holes in my pockets so my shoes full of cash though
Cigar, Fidel Castro, car full of Castrol
See the sunset when I backstroke, can't swim, but I could act, though

[Outro: Kevin Abstract]
I was playing rock paper scissors with imaginary friends
Imagine having no friends, ayy
I was playing rock paper scissors with imaginary friends, ayy
Imagine having no friends, man
I was playing rock paper scissors with imaginary friends, ayy
Imagine having no friends, man
Ayy, ayy, imagine having no friends, man11Embed"
BROCKHAMPTON,3113512,3195745,323651,BROCKHAMPTON,https://images.genius.com/63f4ae252959cf8e0fbbee735bba6bcd.300x300x1.jpg,TRIP,https://genius.com/Brockhampton-trip-lyrics,108999,"TRIP Lyrics[Chorus: Kevin Abstract]
Today I'ma be whoever I wanna be
Today I'ma be whoever I wanna be
It's a boy fantasy, it's a girl fantasy
This is our fantasy, baby boy, boy, boy
Today I'ma be whoever I wanna be
Today I'ma be whoever I wanna be
It's a boy fantasy, it's a girl fantasy
This is our fantasy, baby boy, boy, boy

[Verse 1: Kevin Abstract]
Flap, flap, flap your wings, go high
Go high, go high
Ride, ride, ride, ride, ride around the night
This little town, I wanna say goodbye
To everybody here 'cause they're all the same
I hate this place
And everybody here is all the same
Life's a disgrace

[Chorus: Kevin Abstract]
Today I'ma be whoever I wanna be
Today I'ma be whoever I wanna be
It's a boy fantasy, it's a girl fantasy
This is our fantasy, baby boy, boy, boy
Today I'ma be whoever I wanna be
Today I'ma be whoever I wanna be
It's a boy fantasy, it's a girl fantasy
This is our fantasy, baby boy, boy, boy
[Verse 2: Ameer Vann]
Flying on my rocket ship (ay!), I'm on an acid trip (ay!)
I need another pill, snort and let it drip
I'm with my white friends, we getting wasted
Trapped in the suburbs, we suffocatin' (ay!)
We get all our drug (ay!) and education
""You came with black folks?"" Hoe, your parents racist
You say they hate me? Well, I love them
We still roll up, we still best friends (ay!)
[Verse 3: Dom McLennon]
Everybody smilin', I don't see what's funny
Everybody friends, guess I wasn't lucky
Family full of athletes, I was kind of chubby
Shit was never sunny, wrists were sorta bloody
Lick my wounds with honey, save me for the vultures
I'm fallin' in the void, I don't know what I discover
I know I could hear the thunder, I can feel the hunters
They be preying on my hunger, I won't let 'em make me suffer 'cause

[Chorus: Kevin Abstract]
Today I'ma be whoever I wanna be
Today I'ma be whoever I wanna be
It's a boy fantasy, it's a girl fantasy
This is our fantasy, baby boy, boy, boy
Today I'ma be whoever I wanna be
Today I'ma be whoever I wanna be
It's a boy fantasy, it's a girl fantasy
This is our fantasy, baby boy, boy, boy
[Outro: Joba]
Oooh, take a moment
Do you take a moment?
Do you take a moment?
Oooh, take a moment
Do you take a moment?
Do you take a moment?14Embed"
BROCKHAMPTON,3199044,3049243,323651,BROCKHAMPTON,https://images.genius.com/b0538ae7632778530f7e47672eb74a97.300x300x1.png,TEETH,https://genius.com/Brockhampton-teeth-lyrics,107494,"TEETH Lyrics[Verse: Ameer Vann]
I done been in trouble 'bout as long as I remember
My momma tried to help me but I hardly ever listened
So she sent me to them white schools, I learned that I was different
They told me I'm a nigga, well, now I know I am
I got my finger on the trigger, I'm a project baby
A free-lunch felon, and I'm hungry every minute
Empty stomach, weed smoke can't fill it
If you don't listen to me, I set fire to the building
Need to listen to the children and the weapons they concealing
Hear the voices of a million when I sell my first million
I am bound to go diamond, ain't no luck or surprises
I am tanning on an island
I can feel the pressure, but I see my new horizons
Me and all my niggas getting stars down on Sunset Boulevard
But niggas from the Southside with Xan bars and gunplay
Niggas on that ""Someday...""
If you shooting for the stars, you only headed one way22Embed"
BROCKHAMPTON,2452978,356519,323651,BROCKHAMPTON,https://images.genius.com/d43d3a6e3fd7dad813847aee4b7c5ef4.300x300x1.jpg,PALACE,https://genius.com/Brockhampton-palace-lyrics,106783,"PALACE Lyrics[Verse 1: Matt Champion]
On a palace floor I see my soul
Banging through the doors, we swing 'em closed
We need glass or something strong
For the creeps when you come 'round

[Bridge: Bearface]
I feel like fucking on the west side like bullets out a gun
These strangers coming out about twice as strong
Yeah, I know you say I miss it but come on baby please
Just know you come off strong, your soul is getting lost

[Chorus: Joba]
I wish you knew me
I wish you knew
I’m everything I am
I’m everything I am
But you don’t know me
I’m everything I am
With everything I am
You don’t know me

[Verse 2: Matt Champion]
Hold me down, I know I've lost control
Picking up all of my dirty bones
Oh I know there's something wrong
Freak me out when you come round
[Bridge: Bearface]
I feel like fucking on the west side like bullets out a gun
These strangers coming out about twice as strong
Yeah, I know you say I miss it but come on baby please
Just know you come off strong, your soul is getting lost

[Chorus: Joba]
I wish you knew me
I wish you knew
I’m everything I am
I’m everything I am
But you don’t know me
I’m everything I am
With everything I am
You don’t know me

[Outro: Joba]
At all, at all, at all, at all, at all, at all (You don't know)
At all, at all, at all, at all16Embed"
BROCKHAMPTON,3206062,3355833,323651,BROCKHAMPTON,https://images.genius.com/b0538ae7632778530f7e47672eb74a97.300x300x1.png,SUNNY,https://genius.com/Brockhampton-sunny-lyrics,105047,"SUNNY Lyrics[Verse 1: Merlyn Wood]
All I do is work and pray (Ay-yah-woo-woo!)
Tryna' find a place to stay (Ay-yah-woo-woo!)
Tryna' find some food today (Ay-yah-woo-woo!)
This shit is real hard okay? (Okay)
Take that, homie got the Lysol spray, ain’t it? (Ain't it?)
You don't wanna see all my bad days, ain't it? (Ain't it?)
You don't wanna see what I got to say, ain't it?
You don't wanna see my boys, man, they ain't friendly

[Chorus: Kevin Abstract]
Trip a lot, sinned a lot, send em' all down
Trip a lot, sinned a lot, send em' all down
Trip a lot, sinned a lot, send em' all down
Trip a lot, sinned a lot, send em' all down
Trip a lot, sinned a lot, send em' all down
Trip a lot, sinned a lot, send em' all down
Trip a lot, sinned a lot, send em' all down
Trip a lot, sinned a lot, send em' all down

[Bridge: Kevin Abstract]
It ain't my birthday yet and I'm acting like a bitch
Screaming ""motherfuck your set"" like I'm 2Pac
Ain't got no ice on me yet, still feeling how I dress
So it's Dickies and I got these hoes from Walmart
It ain't my birthday yet and I'm acting like a bitch
Screaming ""motherfuck your set"" like I'm 2Pac
Ain't got no ice on me yet, still feeling how I dress
So much Dickies and I got these hoes from Walmart
[Verse 2: Ameer Vann & Kevin Abstract]
I just saw my P.O. (What up, nigga?)
He like me, though (He like me, though)
Clean money, tryna stay up out the streets, though
7 days a week though, (All day!) it's that heat, though
My daddy called me, said he seen my last video
Looking at a younger me, coulda had a heatstroke
In the middle of the summer with my negros
Cool cuts and snow cones, smoking to the ozone
Smokin' 'til it's all gone, smoking 'til my folks come home

[Chorus: Kevin Abstract]
Trip a lot, sinned a lot, send em' all down
Trip a lot, sinned a lot, send em' all down
Trip a lot, sinned a lot, send em' all down
Trip a lot, sinned a lot, send em' all down
Trip a lot, sinned a lot, send em' all down
Trip a lot, sinned a lot, send em' all down
Trip a lot, sinned a lot, send em' all down
Trip a lot, sinned a lot, send em' all down

[Outro: bearface & Joba]
Runnin' outta time again
Runnin' outta time again
Runnin' outta time again, mmm
Ay-yeahh, ay-yeahh
Ooh, ooh, oo-ooh, ooh10Embed"
BROCKHAMPTON,3957004,3195745,323651,BROCKHAMPTON,https://images.genius.com/5da37b77be2204a52bd0433c6650f563.300x300x1.png,SOMETHING ABOUT HIM,https://genius.com/Brockhampton-something-about-him-lyrics,96549,"SOMETHING ABOUT HIM Lyrics[Chorus: Kevin Abstract]
Something about him
His car ain't nice and flashy (Yeah, yeah)
There’s something about him
Yeah, his attitude is like magic (Yeah, yeah)
There's something about him
I know I got to have it
And oh, oh, oh, oh, oh, oh, oh

[Refrain: Kevin Abstract]
I really like how you do all the things that you do
I really like how you say all the things that you say (I love him!)
I really like how you do all the things you could do
I really like all the things that you really could say, ayy
I really like how you move when you're out by yourself
I really like all your crew and you can take ’em to hell
Boy, don't you know I fucking got you? Right, right

[Chorus: Kevin Abstract]
There's something about him
His car ain't nice and flashy (Yeah, yeah)
There's something about him
Yeah, his attitude is like magic (Yeah, yeah)
There's something about him
I know I got to have it
And oh, oh, oh, oh, oh, oh, oh
[Outro: Kevin Abstract]
I love him, I love him
Something about him6Embed"
