artist,id,lyrics_owner_id,primary_artist_id,primary_artist_name,song_art_image_thumbnail_url,title,url,pageviews,lyrics
Chance the Rapper,146864,60998,16751,Chance the Rapper,https://images.genius.com/aa16cba40f43828a61bbb6212de712bd.300x300x1.jpg,Cocoa Butter Kisses,https://genius.com/Chance-the-rapper-cocoa-butter-kisses-lyrics,2577492,"Cocoa Butter Kisses Lyrics[Intro: Chance The Rapper]
Na-na-na-na-na-na-na-na-na-na, igh
Na-na-na-na-na-na-na-na-na-na, igh

[Chorus 1: Chance the Rapper]
Cigarettes on cigarettes, my mama think I stank
I got burn holes in my hoodies, all my homies think it's dank
I miss my cocoa butter kisses
I miss my cocoa butter kisses
Cigarettes on cigarettes, my mama think I stank
I got burn holes in my hoodies, all my homies think it's dank
I miss my cocoa butter kisses (Kisses, kisses)
I miss my cocoa butter kisses

[Verse 1: Chance The Rapper]
Okie dokie, alkie, keep it low-key like Thor lil' bro
Or he'll go blow the loudy, saudy of sour Saudi
Wiley up off peyote, wilin' like that coyote
If I sip any Henny, my belly just might be outie
Pull up inside a huggy, Starsky & Hutch a dougie
I just opened up the pack, in an hour I'll ash my lucky
Tonight she just yelling ""Fuck me""
Two weeks she'll be yelling ""Fuck me""
Used to like orange cassette tapes with Timmy, Tommy, and Chuckie
And Chuck E. Cheese's pizzas, Jesus pieces, sing Jesus love me
Put Visine inside my eyes so my grandma would fucking hug me
Oh, generation above me, I know you still remember me
My afro look just like daddy's, y'all taught me how to go hunting, blam
[Chorus 1: Chance the Rapper]
Cigarettes on cigarettes, my mama think I stank
I got burn holes in my hoodies, all my homies think it's dank
I miss my cocoa butter kisses (Kisses, kisses)
I miss my cocoa butter kisses
Cigarettes on cigarettes, my mama think I stank (Innanet)
I got burn holes in my hoodies, all my homies think it's dank
I miss my cocoa butter kisses (Kisses, kisses)
I miss my cocoa butter kisses (Innanet)
(Kisses, kisses)

[Verse 2: Vic Mensa]
I will smoke a little something but I don't inhale
Everywhere that I go, everywhere, they be asking how's it going
Say the going's well, go figure, Victor's light skinned
Jesus got me feeling like Colin Powell, all praise to the God
God knows he's a pro, he's a pro like COINTEL
Check, checkmate, check me, take me to the bedroom
Like she know me well, I mean normally
You see Norma Jean wouldn't kick it with Farmer Phil
But these kids these days, they get so high
Burn trees, smoke chlorophyll, 'til they can't feel shit
Shit-faced, faced it, 15 hits on this L
Elevated, train, and the craziest thing
Got me feeling like Lauryn Hill, miseducated, my dick delegated
Rap Bill Bellamy, they said I shoulda never made it
Probably shoulda been dead or in jail
Deadbeat dad, enough of that jazz
Asshole, absinthe, thumpin' that glass
Are we there yet? Ice cubes in a bong
Rip, brain-dead, take a tug and then pass
[Bridge: Vic Mensa]
I think we all addicted
Yeah, I think we all addicted
Really though, I think we all addicted (Yah)
I think we all addicted

[Chorus 2: Vic Mensa]
Cigarettes on cigarettes, my mama think I stank
I got burn holes in my memories, my homies think it's dank
I miss my cocoa butter kisses (Kisses, kisses)
I think we all addicted (Kisses, kisses)

[Chorus 1: Chance the Rapper]
Cigarettes on cigarettes, my mama think I stank
I got burn holes in my hoodies, all my homies think it's dank
I miss my cocoa butter kisses (Kisses, kisses)
I miss my cocoa butter kisses
[Verse 3: Twista]
I could make a flow, pitter patter with a patter pitter, juicy
Used to be in a jalabiya and a kufi
Trying hard not to be addicted to a groupie
I ended up on an album cover in a Coogi
You see, I be still a God but a goofy
You be flowing about drugs and a Uzi
That's the dual principle, sometimes I'ma be about some hoes
Sometimes I'ma wanna make a movie
And when it come to rapping fast, I'm the Higgs Boson (Yeah)
And though my style freakish
I could still break your body down to five pieces like I did Voltron
'Cause I'm addicted to the craft and I be off a OG
Know me, I'm the Obi-Wan Kenobi of the dope, see (What?)
Never scared of mean spirits, methamphetamine lyrics
Cooler like I'm off of codeine, low key
Don't be so judgmental, even though I'm reminiscing
If I don't know what I miss is
I'ma end up figuring out that it's home
And my mother and my grandmother cocoa butter kisses
This is just a testament to the ones that raised me
The ones that I praise and I'm thanking
I need 'em but the chronic all up in my clothes
And I wanna get a hug, and I can't 'cause I'm stanking
Never too old for a spanking, IGH!
[Chorus 2: Vic Mensa]
Cigarettes on cigarettes, my momma think I stank
I got burn holes in my memories, my homies think it's dank
I miss my cocoa butter kisses (Kisses, kisses)
I think we all addicted (Kisses, kisses)

[Chorus 1: Chance the Rapper]
Cigarettes on cigarettes, my mama think I stank
I got burn holes in my hoodies, all my homies think it's dank
I miss my cocoa butter kisses (Kisses, kisses)
I miss my cocoa butter kisses (Kisses, kisses)
Cigarettes on cigarettes, my mama think I stank
I got burn holes in my hoodies, all my homies think it's dank
I miss my cocoa butter kisses
I miss my cocoa butter kisses
[Prod. by Cam & Peter Cottontale]
[Click here to watch the making of the beat with Cam]491Embed"
Chance the Rapper,2471960,104344,16751,Chance the Rapper,https://images.genius.com/bd58f880e3639190c45ab29cd1bdf354.300x300x1.png,No Problem,https://genius.com/Chance-the-rapper-no-problem-lyrics,2433162,"No Problem Lyrics[Intro: Ha Ha Davis & Chance The Rapper]
You don't want zero problems, big fella!
Yep! Igh!

[Refrain: Chance The Rapper]
If one more label try to stop me
It's gon' be some dreadhead niggas in ya lobby, huh huh

[Chorus: Chance The Rapper]
You don't want no problem, want no problem with me, bih
You don't want no problem, want no problem with me, huh, haha
Just another day, had to pick up all the mail
There go Chano ridin' through the streets, they be like, ""There he go!""
You don't want no problem, want no problem with me, bih
You don't want no problem, want no problem with me, huh, haha
Just another day, had to pick up all the mail
There go Chano ridin' through the streets, they be like, ""There he go!""

[Verse 1: Chance The Rapper]
Ooh, watch me come and put the hinges in their hands
Countin' Benjis while we meetin', make 'em shake my other hand, huh
Milly rockin', scoopin' all the blessings out my lap
Bitch I know you tried to cheat, you shoulda never took a nap, hey
Fuck wrong with you? What you were thinkin'?
Fuck you thought it was?
You talk that talk that make a lame-ass nigga fall in love
Not me, though, bitch, you can keep those
Bruh, I'm at your head like Craig did Deebo
Don't tweak, bro, it's never sweet, ho
My shooters come for free, so
[Refrain: Chance The Rapper & Lil Wayne]
If one more label try to stop me
It's gon' be some dreadhead niggas in ya lobby, huh, huh

[Chorus: Chance The Rapper & 2 Chainz]
You don't want no problem, want no problem with me, you bih
You don't want no problem, want no problem with me, huh, haha
Yep, yep
Pull up in the new thing, I'm like
You don't want no problem, want no problem with me, bih
You don't want no problem, want no problem with me, huh, haha
You don't want no problem, want no problem with me, bih
You don't want no problem, want no problem with me, huh, haha
(Yeah, 2 Chainz)
They be like, ""There he go!""

[Verse 2: 2 Chainz]
You old Petey Pablo, take your shirt off
Wave 'round your head like a helicopter
I ain't put enough weed in the blunt
All you do is smoke tobacco
Where the hell you get them from?
Yeezy said he ain't make them
My niggas chasin' bounty hunters
And gettin' chased by their baby mamas
My first tat was on my stomach
Got a pocket full of money (Money)
And a mind full of ideas
Some of this shit may sound weird
Inside of the Maybach
Look like it came out of Ikea
Run shit like diarrhea (True)
Big yacht, no power steering (Yeah)
Aye, aye, captain (Ooh!)
I'm high, captain (A-alright!)
I'm so high (I'm so high)
Me and God dappin' (Alright)
This is my blessin' (Yeah)
This is my passion
School of hard knocks
I took night classes
[Chorus: Chance The Rapper]
You don't want no problem, want no problem with me, bih
You don't want no problem, want no problem with me, huh, haha
Yep
Pull up in the new thing, I'm like
They be like, ""There he go!""
[Verse 3: Lil Wayne]
I got problems bigger than these boys, yeah
My deposits, they be on steroids
Lord, free the Carter, niggas need the Carter
Sacrificin' everything, I feel like Jesus Carter
Hold up, I got this sewed up, my soda poured up
My woes up, I'm flippin' those bucks, they doing toe tucks
I rolled up and let the smoke puff
I lay down, toes up
Hold up, get too choked up when I think of old stuff
Move on, put my goons on, they kidnap newborns
In the streets my face a coupon
Her pussy too warm
All these bitches come to do harm
Just bought a new charm
Fuck the watch, I buy a new arm, you lukewarm
I'm Uncle Luke with the hoes
Pretty bitches, centerfolds
Tippy toes around my crib in they robes, just their robes
Half a milli' in the safe, another in the pillowcase
Codeine got me movin' slower than a caterpillar race
Fuck wrong with you? What you were thinkin'?
What you thought it was?
I just popped five Percocets and only caught a buzz
And if that label try to stop me
There gon' be some crazy Weezy fans waitin' in the lobby
Mula, baby
[Chorus: Chance The Rapper]
You don't want no problem, want no problem with me, bih
You don't want no problem, want no problem with me, huh, haha
Just another day, had to pick up all the mail
There go Chano ridin' through the streets, they be like, ""There he go!""
You don't want no problem, want no problem with me, bih
You don't want no problem, want no problem with me, huh, haha
Just another day, had to pick up all the mail
There go Chano ridin' through the streets, they be like, ""There he go!""

[Outro: Lil Wayne & Chance The Rapper]
You don't want no problem, want no problem with me
You don't want no problem, want no problem with me
You don't want no problem, want no problem with me
You don't want no problem, want no problem with me
You don't want no problem, want no problem with me
You don't want no problem, want no problem with me
They say so, ridin' with the payo'
They be like, ""There he go!""
There he go
[Produced by BrassTracks]90Embed"
Chance the Rapper,146855,22533,16751,Chance the Rapper,https://images.genius.com/aa16cba40f43828a61bbb6212de712bd.300x300x1.jpg,Favorite Song,https://genius.com/Chance-the-rapper-favorite-song-lyrics,1611500,"Favorite Song Lyrics[Verse 1: Chance The Rapper]
Chance, acid rapper, soccer, hacky sacker
Cocky khaki jacket jacker
Slap-happy faggot slapper, bah-bah
Iraqi rocket launcher
Shake that Laffy Taffy, jolly raunchy rapper
Dang, dang, dang, skeet, skeet, skeet
She do that thing for three retweets
The album feel like '92
Now take that ball 'fore he three-peat
Chance, ho, acid, cruising on that LSD
Asked Joseph about my deal
He looked back said, ""Hell yeah, let's eat""

[Chorus: Chance The Rapper]
This shit my favorite song, you just don't know the words
But I still fuck with you, you just ain't never heard
It go like, count that stack, pop that cap then down that Jack
All my niggas hit that xan, and all my ladies bob that back
This my jam, this my jam, this my jam, this my jam
I'm 'bout that jam, I'm 'bout that jam, I'm 'bout that jam, I'm 'bout that jam
This my jam, this my jam, this my jam, this my jam
I'm 'bout that jam, I'm 'bout that jam, I'm 'bout that jam, I'm bout that jam

[Verse 2: Chance The Rapper]
Young Rascal Flatts, young ass kid ass could rap
Fuck all the faculty, tobacco-packing acrobat
Back-to-back packin' bags back and forth with fifths of Jack and
Fourths of weed, I'm back to pack on hands
With young Cletus to pat my back
Real nigga with a nose ring, that's right
Just here to rap them songs
Rag on my hair, wrap weed in Vegas, rockin' Vagabonds
Sang a song, oh, you don't know? What?
Well, I still bang with you
Hang with you, sip drank with you
As long as I can sang with you like
[Chorus: Chance The Rapper]
This shit my favorite song, you just don't know the words
But I still fuck with you, you just ain't never heard
It go like, count that stack, pop that cap then down that Jack
All my niggas hit that xan, and all my ladies bob that back
This my jam, this my jam, this my jam, this my jam
I'm 'bout that jam, I'm 'bout that jam, I'm 'bout that jam, I'm 'bout that jam
This my jam, this my jam, this my jam, this my jam
I'm 'bout that jam, I'm 'bout that jam, I'm 'bout that jam, I'm bout that jam

[Verse 3: Childish Gambino]
Niggas, please be focused, that Bino, you know this
He rep the home of Sosas, you know I'm from that Zone 6
You know I rep that Stone shit, you know your hood is so clit
As God as my witness, this Will Smith spit real shit
I'ma be that, CG busy gettin', where the weed at?
Bought your girl some new kneepads
You're fuckin' with the Fifi bag
My stars, egad, she said, ""This my favorite song""
""Hold my purse"", now she on the floor, droppin' like it's hot
You blast this shit in Abercrombie when your work is finished
Your mom won't play it in the car 'cause it got cursing in it
Your boy like, ""I'm the one who showed you""
He want his percentage
'Cause you were like, ""This ain't the nigga you said spittin', is it?""
Two-step, white dude's Harlem Shake
Why you laughing? 'Cause you Harlem Shake
I was never fake, I was just too good to be true
That's acid rap, we killed the track
You had your chance, and 'Bino too, ooh
[Chorus: Chance The Rapper & Childish Gambino]
This shit my favorite song, you just don't know the words
But I still fuck with you, you just ain't never heard
It go like, count that stack, pop that cap then down that Jack
All my niggas hit that xan, and all my ladies bob that back
This my jam, this my jam, this my jam, this my jam
I'm 'bout that jam, I'm 'bout that jam, I'm 'bout that jam, I'm 'bout that jam
This my jam, this my jam, this my jam, this my jam
I'm 'bout that jam, I'm 'bout that jam, I'm 'bout that jam, I'm bout that jam450Embed"
Chance the Rapper,113663,136154,16751,Chance the Rapper,https://images.rapgenius.com/fbf66a14d285636c7139e9b5a54a352b.300x300x1.jpg,Juice,https://genius.com/Chance-the-rapper-juice-lyrics,1337400,"Juice Lyrics[Produced by Nate Fox]

[Refrain]
Thirsty, thirsty, tryna choose
I mean, I know I'm pretty cool
My Nitty bag, my kitty boost
I got the juice, I got the juice

[Verse 1]
Chano, Chatham's own
Foolies glad I'm home
Even my haters kinda glad I'm on
Rest In Peace to my Vagabond
Rapper song, singer, suspended, subpoena
For misdemeanors, dreamer
Held back ass is lowkey still a senior
And I still shake up BO Squad, praying for my BroBois
City on the come up, shout that nigga Sosa!
Shout my nigga Fat Trel, shout my nigga Joseph
Playing Buenos Aires while they sleepin': buenas noches!
Wonder if I wrote this, 'cause it's so crisp
The most brokest cold stockbroker, winter solstice
I could win an Oscar, Russian accent husky
Acid addict, costly avid actor, Kevin Costner

[Chorus]
Juice! Juice! Juice! Juice!
I got the juice, I got the juice (Yup!)
Juice! Juice! Juice! Juice!
I got the juice, I got the juice (Yup!)
[Verse 2]
God give me one sentence more
Maybe I just gotta get suspended more?
Hashtag it, get mentions for it
Make you love it, get it trending more
And then act humble
Hear some bull that some dude mumble
Wantin' to jump dude, but let that nigga punk you
Knowin' bitch niggas wanna bring guns to the rumbles, IGH!
But I love y'all souls, don't let the juice spill Pac!
Blue pill pop 'til you feel good enough to pop
The popped bitch in the blue heels, yop!
That one, drown in the juice nigga
Hunnid proof get found in a youth nigga
Stop with all the tryna' introduce nigga
Everybody know you dude, you the new nigga!
How's it feel to be you? Yo no sé
I ain't really been myself since Rod passed
I ain't even really need that shop class
I ain't really been weak since pop's smashed
I'm a genius, a mothafuckin' pop smash
Hit sensei, master
Jack and Lindsey, Wiley, Kembe
Been paid, 10 Day been they FAFSA

[Chorus]
Juice! Juice! Juice! Juice!
I got the juice, I got the juice (Yup!)
Juice! Juice! Juice! Juice!
I got the juice, I got the juice (Yup!)
[Verse 3]
Jugo, you never tasted paper
Tripped, racing yaself tryna' chase the paper
I just faced a Veg-er
And you love being Kobe when you make the lay-er
'Til you realize everybody in the world fuckin' hates the Lakers
And then everybody wanna sip
'Til the juice spill, everybody wanna bib
And then everybody wanna dip
Told you I ain't worried, I ain't scared of the booth
All you can do is spit a verse of the truth
Merge the mixture with the purest of fruits
And the thirst is the worst, it's the curse of the juice!

[Chorus]
Juice! Juice! Juice! Juice!
I got the juice, I got the juice (Yup!)
Juice! Juice! Juice! Juice!
I got the juice, I got the juice (Yup!)

[Refrain]
Thirsty, thirsty, tryna choose
I mean, I know I'm pretty cool
My Nitty bag, my kitty boost
I got the juice, I got the juice
[Outro]
(Juice, juice, juice, juice) Yup!
(Juice, juice, juice, juice) Yup!
Yup! Yup!
Yup!287Embed"
Chance the Rapper,146865,60998,16751,Chance the Rapper,https://images.genius.com/aa16cba40f43828a61bbb6212de712bd.300x300x1.jpg,Pusha Man/Paranoia,https://genius.com/Chance-the-rapper-pusha-man-paranoia-lyrics,1316786,"Pusha Man/Paranoia Lyrics[Part I: Pusha Man (produced by CeeJ)]

[Verse 1: Chance The Rapper]
Ten damn days
And all I got to show for it is shoes and shows
And chauffeurs with road rage
Still the same damn ad-lib: IGH!, old ways
Still got a letterman, no practice
Still got a burner, man, no lacking
Still outtin' Jams nigga, no Jackson
No Jordan and we toe-tagging
I'll take you to the land where the lake made of sand
And the milk don't pour and the honey don't dance
And the money ain't yours
Now it's just a red pill
Got a blue and a handful of Advils
I'm the new Nitty, fuck it, Nitty the old me
So I'ma tell the buyer what Nitty told me

[Chorus: Nate Fox]
I got that mmm, mmm, I got that goddamn
I'm your pusha man, I'm your, I'm your pusha man
Pimp slappin', toe taggin', I'm just tryna fight the man
I'm your pusha man, I'm your, I'm your pusha man
I got that mmm, mmm, I got that goddamn
I'm your pusha man, I'm your, I'm your pusha man
Pimp slappin', toe taggin', I'm just tryna fight the man
I'm your pusha man, I'm your, I'm your pusha man
[Verse 2: Chance The Rapper]
You a laaaaaaaame
And your bitch break down my weed sometimes
See my face in the streets, in the tweets
And a Reader or a RedEye if you read Sun-Times
She got blisters on her knees, she's a fiend for the D
Even though I only beat one time
One time, it was one two times
It was two plus me equals threesome time
Shouts out to Nate, I jackball and I bop, I flex
Got neck from all these thots I sex
Rastafari them shottas, yes
House safari, mi casa, yes
Poppy fields of that popeye
She came to party, she popped a molly
Said, ""Come to Papa"", she said, ""Papa, yes""

[Chorus: Nate Fox]
I got that mmm, mmm, I got that goddamn
I'm your pusha man, I'm your, I'm your pusha man
Pimp slappin', toe taggin', I'm just tryna fight the man
I'm your pusha man, I'm your, I'm your pusha man
I got that mmm, mmm, I got that goddamn
I'm your pusha man, I'm your, I'm your pusha man
Pimp slappin', toe taggin', I'm just tryna fight the man
I'm your pusha man, I'm your, I'm your pusha man
[Part II: Paranoia (produced by Nosaj Thing)]

[Chorus: Chance The Rapper]
I've been riding around with my blunt on my lips
With the sun in my eyes and my gun on my hip
Paranoia on my mind, got my mind on the fritz
But a lot of niggas dyin', so my 9 with the shits
I've been riding around with my blunt on my lips
With the sun in my eyes and my gun on my hip
Paranoia on my mind, got my mind on the fritz
But a lot of niggas dyin', so my 9 with the shits
[Verse 1: Chance The Rapper]
Move to the neighborhood; I bet they don't stay for good, watch
Somebody'll steal daddy's Rollie, call it the neighborhood watch
Pray for a safer hood when my paper good, watch
Captain Save-a-Hood, hood savior, baby boy
Still getting ID'd for Swishers (Mama still wash my clothes)
Still with the Save Money militia (I'ma still watch my bros)
Trapped in the middle of the map
With a little-bitty rock and a little bit of rap
That, with a literary knack
And a little shitty Mac, and like literally jack

[Chorus: Chance The Rapper]
I've been riding around with my blunt on my lips
With the sun in my eyes and my gun on my hip
Paranoia on my mind, got my mind on the fritz
But a lot of niggas dyin', so my 9 with the shits
I've been riding around with my blunt on my lips
With the sun in my eyes and my gun on my hip
Paranoia on my mind, got my mind on the fritz
But a lot of niggas dyin', so my 9 with the shits
[Verse 2: Chance The Rapper]
They murking kids, they murder kids here
Why you think they don't talk about it? They deserted us here
Where the fuck is Matt Lauer at?
Somebody get Katie Couric in here
Probably scared of all the refugees
Look like we had a fuckin' hurricane here
They'll be shooting whether it's dark or not
I mean, the days is pretty dark a lot
Down here, it's easier to find a gun
Than it is to find a fucking parking spot
No love for the opposition, specifically a cop position
'Cause they've never been in our position
Getting violations from the nation, correlating, you dry snitchin'

[Chorus: Chance The Rapper]
I've been riding around with my blunt on my lips
With the sun in my eyes and my gun on my hip
Paranoia on my mind, got my mind on the fritz
But a lot of niggas dyin', so my 9 with the shits
I've been riding around with my blunt on my lips
With the sun in my eyes and my gun on my hip
Paranoia on my mind, got my mind on the fritz
But a lot of niggas dyin', so my 9 with the shits

[Breakdown: Chance The Rapper]
I know you scared
You should ask us if we scared too
I know you scared
Me too
I know you scared
You should ask us if we scared too
If you was there
Then we'd just knew you cared too

[Verse 3: Chance The Rapper]
It just got warm out, this the shit I've been warned 'bout
I hope that it storm in the mornin', I hope that it's pourin' out
I hate crowded beaches, I hate the sound of fireworks
And I ponder what's worse
Between knowing it's over and dyin' first
'Cause everybody dies in the summer
Wanna say your goodbyes, tell them while it's spring
I heard everybody's dying in the summer
So pray to God for a little more spring

[Breakdown: Chance The Rapper]
I know you scared
You should ask us if we scared too
If you was there
Then we'd just knew you cared too189Embed"
Chance the Rapper,2472248,672397,16751,Chance the Rapper,https://images.genius.com/bd58f880e3639190c45ab29cd1bdf354.300x300x1.png,Same Drugs,https://genius.com/Chance-the-rapper-same-drugs-lyrics,1177085,"Same Drugs Lyrics[Chorus]
We don't do the same drugs no more
We don't do the, we don't do the same drugs, do the same drugs no more
'Cause she don't do the same drugs no more
We don't do the, we don't do the same drugs, do the same drugs no more

[Verse 1]
When did you change?
Wendy, you've aged
I thought you'd never grow up
I thought you'd never
Window closed, Wendy got old
I was too late, I was too late
A shadow of what I once was

[Chorus]
'Cause we don't do the same drugs no more
We don't do the, we don't do the same drugs, do the same drugs no more
She don't laugh the same way no more
We don't do the, we don't do the same drugs, do the same drugs no more

[Verse 2]
Where did you go?
Why would you stay?
You must have lost your marbles
You always were so forgetful
In a hurry, don't wait up
I was too late, I was too late
A shadow of what I once was
'Cause we don't, we don't do what we say we're gonna
You were always perfect, and I was only practice
Don't you miss the days, stranger?
Don't you miss the days?
Don't you miss the danger?
[Chorus: Chance The Rapper & Eryn Allen Kane]
We don't (We don't) do the same drugs no more (Do the same drugs no more)
We don't do the, we don't do the same drugs, do the same drugs no more
We don't (We don't) do the same drugs no more (Do the same drugs no more)
We don't do the, we don't do the same drugs, do the same drugs no more
We don't do the, we don't do the same drugs

[Outro: Chance The Rapper & Eryn Allen Kane]
Turn it around
I remember when
This age of pathetics
Don't forget the happy thoughts
All you need is happy thoughts
The past tense, past bed time
Way back then when everything we read was real
And everything we said rhymed
Wide eyed kids being kids
Why did you stop?
What did you do to your hair?
Where did you go to end up right back here?
When did you start to forget how to fly?
It's so natural
Tastes like Juicy Fruit
Works like a magic trick
Please give me half of that
We don't, we don't, we don't
Don't you color out
Don't you bleed on out, oh
Stay in the line, stay in the line
Dandelion
We don't do the same drugs no more
We don't do the, we don't do the same drugs, do the same drugs no more
We don't, we don't, we don't
Don't you color out
Don't you bleed on out, oh
Stay in the line, stay in the line
Dandelion62Embed"
