artist,id,lyrics_owner_id,primary_artist_id,primary_artist_name,song_art_image_thumbnail_url,title,url,pageviews,lyrics
Chance the Rapper,2472239,409643,16751,Chance the Rapper,https://images.genius.com/bd58f880e3639190c45ab29cd1bdf354.300x300x1.png,Finish Line / Drown,https://genius.com/Chance-the-rapper-finish-line-drown-lyrics,565461,"Finish Line / Drown Lyrics[Part I: Finish Line]

[Intro: Eryn Allen Kane & Chance The Rapper]
Do-do-do, do-do, do-do (Huh)
Do-do-do, do-do, do-do (And we back, and we back, and we back, and we back)
Do-do-do, do-do, do-do
Do-do, do-do, do
Do-do-do, do-do, do-do (Huh)
Do-do-do, do-do, do-do (And we back, and we back)
Do-do-do, do-do, do-do (And we back)
Do-do, do-do, do

[Verse 1: Chance The Rapper]
They ain't teaching taxes in school
It don't even matter, I was acting a fool
But who would think the raps would turn into racks?
Don't matter, matter fact, it could happen to you
Scars on my head, I'm the boy who lived
The boy love playing when the boy too sick
Reclining on a prayer, I'm declining to help
I've been lying to my body, can't rely on myself, oh, no
Last year, I got addicted to Xans
Started forgetting my name and start to missin' my chance
L.A. for four months, end up leaving right back
I'm in love with my city, bitch, I sleep in my hat, uh
I felt hogtied ever since my dog died
He lived to 84, damn, that's a long ride
I know he up there, he just sit and he wait
I'll be racing up the stairs, I'ma get to the gate, singing
[Refrain: Eryn Allen Kane]
Do-do-do, do-do, do-do
Do-do-do, do-do, do-do
Do-do-do, do-do, do-do
Do-do, do-do, do
Do-do-do, do-do, do-do
Do-do-do, do-do, do-do
Do-do-do, do-do, do-do
Do-do, do-do, do

[Chorus: T-Pain & Chance The Rapper]
Oh, all my days
I prayed and prayed
And now I see the finish line
Oh, I'm gonna finish mine, yeah
All my days
I prayed and prayed
And now I see the finish line
Gonna finish mine, yeah (Hey)

[Verse 2: Chance The Rapper]
Gimme the water, gimme the water, I need the kind from Space Jam
Get this money, get this budget, KOK to day camp
Me and my girl plan to stay to the end
Hope there never come a day where we be better as friends
We in a marathon we could build a marriage on
Arguments as parents digging deeper than a baritone
I've been getting blocked just tryna make songs with friends
Labels told me to my face that they own my friends
I got to pray, I got to pray, like Hammer after ""2 Legit""
I got the power, I could poke Lucifer with crucifix
I cannot scrape off stupid shit, I stand up like I'm Ludacris
I know some folks that talk so much, you'd think they drive an Uber whip, damn
Queen said, ""Why we in a queen bed?""
I said, ""It's yours, don't worry, lil' beanhead""
I'm just here to catch my breath, I got the world tattooed
She said, ""Cool, just bring me some food""
[Chorus: T-Pain]
Oh, all my days
I prayed and prayed
And now I see the finish line
Oh, I'm gonna finish mine, yeah
All my days
I prayed and prayed
And now I see the finish line
I'm gonna finish mine, yeah

[Refrain: Eryn Allen Kane]
Do-do-do, do-do, do-do
Do-do-do, do-do, do-do
Do-do-do, do-do, do-do
Do-do, do-do, do
Do-do-do, do-do, do-do
Do-do-do, do-do, do-do
Do-do-do, do-do, do-do
Do-do, do-do, do

[Outro]
Alright, we got it

[Part II: Drown]

[Intro: Eryn Allen Kane]
The water may be deeper than it's ever been
[Verse 1: Noname]
Lord rain down on me so I can move on water
Like children at the altar, like God inside my house
I love you, I love you, you looking holy like Mama
You made a church out of feathers, so when she fly to the Father
She know the choir gon' follow and all the offering paid
She gave my name away to your holy house
She like my blessings in disguise
She like her Jesus mountain high
So He can watch her lonely child, I know my God
I know my God, seen His breaks and His edges
Are jagged for giving that pain to His city in gold
Like everything is everything
Like all them days He prayed with me
Like emptiness was tamed in me
And all that was left was His love
And all that was left was His love
And all that was left was His love
And all that was left was His love

[Chorus: Choir]
Never, never drown
The water may be deeper than it's ever been
Never drown
The water may be deeper than it's ever been
Never drown
[Verse 2: Choir & Kirk Franklin]
Never, never, never (Chance, let me in, come on)
This thirst in my soul (There's a thirst in my soul, it tell me)
Where else can I go? (Where?) but You? (Come on)
I may cry a river (I may cry a thousand tears, but)
But You take each drop and You wash (You wash me new)
Me new (People sing)
This water is deep (Yes, yes and I need You to)
Jesus, rescue me (Come on, save me, I need You to)
Take me to Your mountain (Hallelujah)
So someday Chicago will be free (Someday, we'll all be free)
Be free (Say)

[Chorus: Choir]
The water may be deeper than it's ever been
Never drown
The water may be deeper than it's ever been
Never drown20Embed"
Chance the Rapper,2472220,1507505,16751,Chance the Rapper,https://images.genius.com/bd58f880e3639190c45ab29cd1bdf354.300x300x1.png,How Great,https://genius.com/Chance-the-rapper-how-great-lyrics,528099,"How Great Lyrics[Intro: Nicole Steen & Choir & Nicole Steen]
How great is our God?
Sing with me, how great is our God?
All will see, how great is our God? (Ooh)
How great (How great), is our God? (Oh)
Sing with me, how great (How great), is our God?
All will see, how great, how great, is our God? (Ooh)
Name above all names (Name above all names)
Worthy of all praise (And my heart will)
And my heart will sing how great (How great) is our God?
Name above all names (Name above all name)
Worthy of all praise (Worthy of all praise)
And my heart will sing (My heart will sing), how great is our God? (Woah-oh, oh-oh)
How great (How great), is our God? (Is our God?)
Sing with me (Won't you sing?), how great is our God? (And all will see)
All will see how great (How great, how great), is our God? (Oh)
(How great), how great (How great is), is our God?
Sing with me (Sing with me), how great is our God? (And all will see)
All will see how great (How great), how great (How great)
How great (How great), how great (How great)
How great, how great is our God? Oh

[Interlude]
The first is that God is better than the world's best thing
God is better than the best thing that the world has to offer
[Verse 1: Chance the Rapper]
Magnify, magnify, lift it on high
Spit a Spotify to qualify a spot on his side
I cannot modify or ratify, my mama made me apple pies
Lullabies and alibis, the book don't end with Malachi
Devil will win employee of the month by the dozen
'Til one score and three years from the third when he doesn't
My village raised 'em a child, come through the crib and it's bustin'
You meet anyone from my city, they gon' say that we cousins
Shabach, Barak, edify
Electrify the enemy like Hedwig 'til he petrify
Any petty Peter Petigrew could get the pesticide,
79th, 79th
I don't believe in science, I believe in signs
Don't believe in signing, I seen dollar signs, color white collar crime
Good God, the gift of freedom
Hosanna Santa invoked and woke up slaves from Southampton to Chatham Manor
My dream girl's behind me, feel like I'm James Early
The type of worship make Jesus come back a day early
With the faith of a pumpkin seed-sized mustard seed
Hear, for I will speak noble things as entrusted me
Only righteous, I might just shrug at the skullduggery
I couldn't stand to see another rapper lose custody
Exalt, exalt, glorify, descend upon the earth with swords
And fortify the borders where your shortage lies
I used to hide from God, ducked down in the slums like ""shhh""
[Verse 2: Jay Electronica]
I was lost in the jungle like Simba after the death of Mufasa
No hog, no meerkat
Hakuna matata by day, but I spent my night-time fighting tears back
I prayed and prayed and left messages
But never got no hear-back or so it seemed
A mustard seed was all I needed to sow a dream
I build the ark to gently, gently row my boat down Noah's stream
Sometimes the path I took to reach my petty goals was so extreme
I was so far down in the mud
Couldn't even let my light shine
But you was always there when I needed to phone a friend or use a lifeline
From a lofty height we wage war
On the poltergeist with the exalted Christ
Spark the dark with the pulse of light
Strike a corpse with a pulse of life
I spit on the Tidal, it's tidal waves
I spit on the Apple and kill a worm
A fire in Cali'll swallow a valley for every African village burned
Jay Elect would've never made it
O' son of man, O' son of man
Who was the angel in Revelations with a foot on water and a foot on land?
Who was the angel that rode a Harley from the project to the house of Parliament?
And opened the book in the Devil's chamber
And put the true name of the Lord in it?
Old Jerusalem, New Jerusalem
Comes like this beast with a ball of fire
They poisoned the scriptures and gave us the pictures of false messiahs, it was all a lie
Mystery Babylon tumbling down
Satan's establishment crumbling down
This is the year that I come for the crown
Bury my enemies under the ground48Embed"
Chance the Rapper,2472233,272373,16751,Chance the Rapper,https://images.genius.com/bd58f880e3639190c45ab29cd1bdf354.300x300x1.png,Smoke Break,https://genius.com/Chance-the-rapper-smoke-break-lyrics,502883,"Smoke Break Lyrics[Intro: Chance The Rapper]
Smoking the bowl
We just been smoking, uh—
We just been smoking the bowl
We just been smoking the bowl
We just been
We just been smoking the bowl
We just been smoking the bowl
We just been smoking the, we just
The fuck is going on?
When did we buy a bowl?

[Verse 1: Chance The Rapper]
We just been smoking the bowl
We don't got no time to roll
I'm always out on the road
She don't got time for a whole
Lil' bit of time that we have
We used to purchase a half
It don't be no time to smoke
I'm always throwing on clothes
She always throwing a fit
We don't got no time for no sex
I just put milk in the bowl
She don't be cooking at all
She just put weed in the bowl
She don't have time for herself
She putting points on the board, yes
You know she carry her own
You know she carry the child
She wake up at crack of dawn
She don't be cracking a smile
So when she packing the bowl
I grab her, I tell her
[Chorus: Chance The Rapper]
Let me crack this blunt
Slow it down for a second
Break it down, ooh
She said, ""Let me lick this blunt""
Slow it down for a second
Break it down, ooh
We deserve, we deserve (We deserve)
We deserve a smoke break
We deserve, we deserve
We deserve a smoke break

[Verse 2: Chance The Rapper]
Truth being told
We used to movies and bowl
We used to Netflix and roll
I used to pass her the smoke
She used to laugh at my jokes
You pat my back when I choke
Wish we were stuck in our ways
We way too young to get old
We stuck together like oowops
We smoke to Fetty, sing ""ZooWap""
Traphouse 3, Guwop
I should've knew when I grew up
It would be no time at all
We went from White Owls to Raws
We went from joints to a bowl
She need a second to breathe
We need a actual smoke sesh
[Chorus: Chance The Rapper]
Let me crack your back
Slow it down for a second
Take it down, ooh
Let me run this back
Slow it down for a minute
You deserve, you deserve
We deserve, we deserve (We deserve)
We deserve a smoke break
We deserve, we deserve
We deserve a smoke break

[Verse 3: Future]
I don't have time to finesse
I put some ice on your neck
But I ain't holding you back
I spend my time on the road
Super ain't saving no hoes
I don't have time to patrol
Let me break these bales right down for a second
When it touch down, ooh
I got to lay back the roof
I got her breakin' the rules
She can't be taking no calls
When she involved with a boss
Please don't get lost in the sauce
Please don't get lost in the sauce
She been like this from the door
Told me her mom was a ho
I gave her Percs for herself
I give her Perc for esteem
I'm tryna crown me a queen
You hear the chains when they cling
I take that molly, it's clean
I push the whip with the wings
I gotta be overseas
I gotta be on the pedal
I push it down to the floor
I got designer galore
I keep some Goyard and 'gars
I smoke out all of my cars
You smell the weed in the air
You smell the smoke in the seats
You went and had our child
You didn't abandon the D
You got me twisted at least
You can
[Chorus: Chance The Rapper & Future]
Let me crack your back
Let me rub you all over
Take it down, ooh
Let me make this blunt
Make you dinner or somethin'
You deserve, you deserve
We deserve, we deserve (We deserve)
We deserve a smoke break
We deserve, we deserve
We deserve a smoke break46Embed"
Chance the Rapper,139017,127224,16751,Chance the Rapper,https://images.genius.com/aa16cba40f43828a61bbb6212de712bd.300x300x1.jpg,NaNa,https://genius.com/Chance-the-rapper-nana-lyrics,428657,"NaNa Lyrics[Produced by brandUn DeShay]

[Intro: Chance the Rapper]
Na na na, na na na
Na na na, na na na
Na na na, na na na

[Verse 1: Chance The Rapper]
Introducin' Chance the Ruthless, trip 'shrooms and lucy
Dreams is lucid, loosely based on music, swallow my mucus
Hope your pussy get herpes and yo' ass get lupus
Deuces Douches, deuce deuce, I'll shoot ya (Bang)
Shoes might boot ya and a suit might suit ya
They be on bullshit but they really don't do shit
They use of allusion could confuse Confucius
Nasty, ashy, cigarette ashing 'til my voice get raspy
Last week suspended, last night kissed Va$htie
Parleyed with Ashley, always in the hallway
So I never been classy (Hahaha)
Shut up

[Chorus: Chance the Rapper]
Na na na, na na na
Na na na, na na na
Na na na, na na na
(Igh, igh, igh, igh)
[Verse 2: Chance the Rapper]
Acid, acid, get it? Acid
Melts through plastic, I spit fired
Pad my palette, talkin' paper if this was work, I'd get higher
Pardon my mishaps, burp and get murdered
Fart and get bitch-slapped, like bourbon mixed with Jack
Lickety-split, look it, he slipped on a shell
From peelin' banana splits back, give me my Kit-Kat
Don't break me off shit, batch, fack is you mean bitch?
Zan with that lean bitch, xan with that lean bitch
Zen with that chakra I eat it like Idi Amin
Ya kna' wha' mean, hit me back when that mean shit

[Chorus: Chance the Rapper]
Na na na, na na na
Na na na, na na na
Na na na, na na na
(Igh, igh, igh, igh)

[Verse 3: Action Bronson]
Introducin', it’s Bronsonliño
With my hair slicked back, I look like Rick Pitino
Three Japanese dykes in my El Camino (Haha)
Lettin' trees blow, oh, I rep the East Coast
I got a team of hoes like Pat Summitt
I look like Arnold Schwarzenegger in a black Hummer
(Get to the chopper)
I splash summer like a fast brother, with a number on his back
Ain’t no fumblin', in fact, I'm back, acid in my hat
Shoot, then pass the gat
It's at the bottom of the river in a plastic bag (Bag)
My new shorty got a gymnastic back
'87 emerald green on a classic jag, uh
She had the cleft palate, I ordered chef’s salad (Okay)
She had the club foot (What else?), with that little arm (Hahaha)
I couldn’t help but laugh, she ordered Chicken Parm
I had the full Bulls warm-up with the Pippens on, it's me
[Outro: Action Bronson]
Suck my motherfucking dick
It's the young Randy Velarde
Queens, baby
Blow me52Embed"
Chance the Rapper,2472235,599242,16751,Chance the Rapper,https://images.genius.com/bd58f880e3639190c45ab29cd1bdf354.300x300x1.png,Mixtape,https://genius.com/Chance-the-rapper-mixtape-lyrics,417879,"Mixtape Lyrics[Intro: Young Thug &  Lil Yachty]
Chance the motherfuckin' Rapper
With a capitalized, uh, times
Not the times but you know what I'm saying, the times, bruh
Lil Boat
Chance
Thugger!
Lil Boat

[Chorus: Chance the Rapper & Young Thug]
Am I the only nigga still care about mixtapes? (Hell no!)
Am I the only nigga still care about mixtapes?
I'm the only nigga still care about mixtapes
Bad little bitch, wanna know how lips taste
(She curious, she curious)
I swear that I'm the only nigga still care about mixtapes
Bad little bitch, wanna know how the lips taste
[Verse 1: Chance The Rapper]
All I can hear is the third, ayy
All I can hear is the third, ayy
We don't know none of your words, ayy
We don't know none of your words, ayy
I like my women real tall, ayy
Type that can really play ball, ayy
You buy my hat at the park, ayy
Think I might really play ball, ayy
I got a link in my bio
My bitch do the salsa like pico de gallo
They gotta ask if they may, Cinco de Mayo
How can they call themselves bosses
When they got so many bosses?
You gotta see what your boss say
I get it straight out the faucet
I ain't felt like this since the third Drought, third Carter drop
Told my momma third grade I'd be in the third Barbershop
And yeah, my momma got real worried when she heard I college dropped
But now I call the shots
[Chorus: Chance the Rapper & Young Thug]
I'm the only nigga still care about mixtapes
Bad little bitch wanna know how lips taste
(She curious, she curious)
I swear that I'm the only nigga still cares about mixtapes
Bad little bitch wanna know how lips taste

[Verse 2: Young Thug]
Bad little mama, she gettin' it Obama
She sting like a bumblebee, hot as the sauna
She shine like a Rollie, got that from her momma
Can't see me, can't be me, I'm ridin' like a panda
That booty gon' roll and it's outta control
And these bitches gon' fuck off respect and that loyalty
All my bitches lovin' me and they spoil me
Rub me down with that lotion, babe, oil me
Drinking Actavis, baby, I'm slowin' me
In that choppa I see your perimeter
Change the culture, 'cause my ring is a solar
Wait one minute, I told you
Yeah, I would like to know you
Yeah, you lucky like clovers
Yeah, the clothes no good
Mama I do it, the racks I pursue it
Just look at me baby, I came from the sewers
They love all the slime ball
Like they fuck all these cats on your slime dog
I got me some rings like I'm Bruce Bowen
I'm ballin' on you like I'm Chris Paul
[Chorus: Chance the Rapper & Young Thug]
I'm the only nigga still care about mixtapes
Bad little bitch wanna know how lips taste
(She curious, she curious)
I swear that I'm the only nigga still care about mixtapes
Bad little bitch wanna know how lips taste
[Verse 3: Lil Yachty]
Am I the only one who really care about cover art?
Growing up I ain't have my brother 'cause he said the streets gave him a fresh start
I ain't know what that mean
I bumped heads with my dean
Dropped out and hit the scene
Now I'm stunting like bling
Time and time again, they told me no
They told me I wouldn't go
'Cause in high school all I cared about was hoes
Well, maybe that shit was my interest
Now I spend more than they make at my dentist
After ""1 Night,"" them folks thought I was finished
I pinned my name to the game like a seamstress
Oh, bitch, I bite like a gator
Fuck them reviews that they put in the paper
Did what I wanted, didn't care about a hater
Delivered my tape to the world as a caterer
Oh, they fuck with me 'cause I'm different
New sound, new appearance
Bitch, it's Boat from the 6
Give a fuck about a bitch
Walk with my hand on my dick, I'm the shit
[Chorus: Chance the Rapper & Young Thug]
I'm the only nigga still care about mixtapes
Bad little bitch wanna know how lips taste
(She curious, she curious)
I swear that I'm the only nigga still care about mixtapes
Bad little bitch wanna know how lips taste24Embed"
Chance the Rapper,3847670,395357,16751,Chance the Rapper,https://images.genius.com/0ea1b30f066f2974043519d9c1ab3453.300x300x1.jpg,I Might Need Security,https://genius.com/Chance-the-rapper-i-might-need-security-lyrics,405719,"I Might Need Security Lyrics[Intro: Jamie Foxx & Chance The Rapper]
Fuck you
Fu-u-u-u-u-uck you, fu-fuck you
Fu-u-u-u-u-uck you, fu-fuck you
Fu-u-u-u-u-uck you, fu-fuck you
Fu-u-u-u-u-uck you, fu-fuck you (Yep)
Fu-u-u-u-u-uck you, fu-fuck you (Nah-nah)
Fu-u-u-u-u-uck you, fu-fuck you (Nah-nah)
Fu-u-u-u-u-uck you, fu-fuck you (No)
Fu-u-u-u-u-uck you

[Verse 1]
I ain't no activist, I'm the protagonist
I don't co-captain it, I fly solo like one cup in the cabinet
The cab is the cabinet, they trust me at landing it
They call me the advocate, they'll slide like the abacus
Boy meets world, everybody been savages
I just want to really know how much that your shooter averages
I'm not no nice guy, I'm just the good guy
The bad guys should really stay on my good side
I smelled my roses younger than the good die
The Illuminati couldn't see me with they good eye
They think they Heath Ledger scary, they just Jack Nichols
I'm a sign to my city like the Bat-Signal
Young chosen one, golden boy, De La Hoya
It ain't too many me's, rest in peace to Verne Troyer
I was younger than I seemed as a kid
I mean my G17 18 in the head
I mean I'm only 25 but I'm Motown 25
Bet I get a statue in my hometown when I die
And Rahm, you done, I'm expectin' resignation
An open investigation on all of these paid vacations for murderers
[Interlude]
Fuck you, oh-oh
Fuck you, fuck you
Fu-u-u-u-u-uck you, fuck you-ou-ou-ou
Fu-fu-fu-fu-fu-fu, fu-fu-fu-fu-fu-fu
Fuck you, oh-oh
Fuck you, fuck you
Fu-u-u-u-u-uck you, fuck you-ou-ou-ou
Fu-fu-fu-fu-fu-fu, fu-fu-fu-fu-fu-fu
Fuck you, fu-u-u-u-u-uck you, fu-fuck you
Fu-u-u-u-u-uck you, fu-fuck you
Fu-u-u-u-u-uck you, fu-fuck you
Fu-u-u-u-u-uck you, oh

[Verse 2]
I don't get no paper, I gotta sign at the bottom
Still in my bag like the fries at the bottom
And I can't do nothing right, they gon' always be at me
I missed a Crain's interview, they tried leaking my addy
I donate to the schools next, they call me a deadbeat daddy
The Sun-Times gettin' that Rauner business
I got a hit-list so long I don't know how to finish
I bought the Chicagoist just to run you racist bitches out of business
Speaking of racist, fuck your microaggressions
I'll make you fix your words like a typo suggestion
Pat me on the back too hard and Pat'll ask for your job
And in unrelated news, someone'll beat your ass at your job
I'm the real deal
Who taught all these rappers that a big deal's not a big deal?
Inherited the earth, popping wheelies on a big wheel
My enemy lives in his mother's basement
That's why my videos don't got no Baphomet product placement
I'm a real one
The honey is sweet, the apple's bitter
They'll try to convince you you stronger without your woman than when you with her
And tell you they kidding while Twitter trashing your litter
I know the devil's a liar
I know that players is quitters, I heard you hire your hitters
I know the higher the bidder, that mean the less on return
So I just hire a sitter
I'm not no boss nigga, I'm a soldier
Kingdom builder, man somebody shoulda told ya
Fuck you
[Outro: Jamie Foxx]
Fuck you, oh-oh
Fuck you, fuck you
Fu-u-u-u-u-uck you, fuck you-ou-ou-ou
Fu-fu-fu-fu-fu-fu, fu-fu-fu-fu-fu-fu
Fuck you, oh-oh
Fuck you, fuck you
Fu-u-u-u-u-uck you, fuck you-ou-ou-ou
Fu-fu-fu-fu-fu-fu, fu-fu-fu-fu-fu-fu
Fuck you, fu-u-u-u-u-uck you, fu-fuck you
Fu-u-u-u-u-uck you, fu-fuck you
Fu-u-u-u-u-uck you, fu-fuck you
Fu-u-u-u-u-uck you, fu-fuck you33Embed"
