artist,id,lyrics_owner_id,primary_artist_id,primary_artist_name,song_art_image_thumbnail_url,title,url,pageviews,lyrics
Chance the Rapper,386592,102703,16751,Chance the Rapper,https://images.genius.com/9db1a9643a028d62543e44c90da3a6ad.300x300x1.jpg,Home Studio (Back Up In This Bitch),https://genius.com/Chance-the-rapper-home-studio-back-up-in-this-bitch-lyrics,100205,"Home Studio (Back Up In This Bitch) Lyrics[Intro]
Uh-uh, uh-IGH!
Nana-naa
Yup, wooooh, ah!
Nanana
[Verse 1]
Young black boy, how he got the labels scared? (Labels scared)
A&R's like, ""Chano, you ain't playin' fair! (Playin' fair)
You gon' set a bad example for the average bear (Bear)
You a Yogi, you should idle while in child's position""
I be like, naw, these my sons, this prenatal care (Ooh)
I'ma show 'em how to make it here and make it fair (Ooh)
Take it there, they could kill me and I ain't gon' care (Igh!)
You is just an ankle weight, lighter than some angel cake
Sweeter than some maple syrup (Uh!)
Easier than Ableton (Uh!)
Make a plate and make a player, make 'em play it
Just don't count your sheep before they hatch
You chickens 'fore your eggs
Eat your dinner 'fore you say your prayer

[Chorus]
I'm back up in this bitch
I'm back up in this bitch (Back up in it)
I'm back up in this bitch
I'm back up in this bitch (I'm in back up in this bitch)
I'm back up in this bitch
I'm back up in this bitch (Back up in this bitch)
I'm back up in this bitch (Back up in this bitch, back up in this-)
I'm back up in this-
[Verse 2]
Young tactician, just got my taxes finished
Beat the tortoise by a hair in an '04 Ford Taurus
On a spare with a wax finish
There's a lot of metaphors, you just lack vision
You just bad business
UH!
All your shit been lower case
Lower class, lower key
I'm the only minor minority in priority
Sippin' gin and tonic while I plot upon authority
Author of my horoscope, feeling like the oracle
Ain't no rules, nigga, igh!

[Bridge]
Come on now
Come on now
Come on, put your hands together

[Chorus]
I'm back up in this bitch (Jump, jump, jump, jump, jump)
I'm back up in this bitch (Jump, jump, yeah)
I'm back up in this bitch (Jump, jump, jump, jump)
I'm back up in this bitch (Jump, jump, jump, yeah)
I'm back up in this bitch
I'm back up in this bitch
I'm back up in this bitch
I'm back up in this-
[Outro]
Igh!81Embed"
Chance the Rapper,72705,87695,16751,Chance the Rapper,https://images.genius.com/04c687414ea567ebf44f05a92c3e86ff.300x300x1.jpg,Juke Juke,https://genius.com/Chance-the-rapper-juke-juke-lyrics,97836,"Juke Juke Lyrics[Produced by Caleb James]

[Intro]
Chance The Rapper, Caleb
10 Day, ohh
Igh

[Chorus]
She working that thang, she know she got it
Lil' mama so bad, you know she naughty
Her do it so slow, now watch her take it
She giving a show, now watch her break it

[Verse 1]
Back it up like, ""Juke juke"", 3, 4, ""Juke juke""
Hands on the tracks like ""Choo-choo""
Can't nobody do it like you do
True, true, mama sip a little bit of that screw juice
Or a little bit of that Special K
And throw it in the bowl like Froot Loops
Hola, mami chula
Mami hol'up, mami slow up
'Scuse my French, my lingo but I no hable cinco
Her girlfriends say they 'bout it, you know that I'm bilingual
And Chano gonna mingle, I'm off a couple pintos
The bad hoes out on Saturday, it's church on Domingo
So while they out here frontin', go on back it for your mans
Because even when your friends actin' funny you gon' dance like
[Pre-Chorus]
Juke, juke, juke, juke, juke, juke, juke, juke
Juke, juke, juke, juke, juke, juke
Juke, juke, juke, juke, juke, juke, juke, juke
Juke, juke, juke, juke
Break it down
Chi-Town break it down, Chi-Town break it down
Break it down, Chi-Town break it down
Chi-Town break it down, break it down

[Chorus]
She working that thang, she know she got it
Lil' mama so bad, you know she naughty
Her do it so slow, now watch her take it
She giving a show, now watch her break it

[Verse 2]
Bust it, bust it, wide open, open
I been hopin'-hopin' shorty goin'-goin'
She from low-end, oh, and went to Kenwood? Me, too
Nah I'm lyin', she say she got somebody bitch, me, too
I hope that that shit do work out man
Cause this that new 'New Workout Plan'
And I'm that dude, you heard 'bout
And I hope that get your shirt off and if not
Keep on dancin' babe, all I need is that preview
Put you on the floor and show them niggas how to freak you
Slow wind, slow grind
On time, you can take your own time
But if I can't hit your ass on time
Gotta hit me online, you can't hit my phone line
[Pre-Chorus]
Juke, juke, juke, juke, juke, juke, juke, juke
Juke, juke, juke, juke, juke, juke
Juke, juke, juke, juke, juke, juke, juke, juke
Juke, juke, juke, juke
Break it down
Chi-Town break it down, Chi-Town break it down
Break it down, Chi-Town break it down
Chi-Town break it down, break it down

[Chorus]
She working that thang, she know she got it
Lil' mama so bad, you know she naughty
Her do it so slow, now watch her take it
She giving a show, now watch her break it

[Outro]
Juke, juke, juke, juke, juke, juke, juke, juke
Juke, juke, juke, juke, juke, juke
Juke, juke, juke, juke, juke, juke, juke, juke
Juke, juke, juke, juke
Break it down
Chi-Town break it down, Chi-Town break it down
Break it down, Chi-Town break it down
Chi-Town break it down, break it down
Juke, juke, juke, juke, juke, juke, juke, juke
Juke, juke, juke, juke, juke, juke
Juke, juke, juke, juke, juke, juke, juke, juke
Juke, juke, juke, juke
Break it down
Chi-Town break it down, Chi-Town break it down
Break it down, Chi-Town break it down
Chi-Town break it down, break it down17Embed"
Chance the Rapper,71140,92935,16751,Chance the Rapper,https://images.genius.com/04c687414ea567ebf44f05a92c3e86ff.300x300x1.jpg,Long Time Part 2,https://genius.com/Chance-the-rapper-long-time-part-2-lyrics,96426,"Long Time Part 2 Lyrics[Produced by Peter Cottontale and THEMpeople]

[Verse 1]
I wonder if Gladys smiles when angels bring my name up
Or change language and subject change up
Her boy's a long way from red dolls and green rangers
Things ain't been the same since Ms. Patterson called me famous
I saw your reflection in a toilet full of vomit water
You don't think I felt your hand on my head yelling, ""Call his father""?
But people don't hear ghost, so how they gon' play me?
Money saved me, so I'ma do the same thing
You droppin' pounds, gettin' small on some sick shit
Like how you got the drive but don't know how to use a stick shift?
You better not miss this, overdose dope and mix this
Let your throat close with a boatload of dope quotes within it

[Chorus]
Long time now since I seen you smile
Long time, long time now since I seen you smile
And it's been a long time, long time now
Since I seen you smile

[Verse 2]
Dropping tapes 'til I lost the count
Coughing out blood
Dropping weight like I lost an ounce
Throwing words and tossing nouns
NY traveling, I'm Boston bound, bossing 'round homies
And talking down to shorties while I'm jotting down
Notes to spit to Harlem crowds
Surfing through the Harlem crowds
At the crib, I'm falling down
I'm on the floor, crawling 'round
I'm calling out to God, ""You're little angel's falling down
Save me from my darkened cloud
Reach your hands and arms around""
[Chorus]
Long time, long time now, since I seen your smile
We miss you

[Verse 3]
10 day
It's been a really, really long time, long time
Since a goof-ass nigga done tried me
Label niggas wanna sign me
And lame ol' nigga wanna buy me
Food and weed and drink and shit
Just as long as you inkin' shit
Sometimes I can't pay for food
'Cause sometimes I can't think of shit
Where's your head at? Where's your head at?
Singing my shit like you just said that
Wanging my shit like, ""Where'd you hear that?""
Young-ass nigga, where you headed? Long time to get famous
Life's whatever you make it, just thank God that we made it19Embed"
Chance the Rapper,388139,217970,16751,Chance the Rapper,https://images.genius.com/9db1a9643a028d62543e44c90da3a6ad.300x300x1.jpg,Thotty,https://genius.com/Chance-the-rapper-thotty-lyrics,95440,"Thotty Lyrics[Hook]
Shawty, she got the body
She did the molly
Probably gonna do the squaddy
Right after papi
Sloppy, she extra choppy
Just did the potty
I love that bitch, the perfect thottie
The perfect thottie
Shawty, she got the body
She did the molly
Probably gonna do the squaddy
Right after papi
Sloppy, she extra choppy
Just did the potty
I love that bitch, the perfect thottie
The perfect thottie

[Verse 1: Chance the Rapper]
You are the prototype
I love you like you love your photo likes
When you post your life
Some of these hoes just wanna Instagram me
You out here trying to win you an Instagrammy
Instant pancakes in the morning
Aunt Jemima try to Andre Benjamin me
I'm sorry Ms. Jackson, but your daughter do dicks
Wouldn't be my old bitch if you taught her new tricks
But she do do the one thing, with her tongue ring
When she bust like a gun range
I had a couple pics, record her out her panties
But, that's just chump change
She the type of bitch that loves to say she's mixed
But when she say the roster she always say ""Black last""
You know who you is and you know what it is
I love you with your black ass
You helpless thing, wish you gave me more head
And have way more self esteem
But I wish she gave me way more head
Way more then I ever gave a fuck about your self esteem
[Hook]
Shawty, she got the body
She did the molly
Probably gonna do the squaddy
Right after papi
Sloppy, she extra choppy
Just did the potty
I love that bitch, the perfect thottie
The perfect thottie
Shawty, she got the body
She did the molly
Probably gonna do the squaddy
Right after papi
Sloppy, she extra choppy
Just did the potty
I love that bitch, the perfect thottie
The perfect thottie

[Verse 2: J. Cole]
Got it locked, I got lots of keys
Fuck nigga don't start with me
Oh my god, oh my god I’m a novelty
At least that’s what she said when she swallowed menovelty
Your bitches had the ball, my bitches pass the ball
And this dick is a gift for that love degree, hey
Heard you graduating, girl congratulations
This ain't prom but can I take you home as if your fam was waiting
At the front door with that 44 cocked
[Hook]
Shawty, she got the body
She did the molly
Probably gonna do the squaddy
Right after papi
Sloppy, she extra choppy
Just did the potty
I love that bitch, the perfect thottie
The perfect thottie
Shawty, she got the body
She did the molly
Probably gonna do the squaddy
Right after papi
Sloppy, she extra choppy
Just did the potty
I love that bitch, the perfect thottie
The perfect thottie59Embed"
Chance the Rapper,4730357,2733501,16751,Chance the Rapper,https://images.genius.com/cb946abdb06b698c4b2cb6ce2b2fb96d.300x300x1.jpg,I Got You (Always and Forever),https://genius.com/Chance-the-rapper-i-got-you-always-and-forever-lyrics,87380,"I Got You (Always and Forever) Lyrics[Intro: En Vogue]
Five, six, seven
I got you, you've got me
I don't care what people might say
I know you know
I've got you
Oh-oh-oh-oh

[Refrain: Chance the Rapper]
Do it for the 1-9 love, 1-9
For the 1-9, for the 1-9 love
Do it for the 1-9
We do it, we do it for the 1-9 love

[Pre-Chorus: Ari Lennox]
Around the world, people tend to lend advice
We can't blame them, it's all just by design
Take it all with a grain of sand
Or leave it all up to me, I got you always

[Chorus: Ari Lennox & Kierra Sheard]
Always, always and forever
Always, always and forever
Always, always and forever
Always, always and forever
Always, always and forever
Always, always and forever
Always, always and forever
Always, always
[Refrain: Chance the Rapper, Ari Lennox, Kierra Sheard & En Vogue]
We do it for the 1-9 love, 1-9
For the 1-9, for the 1-9 love
Do it for the 1-9
We do it, we do it for the 1-9 love
We do it for the 1-9
Ooh, I've got you, oh-oh-oh

[Verse 1: Chance the Rapper]
Ayy, call me Young Mister, Mister Tongue Twister
Niggas couldn't touch the flow if they was playing Twister, right
A minute in it, they turn to Sonny Liston, right
It's plenty of pullin' up, I'm gettin' blisters
Ever since I kissed her
Everyone seem like they got something to say
Like the day after the big day
Is supposed to be super bad like we won't stay
It's supposed to be super scary like we don't pray
We treat the bad advice like bad breath
Either give a compliment or couple mints, depends what we have left
Findin' good news in the bad press
Tell 'em break a leg like an actress, hit with a jab step
1-9 love, that's forever, it'll never stop
1-9 Love, that's a record I'll never drop, uh
1-9 love, that's a one time love
That's a one time, one time, every time it'll be the
Lot of folks share they opinions
Same folks so easy offended
One thing I'll always remember
They here today, but we'll be together forever
[Pre-Chorus: Ari Lennox & Chance the Rapper]
Around the world, people tend to lend advice
We can't blame them, it's all just by design
Take it all with (Take it all with), a grain of sand
Or leave it all up to me (Leave it all up to me), I got you always

[Chorus: Ari Lennox  & Chance the Rapper]
Always, always and forever, ever
Always, always and forever, ever
Always, always and forever, ever
Always, always and forever, ever
Always, always and forever, ever
Always, always and forever, ever
Always, always and forever, ever
Always, always (I got you, oh-oh-oh)

[Verse 2: Chance the Rapper]
It's been a minute, I've been messin' with ya, I could never switch up
Turn my life around, I'm tryna go to Heaven with ya
I would sit there in the waiting room together with ya
Magazines, pat my jeans, have a beverage with ya
Count my blessings with ya
They prefer success less than when we stress, bet
Forget about all the drama and the comments they left
Out rightly fine, the bottom line is right on top of they text
You gotta remember that the enemy is not of the flesh
You gotta remember that our imagery is made from the best
So pray for the best
Hands high, caught the garter, caught the Hail Mary
Married, tossed the veil, moved to Fort Lauderdale
1-9 to 9-1, that's the goal
9-1 dash, that's the soul
Can't keep track of lies that they told
So extra in the background, that's they role, but
Lot of folks share they opinions
Same folks so easy offended
One thing I'll always remember
They here today, but we'll be together forever
[Pre-Chorus: Ari Lennox & Chance the Rapper]
Around the world, people tend to lend advice
We can't blame them, it's all just by design
Take it all with (Take it all with), a grain of sand
Or leave it all up to me, I got you always

[Chorus: Ari Lennox & Chance the Rapper]
Always, always and forever, ever
Always, always and forever, ever
Always, always and forever, ever
Always, always and forever, ever
Always, always and forever, ever
Always, always and forever, ever
Always, always and forever, ever
Always, always

[Outro: Ari Lennox]
I got you, you've got me
I don't care what people might say
I know you know
I've got you always1Embed"
Chance the Rapper,4662118,126836,16751,Chance the Rapper,https://images.genius.com/cb946abdb06b698c4b2cb6ce2b2fb96d.300x300x1.jpg,5 Year Plan,https://genius.com/Chance-the-rapper-5-year-plan-lyrics,85158,"5 Year Plan Lyrics[Verse 1: Chance the Rapper]
You gotta schedule vacations in your five-year plan
You gotta schedule celebrations in your five-year plan
You gon' have several revelations in your first five days
In your first five minutes, have your first five fans
For like forty-five minutes, take your first shift break
There's no time for impatience in your five-year plan
You got time for hesitation in your five-year plan
A lot of shit came at you in a five-year span
If you followed your flight plan, you'd be right here prayin'
Eyes closed, right now sayin', Lord of Lords
I know you gave abundantly, even gave up your son for me
No need for sacrifice in my plans
And I love to say your name, it come from my diaphragm
I just had to scare 'em off and draw a line in the sand
Anything you gave to me, they couldn't pry from my hands
Anything you gave to me, I know it's right for my brand
I know shortcuts cut short long runs
I seen niggas on one try the wrong one
Get trunked, sing the same song, Ken Jeong swung
Giant mistakes on fee fi foenem
Probably keep both of 'em, you got time for missteppin'
Time for them weapons, formed but not prosper
Time for them lessons, time for them blessings
Time for first, second, third, fourth impressions
Time for reflection, time for confession
Time will heal all, let's get a good stretch in
[Chorus: Chance the Rapper]
Things that's in the way of my goal
Things that eat away at my heart
That's just, just the way of the art
I know that I had a good start
I wish I could play a guitar
I, I  know that I'm gonna be
Better than I ever was
I told 'em they gonna see
I just want everybody ta
Love, love, love

[Interlude: Randy Newman]
Time has, time has come
Time has, time has come
To be who you are
Be who you are
Time has, time has come
Time has come
To take it all in, take it all in
Take it all in
The time has come
Time has come, time has come
Know who you are
Know who you are
The time has come
Time has come, time has come
To take it all in
[Verse 2: Chance the Rapper]
Who's that in the back of the back?
You deserve a plaque and a pat on the back
I see y'all in your suits like the Cat in the Hat
With the clean black slacks and the jacket to match
Found your way back like a Cadillac with the flats
Came around like satellite, down like a battle axe
Why do you word insure me like it's Aflac?
I don't know, why do birds Burt Bacharach?
Why do worms prefer habitats?
Why did it occur where it happened at?
Why ain't no apples in Apple Jacks?
Are you ready for The Big Day?
I don't know, but you're well on your way

[Outro: Randy Newman]
Somebody hurt you really bad
And you don't know what to do
And you think how so many people live through things like this
Sounds crazy but it's true
You can get over anything, almost
I'm telling you the truth
The one thing left to say is...4Embed"
Chance the Rapper,4126787,104344,16751,Chance the Rapper,https://images.genius.com/47c6ebd2bb4bb77ee873d143f0ecb8eb.300x300x1.jpg,The Man Who Has Everything,https://genius.com/Chance-the-rapper-the-man-who-has-everything-lyrics,79534,"The Man Who Has Everything Lyrics[Verse 1]
What to get the man who has everything?
Tryna fit myself into a schedule and a wedding ring
Tryna eat everything
I was raised, it come across my plate, then I better swing
Tryna turn Confederate flags into confetti strings
I'm tryna back up my baby mama like Kevin Federline
Heard they got some nice-ass houses out there in Beverly
Never leave where I came from
I just need me some stockings
And the chimney they could hang from
Photos so my kids can find out where they got their names from
Christmas cards so gorgeous, other families wanna frame one
Real talk, I need a front yard, a backyard
A side yard, a side yard, inside bar, a dry bar
Nine cars and a garage, and it's on hella acres
I'm tired of people visitin', takin' the elevator
Well, we'll keep the elevator

[Chorus]
Love me forever, that's all I ask of you
Love me forever, that's all I ask of you

[Verse 2]
Don't gifts get re-wrapped?
That shit could get sticky like tree sap
I gave you free raps, that shit sound like free facts
Which is 'bout as common as free blacks
Stuck like freeze tag from one of these random police stops
Look like the treetops soon as the breeze stops
And once the debris drops, the streets 400 degrees hot
Please, man, we needin' some freeze pops
What in the world for the man who has everything?
Man, West Chatham Park could use some better swings
Used to be disheveled, I went and shoveled everything
Tell Santa to show up to doors he never ring
He never ring
[Chorus]
Love me forever, that's all I ask of you
That's all I ask
Love me forever, that's all I ask of you

[Verse 3]
That baby is a genius
Don't teach him 'bout Santa 'til you teach him 'bout Jesus
Don't take him out the snow to try to take him on beaches
I swear, it's enough leisure in this world to get lost
What's the point of gainin' chicken if you lose all the sauce?
What's the point of gainin' chicken if it can't get across?
Lost the cold hard cash, they said, ""Damn, that boy soft""
Same niggas lost their souls in a fuckin' coin toss
I guess I cleaned up, Santa don't miss no names but I miss Fatimah
It's been a minute since I've seen her
Them the type of things I hate to bring up, just like the prenup
That shit be see-through like John Cena, Aquafina
But like the Christmas tape, there's things that I gotta get clear
Like my papa ask the same question every year
""What to get for my boy who has everything?""
I said, ""I'll take anything but everything,"" you know?

[Chorus]
Love me forever, that's all I ask of you
Love me forever, that's all I ask of you
Love me forever, that's all I ask of you
Love me forever, that's all I ask of you7Embed"
Chance the Rapper,465081,217970,16751,Chance the Rapper,https://images.genius.com/7a4992b2b1106a9324017eca5b0af565.300x300x1.jpg,Wonderful Everyday: Arthur,https://genius.com/Chance-the-rapper-wonderful-everyday-arthur-lyrics,78629,"Wonderful Everyday: Arthur Lyrics[Intro: Chance The Rapper & Guests]
It could be (It could be, it could be everyday)
Everyday (It could be wonderful)
Everyday, it could be (It could be)
It could be wonderful (It could be wonderful)
Wonderful (It could be)
Hey
Everyday (Everyday)
It could be wonderful
It could be wonderful everyday (Everyday)
Everyday, it could be, everyday (It could be wonderful, wonderful)
Hey, it could be everyday (It could be everyday)
It could be (Everyday it could be wonderful)
(It could be wonderful everyday)
(Everyday could be so wonderful, it could be)

[Verse 1: Chance The Rapper & Guests]
Every day when you're walking down the street (Wonderful)
Everybody that you meet
Has an original point of view
(Everyday, everyday it could be wonderful)
And I say hey! (Everyday)
Heyyy! (Everyday, everyday, it could be wonderful)
(Everyday, everyday it could be wonderful, wonderful)
It could be so wonderful
Everyday it could be, it could be
It could be wonderful, wonderful
Heyyy! (Everyday, everyday, everyday)
(It could be wonderful)
It could be (It could be wonderful)
It could be wonderful (Everyday, it could be wonderful)
It could be wonderful, everyday (It could be wonderful)
(It could be so wonderful)
(It could be, everyday)
[Bridge: Chance The Rapper]
It's a simple message
And it comes from the heart
Believe in yourself
For that's the place to start

[Hook: Chance The Rapper & Guests]
And I said Hey!
What a wonderful kind of day
We can learn to work and play
Get along with each other
And I said Hey!
What a wonderful kind of day
We can learn to work and play
Get along with each other

[Verse 2: Chance the Rapper]
Listen to your heart
Listen to the beat
Listen to the rhythm
The rhythm of the street
Open up your eyes
Open up your ears
Get together and make things better
By working together
[Bridge: Chance The Rapper]
Its a simple message
And it comes from your heart
Believe in yourself
As thats the way to start

[Verse 3: Chance The Rapper]
I'm gonna get by when the going get rough
I'm gonna love life 'til I'm done growing up
And when I go down
I'ma go down swinging
My eyes still smiling
And my heart still singing
I'm gonna get by when the going get rough
I'm gonna love life 'til I'm done growing up
And when I go down
I'ma go down swinging
My eyes still smiling
And my heart still singing
I'm gonna get by when the going get rough
I'm gonna love life 'til I'm done growing up
And when I go down
I'ma go down swinging
My eyes still smiling
And my heart still singing
I'm gonna get by when the going get rough
I'm gonna love life 'til I'm done growing up
And when I go down
I'ma go down swinging
My eyes still smiling
And my heart still singing66Embed"
