artist,id,lyrics_owner_id,primary_artist_id,primary_artist_name,song_art_image_thumbnail_url,title,url,pageviews,lyrics
Chance the Rapper,4553383,427740,16751,Chance the Rapper,https://images.genius.com/f0e56540f66607b0e1b83c872a34f766.300x300x1.jpg,GRoCERIES,https://genius.com/Chance-the-rapper-groceries-lyrics,182572,"GRoCERIES Lyrics[Intro: TisaKorean]
M-M-M-Murda
Uh

[Refrain: TisaKorean]
I'm like oh my God, shawty tender like a strip (Strip)
I'm like oh my God, shawty came in with the drip (Okay)
I'm like her and her friend (Her friend), came for the show (Ooh)
Her and her friend came for the show, I'm like, um
Can you do it simple just like lemonade? (Ooh, lemonade)
Can you do it simple just like lemonade? (Yeah, lemonade)
Can you do it simple just like lemonade? (Ooh, lemonade)
Can you do it simple just like lemonade? (Yeah, dawg, ooh)

[Chorus: Chance the Rapper]
Used to carry all the groceries in in one trip (Hercules)
Simply Minute Maid, gone in one sip (Drip, drip, drip)
Too much dip on my chip (Hey)
Stiff arm a jit to get my lip balm (Yeah, yeah, yeah, yeah)
Used to carry all the groceries in in one trip (Hercules)
Simply Minute Maid, gone in one sip (Drip, drip, drip)
Too much dip on my chip (Hey)
Stiff arm a jit to get my lip balm (Hey, hey)

[Verse 1: Chance the Rapper]
Traffic, traffic, lookin' for my chapstick
Big star, Patrick, haircut look like Brad Pitt
Five star hotel, doorman look like Braxton
Fancy carpet make her feel like J-
Make her feel like Jasmine
Make her feel like...
Make her feel like Jas'
Make me feel like I choose you like I'm Ash
Take me to the box, Bandicoot, let me crash
Ooh, make me sleep, make me dream, make me snore
Then wake me up, baby, I'ma need support
Thank you, Lord
'Member eatin' dinner, kitchen drawers full of sporks (Drip)
I was always one to try to go over my aunt's (Yeah)
Sugar in the 'frigerator right next to the ants (Ew)
I would make the Kool-Aid then go make a cooler dance (Yup)
Since I was a shorty, nigga, always wore the pants
[Refrain: TisaKorean]
I'm like oh my God, shawty tender like a strip (Strip)
I'm like oh my God, shawty came in with the drip (Okay)
I'm like her and her friend (Her friend), came for the show (Ooh)
Her and her friend came for the show, I'm like, um
Can you do it simple just like lemonade? (Ooh, lemonade)
Can you do it simple just like lemonade? (Yeah, lemonade)
Can you do it simple just like lemonade? (Ooh, lemonade)
Can you do it simple just like lemonade? (Yeah, dawg, ooh)

[Verse 2: TisaKorean]
Put some water on the grass to make it grow (To make it grow)
I like her skin all black like a crow (Just like a crow)
I'm like, ""Get it, please, baby, get it,"" uh
I'm like, ""Dip it, nacho chip it,"" ayy
She like the club, but she don't dance, though (But she don't dance, though, okay)
I text her kitty and she text me back hello (Eww)
I'm like Simple Lemonade (Simple)
I'ma play my cards right, I ain't talkin' spades (Okay, okay)
They should be afraid
Money growin' on the tree, it's gon' cause a shade (Ayy)
Please, can you hold on? Please, could you hold on? Ayy (Ayy, please can you? Please?)
'Cause me and Chance ain't gon' take long (Grr, grr)
'Cause me and Chance ain't gon' take long (Ooh, ooh, ooh)

[Chorus: Chance the Rapper]
Used to carry all the groceries in in one trip (Hercules)
Simply Minute Maid, gone in one sip (Drip, drip, drip)
Too much dip on my chip (Hey)
Stiff arm a jit to get my lip balm (Yeah, yeah, yeah, yeah)
Used to carry all the groceries in in one trip (Hercules)
Simply Minute Maid, gone in one sip (Drip, drip, drip)
Too much dip on my chip (Hey)
Stiff arm a jit to get my lip balm (Hey, hey)7Embed"
Chance the Rapper,2280404,672397,16751,Chance the Rapper,https://images.rapgenius.com/9c9553c23366eefea89fc896c49e9303.300x300x1.jpg,Israel (Sparring),https://genius.com/Chance-the-rapper-israel-sparring-lyrics,176417,"Israel (Sparring) Lyrics[Produced By Cam O'bi]

[Verse 1: Chance The Rapper]
Sparring is training, chain-snatching the slaves
But a rap song is a match in a cave
Dim lit, wet wick, wicked wrath in its way
Drunk off of light, lies, laughing
Claiming asylum while shying in shade
I can't stay silent, I go violent when my violets is gray
And my roses is black
Fuck the pharaohs and the Pharisees, Moses is back
I don't need to see a Sphinx to know they noses was black
I don't know one Temptation that had Otis's back
Sparring is training; this a jumping jack
I'm the scariest Jack in the pumpkin patch
Float like my jumper wet, sting like a bumblebee
I swing like a lumberjack, go back when I'm up at bat
They tried to label me a non-rapper
I'm an independent contractor, card cracker
Sparring is training without the training wheels
You made it, you made it, you made it, yeah, you made a deal
You played it straight, hated, graduated
Waited-waited, you still a waiter still
Mice will always find out ways to steal
Picture me, fifth of Hennessy and a Swisher Sweet
Fake identity, 'til a plug named Trinity shook me
""Wake up, wake up,"" like ""Remember me?""
Said one plus one make three, and you finna see
You ain't as grown as you finna be
You got them young nigga tendencies
[Verse 2: Noname]
Mm... Sentimental energy
I let the light in beside him, I stand like angel
Sparring is training for an apathetic halo
Apologetic, nonreligious, consequential fable
Like good is good, the love in me is goodly, or godly
The Bible say mistakes is necessary
So I Mississippi monologue to granny house
My soloist is sold out to attentive God
Cornbread on my table when I say my prayers
On airs, to stairs where shadiness is time to rest or manifest
Sparring is training, I know they think me bumblebee
Afro-Americano Sunny D, but bet I sting, no die

[Verse 3: Chance The Rapper & Both]
Sparring is training, Jacob wrestled with God
In the desert 'til he broke him and he blessed him
And he rescued his heart
I struggle with love, I juggle my loves
I cuddle and coddle, ship wreckin' bottle, I huddle in hugs
Sparring is training bra, Ramses watching raining frogs
Jigga watching Damon, Damon watching Wayans Bros
A tandem unicycle with two pilots in different maps

[Transition: Noname (Chance The Rapper)]
You giving back? (I'm giving back)
Tit for tat
[Verse 4: Noname]
Synagogue and bottle caps
A body in the underpass says, where's my Jesus?
Pledge allegiance to the money now
We runnin down to kiddie parks where darker kids be casualty
Like come with me, to the museum

[Transition: Noname & Chance The Rapper]
Excuse them, they know of what they do

[Verse 5: Chance The Rapper]
Sparring is training, don't let Denzel Training Day you
Sensei could catch a fade too
We be on that elegant, hella melanin
Pelle Pelles since they crayons and jelly pens

[Outro: Chance The Rapper & Noname]
And now you know Noname ain't never for none
Ayo, you know Chano ain't never for none
And now you know Noname ain't never for none
Ayo, you know Chano ain't never for none
Ha-HA!! And you don't stop
Ayy! Ayy!
Boom bap, and you don't stop
Hahahahaha!
I told you that was gonna be fun though
Nah that was... Oh shit!53Embed"
Chance the Rapper,4730279,3499957,16751,Chance the Rapper,https://images.genius.com/cb946abdb06b698c4b2cb6ce2b2fb96d.300x300x1.jpg,All Day Long,https://genius.com/Chance-the-rapper-all-day-long-lyrics,172925,"All Day Long Lyrics[Intro: Chance the Rapper]
Yup
And we back (Igh)
Na-na-na (Igh)

[Verse 1: Chance the Rapper]
If you blink you might miss it
You gotta click it or ticket
You gotta go get the gettin' before it's gone
End it quickly as it begun
Life is short as a midget, but mine's a little LeBron
Been a minute since Eminem was a blonde
I need a peace prize‚ mom invented the bomb
A nigga wanted more‚ I would only sit on the lawn
A nigga up next like strongly scented colognes
I'm 'bout to book a show at the Dimmsdale Dimmadome
I still could hit up Sony today and get a loan
And shout out to Miss Sylvia Rhone‚ we get along
But that boy advance gotta be bigger than Diddy Kong
I need stock and it gotta be Pippi Long
Can't stop, won't stop boppin' like Diddy's song
My next tour got eight legs like daddy long
I'm 'bout to have two kids that like daddy's song

[Chorus: John Legend]
We can't be out here pleasin' everybody (Oh, I...)
We know who we are (Oh‚ yeah)
And if you with me, then I'm with you darlin' (Yeah)
Baby, all day long (Come on‚ come on)
Baby, all day long (Oh, I...)
Baby, all day long (Yeah)
Baby, all day long
[Interlude: Chance the Rapper]
This is, this is the day
Took it the scenic route, but this is the way
That's old news, baby, this is today
They gon' miss us today, you a ""Mrs."" today
This is, this is the day
Took it the scenic route, but this is the way
That's old news, baby, this is today
They gon' miss us today, you a ""Mrs."" today

[Verse 2: Chance the Rapper]
Backyard blasted, dance 'til it's grassless
Patio glass, the mazel tov cocktails
Bomb, b-bombastic, used to drop acid
Marli come soon, I only drop classics
Everyone ask
""When that heat gon' drop?""
""When that knee gon' drop?""
""When is he gon' pop the question we all got?""
""'Cause this could be y'all block
You're livin' in a glass house, we can see y'all clocks""
But I can see you from the other side, see y'all rocks
And we could've been Magneto, if you seen our locks
But we share it with the world, not just fans
Come out clean lookin' like we jumped the broom and the dustpan
So now it's here and we actin' out
Dame Dash, champagne in the back of Tao
Now I'm back in my bag and the cat is out
Burn a hole in my pocket like a Black & Mild (Igh)
[Chorus: John Legend]
We can't be out here pleasin' everybody (Oh, I...)
I know, you know, we know just who we are (Oh, yeah)
And if you with me, then I'm with you darlin' (Oh, baby)
Baby, all day long (Come on, come on)
Baby, all day long (Oh, I...)
Baby, all day long (Yeah)
Baby, all day long (Oh, I...)

[Bridge: John Legend]
Hey, we made it, we made it
I'm feelin' grateful
I'm here with my favorite
Oh God, I'm thankful
Our song and we played it
So good, we played it (Yeah)
I just wanted to keep on playin' (Hey)
We made it, we made it
I'm feelin' grateful
I'm here with my favorite
Oh God, I'm thankful
Our song and we played it
So good, we played it (Yeah)

[Chorus: John Legend]
Baby, all day long (Come on, come on)
Baby, all day long (Oh, I...)
Baby, all day long (Yeah)
Baby, all day long
Baby, all day long6Embed"
Chance the Rapper,543095,154912,16751,Chance the Rapper,https://images.rapgenius.com/3ce404f150edcf34e1dfa648721e2a12.300x300x1.jpg,No Better Blues,https://genius.com/Chance-the-rapper-no-better-blues-lyrics,172628,"No Better Blues Lyrics[Intro]
It just don't get better
It don't get better
It just don't get no better

[Hook]
It don't get no better
It don't get no
It don't get no better
It just don't get no better

[Verse 1]
I hate my bed, I hate my home, I hate my job
I hate the wife, I hate the kids, I hate the dog
I hate the sun, I hate the rain, I hate the clouds
I hate the TV, hate the dinner, hate the couch
I hate the car, I hate the bus, I hate the road
I hate the bar, I hate to drink, I hate to smoke
I hate a stranger, hate his boss, I hate his friend
I hate the womb, I needed room, I ate my twin
I hate my hands, handshakes, pancakes, milkshakes
Child-resistant locks on the pill case
I hate inflation, hate the store, I hate to choose
I hate the war, I hate the poor, I hate the news
I hate the late, I can't be early, hate to wait
I hate my lovers cause the way they suffocate
I fuck to hurt, it hurt to date, I hate to date
I fuck to hate, I hate to love, I hate to hate
[Bridge]
And it just don't
And it just don't
And it just don't

[Hook]
It don't get no better
It don't get no
It don't get no better
It just don't get no better

[Verse 2]
I hate to lose, I hate to try, I hate to win
I hate to cruise, I hate to fly, I hate to swim
I hate the optimistic smirks on the face of children
I hate the government and those who deface its buildings
I hate artists, hate creatives, I hate bright people
I hate darkness, I hate racists, I hate white people
I hate small speakers, I hate loud speakers
I hate great concerts, I don't like crowds neither
I hate money, I hate change, I hate hope
I hate funny, I hate strange, I hate dope
I hate charities and parodies and tragedies
I hate carrots, peas, asparagus
Virtually all vegetables, circuses, all festivals
Texts that are oversexual, motion because it's perpetual
I hate schedules, calendars, reminders
Cause they just remind us that tomorrow gon' be just as timeless
I fucking hate you
[Bridge]
And it just don't
And it just don't
And it just don't

[Hook]
It don't get no better
It don't get no
It don't get no better
It just don't get no better116Embed"
Chance the Rapper,4662057,5748418,16751,Chance the Rapper,https://images.genius.com/cb946abdb06b698c4b2cb6ce2b2fb96d.300x300x1.jpg,We Go High,https://genius.com/Chance-the-rapper-we-go-high-lyrics,172241,"We Go High Lyrics[Intro]
Yeah
(We love You, we love, we love You, God)
(We lo-lo-lo-lo-lo-lo-love You, God)
(We love You, love You, love You, God)
(We lo-lo-love You, we love You, God)
(We love You, God, we love You, God, we love You, God)

[Verse 1]
My baby mama went celibate
Lies on my breath, she say she couldn't take the smell of it
Tired of the rumors, every room had an elephant
Tryna find her shoes, rummagin’ through the skeletons
She took away sex, took me out of my element
I tried to do the single-dad mingle-dance
At the club with the iron in my wrinkled pants
You could fall much faster than you think you can
Big hands for my ring, I'ma need a Pringles can
I just want the shine back like a Eagles fan
My ego like, ""Ah damn, there he go
Prayin' again, again, the same ol’ thang""
I mean, I ain't gon' promise that the pain go away
And you can take your sweet time, but she ain't gon' wait
'Cause a new coat of paint don't make the stain go away
But he go high (We love You, God)
And we go high
They go low, we go…
Higher, higher
[Verse 2]
My wife nanny like Fran Drescher
Three damn Grammys, my Granny like, ""No pressure""
So much style, my stylist got no dresser
Fuck goin' straight to the pros, I’m professor
Fuck bein’ one of the G.O.A.T.s, I'm Gotenks
Tried to try that with my girl, she ""No thanks""
Dropped the bomb, I couldn’t find a Tom Hanks
Got me pressed, tryin' to find DeVon Frank
Who the fuck rocked the boat? It's gon' sank
Shootin’ at me point blank with those blanks
They don't take teenage angst at no banks
(We love You, God)
Tried some new hues like Langston gon' paint
You gotta come harder than that

[Bridge]
Eh, eh, eh, eh, eh
It's two different things
It's too bad, and it's so sad
It's too bad, and it's so sad
It's two things (We love You, God)
It's too bad, and it's so sad

[Verse 3]
We give the glory to You, God
One livin' true God, You make us booyah
And throw up the Wu like U-God
They prop up statues and stones, try to make a new God
I don't need a EGOT, as long as I got You, God
Deep breathe, the woosah
Pretty sure I need You in this season like a flu shot
I just sit and wait like I'm with Kirsten when she shoe shop
Know you always with me like how Diddy be with Blue Dot
Got us movin' 'round without the straps like a tube-top
Got me big comfy like Molly's couch
Floatin' 'round the city like Malcolm X dolly'd out
They highly doubt, I guarantee it
This the part of my life my Lifetime movie prolly 'bout
When they come to jump a board, I won't ollie out
I too was once a snotty nose with a potty mouth
One day you get 1 OAK, then poppied out
And poppin' out don't seem as popular as just passin' out
When time get rationed out, you get rational
Folks become pageants inside the fashion house
They start to clash and you let 'em hash it out
But stay passive, so if they crash, you got a fastened belt (Huh)
Lord bless my lineage, let me be the skinniest
Let me get some time with him, let him know who Kenny is
Children born in one's youth are like arrows in the hands of a warrior
Well, I got an extendo with a long nose like Phineas
Kids proud like Penny is
BeBe & CeCe, I need like 20 twins
Got her in my family like Indian
Feel it in your gut like when you uppercut Ballchinians
Speakin' of guts, hers pokin' out like Winnie in the red shirt
I don't have to teach you a lecture about how sex works
I found out diamonds make pressure
I used to dive headfirst, just know I had to let go of the flesh first
It's true, God, this union was for You, God
We standin' at the stoop, we want to make it to the rooftop
You told us bring some people through, we tried to bring a few, God
We tried to form a new bond, just tell us what to do, God8Embed"
Chance the Rapper,427856,599242,16751,Chance the Rapper,https://images.genius.com/258989c45c0fdc85cf5de2a88f18e733.300x400x1.jpg,XXL Freshman Freestyle,https://genius.com/Chance-the-rapper-xxl-freshman-freestyle-lyrics,160342,"XXL Freshman Freestyle Lyrics[Hook]
Ice, melting in my chain
Pretty as my hair
Ugly as my name
Dirty as my gold
Comfy as my chair
Ugly is my name
Ugly is my name

[Verse]
No weapon formed against me shall prosper
My sword look just like Michael's
He lent it to me, this a house of God
I'm just leasing, he rent it to me
This sentence he penned it too
That's a Gmail, he sent it to me
I can send you his contact, hit him if you in combat
Hit him if you in traffic, even if there ain't no static
That's my G, he got me shinin'
My hair, he made it tangled
My seed, don't need no lining
A halo fits on an angel
And if the shoe fits, I'll tie his and let the kiddie rap
Finally give the city back, and ask God for a piggy-back
Up on his shoulders I notice, I'm within earshot
I yell, ""Thanks for makin' us in your image
You got a good sense of hubris""170Embed"
Chance the Rapper,2392690,1500852,16751,Chance the Rapper,https://images.genius.com/752d6aaed3922b7bb14746b479a8c6e2.300x422x1.jpg,Sunday Candy (Saturday Night Live Version),https://genius.com/Chance-the-rapper-sunday-candy-saturday-night-live-version-lyrics,158028,"Sunday Candy (Saturday Night Live Version) Lyrics[Intro: Chance The Rapper]
Happy Holidays

[Verse 1: Chance the Rapper]
She could say in her voice, in her way that she love me
With her eyes, with her smile, with her belt, with her hands, with her money
I am the thesis of her prayers
Her nieces and her nephews are just pieces of the layers
Only ones she love as much as me is Jesus Christ and Taylor
I got a future so I'm singing for my grandma
You singing too, but your grandma ain't my grandma
Mine's is hand made, pan fried, sun dried
Southside, and beat the devil by a landslide
Praying with her hands tied, president of my fan club, saying to her
Something told me I should bring my butt to church
[Hook: Jamila Woods]
You gotta move it slowly
Take and eat my body like it's holy
I've been waiting for you for the whole week
I've been praying for you, you're my Sunday candy
[Bridge: Jamila Woods]
Come on in this house, cause it's gonna rain
(*Mama you know it's gonna rain*)
Rain down Zion, it's gonna rain
(*Mama you know it's gonna rain*)
[Verse 2: Chance the Rapper]
I come to church for the candy, your peppermints is the truth
I'm pessimistic on Monday if I had tweaked and missed you
You look so good with that hat on, had to match with the shoes
Came and dressed in the satin, I came and sat in your pew
I come to Christmas for dinner, fifty rolls on my plate
Hella holes in my stocking holding your pockets in place
I like my love with a budget, I like my hugs with a scent
You smell like light, gas, water, electricity, rent
You sound like why the gospel choir got so tired
Singin his praises daily basis so I gotta try it
You're my dreamcatcher, dream team, team captain
Matter fact, I ain't seen you in a minute let me take my butt to church
[Bridge: Jamila Woods]
Come on in this house, cause it's gonna rain
(*Mama you know it's gonna rain*)
Rain down Zion, it's gonna rain
(*Mama you know it's gonna rain*)

[Verse 3: Chance the Rapper]
Mama you know, Mama you know its gonna rain
Father you know
Promised, you said it would rain, finally I'm home
You left on the light when I left on the flight, but I made it alright
I've been waiting all week, I've been waiting all night
Jason Van Dyke
Had to say something on Saturday
See you at Church on Sunday
Open Mike coming on Monday
I wonder what the internet gonna say
When SNL end with the Indie
Then the third tape slide down the chimney
Via Kirsten, Kinsley, Lisa, Kenny, Taylor, Wendy, Austin win the Emmy, Mama Jan too
[Bridge: Jamila Woods]
Come on in this house, cause it's gonna rain
(*Momma you know it's gone rain*)
Rain down Zion, it's gonna rain3Embed"
Chance the Rapper,66798,15936,16751,Chance the Rapper,https://images.genius.com/04c687414ea567ebf44f05a92c3e86ff.300x300x1.jpg,Long Time,https://genius.com/Chance-the-rapper-long-time-lyrics,152646,"Long Time Lyrics[Produced by Beirut]

[Intro]
Oh, no, no, no, no-no
Well, it's been a long time, long time now
Since I've seen you smile
[Verse 1]
I wonder if Gladys smiles when angels bring my name up
Or change language and subject change up
Her boy's a long way from red dogs and green rangers
Things ain't been the same since Ms. Patterson called me famous
I saw your reflection in a toilet full of vomit water
You don't think I felt ya hand on my head, yelling: ""Call his father""?
But people don't hear ghosts, so how they gon' play me?
Money saved me, so I'ma do the same thing
You're droppin' pounds, gettin' small on some sick shit
Like, how you got the drive, but don't know how to use a stick shift?
You better not miss this, overdose, dope and mixes
Let ya throat close with a boatload of dope quotes within it
Blast off

[Verse 2]
Dropping tapes 'til I losted count, coughing out blood
Dropping weight like I lost an ounce
Throwing words and tossing nouns
NY traveling, I'm Boston bound, bossing 'round homies
And talking down to shorties while I'm jotting down
Notes to spit to Harlem crowns
Surfing through the Harlem crowds
At the crib, I'm falling down
Yeah, I'm steady crawling 'round
I'm calling out to God
Your little angels falling down
Save me from my darkened cloud
Reach your hands and arms around
[Bridge]
Oh, non je t'en prie, nous ne sommes pas chez nous
Oh, je t'assure que ce n'est pas grave
Non laisse-moi!
Mais qu'est-ce que tu as aujourd'hui?
J'ai que les hommes me dégoûtent. Vous ne pensez qu'à ça

[Chorus]
Well, it's been a long time, long time now
Since I've seen you smile
And I'll gamble away my fright
And I'll gamble away my time
And in a year, a year or so
This will slip into the sea
Well, it's been a long time, long time now
(Oh, it's, oh, it's been so long)
Since I've seen you smile
(It's been so long)

[Outro]
Said it's been a long time, long time now, now, now
Said it's been a long time, long time now
And it's been a long time, long time now28Embed"
