artist,id,lyrics_owner_id,primary_artist_id,primary_artist_name,song_art_image_thumbnail_url,title,url,pageviews,lyrics
Damso,3756041,5428057,45855,Damso,https://images.genius.com/88359e6c58b6ffd04a45dc42874c12e2.300x300x1.jpg,Feu de bois,https://genius.com/Damso-feu-de-bois-lyrics,1292618,"Feu de bois Lyrics[Paroles de ""Feu de bois""]

[Intro]
Baby, baby
Oh ba-baby
Baby-y-y-y-y
[Couplet 1]
Feu de bois, jeu de voix, suis-moi
Je te veux pas, fuis-moi, je te veux toi (Dems, Dems)
Feu de bois, jeu de trois, un des deux est de moi
Un des trois est de nous, aidez-nous, aidez-moi
Feu de bois, jeu de voix, tu me dois, Dieu te voit
Montre-moi que du doigt ce que t'as fait de moi
Creux de joie, queue de rois, fée des bois
Fais de moi ce qu'on a fait de toi
Sur le toit, sûre de toi, tu t'y crois
C'est déjà ce qu'on a fait de moi (sale, sale)
Fais de toi, fais de nous
Prends pas la tête, je n'tiens plus le coup
On bavardait sans dire un mot, le bruit de mon silence en dit long
Sentiments grandissants figeant l'ego
Prison de mots, absence de compliment
J'suis en attente, en apprentissage, très peu sage
J'ai vu l'âge à la nage, je fuis l'alcoolisme
Sur la blanche page, j'agonise
Mille latences entre c'que je pense et ce que je dis, ce que j'obtiens et ce que je vise
Soit c'est le père ou bien le fils, soit la be-her ou bien la tise
Que la nightzer, ouais
[Pré-refrain]
Je sais c'que tu penses de nous
Quand tu dis que tu n'sais plus quoi penser de nous
Je sais c'que tu veux vraiment
Quand tu dis que tu n'sais plus c'que tu veux vraiment
Je sais qu'tu n'as plus le temps
Quand tu dis que tu penses qu'il te faut plus de temps

[Refrain]
Baby (Oh la la), baby (Oh la la)
Oh ba-baby (Oui, c'est sale)
Baby-y-y-y-y
Baby (Oh la la), baby (Oh la la)
Oh ba-baby (Oui, c'est sale)
Baby-y-y-y-y
Oh, oh, oh

[Couplet 2]
Tu parles de moi, craches dans mon dos
Je parle de toi, crache dans ta bouche (Rrk, peuh)
J's'rai toujours un vrai négro, que t'aies tes règles ou que t'accouches (Sale)
J'te vois à travers le rideau, je t'observe quand tu te touches
J'sais pas si c'est toi ou c'est l'eau, j'vois pas quand tu mouilles dans la douche
Fume quand relation s'effrite
Lune, Soleil dans même rayon
Qu'une parole tant que j'écris, brume, gondole dans l'océan
Femmes aux yeux d'hommes sont que des filles
Sentiments plongés dans l'néant
Pluie, averses de ressentis mais silence prend les devants
Je t'aime quand je suis dedans, dehors, je suis plein de mépris
Ta fragilité n'est plus à prouver
Quand tout allait mal et qu'on le savait pas
On passait du temps à essayer d'en passer
À deux pour l'prix d'un, d'un ""nous"" sans ""toi"" et ""moi""
J'ai brûlé tes lettres dans un feu de bois mais j'ai toujours en tête nos jeux de voix
J'ai suivi l'oseille, toi, la fée des bois
J'ai toujours en toi ce que t'as fait de moi
Que la nightzer, ouais
[Pré-refrain]
Je sais c'que tu penses de nous
Quand tu dis que tu n'sais plus quoi penser de nous
Je sais c'que tu veux vraiment
Quand tu dis que tu n'sais plus c'que tu veux vraiment
Je sais qu'tu n'as plus le temps
Quand tu dis que tu penses qu'il te faut plus de temps

[Refrain]
Baby (Oh la la), baby (Oh la la)
Oh ba-baby (Oui, c'est sale)
Baby-y-y-y-y
Baby (Oh la la), baby (Oh la la)
Oh ba-baby (Oui, c'est sale)
Baby-y-y-y-y
Oh, oh, oh

[Outro]
Pa-pam, pa-pam, pa-pam, pa-pam47Embed"
Damso,2685480,3006754,45855,Damso,https://images.genius.com/9f7d44ec236db1f623909979988e53d8.300x300x1.jpg,Amnésie,https://genius.com/Damso-amnesie-lyrics,973576,"Amnésie Lyrics[Paroles de ""Amnésie""]

[Couplet 1]
Mort est son avenir proche
Les anges de l'enfer l'escortent
Le hashtag #Vie tient peut-être d'elle
De son cou pendu à la corde
Trop jeune pour comprendre l'impact des mots
J'm'en fous de c'qu'elle veut tant que j'ai ce qu'il me faut
Treize ans, déjà mon premier rapport
Depuis mon cœur a fermé la porte
Aussi bizarre que cela puisse paraître
Après l'avoir ken j'voulais qu'elle disparaisse
Elle voulait qu'on s'aime mais je n'voulais pas
J'tais l'dernier à faire le premier pas
Plus les années passent et plus lourde est la tâche
J'la trouvais pas bonne et j'voulais qu'elle le sache
Dans la méchanceté, j'me sentais si bien
J'tais loin d'imaginer son quotidien
Des larmes séchées sur ses poèmes
Qu'elle m'écrivait en recherchant plaisir clitoridien
Faux-cul, j'étais comme un ""Allez l'OM""
Scandé par un supporter parisien
Le jour de son suicide, j'n'en revenais pas
La veille, elle voulait que j'la prenne dans mes bras
Mais j'suis pas doué dès qu'on s'éloigne des draps
J'suis plus dans le ""suce-moi et concentre-toi""
Dernier message, elle parle au répondeur
""Allô Damso, j'vais faire sonner mon heure""
J'décrochais pas, j'voulais pas faire d'erreur
Qu'elle m'casse les couilles, c'est ce dont j'avais peur
C'était la dernière fois qu'j'entendais ses pleurs
Elle était morte et pourtant, je lui ai dit : ""À tout à l'heure.""
[Refrain]
Depuis je fume pour l'oublier
Je fume pour oublier qu'j'l'ai tuée
Depuis je fume pour l'oublier
Je fume pour oublier qu'j'l'ai tuée
Depuis je fume pour l'oublier
Je fume pour oublier qu'j'l'ai tuée
Depuis je fume pour l'oublier
Je fume pour oublier qu'j'l'ai tuée
[Couplet 2]
Vingt-trois ans aujourd'hui, y a dix ans déjà
Que j'prie pour que l'amnésie s'en prenne à moi
J'assume mes actes en fumant des noix
P't-être que son avenir me pardonnera
Le jour de l'enterrement, j'm'en battais les couilles
Bizarrement, c'est comme si j'sentais pas les coups
En même temps, j'tais pas là pour voir sa dépouille
J'rappais pendant que le prof donnait cours
Jeune délinquant très mal dressé
Menottes à plein temps, poignets blessés
Négros des champs, chiasse dans l'WC
M'a dit le caissier avant d'encaisser
Énervé, j'lui ai foutu une patate dans le menton
J'ai pris c'qu'il avait dit pour argent comptant
Premier braquage sans trop faire exprès
C'fils de putain n'avait pas d'espèce
J'm'enferme dans la drogue douce
Brin de whisky dans le juice
J'oublie cette vie que j'ai ôtée
Son cul plat dont j'me suis moqué
Ampoule de verre dépolie
Ressort mon teint défraîchi
J'me souviens d'cette vie qu'j'ai ôtée
Son 86B que j'ai peloté
J'me construis plus dans l'regard des autres
J'suis ni des leurs, ni des vôtres, ni des nôtres
Cul terreux loin des beaux bâtiments
Remords hideux, sombre châtiment
C'était la dernière fois qu'je sentais son pouls
Elle était morte et pourtant, je lui ai dit : ""I love you.""
[Refrain]
Depuis je fume pour l'oublier
Je fume pour oublier qu'j'l'ai tuée
Depuis je fume pour l'oublier
Je fume pour oublier qu'j'l'ai tuée
Depuis je fume pour l'oublier
Je fume pour oublier qu'j'l'ai tuée
Depuis je fume pour l'oublier
Je fume pour oublier qu'j'l'ai tuée46Embed"
Damso,3041048,2415106,45855,Damso,https://images.genius.com/1a572edbf6da198c99dacd7c19282804.300x300x1.jpg,Θ. Macarena,https://genius.com/Damso-macarena-lyrics,756826,"Θ. Macarena Lyrics[Paroles de ""Θ. Macarena""]

[Intro]
Double X on the track, bitch!
[Refrain]
Le monde est à nous, le monde est à toi et moi
Mais p't-être que sans moi le monde s'ra à toi
Et p't-être qu'avec lui le monde s'ra à vous et c'est p't-être mieux ainsi
Mes sentiments dansent la macarena
Donc je me dis qu'si t'es avec lui, tu t'sentiras mieux
Mais si tu te sens mieux, tu t'souviendras plus de moi
Oh la la, mon cœur danse la macarena
La la la la la la la la la la
Oh la la, mon cœur danse la macarena
La la la la la la la la la la

[Couplet 1]
Sabrina
T'es d'jà trentenaire, on s'envoie en l'air mais j'ai qu'la vingtaine donc j'ai qu'ça à faire, me parle pas de mariage, j'te
Fais perdre ton temps mais qu'est-c'que c'est bon
Quand j'p'lote tes implants, j'me sens comme avant, comme quand j'en avais rien à battre, je
Suis jeune, j'm'en fous de l'avenir, de c'que notre relation va devenir mais pour lui ce n'est pas le cas, il a d'jà un taf
Il fait le mec mature mais tu sais qu'au lit, plus que lui j'assure
Rappelle-toi quand t'avais des courbatures, j't'avais bien niqué ta race
Rappelle-toi bien de la suite, dans les hôtels et les suites
J't'invitais aux soirées V.I.P, à la télé tu r'gardais mes clips
On l'a fait sans autotune sur une prod de Twinsmatic
C'est ma manière romantique de dire que j'n'avais pas mis de préservatif
[Refrain]
Le monde est à nous, le monde est à toi et moi
Mais p't-être que sans moi, le monde s'ra à toi
Et p't-être qu'avec lui le monde s'ra à vous et c'est peut-être mieux ainsi
Mes sentiments dansent la macarena
Donc je me dis qu'si t'es avec lui, tu t'sentiras mieux
Mais si tu te sens mieux, tu t'souviendras plus de moi
Oh la la, mon cœur danse la macarena
La la la la la la la la la la
Oh la la, mon cœur danse la macarena
La la la la la la la la la la
[Couplet 2]
J'ai fait semblant de bien aller, quand t'as démarré, qu't'es allée chez lui ben nan j'ai rien dit
Pourtant j'le savais qu'tu baisais pour t'évader, après tout j'étais là qu'pour dépanner
J'vais pas trop m'étaler, saigner fallait, blessé j'l'étais, j't'ai remballé, tu m'as remplacé, tu m'as délaissé
Mais comme tout salaud, j't'ai téléphoné, j't'ai récupéré puis j't'ai fait pleurer parce que j'en ai rien à foutre
C'est ça la life (ouais), qu'est-c'qu'tu croyais ?
Tu baises avec moi, tu baises avec d'autres même si j'fais pareil, c'est pas la même chose
Ben oui et non, moi, j'ai b'soin de ma dose, ma libido et casse pas les yeuks, fais pas celle qui réplique
T'façon, j'veux plus trop qu'on s'explique
P't-être qu'avec lui le monde s'ra à vous et c'est p't-être mieux ainsi
Donc je me dis qu'si t'es avec lui, tu t'sentiras mieux mais si tu te sens mieux, tu te souviendras plus de moi
Oh la la (oui)

[Pont]
Mon cœur danse la macarena la la la la la la la la la la
Oh la la (oui, oui)
Mon cœur danse la macarena la la la la la la la la la la
[Outro]
Oui
Dems
Oui, oui, oui, oui30Embed"
Damso,3038927,169443,45855,Damso,https://images.genius.com/cc5b8b020c7d8a912a8a35b14b64de4d.300x300x1.jpg,Γ. Mosaïque solitaire,https://genius.com/Damso-mosaique-solitaire-lyrics,730002,"Γ. Mosaïque solitaire Lyrics[Paroles de ""Γ. Mosaïque solitaire""]

[Couplet 1]
M'd'mandez pas c'que j'fais dans la vie
C'est si noir, vous s'rez pris de panique
Quelque part, loin de toute compagnie
Batterie Faible m'a fait perdre beaucoup d'amis
Me serre pas la main, fais-moi un #Vie
J'attends la mort comme en Gethsémani
Baise-la c'est tout sinon elle f'ra des manies
Elle manquera d'respect à ta famille
Une seule erreur et t'as plus d'followers
Donc j'fais c'que j'aime non pas c'que l'on me dit
J'suis toujours debout, aux tombées des nuits
Vu du ciel, l'Enfer est comme le Paradis
""Crève dans ta merde, t'auras pas un radis"", c'est à peu près ce que le daron m'a dit
Heureusement gros culs ont su consoler
De leurs 'ttes-cha, j'me suis empoisonné
J'ai picolé, j'ai bu oui, j'ai bu oui
J'perds la raison à cause de mes torts, c'est ça qu'ça fait d'toujours bosser la nuit
J'fume de trop, j'fais plus de sport
""C'est pas très bon"", m'a dit coach Elie
Drogue dans la soute, à peine j'atterris
J'roule un doobie, oh oui

[Refrain]
Ils ne me veulent pas du bien, no
Ils ne me veulent pas du bien, no
Ils font bonhomme de neige, j'ai fait bonhomme de chemin
Ils ne me veulent pas du bien, no
Ils ne me veulent pas du bien, no
J'suis sorti de la dèch', vie en rose comme schneck de tchoin
Fiancé à la vulgarité, j'ai renoncé à la précarité
J'ai mis mes chances dans le barillet, j'ai tiré sans jamais m'arrêter
Rosemark s'tu veux qualité
Grosses liasses : la mentalité
Plus d'sable dans le sablier, plus d'place dans le paradise
Damsolitaire
[Changement d'instrumentale]

[Pont]
Dems, sale, sale, sale
That I used to say
Oh oui, oh oui, oh oui, oh oui, oh oui, oh oui
That I used to say

[Refrain]
Ils ne me veulent pas du bien, no
Ils ne me veulent pas du bien, no
Ils font bonhomme de neige, j'ai fait bonhomme de chemin
Ils ne me veulent pas du bien, no
Ils ne me veulent pas du bien, no
J'suis sorti de la dèch', vie en rose comme schneck de tchoin
Fiancé à la vulgarité, j'ai renoncé à la précarité
J'ai mis mes chances dans le barillet, j'ai tiré sans jamais m'arrêter
Rosemark s'tu veux qualité
Grosses liasses : la mentalité
Plus d'sable dans le sablier, plus d'place dans le paradise

[Couplet 2]
Des blème-pro, fils, y en aura toujours
La police piste nos phone-tel
Du mal à appréhender l'futur car dans ma vision j'suis immortel
Plus d'sept mille jours que j'suis né, dont au moins mille passés à fumer
Fumer tue, vivre aussi donc tant qu'à faire autant se ruiner (hey)
J'n'ai rien à perdre en soi vu qu'on n'emporte rien avec soi
Me dis pas ""j't'aime"" quand tu me vois, viens pas dans mon lit mais sous ma ble-ta
Pourquoi j'suis comme ça ? Me l'demandez pas, j'saurais pas trop quoi vous répondre
Faut pas vous méprendre, j'prends tous c'que je peux prendre
Comme ma terre, j'suis riche que sous les décombres
Je pleure que de l'intérieur pour que mes soucis se noient
Pourquoi leur demander l'heure ? J'sais bien qu'la mienne n'est pas encore là
Diplômé, riche et après ? J'regrette la cour de récré
Mais pas l'temps pour les regrets m'a dit mon cœur
Nostalgique car présent pas à la hauteur
Ma sueur vient que de l'effort, le stress me sert de décor
J'm'en bats tellement les ille-cou, désinvolture recouvre mes pores
Rêve mais ne dors pas, crève mais ne meurs pas
Moi j'aboie, je mords la java je sors, l'âme vêtue d'une burqa
[Changement d'instrumentale]

[Couplet 3]
Rapper, c'est c'que j'sais faire de mieux, casser la gueule des racistes aussi
Toujours un couteau dans l'sac pour mieux cadrer l'ennemi pour qu'il soit plus docile
""En chacun d'nous habite Dieu"", qu'il m'dit
""Sa maison s'trouve dans nos cœurs"", qu'il m'dit
Donc, ""excusez-moi Seigneur"" qu'j'lui dis si mes poumons sentent trop la beuh
J'passe mon temps à rêver d'prendre l'air, putain de merde
Larges baies vitrées, bureaux, phones, secrétaires
Équivaut réussite urbaine sur la Terre
J's'rai rappeur plus tard maman, faut pas t'en faire
J'gagnerai des grosses thunes en disques et concerts
J'crois qu'ça va t'plaire, j'f'rai l'tour de la Terre
J'écarterai barreaux d'la vie pour qu'on se libère
Là j'avance, j'pense accident cardio-vasculaire
Triste d'être célèbre mais sans père ni mère
Mes ennemis prennent cher, j'digère rien
Ma bile sort jamais d'sa vésicule biliaire
D'vant l’évangéliaire, je cite quelques prières
Peu précédé par folie meurtrière
M'sieur l'abbé, ma haine ne date pas d'hier
Je suis donc j'aurai, suite logique des auxiliaires
Damso

[Outro]
Damsolitaire
Dems
C'est bon ?31Embed"
Damso,3042955,4012897,45855,Damso,https://images.genius.com/1a572edbf6da198c99dacd7c19282804.300x300x1.jpg,N. J Respect R,https://genius.com/Damso-n-j-respect-r-lyrics,563361,"N. J Respect R Lyrics[Paroles de ""N. J Respect R""]

[Intro]
Ah ouais, Dems
J'm'en fous, j'm'en fous
J'respecte R

[Couplet 1]
J'm'en fous d'être ton boyfriend, c'est ton cul moi que je veux
Moi, qu'est-c'tu croyais, viens pas chialer
Personne ne m'aimera, non si ce n'est moi dans trafics pas très renoi
Tu ne trouveras pas mon ze-bla, y a qu'mon crew qui sait qui j'suis
Tends-moi la joue, faut bien qu'j'm'essuie
O.G. reconnait O.G, qu'il ait fait l'école ou la son-pri
J'aime toujours pas les condés car condés n'aiment pas c'qu'on est
J'viens à ton mariage en training pour bien t'manquer de respect
Car depuis qu'on se connaît, nan, jamais tu n'm'as phoné

[Refrain]
Bah ouais, à part hier quand j'ai cé-per
Donc t'étonnes pas qu'j'respecte R
Ben ouais, à part hier quand j'ai cé-per
Donc t'étonnes pas qu'j'respecte R
Enculé d'fils de putain, aucun soutien, je me souviens
Et toi là petite salope, tu m'parles de tes Louboutin
Ma grammaire te dit ""va t'faire""
Ça ne m'étonne pas car elle ne respecte R
[Couplet 2]
Des fils de putes, j'en vois tous les jours, plan dans son uc', elle a plus d'un tour
Du monde à dos, pour ce que j'ai fait, qu'ils aillent s'faire enculer de loin et de près
J'suis fort dans l'enculade de trous du cul et tralala, je n'comptais jamais changer
Après tout, ton point G, je n'sais pas trop où il en est, tu t'fais baiser par qui veut la mettre
J'fais dans la méditation pour oublier qu'ça n'a jamais rayonné
Stress et tribulations me rient au nez parce que j'fais de la monnaie
Parle pas trop de tes rêves, ces fils de lâches ne voudront pas que t'y arrives
Te noieront avant que t'atteignes la rive, n'aiment pas voir nègre au sommet
Damsette est Damsohizé (oh ouais), schneck en train d'agoniser (oh ouais)
Négro même carbonisé (oh ouais), j'pisserai toujours sur les Champs-Élysées
J'suis dans le mood de finir au Louvre parce que quand j'l'ouvre, j'peins avec les mots
J'sirote une douze, dans le Hainaut, j'écoute des prods, et j'écris des couplets
La vie, c'est simple, c'est beau la vie, dans les enceintes, règne ma zik'
Personne ne parle, mais tout le monde flippe, crachat buccal de fumée de shit
Plus dans le méli' qu'dans le mélo', sachant que Mélie, c'est l'nom de sa go'
Qu'elle l'a mise en bouche comme un marshmallow, fallait pas faire le chaud Grégorio, no

[Outro]
Souviens-toi qu'j'l'ai niquée donc t'étonne pas qu'j'respecte R
Donc t'étonne pas qu'j'respecte R
Nan, t'étonne pas qu'j'respecte R
Yo, la vie, woh
Dems27Embed"
Damso,3039687,3665808,45855,Damso,https://images.genius.com/1a572edbf6da198c99dacd7c19282804.300x300x1.jpg,Ε. Signaler,https://genius.com/Damso-signaler-lyrics,438515,"Ε. Signaler Lyrics[Paroles de ""Ε. Signaler""]

[Intro]
Yeah, j'l'ai signalé, ouais
J'l'ai signalé, eh

[Couplet 1]
J't'invite à tout refaire comme les fesses de Kylie Jenner
J'peux séparer la mer mais j'peux pas rassembler nos cœurs
Dangereux délinquant ambitieux, OG Larry Hoover
Bien sûr qu't'es sur la liste, pour toi il n'y a plus d'videur
J'fume jusqu'à plus d'gousse, eh
J'veux pas qu'on s'allonge, j'veux qu'on couche, eh
Pote-ca dans la chambre, dans la douche
Crie pas, j'suis sur écoute
Faut pas semer de doutes
Y'a pas qu'toi sur ma route
Non j'veux pas d'sentiment, pour moi c'est trop la loose
J'deviens incontinent quand tu parles d'amour
Tu viens d'mon continent, ouais si j'en crois ton boule
J'te ferai plus d'compliments, j'vois qu'tu casses déjà les couilles

[Pont]
J't'ai vue sur les réseaux
J't'ai signalée
J'ai vu ton boule sur les réseaux
J'l'ai signalé
[Refrain]
J't'emmènerai sur la Lune
Dès que j'termine de faire ma thune
Des maîtresses j'en ai pas qu'une
Donc attends qu'j'te fasse signe
Tout seul dans ma bulle
Solitaire, ma seule lacune
Rien ne sert d'avoir rancune
Donc attends qu'j'te fasse signe
Laisse-moi juste une dernière chance
J'te ferai tout oublier, diamants sur collier
Accorde-moi juste une dernière danse
Te voir te dandiner, remplir les pointillés
J't'emmènerai sur la Lune
Dès qu'j'termine de faire ma thune
Des maîtresses j'en ai pas qu'une
Donc attends qu'j'te fasse signe
Tout seul dans ma bulle
Solitaire, ma seule lacune
Rien ne sert d'avoir rancune
Donc attends qu'j'te fasse signe
J'l'ai signalé
J'l'ai signalé

[Couplet 2]
Cachotteries dans parking souterrain
J'm'en vais et je viens entre tes reins
Loin des menottes, genoux au sol
Les racistes de l'école
Balade en carriole sur fond de marivole
Du blanc cassé sur les pommettes
Elle s'essuie pour pas s'faire cramer par son mec, nan
Un coup d'un soir, j'lui ai dit honnêtement
J'te dirai pas ""Je t'aime"" pour que tu t'évanouisses
J'te prendrai à l'hôtel entre sacs et valises
J'veux de l'or sur ma montre, fuck le mécanisme
J'la vois nue première rencontre, j'me volatilise
Épuisé par son derrière, elle me brutalise
Me brutalise
[Pont]
J't'ai vue sur les réseaux
J't'ai signalée
J'ai vu ton boule sur les réseaux
J'l'ai signalé

[Refrain]
J't'emmènerai sur la Lune
Dès que j'termine de faire ma thune
Des maîtresses j'en ai pas qu'une
Donc attends qu'j'te fasse signe
Tout seul dans ma bulle
Solitaire, ma seule lacune
Rien ne sert d'avoir rancune
Donc attends qu'j'te fasse signe
Laisse-moi juste une dernière chance
J'te ferai tout oublier, diamants sur collier
Accorde-moi juste une dernière danse
Te voir te dandiner, remplir les pointillés
J't'emmènerai sur la Lune
Dès qu'j'termine de faire ma thune
Des maîtresses j'en ai pas qu'une
Donc attends qu'j'te fasse signe
Tout seul dans ma bulle
Solitaire, ma seule lacune
Rien ne sert d'avoir rancune
Donc attends qu'j'te fasse signe
[Pont]
J't'ai vue sur les réseaux
J't'ai signalée
J'ai vu ton boule sur les réseaux
J'l'ai signalé, eh10Embed"
Damso,2462870,261541,45855,Damso,https://images.genius.com/6b212c6f4e97b58bcad87afc198aba38.300x300x1.jpg,Autotune,https://genius.com/Damso-autotune-lyrics,412939,"Autotune Lyrics[Paroles de ""Autotune""]

[Couplet 1]
Verre de vodka dans la bouche
Reste de pote-ca dans la douche
J'suis incapable de nous voir ensemble
Mon cœur est myope de souche
Sur une aire d'autoroute, je bois
J'fume de l'herbe et je perds du poids
J'élève la voix que sur Pro Tools
Si tu m'saoules trop, on en restera là
T'es la deuxième que j'ken sur le même drap
J'écris sans thème car je ne t'aime pas
Après l'orgasme j'prends plus soin de toi
C'est qu'un au revoir mais j'veux pas qu'on s'revoie
Tu t'demandes ce qui n'va pas chez moi
Mais que lui ont-ils fait de si noir ?
Tes réponses se trouvent dans l'Beretta
Sais-tu seulement à quel point tu n'sais pas ?
Dangereux je suis, bandit du 92i
Bonne et bien lotie, parle d'amour et j'me r'tire
La vie c'est le patin, j'suis la patinoire
Je n'vise que les catins qui n'ont plus d'espoir
Aux talons, aux formes et aux strings léopard
Tout est noir comme Noémie Lenoir
Elle veut maison, enfants, mais j'suis là que pour faire du sale
Mais je n'ose pas lui dire, je n'veux pas faire de peine
Et si j'lui disais tout c'que je ressens sur l'instrumentale
Avec de l'autotune ça passera p't-être mieux
[Refrain]
Je n'veux plus de toi, je n'veux plus de toi
Je n'veux plus de toi, je n'veux plus de toi
Je n'veux plus de toi, je n'veux plus de toi
Je n'veux plus de toi, je n'veux plus de toi
Elle veut maison, enfants, mais j'suis là que pour faire du sale
Mais je n'ose pas lui dire, je n'veux pas faire de peine
Et si j'lui disais tout c'que je ressens sur l'instrumentale
Avec de l'autotune ça passera p't-être mieux

[Couplet 2]
Y-yeah-y
Quelques râteaux plus tard j'décide de partir en friendzone
Plus tranquille, plus sensible, j'la joue fine et j'l'attaque sur d'la dancehall
J'suis sur la piste, j'fais semblant d'être dans l'mouv
Si elle savait c'que j'f'rai pour per-cho son boule
J'crois qu'j'pourrais même arrêter l'bédo si j'vois qu'ça gêne trop
Elle veut qu'on danse, mais c'est pas sûr qu'j'assure
J'dois prendre son phone, j'me dis : ""Tant pis, j'assume""
Obligé de m'la faire quitte à perdre ma tune dans l'hôtel et la Benzo
""Après toi c'est clair que j'en baiserai aucune""
Ouais ouais j'ai menti, j'lui ai promis la lune
Juste pour la ken comme celle du premier couplet, dans le dos, comme il faut
Sa puterie me parait si tendre
Surpris, j'sais pas comment m'y prendre
Blonde platine, elle fait sa Khaleesi
Dragon dans la queue je l'encendre
Avocate du diable, elle me donne le barreau
Fait dans l'glougloutage de poireau
La bitch fait sa Françoise Hollande
Je lui dis de partir, mais elle en redemande
Gangster moderne elle me qualifiait
Quand il s'agit de sa teuch, j'suis plus habile que Diabaté Sidiki (hey)
Dons de me-sper, j'fais dans l'humanitaire
Je me tape donzelles de l'humanité
J'aimerais tant lui dire que j'la veux pas dans ma vie, mais uniquement dans mon pieu
Avec de l'autotune ça passera p't-être mieux
[Refrain]
Je n'veux plus de toi, je n'veux plus de toi
Je n'veux plus de toi, je n'veux plus de toi
Je n'veux plus de toi, je n'veux plus de toi
Je n'veux plus de toi, je n'veux plus de toi
Elle veut maison, enfants, mais j'suis là que pour faire du sale
Mais je n'ose pas lui dire, je n'veux pas faire de peine
Et si j'lui disais tout c'que je ressens sur l'instrumentale
Avec de l'autotune ça passera p't-être mieux

[Outro]
Avec de l'autotune ça passera p't-être mieux
(Avec de l'autotune ça passera p't-être mieux)30Embed"
