artist,id,lyrics_owner_id,primary_artist_id,primary_artist_name,song_art_image_thumbnail_url,title,url,pageviews,lyrics
Damso,6753197,7251558,45855,Damso,https://images.genius.com/dedd2737025606423d012b43b3a3b9a0.300x300x1.jpg,Υ. 2 DIAMANTS,https://genius.com/Damso-2-diamants-lyrics,116640,"Υ. 2 DIAMANTS Lyrics[Paroles de ""Υ. 2 DIAMANTS""]

[Couplet 1]
J'viens pas des quartiers, drogue dans les sachets
J'en ai vendus, j'en ai achetés et braqués
J'connais la rre-gue, cervelle atrophiée
Millions de cadavres en pièces détachées
Broutis dans l'passé, bracelet, quelques biftons mal entassés, plaqués
Diamants, roro, ah bah ouais, sisi, c'est ça, la vie qu'on a choisie
Un million, deux millions, daronne est ravie
Montagne est gravie, schnek est dégarnie
J'crache et tu t'r'habilles
Raciste, comme Nagui j'changerai pas d'avis
Hoover Larry
OG tu connais, toujours à zoner, toujours à fumer
You-voi sur le toit, débrouillard à jamais
Bédo j'ai canné, négro m'a cramé
Sait que QALF va pas sortir cette année

[Refrain]
J'suis toujours sur le cou, comme chaîne en or
J'me lave avec, je dors avec, négro ça brille encore
Et puis j'rajoute un diamant, deux diamants, dix diamants, cent diamants
Ice, ice, j'crois qu'ça brille encore
Oh Hallelujah
Merci pour la moula
Et puis j'rajoute un diamant, deux diamants, dix diamants, cent diamants
Ice, ice, j'crois qu'ça brille encore
Oh Hallelujah (Hey)
Merci pour la moula
Eh, eh, eh, ouais, merci pour la moula, eh (Sale)
[Couplet 2]
J'bouge avant qu'l'huissier arrive, j'roule d'vant policier aride
Pas dans l'comico, pas dans l'comico, attends qu'l'avocat s'aligne
De la ganja, de la lean, pute est dans cocaïne, amphétamine
J'suis dans la gue-dro, j'suis dans la gue-dro
Y a que du sale quand médecin m'examine
Ramène les teu-ch', ramène la kush
T'es dans la tess, j'suis dans le tieks
J'suis dans le beaucoup, beaucoup trop d'euros
J'suis sur les gros coups, beaucoup de roro
J'suis dans le binks, j'suis dans le binks
T'es dans le block, t'es dans le block
J'suis dans les gros coups, beaucoup de moula
J'suis sur les gros coups, beaucoup de dollars
Beaucoup de billets violets, salaire, gros sous
Plus dans la galère et crédit d'conso
J'suis dans ta mère et je crédite mon son
J'prends l'game en otage, j'en demande rançon
J'prends l'game en otage, j'en demande rançon
J'garde mes éditions, j'prends tout sur mes chansons
Gonfler ses nibards pour plus d'attention
J'rajoute festival pour payer la pension (Dems)

[Refrain]
J'suis toujours sur le cou, comme chaîne en or
J'me lave avec, je dors avec, négro ça brille encore
Et puis j'rajoute un diamant, deux diamants, dix diamants, cent diamants
Ice, ice, j'crois qu'ça brille encore
Oh Hallelujah (Eh)
Merci pour la moula
Et puis j'rajoute un diamant, deux diamants, dix diamants, cent diamants
Ice, ice, j'crois qu'ça brille encore
Oh Hallelujah (Hey)
Merci pour la moula
Eh, eh, eh, merci pour la moula (Sale), eh9Embed"
Damso,3042001,2985913,45855,Damso,https://images.genius.com/1a572edbf6da198c99dacd7c19282804.300x300x1.jpg,Ι. Peur d’être père,https://genius.com/Damso-peur-detre-pere-lyrics,116527,"Ι. Peur d’être père Lyrics[Paroles de ""Ι. Peur d’être père"" ft. Youri]

[Couplet 1 : Damso]
Elle porte notre avenir dans son ventre
Première fois que je parlerai d'amour
En chanson pour faire court
Oui, j'ai p't'être peur de  ne pas être le père que j'veux être
J'tremble à chaque fois que j'vois grand boule
Bonne paire de kilojoules
Comment donner l'exemple de ce que je serai jamais, hey
Cursus scolaire très inquiétant
Vente d'haschich et stupéfiant
Et puis merde t'façon chacun sa destinée, hey
Policier, peut-être tu seras
Que pourrais-je faire contre ça ?

[Refrain : Damso]
J'ai si peur d'être pè-è-ère
De voir l'enfer vu du cie-e-el
De mes défauts qu'elle s'imprè-è-ègne
Qu'elle n'atteigne jamais la 'tai-ai-aine
Qu'elle m'aime et me follo-o-ow
En dehors de la scè-è-ène
Qu'elle m'aime pour ce que je suis-is-is
En dehors de la scè-è-ène
[Couplet 2 : Damso]
Je réserve une balle pour celui
Qui en aide jamais ne te viendra
J'ferai le ménage, j'vais nettoyer celui
Qui entre nous se tiendra
Avant j'étais juste pété, aujourd'hui, j'suis pété de thune
J'ai vu moins souvent l'daron
Qu'un croisement Soleil, Terre et Lune
Tout est noir comme désespoir
De savoir que mort de mère est proche
J'sais pas c'que j'ferai si elle part
Avant de voir mon premier gosse
Trafiquant de mots, ça a prit tant de mois
Pour être c'que je suis et faire ce que tu seras dans six mois

[Refrain : Damso]
J'ai si peur d'être pè-è-ère
De voir l'enfer vu du cie-e-el
De mes défauts qu'elle s'imprè-è-ègne
Qu'elle n'atteigne jamais la 'tai-ai-aine
Qu'elle m'aime et me follo-o-ow
En dehors de la scè-è-ène
Qu'elle m'aime pour ce que je suis-is-is
En dehors de la scè-è-ène

[Pont : Choeurs féminins]
Why, why, why
Why, why, why
Why, why, why
Why, why, why
Hmm, hmm...
[Outro : Coredana Guerriero]
Baba, baba a leo mutoto yangu kesho
Baba, baba a leo mutoto yangu kesho
Baba, baba a leo mutoto yangu kesho
Baba, baba a leo mutoto yangu kesho6Embed"
Damso,6753236,12389325,45855,Damso,https://images.genius.com/dedd2737025606423d012b43b3a3b9a0.300x300x1.jpg,Ψ. PASSION,https://genius.com/Damso-passion-lyrics,113745,"Ψ. PASSION Lyrics[Paroles de ""Ψ. PASSION""]

[Sample]
I must be stronger, I must be stronger for you
I must be stronger, I must be stronger, I must be stronger for you
I must be stronger, I must be stronger for you
[Intro]
L'artiste dont nous allons vous parler maintenant est considéré comme l'un des meilleurs rappeurs de sa génération et il est belge. À seulement vingt-cinq ans, Damso a déjà vendu plus de deux cent mille albums en France, où il est désormais double...

[Couplet 1]
2015, Nero Nemеsis, j'rentre dans l'game еn un seul couplet
Le 5, Bercy de Kopp, à cette époque on s'entend bien, y a pas d'clashs ni de diss
2016, j'ai la pression, mon ex attend famille, faut qu'j'fasse du cash à vie
L'album n'est pas sorti qu'je stresse, si j'foire c'est la défaite
Pas d'moula pour mon gosse, pas d'moula pour le reste
La première semaine craint, mais bon pour un début c'est bien
Premier showcase plein, premiers rageux s'plaignent, premières tass' viennent taper du vice
Les ""Bien ou quoi ?"", ""Ça fait longtemps !"" fusent, mais j'suis pas dupe
Quand j'étais à la rue, y avait sonne-per à part mon sin-cou
J'me renferme sur moi-même, chaque jour une heure quarante-cinq de marche pour aller au Forem
Pas d'cash pour les transports en commun, même deux euros c'est trop
Trente-quatre-centimes sur le compte Fortis, pas d'quoi faire des éco'
Réflexion d'la vie sur tout ce que j'vais faire si j'perce pas
Les études c'pas pour moi, j'ai raté tellement d'fois
Dans l'illégal, j'ai deux trois pistons
Premier braquo mais j'regrette, j'vole aux honnêtes gens
Première avance j'rembourse mes dettes, j'invite deux trois plans
Putain d'merde pourquoi j'raconte ma vie ? Parce qu'en vrai t'as la tienne
T'as tes problèmes aussi, mais nique sa mère faut bien qu'j'crache ma haine donc
Je continue, Ipséité sort et j'deviens trop connu
Selfies dans la rue, selfies d'fans, de fils de pute qui n'y croyaient plus
J'vois qu'ça parle en bien mais c'est l'début
Lithopédion sort, mon ex mentor me clashe
De l'encre a coulé
[Interlude]
Le Conseil des Femmes Francophones regrette la désignation du rappeur Damso pour composer la chanson des Diables Rouges pour le Mondial en 2018. Les textes du chanteur sont ""violents et sexistes, un mauvais signal pour la jeunesse"". Faut lire ces textes, moi je, je n'ose même pas les citer, je, je veux dire, je vais dire simplement quelque chose qui...
Est-ce que les gens qui vont écouter Damso l'écoutent au second degré ? Eh bien la réponse...

[Couplet 2]
En fait, ce texte va être compliqué (Ce texte va être compliqué, ce texte va être compliqué)
Parce que je vis des trucs vraiment compliqués (Des trucs vraiment compliqués, des trucs vraiment compliqués)
Donc j'vais rapper lentement juste pour bien te l'expliquer (Juste pour bien te l'expliquer, juste pour bien te l'expliquer)
La vie de star est un milieu carcéral de luxe
Beaucoup de putes, de gens qui scrutent
Tes moindres gestes pour les répéter, te filment pour se la péter
Pour dire à tous leurs potes qu'ils étaient là quand t'y étais
C'est ça la célébrité (C'est ça la célébrité, c'est ça la célébrité)
Et plus j'avance dans mon rang social (Social)
Et plus je recule dans ma vie sociale (Sociale)
Ma liberté est dans ma tête et mon portefeuille, je n'sors plus jamais tout seul
J'ai l'malheur de constater que j'me suis fait menotter
Mon être est une société (Mon être est une société, mon être est une société)
Putain c'est tout c'que je détestais, et quand t'arrives au sommet (Ah ouais)
Tu t'aperçois qu'en bas, c'est juste un trou noir mais coloré (Un trou noir mais coloré, un trou noir mais coloré)
Turpitude morale honteuse de moi, j'suis pas si fier
S'faire aimer quand on s'déteste, c'est ça dev'nir c'qu'on veut être
Bien installé sans être bourgeois
J'vais louer ma vie sur Terre pour racheter celle d'l'au-delà (L'au-delà, l'au-delà)
Comme chenille qui rêve de battre des ailes sans dev'nir papillon
Je dessine ma vie en rose, raciste l'a mise noire et blanche
Donc poule aux œufs d'or s'est envolée (Envolée)
Loin quelque part dans la folie (La folie)
Et si un jour tu d'viens fier de la hess, fier de vieillir au tieks, dis-toi qu'banlieue veut dire ""lieu banni""
[Outro]
Celui qui va devoir écrire une nouvelle ligne sur son Wikipédia est...
*bruits d'erreur informatique*8Embed"
Damso,5973240,5428057,45855,Damso,https://images.genius.com/7cef2f5ce8613018942710c25cada629.300x300x1.jpg,BPM,https://genius.com/Damso-bpm-lyrics,113138,"BPM Lyrics[Paroles de ""BPM""]

[Intro]
Vergogne, Sorbonne (eh)
Ouais (mmh), eh (mmh)

[Couplet 1]
Voyou malandrin sans trop de vergogne
C'est dans ta maman que je performe
J'm'en bats les couilles qu't'aies fait la Sorbonne
Moi, j'ai rien fait et j'ai l'salaire d'tout le personnel réuni
J'aime comment tu bounces (tu danses)
Quand ton booty fait ""rum pum pum pum"" sur moi
J'aime vraiment comment tu bounces (tu danses)
J'mets YG, Frenetik, volume dans la ture-voi
Dangereux je suis, enfin, j'crois (j'croyais)
C'est c'que négro m'a dit quand on a croisé le fer
J'ai cru en l'amour en cinq mois (bah ouais)
Puis, c'est parti en vrille, ma bite n'a pas su se taire
J'me fais sucer par une tasse-pé d'télé-réalité
La vie qu'tu veux, c'est la vie qu'j'ai
Retour au quartier, malfrats, bicraveurs affûtés
La weed que j'ai, c'est l'AMG

[Refrain]
J'aime comment tu (attends) bounces
J'aime comment tu (attends), quand ton booty fait ""rum pum pum pum"" sur moi
J'aime vraiment comment tu, eh, bounces pour moi
Dès que j'sors la moula, j'vois qu'elle bounce pour moi (oh, oui)
Bounce pour moi
Dès que j'sors la moula, j'vois qu'elle bounce pour moi, nan, nan, nan, nan, nan, nan (attends)
Billets violets, jaunes, verts, gros sous, everyday, everyday (ouh)
Billets violets, jaunes, verts, gros sous, everyday, everyday
[Couplet 2]
J'sais pas pourquoi c'est un tue-l'amour (j'sais pas pourquoi, j'sais pas pourquoi)
De dire ""je t'aime"" le premier jour (premier jour, premier jour)
J'commence la nuit, j'finis le jour
J'suis près de toi avec tous ceux qui tournent autour (hey)

[Pont]
Donne-moi une raison (ouais) de pas finir chez toi, dans ta house (house)
Tu fais monter la pression (ola)

[Refrain]
J'aime comment tu (attends) bounces
J'aime comment tu (attends), quand ton booty fait ""rum pum pum pum"" sur moi
J'aime vraiment comment tu, eh, bounces pour moi
Dès que j'sors la moula, j'vois qu'elle bounce pour moi (oh, oui)
Bounce pour moi
Dès que j'sors la moula, j'vois qu'elle bounce pour moi, nan, nan, nan, nan, nan, nan (attends)
Billets violets, jaunes, verts, gros sous, everyday, everyday (ouh)
Billets violets, jaunes, verts, gros sous, everyday, everyday8Embed"
Damso,3738887,1235485,45855,Damso,https://images.genius.com/88359e6c58b6ffd04a45dc42874c12e2.300x300x1.jpg,Perplexe,https://genius.com/Damso-perplexe-lyrics,109938,"Perplexe Lyrics[Paroles de ""Perplexe""]

[Intro]
Oh, oh, oh, yeah

[Refrain]
Oh baby, dis-moi c'que je fais (Yeah)
Un jour, tu m'aimes, un jour, tu n'm'aimes pas (Non)
Oh baby, dis-moi c'que j'ai fait (Yeah)
Un jour, tu m'aimes, un jour tu n'm'aimes pas (Non)
Toujours à dire qu'j'suis un salaud (Ouais)
J'vais voir ailleurs pour voir si t'es là
Toujours à dire qu'j'suis un salaud (Ouais)
J'te jure, j'l'ai baisée seulement qu'une fois, oh

[Couplet 1]
C'est vrai, j'te trompe avec la bite (ouais)
Mon cœur, lui, n'a d'yeux que pour toi (bah ouais)
J'te d'mande ta main pour que je gicle (ouais)
Mais bientôt, c'se'ra pour bague au doigt (bah ouais)
Laisse-moi le temps d'être ce que je n'suis pas (ouais)
Pour devenir c'lui qu'tu veux qu'je sois (bah ouais)
Ma tête tourne comme des locks quand je vois ton boule
J'te laisse même fumer sur ma clope, j'crois qu'c'est ça l'amour

[Pré-refrain]
Et toi, t'oses dire qu'j'suis un salaud
J'vais voir ailleurs pour voir si t'es là
Toujours à dire qu'j'suis un salaud
J'te jure, j'l'ai baisée seulement qu'une fois
[Refrain]
Oh baby, dis-moi c'que je fais (Yeah)
Un jour, tu m'aimes, un jour, tu n'm'aimes pas (Non)
Oh baby, dis-moi c'que j'ai fait (Yeah)
Un jour, tu m'aimes, un jour tu n'm'aimes pas (Non)
Toujours à dire qu'j'suis un salaud (Ouais)
J'vais voir ailleurs pour voir si t'es là
Toujours à dire qu'j'suis un salaud (Ouais)
J'te jure, j'l'ai baisée seulement qu'une fois, oh

[Couplet 2]
Sur le front de la sueur, #Vie sur le cœur (Ouais)
Violente est ma douceur, n'aies pas si peur (Connais)
Par quatre chemins je n'irai pas, j'te dis : ""je t'aime"" (Ouais)
Par quatre lèvres, bouche et teu-chas, j'viens pour te ken
J'suis dans une suite au Marriott, t'explorant les trompes de Fallope, ouais
Laisse tomber tes allocs, viens m'rejoindre dans plage et paillote, eh
Femmes nues dans mon bigo, c'est pas glamour (Non)
J'te laisserai même venir au studio, c'est ça l'amour (Ouais)

[Pré-refrain]
Et toi, t'es là à dire qu'j'suis un salaud
J'vais voir ailleurs pour voir si t'es là
Toujours à dire qu'j'suis un salaud
J'te jure, j'l'ai baisée seulement qu'une fois, oh
[Refrain]
Oh baby, dis-moi c'que je fais (Yeah)
Un jour, tu m'aimes, un jour, tu n'm'aimes pas (Non)
Oh baby, dis-moi c'que j'ai fait (Yeah)
Un jour, tu m'aimes, un jour tu n'm'aimes pas (Non)
Toujours à dire qu'j'suis un salaud (Ouais)
J'vais voir ailleurs pour voir si t'es là
Toujours à dire qu'j'suis un salaud (Ouais)
J'te jure, j'l'ai baisée seulement qu'une fois, oh

[Outro]
Toujours à dire qu'j'suis un salaud
J'vais voir ailleurs pour voir si t'es là
Toujours à dire qu'j'suis un salaud
J'te jure, j'l'ai baisée seulement qu'une fois7Embed"
Damso,3042953,3087762,45855,Damso,https://images.genius.com/1a572edbf6da198c99dacd7c19282804.300x300x1.jpg,Μ. Noob Saibot,https://genius.com/Damso-noob-saibot-lyrics,107913,"Μ. Noob Saibot Lyrics[Paroles de ""Μ. Noob Saibot""]

[Intro]
Sale, sale, sale
Dems
Oh oui, oh oui
Oh oui, oh oui
Hey

[Pré-Refrain]
J'suis dans le bendo (ouais)
Ça tire, ça tire, drive-by en Range Ro' (dingue)
Au comico je no comprendo (no)
Ça nique des mères, y'a qu'ça à faire, gros
Ouais, ouais, ouais, ouais (sale)

[Refrain]
Calibré, j'suis dans le club
Calibré, j'suis dans le club
Broliqué, j'suis dans le club
Broliqué, j'suis dans le club
Kalashé, j'suis dans le club
Kalashé, j'suis dans le club
Broliqué, j'suis dans le club
Bang, bang
[Couplet 1]
Les mecs veulent de la pe-fra, j'mets d'la coca' dans mon shit
J'veux très très grosse bitch, juste un gros cul sur ma trique
Pas d'liquide séminal, j'nique leur mère avec du Vicks
T'es dernier comme les Sixers, t'as plus d'buzz même quand ça leak
On fait d'la sique-mu, pas de la 'sique molle
C'est pas du zouk mec, ça parle de rue
Gun, drogue et alcool, ça parle de bres-ténè
D'vécu et fiction, rage et colère dans ma diction
Le rap coûte cher sans vues donc t'as pas assez d'flow pour l'addition
Dans l'ombre j'leur mets des doigts, j'ai l'majeur à Noob Saibot
Échec scolaire, j'étais d'ceux-là : aujourd’hui j'règle la note
J'te marie si tu m'dis oui, d'toute façon l'pussy j'l'ai déjà fuck
T'as la queue d'Iglesias Enrique dans sa te-cha, j'vois qu'tu flottes
Damso ouais

[Pré-Refrain]
J'suis dans le bendo (ouais)
Ça tire, ça tire, drive-by en Range Ro' (dingue)
Au comico je no comprendo (no)
Ça nique des mères, y a qu'ça à faire, gros
Ouais, ouais, ouais, ouais (sal)

[Refrain]
Calibré, j'suis dans le club
Calibré, j'suis dans le club
Broliqué, j'suis dans le club
Broliqué, j'suis dans le club
Kalashé, j'suis dans le club
Kalashé, j'suis dans le club
Broliqué, j'suis dans le club
Bang, bang
[Couplet 2]
OG, négros fragiles : on n'en veut pas (no)
Trust me, on assassine dans la ve-ca
Toujours à faire du le-sa, pilon roulé dans le ce-sa
Oh renoi, on est où là ?
Ferme ta gueule ou tu n'seras plus là
J'te l'dis mon négro, très énervé : je le suis
J'n'ai plus cœur comme Thierry Gilardi
Autant de kush que d'OG
Autant de 9 que 2i
J'ai le bras long mais pas pour selfie
Piraterie, Mugiwara Luffy
J'la baise, elle crie fort comme Pavarotti
C'est noir, ça brille comme dans Get Lucky
J'me barre d'ici, ça sent le flic
Tu sais qu'ça sera noir vu le titre
Jaloux véner' se lance dans des disses
J'les accueille bras ouvert comme Jésus Christ
Elle est bonne, a du cash, elle est hipster
M'en bats les yeuc' d'être sur ta liste
J'suis en showcase donc c'est moi le VIP
Plus j'fais du sale, plus j'fais du chiffre

[Pré-Refrain]
J'suis dans le bendo (ouais)
Ça tire, ça tire, drive-by en Range Ro' (dingue)
Au comico je no comprendo (no)
Ça nique des mères, y a qu'ça à faire, gros
Ouais, ouais, ouais, ouais (sale)
[Refrain]
Calibré, j'suis dans le club
Calibré, j'suis dans le club
Broliqué, j'suis dans le club
Broliqué, j'suis dans le club
Kalashé, j'suis dans le club
Kalashé, j'suis dans le club
Broliqué, j'suis dans le club
Bang, bang3Embed"
Damso,3312010,4295977,45855,Damso,https://images.genius.com/a2d45297697ae3dda63c52e056cbfc9f.300x162x1.jpg,Je nous mens (Carte Blanche France Inter),https://genius.com/Damso-je-nous-mens-carte-blanche-france-inter-lyrics,105301,"Je nous mens (Carte Blanche France Inter) Lyrics[Paroles de ""Je nous mens (Carte Blanche France Inter)""]

[Couplet unique]
Y a 24 heures dans un jour
Yeah, y a 24 heures dans un jour et le jour se lève avant 6 heures du matin
Se couche après 6 heures du soir
Quand j'me lève pour bosser jusqu'au p'tit matin
J'dors plus, j'ai plus b'soin de rêve
J'dors plus, j'ai plus b'soin de rêve
L'oreiller me voit autant de fois qu'les yeux de mon gosse
C'est-à-dire peu souvent, car, trop souvent, j'suis absent de moi-même
Nurofen dans les veines, sur la scène j't'ai vue tapie dans robe rouge
On a ken, on s'est déshabillé pour les mêmes raisons
Quelques frissons à répétition jusqu'à scission du réel
Ma chair dans la sienne faisant les mêmes mouvements que l'on doit faire pour faire des enfants
C'que j'essaye de dire c'est que j'sais pas quoi dire d'autre à part c'qu'on doit dire quand on s'connait pas vraiment :
""Salut ça va ? Moi, c'est Damso, j'me présente car jusqu'à présent j'connais pas ton prénom""
La vie c'est simple et compliqué car c'est c'que j'pense que t'es qui sera ton identité pour moi
Pareil pour toi vis-à-vis d'moi
Quand on y pense, j'pense qu'on se connaitra jamais vraiment
Quand tu dis qu'tu couches pas l'premier soir sache que l'centième soir j'serai pas si différent
Forcé par le forcément qui s'installe à chaque début d'discussion
Tout ça parce qu'on l'a fait
On s'éloigne parce qu'on s'dit je t'aime
On s'éloigne parce qu'on s'dit je t'aime sans vraiment savoir c'que c'est
L'autre pense qu'elle le pense mais son ex est dans sa tête
Malgré qu'j'ai ma bite dans sa schnek
Et c'est dans sa schnek que j'ai compris qu'ma bite et mon être
Sont qu'une location pour elle
Au prix de quelques mots doux, ""love you"" tout ça
J'ai cru voir dans ses draps c'que je voulais voir dans ses bras : l'amour
Intensément je me goure, sans sentiment j'fais la cour
Jamais le jour, que la nuit
Parole de sourds cherchant l'ouïe
Chez l'autre pour un oui et un non
Forcément je me mens, je lui mens
Conclusion : je nous mens en même temps
Donc finalement c'est mort12Embed"
Damso,2685513,2259626,45855,Damso,https://images.genius.com/56cd9f811130dc2e52fbe869c755fe1c.300x300x1.jpg,Beautiful,https://genius.com/Damso-beautiful-lyrics,101547,"Beautiful Lyrics[Paroles de ""Beautiful""]

[Couplet 1]
Le daron voulait que je taff
23 ans diplôme premier boulot
Cravate, col boutonné
Jambes croisées derrière mon bureau
Mais l’alcool, le cash, la weed
Les bitchs comme attrape-nigaud
Ont fait de moi ce que je suis devenu
Un saugrenu putain d'négro
Et puis fuck comme tout écolier
Désemparé d'aucun secret
Je traîne avec mes semblables
Que le monde remballe pour les même secrets
Comment puis-je prouver ce que je vaux
Si leurs valeurs ne me correspondent pas ?
Plus d'pression, cherche plus à perdre
Puis la déception des rents-pas

[Pré-refrain]
Trop d’échecs scolaires, colère, oh merde
Bandit j'le suis, j'serai, je l’étais, j'fous la de-mer
Sa mère fuck
Cherche moyen rapide d'me tirer
Comme les munitions d’un Glock
[Refrain]
À croire que j'suis baisé
Plus d’avenir ouais, j'les vois venir
Mais je n’ai pas de regret (toujours pas de regret)
Je sais ce que j'veux devenir donc venez pas me dire
Qu'en couilles se barre ma life
Je profite de ma beautiful day, beautiful day
Beautiful day, beautiful day
Qu'en couilles se barre ma life
Je profite de ma beautiful day
Beautiful day, beautiful day

[Couplet 2]
Beautiful Day
Quand l'enveloppe est pleine le jour de paye
Je compte l’oseille fait péter les teilles
M'approche de l'enfer en tutoyant le ciel nigga
Ils parlent de dem's nigga, Ils disent que sur dem's nigga
J'ai déjà trop de blêmes nigga
Putain de merde nigga, damn nigga
Blanc métal policier l'homicide est imminent
Ma vie tient un fil de nylon, ils dansent le mia
Pendant que je taff pour le Milli-ions, oui money il y a
Assez pour beautiful day
Profiter jusqu’à mon beautiful deuil
Pour l'instant je n'ai qu'une beautiful 'teille
Je profite autant de ma beauty full déf
Avant chaque sortie on m'savonne Damso
J'ai la vie d'une soirée mousse Damso
Une grosse bitch anglo-saxonne Damso
Je lui fourre mon bacon dans sa bouche Damso
Un jour tu pleures, un jour tu ris
Un homme qui meurt, un autre vit
Un gros flingue t'urge a mon avis Raaa
Bang bang OPG
Déso pour ce que je fais au sexe féminin sans le vouloir
J'ai tendance à confondre
Toutes les femmes à celles du trottoir
Pourtant j'fais des efforts j'suis passé du snack au restaurant
Mais trop vu la mort de près
Elles se plaignent que je tire une tête d'enterrement
[Pré-refrain]
Trop de proches que je perds, colère, oh merde
Bandit j'le suis, j'serai, je l’étais, j'fous la de-mer
Sa mère , fuck
Cherche moyen rapide de me tirer comme les munitions d’un glock

[Refrain]
A croire que j'suis baisé
Plus d’avenir ouais, j'les vois venir
Mais je n’ai pas de regret
Je sais ce que j'veux devenir donc venez pas me dire
Qu'en couilles se barre ma life
Je profite de ma beautiful day
Beautiful day
Beautiful day
Beautiful Day
Qu'en couilles se barre ma life
Je profite de ma beautiful day
Beautiful Day
Beautiful Day5Embed"
