artist,id,lyrics_owner_id,primary_artist_id,primary_artist_name,song_art_image_thumbnail_url,title,url,pageviews,lyrics
Damso,6753191,4838104,45855,Damso,https://images.genius.com/dedd2737025606423d012b43b3a3b9a0.300x300x1.jpg,Τ. CHIALER,https://genius.com/Damso-chialer-lyrics,80870,"Τ. CHIALER Lyrics[Paroles de T. CHIALER ft. YG Pablo]

[Pré-refrain : Damso]
L'alcool brun ne m'fait plus rien, la be-her ne fait plus effet
Son vagin ne m'fait plus rien, son derrière ne fait plus effet
Oh, j'suis si triste
J'ressens plus grand chose quand tu m'suces la bite
Oh, j'suis si triste
J'ressens plus grand chose même quand je gicle

[Refrain : Damso]
J'vais t'faire chialer
Toutes les larmes de ton corps m'appartiennent désormais
J'vais t'faire chialer
Toutes les larmes de ton corps m'appartiennent désormais

[Couplet 1 : YG Pablo]
L'avenir appartient à Dieu, celui qui se lève tôt, c'est son problème
Cœur embouteillé j'ai œdème, j'ai plus trop le temps pour les ""je t'aime""
Mon cœur est hermétique, pas de filtre, j'récupère tout c'que j'mérite
J'lâche un rictus pendant le feat, l'objectif c'est la SACEM des Beatles
J'laisse des ""vu"" à des go plus fraîches que celles qui m'en mettaient à l'époque
À vrai dire, j'ai plus du double dans les poches
Putain quelle époque, j'sais qu'y'a quelques faux négros sur quelques tofs
T'as le prix de tout, la valeur de rien
Elle sait c'quelle fait mais la putain fait sa conne
Moi j'allais en cours, j'm'en battais les reins
J'veux faire du rap, qu'est-ce que j'vais foutre à l'école ?
J'vais te faire chialer, j'espère que tu n'm'en voudras pas
Je n'm'en voudrai pas pour ma part, avec ton corps j'fais bande à part
Avoue-moi, avoue-moi bébé, la vie un trou noir bébé
Y a des gars sournois sûrement sur moi, j'y vais
Ma vie ainsi no, ma vie au ciné
[Refrain : Damso]
J'vais t'faire chialer
Toutes les larmes de ton corps m'appartiennent désormais
J'vais t'faire chialer (oh)
Toutes les larmes de ton corps m'appartiennent désormais

[Couplet 2 : Damso]
Et si on s'bourre juste un peu la gueule ?
Qu'on oublie juste pour une fois
Les ""je t'aime"", les ""on est en couple ?"" et les problèmes
Faut pas toujours vouloir être la seule
Faut qu'tu comprennes qu'on s'comprend pas
Les prises de tête à cause de schnecks
L'Enfer, c'est la vérité perçue trop tard
J'te fais du tort sans le vouloir, j'ai la tromperie au bout des doigts
Que mon sexe qui touchera l'fond si j'tombe amoureux d'toi
Malheureusement, quel enfoiré, j'm'arrête jamais

[Pré-refrain : Damso]
L'alcool brun ne m'fait plus rien, la be-her ne fait plus effet
Son vagin ne m'fait plus rien, son derrière ne fait plus effet

[Refrain : Damso]
J'vais t'faire chialer
Toutes les larmes de ton corps m'appartiennent désormais
J'vais t'faire chialer
Toutes les larmes de ton corps m'appartiennent désormais
J'vais t'faire chialer
Toutes les larmes de ton corps m'appartiennent désormais
J'vais t'faire chialer
Toutes les larmes de ton corps m'appartiennent désormais8Embed"
Damso,5973249,5428057,45855,Damso,https://images.genius.com/7cef2f5ce8613018942710c25cada629.300x300x1.jpg,ROSE MARTHE’S LOVE,https://genius.com/Damso-rose-marthes-love-lyrics,80305,"ROSE MARTHE’S LOVE Lyrics[Paroles de ""ROSE MARTHE’S LOVE""]

[Intro]
Maman, I love you, love

[Couplet 1]
Tellement de blessures de guerre, tellement de blessures de père en fils
J'en connaîtrai que le tiers, douleurs sous la lavallière te crispent
De ta chair, t'as fait ma chair ; de ma chair, j'ai fait ta chair, mon fiston
J'ai peur de foutre la merde, de plus contrôler mes nerfs, je risque
God Bless, Hamdoullah, merci, au nom du Père, du Fils
Le négro est riche et populaire, en plus, il a pris rendez-vous au fisc
Non, jamais je pleure, je cache mes peines, au fond, j'suis triste
Dure est la vie dans le game, maman, je fume et je cède aux vices
J'suis plus entièrement le même, je crache ma haine tout l'temps
Négro fushia la ramène en mauvaise haleine, doucement
Grand-mère est partie, non, sans que je l'ai vue, je suis chagriné
Je me rends compte que ma présence valait bien plus que mes billets (ouais)
Médecin dit : ""C'est la fin"", j'le traite de fils de putain, je m'affole
Pété, j'sais plus trop quoi faire, j't'imagine six pieds sous terre, je frissonne
Papa dit : ""Ça va aller"" mais ses larmes ont déjà coulé aux urgences
J'te dis : ""À demain"" mais, bon, dans ton regard, il n'y a plus de résistance

[Refrain]
Maman, I love you (eh), maman, I love you, love, love
Maman, I love you, love (eh), maman, I love you, love
Maman, I love you (eh), maman, I love you, love, love
Maman, I love you, devant Dieu, même si j'dis jamais dans les yeux
Maman, I love you, love (eh), maman, I love you, love, love
Maman, I love you, love (eh), maman, I love you, love
Maman, I love you, love (eh), maman, I love you, love, love
Maman, I love you, devant Dieu, même si j'dis jamais dans les yeux
[Couplet 2]
J'sais pas pourquoi c'négro m'en veut (nan, nan)
Quand j'rate, il dit qu'c'est moi ; quand j'réussis, il dit qu'c'est Dieu (oui)
Un million, deux, trois ; j'aimerais t'revoir comme autrefois
J'suis sur le trottoir, death, espérons qu'c'n'est pas trop tard
Pourquoi tu pleures ? Nan, pourquoi tu pleures ? Nan, nan, nan
T'inquiète pas pour nous, j'ai d'la moula jusqu'à j'sais pas
Moi, à l'hôpital, j'ai vu : des amis, t'en avais deux
Maman, c'est chaud, tu t'oublies trop pour fils de putes qui n'pensent qu'à eux
Le cœur adamantin, travaille à temps plein : de toi, c'est c'que je retiens
Souffle te remplit de haine, journaliste dans le jeu, que dans la complainte
Fuck ces gens, oui, j'ai la haine, ton enterrement, faut pas qu'ils viennent
Allô, fiston ? C'est tantine, on s'connaît d'Adam mais plus d’Ève
Vilain changé devenu connu, c'était une grande chambre, pas une commune
J'vous ai pas vu, non, non, non, pourtant, tout l'monde avait son num'
Maintenant, ça crie : ""Dieu soit loué"", allez tous vous faire enculer
J'te dis : ""À demain"" aux urgences mais dans ton regard, il n'y a plus de résistance

[Refrain]
Maman, I love you (eh), Maman, I love you, love, love
Maman, I love you, love (eh), Maman, I love you, love
Maman, I love you (eh), Maman, I love you, love, love
Maman, I love you, devant Dieu, même si j'dis jamais dans les yeux
Maman, I love you, love (eh), Maman, I love you, love, love
Maman, I love you, love (eh), Maman, I love you, love
Maman, I love you, love (eh), Maman, I love you, love, love
Maman, I love you, devant Dieu, même si j'dis jamais dans les yeux5Embed"
Damso,2959148,67668,45855,Damso,https://images.genius.com/3de2925567e91cafdbceac86177f0955.300x300x1.jpg,Smeagol,https://genius.com/Damso-smeagol-lyrics,79866,"Smeagol Lyrics[Paroles de ""Smeagol""]

[Intro]
Oui
La violence, eh
Capitol 92i, nouveau flow très noir
Sale, Dems, Vie, oui
Eh

[Couplet unique]
Négros fragiles dans tes alliés, le poulet m'cuisine, j'le fais mariner
Esthéticienne, j'connais l'métier, scène de crime souvent maquillée
RDC, Sapologie, sur la défensive comme un pont-levis
J'te mets dans l'boule pour te fortifier, crie pas au secours, y a pas de justicier
Soit je rappe, soit je trap, soit j'sais pas c'que je fais
Soit je braque, j'vends des pax dans des sachets de thé
Un Tampax dans la chatte, pute n'a pas fait de blé
Pas d'entracte dans le track, j'fais d'la saleté, eh
J'veux tout dépenser, j'prends de court ton point G, porno très séquencé (sale)
Chez moi, tout est foncé, j'suis là pour défoncer tout le rap français
Trente-quatre centimes, j'débutais en indé', t'es pas d'ma team si t'es pas TP Mazembé
J'parle à la Lune comme Indochine, dans ma bulle, y a pas d'ocytocine
Je le strangule puis, j'attends qu'il meurt, négro, après, j'l'encule avec un Taser, négro
Elle tapine pour cinquante euros l'heure, négro
Dans la cabine, je n'fais pas d'erreur, négro
Sur ses babines, y a blanche couleur, négro
Ma mélanine ne craint pas la douleur, négro
Dans mes racines, y a tout Mayweather, négro
Amphétamine ne remplace jamais bon bédo, no
[Refrain]
Schnecks de 'tasses dans mon iCloud
'teille de Jack, mon seul alcool
Sont pas de taille pour nouvel album comme Smeagol (Gollum, Gollum), Smeagol (Gollum, Gollum), Smeagol (Gollum, Gollum)
Sont pas de taille pour nouvel album comme Smeagol (Gollum, Gollum), Smeagol (Gollum, Gollum), Smeagol (Gollum, Gollum)
Sont pas de taille pour nouvel album comme Sméagol

[Outro]
Dems
Vie
Batterie rechargée !10Embed"
Damso,6753198,4881589,45855,Damso,https://images.genius.com/dedd2737025606423d012b43b3a3b9a0.300x300x1.jpg,Ρ. DOSE,https://genius.com/Damso-dose-lyrics,79112,"Ρ. DOSE Lyrics[Paroles de ""Ρ. DOSE""]

[Intro]
Money, money dans la pocket
Flouze
Oui-oui

[Couplet 1]
Thug, bandit, tu connais nos vies
La rue, les profits, tout l'champ des possibles
Jeune millionnaire, plus dans la bibi
Excellent noir comme Carter et Diddy
Concert à Tunis, concert à Alger
J'fais l'tour du monde, juste en niquant des madre
Détails ont grossi, la street a changé
Bonne qualité mais y finit par balancer
J'aime pas la police, pour une seule raison
Ils ont fait pleurer ma mère à la maison
Pourquoi j'suis nerveux ? Pourquoi j'ai fumé ?
Pourquoi ma vie devient celle que je voulais ?
Stoner, j'défie marie-jeanne le soir
Vivre ses rêves en Enfer est un cauchemar
Ils ont changé, veulent qu'on fasse semblant de rien
Ils m'ont tendu, obligé d'rompre les liens

[Pré-refrain]
Money, money dans la pocket (Ah ouais ?)
Money, money dans la pocket (Pocket, pocket)
Le flouze
Flouze
Eh
[Refrain]
Il m'faut ma dose, dose (La gue-dro)
Il m'faut ma dose, dose (La gue-dro)
Ils veulent ma peau, mes lovés (La moula)
Pourtant j'ai rien fait d'mauvais (Jamais)
Il m'faut ma dose, dose (La gue-dro)
Il m'faut ma dose, dose (La gue-dro)
Ils veulent ma peau, mes lovés (La moula)
Pourtant j'ai rien fait d'mauvais (Jamais)
Il m'faut ma dose, dose
Il m'faut ma dose, dose (La gue-dro)
Ils veulent ma peau, mes lovés
Pourtant j'ai rien fait d'mauvais (Hey)
Il m'faut ma dose, dose
Il m'faut ma dose, dose (La gue-dro)
Ils veulent ma peau, mes lovés (La moula)
Pourtant j'ai rien fait d'mauvais (Jamais)

[Pont]
Non, jamais
Sku, hey
Yes, sku, jamais, hey
La guedro, nwaar
[Couplet 2]
Les réseaux font de nous des prisonniers du r'gard des autres
Et des évadés du regard des fautes qu'on veut s'épargner
Miroir de mots sont trop échangés, tiroir d'égo veut pas s'refermer
Calbar en feu, remords reportés sa mère
J'm'en veux de t'avoir démarré, parfois c'est mieux d'pas tout réparer
La mer en deux va s're-séparer, j'vais la fumer sans la détailler
[Pré-refrain]
Money, money dans la pocket
Money, money dans la pocket (Pocket, pocket)
Le flouze
Flouze
Eh

[Refrain]
Il m'faut ma dose, dose (La gue-dro)
Il m'faut ma dose, dose (La gue-dro)
Ils veulent ma peau, mes lovés (La moula)
Pourtant j'ai rien fait d'mauvais (Jamais)
Il m'faut ma dose, dose (La gue-dro)
Il m'faut ma dose, dose (La gue-dro)
Ils veulent ma peau, mes lovés (La moula)
Pourtant j'ai rien fait d'mauvais (Jamais)
Il m'faut ma dose, dose (La gue-dro)
Il m'faut ma dose, dose (La gue-dro)
Ils veulent ma peau, mes lovés (La moula)
Pourtant j'ai rien fait d'mauvais (Jamais) (Hey)
Il m'faut ma dose, dose (La gue-dro)
Il m'faut ma dose, dose (La gue-dro)
Ils veulent ma peau, mes lovés (La moula)
Pourtant j'ai rien fait d'mauvais (Jamais) (Hey)

[Outro]
Dis-moi qu'c'est pas moi mais qu'c'est la vie que j'mène
Dis-moi qu'c'est pas moi mais qu'c'est la vie que j'mène7Embed"
Damso,3738888,5428057,45855,Damso,https://images.genius.com/88359e6c58b6ffd04a45dc42874c12e2.300x300x1.jpg,Tard la night,https://genius.com/Damso-tard-la-night-lyrics,77970,"Tard la night Lyrics[Paroles de ""Tard la night""]

[Intro]
Stone de flanc, Hennessy

[Pont 1]
Hennessy, Hennessy, Hennessy
Stone de flanc, Hennessy, Hennessy, Hennessy

[Refrain]
Bédo, spliff au bec, sombre négro, schnek fons-dé tard la night
Bédo, spliff au bec, sombre négro, schnek fons-dé tard la night
Caïpirinha, marijuana, fons-dé, Copa Caba', 'pa Cabana, olé
Mal au cœur, j'ai mal au cœur, j'suis doré
Baroudeur, j'suis baroudeur, j'suis bourré
J'suis plus dans l'bendo, j'fais qu'd'la moula tard la night, olé
Elle m'roule un bédo d'chez pas où là, ouais, j'suis high, ok

[Pont 2]
Hennessy, Hennessy, Hennessy
Stone de flanc, frénésie, frénésie, frénésie

[Refrain]
Bédo, spliff au bec, sombre négro, schnek fons-dé tard la night, olé
Bédo, spliff au bec, sombre négro, schnek fons-dé tard la night, olé
Caïpirinha, marijuana, fons-dé, Copa Caba', 'pa Cabana, olé
Mal au cœur, j'ai mal au cœur, j'suis doré
Baroudeur, j'suis baroudeur, j'suis bourré
J'suis plus dans l'bendo, j'fais qu'd'la moula tard la night, olé
Elle m'roule un bédo d'chez pas où là, ouais, j'suis high, ok
[Outro]
Olé4Embed"
Damso,6753242,9146989,45855,Damso,https://images.genius.com/dedd2737025606423d012b43b3a3b9a0.300x300x1.jpg,Ω. VIVRE UN PEU,https://genius.com/Damso-vivre-un-peu-lyrics,73888,"Ω. VIVRE UN PEU Lyrics[Paroles de ""Ω. VIVRE UN PEU""]

[Intro : Lior & mère de Lior]
Papa, je t'aime
Oh, oh, c'est mignon
Pardon papa
*rires* C'est bien, Lior
On va l'appeler, hein ?
Euh... j'vais essayer d'l'appeler mais il est occupé, hein
Yeah

[Refrain]
Avant tout ça j'tais bien, mais j'regrette pas c'que j'ai
Peut-être un petit peu, tout quitter, vivre un peu
Moins en moins d'amitiés, pour plus de revenus
Les bons moments sont rares dans la célébrité
Avant tout ça j'tais bien, mais j'regrette pas c'que j'ai (Eh)
Peut-être un petit peu, tout quitter, vivre un peu
Moins en moins d'amitiés, pour plus de revenus (Eh)
Les bons moments sont rares dans la célébrité (Ouh)
Oui, oui, yeah

[Couplet 1]
J'ai perdu sommeil (Pa-pa-pa-pa)
Mes nuits se font le jour, mon train de vie dans les hôtels
Et dire qu'avant, j'tais sur un banc, j'fumais des bédos
Maintenant riche et parano, ouais, j'deviens méfiant quand j'la baise
Elle tue ta carrière pour une photo dans ton sommeil
Le succès n'est qu'un simple reflet, pas un modèle
Emprisonné dans un selfie, idolâtré pour c'que j'suis
Sans pour autant voir que ma vie n'est pas si jolie, c'pas un movie
Solitude et lassitude en soirée mondaine
Je ne crois plus au tribunal mais à la guerre
On n'change pas une équipe qui gagne sauf quand elle perd
Y a plus d'innocence, t'étais conscient, j't'ai fait confiance
Malgré tensions, le bruit sourd du silencieux s'ra dans la tête
[Refrain]
Avant tout ça j'tais bien (Oui), mais j'regrette pas c'que j'ai
Peut-être un petit peu, tout quitter, vivre un peu
Moins en moins d'amitiés, pour plus de revenus
Les bons moments sont rares (Sale), dans la célébrité (Nwaar)
Avant tout ça j'tais bien, mais j'regrette pas c'que j'ai
Peut-être un petit peu (Oui), tout quitter, vivre un peu (Nwaar)
Moins en moins d'amitiés, pour plus de revenus
Les bons moments sont rares dans la célébrité (Sale)

[Couplet 2]
C'est très bizarre quand tu d'viens plus riche que les gens
On ne te voit plus que comme une solution
Décolleté, matérialiste, névrosé au bord de la crise, endetté sans réelle prise de risque
Perdu dans mes pensées, paralysé, j'encaisse
J'prends la parole sur un disque
Rosé dans le rre-vé, plongé dans la richesse, la célébrité n'a pas d'notice
J'ai vu la Terre reprendre tous mes êtres chers, la mort a fait de moi son complice
Coincé par la moula, pas le cœur à la fête, j'pense pas qu'on est fait pour la vie
Jamais rassasié, toujours retardé, je vis si tard que le jour me parut
Si loin que j'oublie que je viens d'en bas comme un Néerlandais
Le bruit des vagues me permet de fuir le monde le temps d'un verre
Le seul prix de vivre ses rêves

[Refrain]
Avant tout ça j'tais bien, mais j'regrette pas c'que j'ai
Peut-être un petit peu, tout quitter, vivre un peu
Moins en moins d'amitiés, pour plus de revenus
Les bons moments sont rares dans la célébrité
Avant tout ça j'étais bien, mais je n'regrette pas c'que j'ai
Peut-être un petit peu, tout quitter, vivre un peu
Moins en moins d'amitiés (Ah oui), pour plus de revenus (Sale)
Les bons moments sont rares (Dems) dans la célébrité
Oui, sale
[Outro : Lior & (Damso)]
(Ouais ORP, tu connais)
On va l'appeler, hein ?
(Sale)
(Ah oui)2Embed"
Damso,6753246,498964,45855,Damso,https://images.genius.com/dedd2737025606423d012b43b3a3b9a0.300x300x1.jpg,Χ. ZWAAR,https://genius.com/Damso-zwaar-lyrics,73181,"Χ. ZWAAR Lyrics[Paroles de ""X. ZWAAR""]

[Intro]
Nwaar
Ah bah ouais
Ah, ouais
Sale, haha, hey

[Couplet 1]
J'voyage rarement, j'regarde story, quelques biatchs pour m'évader
Début d'soirée j'suis d'jà bourré, c'est p't'être pas ça la vie qu'j'voulais
Mais j'fais des sous et d'la moula, donc ses lèvres me sucent à tout va
Pas d'amour ici, j't'entretiens, j'te baise, c'est fifty-fifty, tu veux l'jet
De Fendi, Gucci, attends qu'la SNEP me certifie meilleure passion
Pire des métiers, pas d'glaçons dans l'rre-vé s'te plait
L'alcool fait d'jà plus trop d'effet, l'alcool fait d'jà plus trop d'effet
J'suis dans l'tiekson, fumant tout seul, j'prends mon pacson pour une boussole
J'suis dans l'club, la pute me snap en scred, pour gratter quelques j'aime, deux-trois retweets
Mal à pris son pass, tire mon blaze comme mon jet, avide comme snitch
Invincible car serein, un insigne, j'passe mon chemin, devant les flics
La pute est londonienne, demande si j'parle anglais, j'dis : ""Little bitch""
Kalash remplace le tronc du sapin d'Noël
Rien dans les mollets, tout dans la cervelle
Bang-bang, j't'offre une place près de l'Éternel
Sunday, sur l'Mont Vénus j'te fais une merveille
All day, Sénégalais comme Cheikh, semi AK dans l'break
Diamants de sang sur la Daytona, quand ça va pas j'fais des signes de croix (Dems, Dems, Dems)
[Pré-refrain]
Okay, binks, binks, binks dans le tieks, tieks, tiekson
Grrr, gros C4 dans le break (Ta-ga-da)
Binks, binks, binks dans le tieks, tieks, tiekson
Grrr, gros C4 dans le break
Dans le hood, hood-hood-hood-hood
Dans le hood, hood-hood-hood-hood
Dans le hood, hood-hood-hood-hood
Grrr, grrr, gros C4 dans le break
Okay (Nwaar)

[Refrain]
Nwaar (Hey), nwaar (Hey), nwaar (Hey), très nwaar (Hey)
Nwaar (Hey), nwaar (Hey), nwaar (Hey), très nwaar (Hey)

[Couplet 2]
Nique sa grand-mère et sa mère aussi, fuck you pay me
Tellement d'ennemis, j'suis au-dessus d'tout c'qui est nwaar et terni (Dou-dou-dou)
Bentley berline, vroum-vroum vers la mort sans permis
Police persiste, négro, dealeur, Audi RS6
J'suis un étranger, j'rentre pas chez moi, j'm'installe chez toi
J'fais du she-ca, j'paie mes impôts, trente mille euros, tu profites d'mon bénéfice
Viens qu'on s'termine, j'suis sous Dom Pér', gue-dro, Hennessy
Pas de pré-requis, soit tu baises, soit tu baises aussi
Fuck le rétro, j'avance tout droit, number uno avec mes droits
Négro ficha, tricha, tout ça pour pouvoir gonfler les chiffres
J'passe sur France 2, j'gagne les Victoires, j'nique des mères et des ménagères
Producteur en indépendant (Nwaar, nwaar), j'profite de mes bénéfices (Nwaar, nwaar, nwaar, nwaar), nwaar
[Refrain]
Nwaar (Hey), nwaar (Hey), nwaar (Hey), très nwaar (Hey)
Nwaar (Hey), nwaar (Hey), nwaar (Hey), très nwaar (Hey)
Nwaar (Hey), nwaar (Hey), nwaar (Hey), très nwaar (Hey)
Nwaar (Hey), nwaar (Hey), nwaar (Hey), très nwaar (Hey)8Embed"
Damso,6678029,7770121,45855,Damso,https://images.genius.com/7b9ac7124a4b1fb38f24a09c44f4e83c.300x295x1.jpg,J’avais juste envie d’écrire.,https://genius.com/Damso-javais-juste-envie-decrire-lyrics,66770,"J’avais juste envie d’écrire. Lyrics[Paroles de ""J’avais juste envie d’écrire.""]

[Intro]
Yo
Ha, ha, ha
Ok
Ouais

[Couplet unique]
J'te préfère avec une balle dans la tête au moins j't'écouterai plus raconter ta vie
Un col blanc veut pas dire qu't'es un mec bien : des pédophiles s'cachent derrière l'eucharistie
C'que j'aime chez la mort c'est qu'elle ment pas : elle voit un truc qu'elle aime bien, elle prend et elle le rend pas
Bavе du crapaud atteignant colombe
Les politiquеs ont fini par faire du virus leur campagne
J'rêve qu'j'suis Adam, qu'j'baise Ève dans un paradis où l'seul péché est d'manger un fruit
Des millénaires plus tard, des Elon, des Bezos finissent par imposer leurs prix
Faites de la place pour mon rap c'est tout droit
J'ai les partitions, des gyrophares et des sirènes
Si j'baise une pute, est-ce que j'te trompe ou pas ?
Mon âme est sincère mais mon corps est infidèle
J'te f'rai un Vie même à deux doigts d'mourir, mon avenir n'a prévu aucun décès, gang
J'suis tellement loin que même les bruits qui courent se sont arrêtés, Dems
La voix de la sagesse est muette, elle parle en langage des signes
Je distingue un majeur qui traverse un rond fait d'un pouce et d'un index qui s'agglutinent
J'ai vu dans ton regard ce que les gens appellent ""Néant""
Un adieu à chaque ""au revoir""
Désolé du retard, j'ai mis du temps dans les océans à noyer ton désespoir
Les narines enflées par substance faisant ressurgir ce sentiment d'être une pute qui n'sait pas c'qu'elle fait sur le trottoir
Il n'y a pas assez d'essence dans l'réservoir pour aller jusqu'au bout de tes peines car elles se cachent derrière ton miroir
Vie
[Outro]
Poésie, poésie, poésie, trou noir9Embed"
Damso,5973239,5428057,45855,Damso,https://images.genius.com/7cef2f5ce8613018942710c25cada629.300x300x1.jpg,POUR L’ARGENT,https://genius.com/Damso-pour-largent-lyrics,65480,"POUR L’ARGENT Lyrics[Paroles de ""POUR L'ARGENT""]

[Intro]
Ouais, ouais
Ouais, ouais
Ouais, ouais
Dems

[Couplet 1]
Pona níni ozo bwaka mauvais œil ojalouser nga
Nazali mwana na nzambe loin de haine et vanité
Ko tsia ba kales te, puissance céleste vaincra toujours
Motema sans rature, malgré tant d'adversité
Soldat na Yahwé eh
Jamais ba vaincra
Mwana mbóka, jamais dans les sentiments, ba yuma, ba vagabonds
Président charlatan, bazo bebisa continent fort

[Refrain]
Pona níni, yeah
Juste pour l'argent (yeah, yeah, yeah)
Pona níni, yeah
Juste pour l'argent (yeah, yeah, yeah)

[Couplet 2]
J'ai un peu peur, j't'avoue (ok), j'm'attaque aux gros bonnets (ouais)
J'parle Bukavu, Kivu dans l'Est, la misère a charbonné (c'est clair)
La galère a fait du chеmin (ah ouais) car hier a tué demain (Dems)
Bédo dans lе sang, négros dans les champs sont toujours à crever de faim (ah ouais)
Ici, pas de ""aïe, aïe"" car on tire dans la tête, c'est nwaar, c'est sale (rha)
On abuse du temps, ils abusent des femmes et j't'épargne de tous les détails
Ce que j'ai vu dépasse les flammes, l'enfer a menti
Du Alpha Blondy, j'écoute pas c'qu'on dit, j'observe la mer et ses vagues
[Refrain]
Pona níni, yeah
Juste pour l'argent (yeah, yeah, yeah)
Pona níni, yeah
Juste pour l'argent (juste pour l'argent yeah, yeah, yeah)
[Outro]
Makélélé, bazo sala
La pauvreté, bazo tala
Na lingaka te, nazo lela nase depuis kala
Congo, Afrika, tout pour la moula
Pour l'argent
Pour l'argent3Embed"
