artist,id,lyrics_owner_id,primary_artist_id,primary_artist_name,song_art_image_thumbnail_url,title,url,pageviews,lyrics
Damso,6753201,7770121,45855,Damso,https://images.genius.com/dedd2737025606423d012b43b3a3b9a0.300x300x1.jpg,Σ. MOROSE,https://genius.com/Damso-morose-lyrics,252369,"Σ. MOROSE Lyrics[Paroles de ""Σ. MOROSE""]

[Couplet 1]
J'suis tellement loin
C’est parti pour quelques heures
Écrire sur le monde
Exilé dans simulateur
Près des couleurs, sable en mouvement
Fonce-dé, trop pressé d'plus penser, cerveau danse donc débranché
Haute défonce, plus rien de sensé, sors de ma tête, bouge
Faut que j'me taise, que j’l'ouvre, okay
Trop de tes questions brusquent, bеaucoup de pression, muscles
Trop d'strеss, peu d'émotions
Agression à chaque réflexion, balles, oppression, attaques, restrictions, black
Tu veux pas d'moi, tu veux pas d'nous mais tu veux pas l'dire en face
Baltringue, salope, tasse-pé
J'te d’mande un minimum de respect

[Pré-refrain]
J’calme mes nerfs, joint V.E.R, Tango
J'balance des phrases sur une compo’
J'calme mes nerfs, joint V.E.R, Tango
J'balance des phrases sur une compo'
Morose, morose (Ouais ouais)
Morose, morose (Ouais ouais)
(Sale, sale, sale)
[Refrain]
Donne-moi ton tél’ que j't'appelle et ramène à l'hôtel comme si de rien n'était (Sale, sale, sale)
Donne-moi ton tél' que j't'appelle et ramène à l'hôtel comme si de rien n'était (Eh, sale)
Fais pas genre, fais pas genre qu'on n'va pas le faire (Nan-nan-nan)
J't'entends t'épiler la chatte (Bah ouais)
Fais pas genre, fais pas genre qu'on n'va pas le faire (Nan-nan-nan)
J't'entends t'épiler la chatte (Bah ouais)
Oh ouais

[Couplet 2]
Tu cherches l'amour, vient la mort, t'arrêtes pas d'causer du tort
Tu t'ouvres les veines mais encore, là t'ignores tous tes efforts
Tour à tour, les te-por se ferment et tu t'fais des bords
S'il le faut, tu le fais, il est faux tu le sais, illico tu le fais, silicone dans la fesse
Une icône dans la presse, une michto dans la tess, jamais seul, tu t'en sortiras
Il reste une place dans le corbillard, j'écris surtout c'que je pense, c'est moi
J'écris sur pute et son coquillard et sur c'que j'risque d'apercevoir
Ouais, j'aime quand j'te perds, drogué d'avance, coincer ta chair, j'sens ta fragrance
Douce et sévère, d'l'amande douce à l'ammoniaque
T'aimes le bandit que je suis (Ouais), té-ma la vue quand tu me suis (Ouais)
Tu comptes sur mes économies (Ouais), t'es ma pute que pour aujourd'hui (Ouais)
Tapis, j'ai fait doubler la mise, paire
Bientôt j'abandonne le biz' et pars loin, j'prends fils et mère

[Pré-refrain]
J'calme mes nerfs, joint V.E.R, Tango
J'balance des phrases sur une compo'
J'calme mes nerfs, joint V.E.R, Tango
J'balance des phrases sur une compo'
Morose, morose (Ouais ouais)
Morose, morose (Ouais ouais)
(Sale, sale, sale)
[Refrain]
Donne-moi ton tél' que j't'appelle et ramène à l'hôtel
Comme si de rien n'était (Sale, sale, sale)
Donne-moi ton tél' que j't'appelle et ramène à l'hôtel
Comme si de rien n'était (Eh, sale)
Fais pas genre, fais pas genre qu'on n'va pas le faire (Nan-nan-nan)
J't'entends t'épiler la chatte (Bah ouais)
Fais pas genre, fais pas genre qu'on n'va pas le faire (Nan-nan-nan)
J't'entends t'épiler la chatte (Bah ouais)

[Solo de saxophone]

[Solo de piano]25Embed"
Damso,3296510,3087762,45855,Damso,https://images.genius.com/0f1a031d4170b7621a71a202e9e6766d.300x300x1.jpg,Tueurs,https://genius.com/Damso-tueurs-lyrics,237778,"Tueurs Lyrics[Paroles de ""Tueurs""]

[Intro]
Tueurs, tueurs, tueurs, ouais, ouais
Tueurs, tueurs, tueurs, hey
Yeah, yeah, yeah, yeah, yeah, tueurs, tueurs, tueurs
Yeah, yeah, yeah

[Couplet 1]
Hey, on m'parle de taffer pour des thunes dont j'profiterai même pas
Ils oublient qu'ma vie, j'en ai qu'une, j'vis comme dans Koh-Lanta
Cette vie de rêve, c'est avoir un gosse, une meuf, une Chevrolet
Trop charbonner, une villa, un vélo d'ville, être sous contrat
S'lever à six du mat' ensuite déposer le fiston
Qui, lui, quand il grandira, profitera de tous mes pistons
Routine hebdomadaire donc obligé d'prendre des congés
Une vie tellement robotisée qu'j'sais déjà dans quoi dépenser
Ces crédits immobiliers, minervals d'université
Collier d'perles des Champs-Élysées pour nos dix ans d'mariage soudé, non, non, non
J'veux pas de ça, perdre des sous pour des paires de seins
Être père et mari, boss d'une PME, toucher six mille deux cents
Pour certains, c'est l'paradis, moi, j'veux pas refaire des vies
J'veux vivre un truc inédit, genre Fifty, Jay Z, P. Diddy, ouais, ouais, ouais
J'suis fatigué d'leur vision d'la réalité
Vingt-cinq ans dans l'humanité sans aucune humanité
[Refrain]
Et je pense
Que si la vie ne m'donne pas tout c'que j'lui demande, j'passerai par la violence
Qu'importent les crimes, morts, victimes innocentes
Dans la vie, chacun sa chance
Dans l'oubli, loin des bruits des gyrophares, caméras de surveillance
Mon gun fait la surveillance

[Pont]
Tueurs, tueurs, tueurs (ba-ba-ba-bang, bang)
Tueurs, tueurs, tueurs (ba-ba-ba-bang, bang)
Tueurs, tueurs, tueurs (ba-ba-ba-bang, bang)
Tueurs, tueurs, tueurs (ba-ba-ba-bang, bang)

[Couplet 2]
Ouais, la mort est ma raison de vivre
Mon vécu est ivre mort, rêvasse sur son sort
Toujours à penser qu'il s'ra libre
Mais la vraie prison s'trouve dehors, proche des coffres-forts
Mon âme sœur dans un kilo d'shit
Quand la vie t'baise, y a pas d'pilule, loin des yeux, près d'ta cellule
Ce rap de merde n'a plus de vivres
Mais j'suis là, j'fais qu'niquer des mères, à force, j'sais plus quoi faire
Sa schneck atteinte de varicelle donc j'vis d'amour que sur ses lèvres
Vrai négro vivra ses rêves et c'la forever
T'étais là mais j't'ai pas vu, un peu comme ta carrière
En manque de mains plus qu'hier, les traites n'sont pas qu'négrières
Ils promettent le paradis avec une pelle en main (oui)
J'te dis : ""J't'aime"" aujourd'hui pour une histoire sans lendemain
On est c'qu'on a parce qu’on a eu donc j'donne le mien pour prendre le tien
Si j'prends les vôtres, c'est pour les miens (à mourir)
[Refrain]
Et je pense
Que si la vie ne m'donne pas tout c'que j'lui demande, j'passerai par la violence
Qu'importent les crimes, morts, victimes innocentes
Dans la vie, chacun sa chance
Dans l'oubli, loin des bruits des gyrophares, caméras de surveillance
Mon gun fait la surveillance

[Pont]
Tueurs, tueurs, tueurs (ba-ba-ba-bang, bang)
Tueurs, tueurs, tueurs (ba-ba-ba-bang, bang)
Tueurs, tueurs, tueurs (ba-ba-ba-bang, bang)
Tueurs, tueurs, tueurs (ba-ba-ba-bang, bang)

[Outro]
Tueurs, tueurs, tueurs
Tueurs, tueurs, tueurs
Tueurs, tueurs, tueurs
Tueurs, tueurs, tueurs12Embed"
Damso,3756037,1094887,45855,Damso,https://images.genius.com/88359e6c58b6ffd04a45dc42874c12e2.300x300x1.jpg,Silence,https://genius.com/Damso-silence-lyrics,233824,"Silence Lyrics[Paroles de ""Silence"" ft. Angèle]

[Intro : Damso]
Ouais, ouais
Silence, je ne parle pas
Écoute c'que j'ai à dire quand je parle de toi
J'veux qu'tu me devines, que tu meures de moi
Viens dans ma tête, ne dis plus un mot
J's'rai ton paradis si l'Enfer est l'autre (Hey)

[Couplet unique : Damso]
Vous les femmes, c’est toujours pareil : quand le drame s’abat, vous pleurez
Vous les hommes, c’est toujours pareil : quand le drame s’abat, vous courez
C’pour ça qu'les relations s’arrêtent, j’ai tort, c’est ma faute
Sentiments égarés, on sourit pour ne pas pleurer
On s’oublie pour ne plus s’aimer, cherche la perfection pour fuir la réalité
Le vrai problème, c’est qu’à chaque fois qu'c’est le même problème : chatouilles de bijoux, pardonné, entraîne bisous empoisonnés
Précède un ""je t'aime"" qui n’a pas oublié que t’as aimé un autre
C'est la tienne ou ma faute ?
[Outro : Angèle]
Ta vérité n'est pas la mienne
Ta vérité n'est pas la mienne
Ta vérité n'est pas la mienne
Car je tombe et puis, c'est moi qui traîne12Embed"
Damso,3038923,3082514,45855,Damso,https://images.genius.com/1a572edbf6da198c99dacd7c19282804.300x300x1.jpg,B. #QuedusaalVie,https://genius.com/Damso-b-quedusaalvie-lyrics,233678,"B. #QuedusaalVie Lyrics[Paroles de ""B. #QuedusaalVie""]

[Intro]
Lens Dupuy
Hey, hey
Nous sommes Vie, FuentesVie, hey

[Refrain]
J'fais que du sale (hey), j'fais que du sale (hey, hey)
J'fais que du sale (hey), j'fais que du sale (hey, hey)
J'fais que du sale (hey), j'fais que du sale (hey, hey)
J'fais que du sale (hey), j'fais que du sale (hey, hey)
J'fais que du sale (hey), j'fais que du sale (hey, hey)
J'fais que du sale (hey), j'fais que du sale (hey, hey)
J'fais que du sale (hey), j'fais que du sale (hey, hey)
J'fais que du sale (hey), j'fais que du sale (hey, hey)

[Couplet 1]
Demande pas ""d'où vient le pognon ?"" Argent propre et sale, nous prenons
Africains sans vrai gouvernement, nous pleurons, nous pleurons, nous saignons
Ils m'connaissent depuis qu'on est gamins, quand financièrement j'allais très bien
Quand toit au-d'ssus d'moi y avait plus rien, j'ai vu aucun d'ces fils de putain
La bourgeoisie, j'y ai goûté : sept-milles euros maman touchait
La pauvreté, j'y ai goûté : sept-cents euros maman touchait
Ils s'demandent ""pourquoi j'fais le sale nègre ?"" Comme si j'avais l'choix de faire autre chose
Soit business illégaux tu proposes, soit tu fermes ta gueule à tout jamais
Ma bite dans le gros cul du passé mais c'est dans l'tur-fu que j'ai craché
J'suis défoncé dans le quartier, policier demande mes papiers
La rue au sommet, j'viens de tellement loin, beaucoup de bâtons dans les roues, en vain
Pied de biche pour une mise à pied, niquer des mères jusqu'à c'qu'y en ait plus assez
Tu fais ta gueule, fais-le chaud mais souviens-toi quand t'étais gros
Plus b'soin de combler mes besoins, depuis qu'femme et enfant, j'entretiens
J'ai d'mandé son num, elle a dit ""non"" mais depuis qu'en vues, j'fais des millions
J'tire sur ennemi et son chignon, le succès m'a-t-il rendu mignon ?
[Refrain]
J'fais que du sale (hey), j'fais que du sale (hey, hey)
J'fais que du sale (hey), j'fais que du sale (hey, hey)
J'fais que du sale (hey), j'fais que du sale (hey, hey)
J'fais que du sale (hey), j'fais que du sale (hey, hey)
J'fais que du sale (hey), j'fais que du sale (hey, hey)
J'fais que du sale (hey), j'fais que du sale (hey, hey)
J'fais que du sale (hey), j'fais que du sale (hey, hey)
J'fais que du sale (hey), j'fais que du sale (hey, hey)

[Couplet 2]
Quand j'vois son boule, j'suis ébloui, à l'ancienne, j'danse le boogie
J'serais ton Monk, tu s'ras ma Trudy, j'l'ai pas mariée pourtant elle crie ""oui""
Elle m'a vu grandir, j'la vois mourir, ça peut pas marcher donc j'vais courir
Hentaï dans l'érection, j'ai jauni, vie noire et rose comme Marie-Thérèse Cuny
Sa tte-cha danse le Ndombolo, j'ai plus de paroles qu'Alain Delon
Damso, Charo comme Matuidi, j'ai M sur le front tel Babidi
J'partage ma vie dans mes morceaux, j'tourne en rond comme table de Lancelot
""Pour réussir ta vie, faut qu't'étudies"", j'sais pas qui m'l'a dit, sûrement Carla Bruni

[Pont]
J'fais que du sale (hey), négros sont pas prêts
J'suis dans le noir, très, j'suis dans le square, j'beh
Si j'veux être, il m'faut des avoirs, plus de liquide que dans le lavoir
Elle touche la barre comme un shiteu, souvent les plus moches qui sucent le mieux
J'fais que du sale (hey), négros sont pas prêts
J'suis dans le noir, très, j'suis dans le square, j'beh
Genius League dans l'écurie, points d'suspension, Stephen Curry
Le diable dans mes actes, j'suis puni
No iPhone, Vie BlackBerry
[Refrain]
J'fais que du sale (hey), j'fais que du sale (hey, hey)
J'fais que du sale (hey), j'fais que du sale (hey, hey)
J'fais que du sale (hey), j'fais que du sale (hey, hey)
J'fais que du sale (hey), j'fais que du sale (hey, hey)
J'fais que du sale (hey), j'fais que du sale (hey, hey)
J'fais que du sale (hey), j'fais que du sale (hey, hey)
J'fais que du sale (hey), j'fais que du sale (hey, hey)
J'fais que du sale (hey), j'fais que du sale (hey, hey)8Embed"
Damso,3738883,3082514,45855,Damso,https://images.genius.com/1fbb6c26d16a78ed64b5b82cc7720e2e.300x300x1.jpg,60 années,https://genius.com/Damso-60-annees-lyrics,200221,"60 années Lyrics[Paroles de ""60 années""]

[Intro]
Oui

[Couplet 1]
L'alcool est l'chemin le plus court vers l'adultère, honnêtement
Puceau, en chien sur une meuf plus âgée qui l'avait d'jà fait
Donc j'ai fait semblant de l'avoir fait, pour faire le grand
Pourtant j'étais p'tit, après j'ai compris
Que quand je s'rais grand, j'regretterai tout c'qui s'est passé
Car finalement, j'ai passé ma vie à vivre à peine
De joie mais plutôt de peine, je crois que
Le temps passe vite mais qu'on oublie rien, de c'qu'on a raté
La vie ne fait que soixante années, pour profiter, il faut pécher
Donc on hésite puis on s'fait chier, donc on médite, pour exister
Donc on s'évite pour s'retrouver, après faut juste laisser aller
Pourtant la mort s'est faite toute belle pour un rencard d'un mariage forcé
Cherche aucun nom sur la sonnette, appuie sur l'bouton à l'aveuglette
J'vais profiter, quitte à pécher, car la vie ne fait que soixante années

[Refrain]
Oh la la, oh la la, oh la la, oui
Soixante années
Oh la la, oh la la, oh la la, oui
Bah oui, hey
[Couplet 2]
Les jeunes d'aujourd'hui m'ont dit : ""Dems, on veut la montre, fuck le temps""
Pensant qu'le temps court après la montre sauf que les aiguilles, s'arrêtent avant
Mets ta ceinture mais sache, que tu peux mourir au moindre accident
Crois pas qu'c'est simple, crois pas qu'c'est dur
Crois juste en toi, crois pas les gens
J'viens de la rue, d'la belle étoile
Pour vivre dans l'abus, hôtel cinq étoiles
Des fois, je regrette quand j'y repense
J'fumais mon petch, ma Gordon me manque
Le futur existe que parce qu'on y croit
Si demain s'arrête, j'te connaîtrais mieux
J'parlerais de moi comme si c'était toi, j'parlerais de nous comme si c'était eux
Pendant qu'on s'rapproche pour s'refouler puis, faire semblant d'à nouveau s'aimer
La mort si vieille, se fait rebelle comme un standard veut improviser
Cherche aucun son sur la trompette, appuie sur l'piston à l'aveuglette
J'vais profiter, quitte à pécher, car la vie ne fait que soixante années

[Refrain]
Oh la la, oh la la, oh la la, oui
Soixante années
Oh la la, oh la la, oh la la, oui
Bah oui
Soixante années9Embed"
Damso,3738885,224122,45855,Damso,https://images.genius.com/88359e6c58b6ffd04a45dc42874c12e2.300x300x1.jpg,Dix leurres,https://genius.com/Damso-dix-leurres-lyrics,184332,"Dix leurres Lyrics[Paroles de ""Dix leurres""]

[Intro]
Ouais, ouais-ais-ais
Hé-hé-hé
J'suis dealer, j'suis dealer (ouais)
J'ai si peur, j'ai si peur (ouais)

[Refrain]
Maman, j'fais plus d'études, j'suis dans le tiekson
J'suis dealer, j'suis dealer (j'suis dealer, j'suis dealer)
Chérie, phone pas les stups, j'suis dans bail bre-som
J'suis dealer, j'suis dealer (j'suis dealer, j'suis dealer)
De bonne famille, là d'où je viens, la vie m'laisse sur la faim
Je prends des risques, fais du chiffre, shit brun
Personne me tient la main, j'ai plus d'cash, plus rien
J'ai si peur, j'ai si peur (j'ai si peur, j'ai si peur)

[Couplet 1]
La mort en courrier r'commandé, les huissiers à l'entrée
Le gun est chargé, bang, ils m'vilipendaient
À g'noux d'vant Dieu, d'bout d'vant les Hommes, regard écœuré
Cinq cents chevaux dans le gamos, j'suis palefrenier
Jambes en X, même mon corps avoue ne pas se connaître
Sexuels sont nos rapports, tu m'fais que des courbettes
J'suis criblé de dettes, des ""j't'aime"" non-dits
Z'yeux rivés vers le ciel, bras long, fais-moi un #Vie
[Pré-refrain]
J'regrette l'époque de ""Débrouillard""
Jeune négro rêvant de moula
Galère de stud', plein de coups bas
J't'aimerai avec ou sans le foulard
Des fils de pute, j'en ai vu beaucoup
""Sans Booba, t'es rien du tout""
J'dis pas le contraire mais c'est Dieu qui donne et puis c'est tout
Ta carrière m'attriste, ta kalash factice
Sombre haineux, j'vais t'ébouer comme Fabrice

[Refrain]
Maman, j'fais plus d'études, j'suis dans le tiekson
J'suis dealer, j'suis dealer (j'suis dealer, j'suis dealer)
Chérie, phone pas les stups, j'suis dans bail bre-som
J'suis dealer, j'suis dealer (j'suis dealer, j'suis dealer)
De bonne famille, là d'où je viens, la vie m'laisse sur la faim
Je prends des risques, fais du chiffre, shit brun
Personne me tient la main, j'ai plus d'cash, plus rien
J'ai si peur, j'ai si peur (j'ai si peur, j'ai si peur)

[Couplet 2]
Je fais des sommes, tu fais des tiennes (oui)
Troisième album, toujours le même (vie)
Soleil ne s'soucie pas de pluie
J'n'écoute pas les ""on dit"", y a pas d'hasard, que des Eden (#BelgiumVie)
Négro, je sais qu't'es condamné mais pas coupable
J'suis dev'nu riche, j'vais rach'ter ton âme au Diable
Comme maquisard : sans ligne de défense et j'me bagarre
Plein Mont des Arts, dans la défonce, tard le soir
Selon ses dires, j'suis comme un lâche, car je r'viendrai pas
Y a une différence entre tourner la page et baisser les bras
Un ""tiens"" vaut mieux que deux ""tu l'auras""
Viens on baise, après on verra qui le saura
[Pont]
J'regrette l'époque de ""Débrouillard""
Jeune négro rêvant de moula
Galère de stud', plein de coups bas
J't'aimerai avec ou sans le foulard

[Refrain]
Maman, j'fais plus d'études, j'suis dans le tiekson
J'suis dealer, j'suis dealer (j'suis dealer, j'suis dealer)
Chérie, phone pas les stups, j'suis dans bail bre-som
J'suis dealer, j'suis dealer (j'suis dealer, j'suis dealer)
De bonne famille, là d'où je viens, la vie m'laisse sur la faim
Je prends des risques, fais du chiffre, shit brun
Personne me tient la main, j'ai plus d'cash, plus rien
J'ai si peur, j'ai si peur (j'ai si peur, j'ai si peur)

[Outro]
J'suis dealer, j'suis dealer (j'suis dealer, j'suis dealer)
J'ai si peur, j'ai si peur (j'ai si peur, j'ai si peur)
Damso, dis-leur13Embed"
Damso,6753239,4881589,45855,Damso,https://images.genius.com/dedd2737025606423d012b43b3a3b9a0.300x300x1.jpg,Φ. THEVIE RADIO,https://genius.com/Damso-thevie-radio-lyrics,182207,"Φ. THEVIE RADIO Lyrics[Paroles de Φ. THEVIE RADIO]

[Intro]
*grésillements de radio*

[Couplet 1]
J'suis pas dans mon meilleur état, j'écris pour pas faire de dégâts
Sinon j'risquerais d'éclater des têtes avec un Beretta
La vie commence quand y a un cœur qui bat, s'arrête quand y a plus d'bip
C'est quoi le fric si c'n'est le choix d'avoir encore plus le choix ?
Les embrouilles, les clashs sur Insta', j'les vois plus, j'regarde devant moi
Les blablas sur c'que je n'suis pas, j'n'écoute pas, j'ai plus d'cinq cents K
Tu m'aimes pour c'que j'suis devenu donc tu m'aimes pour c'que je n'suis pas
T'es parti puis t'es revenu, les amis comme toi j'n'en veux pas
J'ai personne à qui dire ""je t'aime"", tout l'monde à qui dire ""nique ta mère""
Soit ronde et bleue n'est pas la Terre, soit les problèmes viennent de moi
En vrai, ne signe pas en maison, sauf si t'es seul et à la rue
Parce que quand tu comptes sur les gens, ils finissent par te décevoir

[Sample]
[?] (Oh-oh-oh-oh-oh-oh)
[?] (Yeah-eh-eh-eh-eh-eh)

[Couplet 2]
Yeah, j'me vois dans tes yeux, j'm'apprécie
Mais se voir à deux, j'suis indécis, après si
On l'fait vite fait sans être précis, sur nos sentiments
C'qu'on ressent tout en laissant notre histoire rétrécir
Mais tu réfléchis trop, mais tu réfléchis qu'aux
Problèmes que ça engendrera
Ton cœur est une gendarmerie, cherchant l'ex qu'il condamnera
Comprenez-moi Dieu, j'fais tout ce que je peux, j'fais comme tes faux cheveux
J't'aide à t'sentir mieux, à travers d'autres yeux
Mon salaire a d'autres voeux que d'finir à deux, vieux, Dems
Viens dans mon secteur, tu comprendras p't-être mes peurs
Mes peines de cœur, mes traînées d'sueur, de séducteur
Un bouquet d'fleurs, fané par le temps d'attente du prince charmant que j'tais censé être
Au lieu d'ça, j'suis qu'le garde champêtre de l'être, censé l'être avec toi
Ton amour, je l'envie, mon amour, je t'en prie
J'veux qu'tu m'haïsses autant que tu m'aimes
""C'est quoi le problème ?"" C'est trop personnel
Oh la la
[Refrain]
J'suis parti sur le terrain de l'abstinence
Le sexe est un venin pour la patience
J'suis parti sur le terrain de l'abstinence
Mais j'ne vois pas comment pas t'décevoir
J'suis parti sur le terrain de l'abstinence
Le sexe est un venin pour la patience
J'suis parti sur le terrain de l'abstinence
Mais j'ne vois pas comment pas t'décevoir

[Pont]
Tchiki-tchiki-tchiki changement d'ambiance, nwaar
Back to the sale, la violence, Dems
Sale, ah bah oui, ah bah oui
([?])

[Couplet 3]
Un putain d'joint entre l'pouce et l'index, je tire sur un pers'
Je tousse dans la caisse, la vie en rose que quand j'fume de la verte
Pas d'trop d'paramètres, un tête-à-tête on l'fait pas sur le net
Ouzbèke, j'la ramène, odeur de shit pour décrire mon haleine
J'suis dans l'arène, l'arena, #Vie sur macarena
J'suis tout c'qui n'fallait pas, premier du top donc j'vais pas par étapes
J'veux voir la fin d'ma vie à l'avance
Pour savoir si mes efforts ont toujours un sens
[Outro]
TheVie Radio, la radio sale, la radio nwaar
Ah oui, oui
*grésillements de radio*5Embed"
Damso,3738904,1904943,45855,Damso,https://images.genius.com/88359e6c58b6ffd04a45dc42874c12e2.300x300x1.jpg,Festival de rêves,https://genius.com/Damso-festival-de-reves-lyrics,180620,"Festival de rêves Lyrics[Paroles de ""Festival de rêves""]

[Intro]
Yeah
La mort, la mort, la mort
A sonné pour eux
""Ding dong""
Hey

[Couplet 1]
La mort, la mort, la mort (yeah)
Une vie, un gun, un corps (yeah)
Menottes ou chaînes en or ? (Yeah)
Boréale est l'aurore
La drogue, la drogue encore (oui)
Pourquoi changer mon sort ? (oui)
Un parfum inodore (oui), une douleur indolore
Le ciel, le ciel, le ciel (oui), un festival de rêves
Cke-bla, que blancs, rebeus
Un pax, du shit, d'la beuh (fire)
Ainsi soit-elle (oui)
Encore, encore plus fort (plus fort)
De l'aube, du soir, d'la veille
L'espoir de jours heureux

[Pont]
Bédo (un stick, du shit)
Bédo (un kilo d'beuh)
Bédo (smoke, smoke, smoke, hey)
Hey
[Couplet 2]
Le monde, le monde, le monde
Un pavillon de haine (colère)
Une succession de scènes (atmosphère)
De nuages à mer bleue (yeah)
Yeah
O.G fort névrosé veut sa dose pour s'alimenter
O.G fort défoncé car sa dose est fort pimentée
O.G fort névrosé, à sa dose, est alimenté
Maîtresse, un gosse qui gêne
Un cri, un cœur qui saigne
À terre, eau, vent et feux (oui)
Espoirs de jours heureux
Le ciel, le ciel, le ciel (oh oui)
Un festival de rêves (oh yeah)
Cke-bla, que blancs, rebeus (oh oui)
Un pax, du shit, d'la beuh

[Outro]
C'est bon8Embed"
Damso,2643109,67668,45855,Damso,https://images.genius.com/4a23b4387dfa6d874a6de7f7c170838f.300x169x1.jpg,Peur d’être sobre,https://genius.com/Damso-peur-detre-sobre-lyrics,180443,"Peur d’être sobre Lyrics[Paroles de ""Peur d'être sobre""]

[Intro]
Damso
Genius League

[Couplet 1]
Posé dans l'quartier, j'suis déchiré
Spliff et drogue dure, j'tise everyday
Mais j'pense à réduire ma conso
Car j'fume de trop, la gue-dro m'fait léviter
Les keufs eux m'ont serré, j'ai tout nié
La femeu d'hier, j'l'ai oubliée
Million de questions qu'elle me pose
Je prends jamais d'fleurs, j'l'envoie qu'dans les rosiers
Défoncé, j'suis pété, je chill
Négro, laisse-moi vivre mon dream
Sa tte-cha comme plaine de jeux
J'l'envoie dans les cieux, j'suis scolaire et férié
Recherche finance dans le crime
Peut-être devrais-je changer de SIM
La police nous questionne
Les dealers nous pistonnent
J'me déf' dans le club et mes sons passent en entier

[Pré-refrain]
Absorbé par une drogue absurde, j'pense qu'à fuir le monde
Sur les ondes j'me réfugie, j'pense qu'au fond j'ai peur d'être sobre
Tant d'blessures, éraflures
A vive allure, je vis, j'évacue
Vices et vertus, Tise et verdure
Négro, sans quoi c'est la mort
[Refrain]
Comment font-ils pour ne pas boire autant que moi ?
Comment font-ils pour ne pas fumer autant que moi ?
Comment font-ils pour ne pas boire autant que moi ?
Comment font-ils pour ne pas fumer autant que moi ?
La drogue dure dans les vaisseaux sanguins
J'suis vulgaire façon Mérovingien
L'alcool pur dans les vaisseaux sanguins
J'ai peur d'être sobre

[Couplet 2]
Damso, mothafucka, OPG Gangst'
Dis-moi qui est le meilleur dans le game
Ces nizzos font qu'pomper nos flows
Ces nizzos pompent la vie qu'on mène
La pote-ca ne sera jamais assez grosse
Pour baiser c'putain d'mothafuckin' rap jeu
Ces rappeurs n'ont plus le level
Le majeur dans le cul de ces niggas
J'suis venu, j'ai bu, j'me souviens plus, j'ai trop tisé
Gros cul et cheveux frisés
Drogue dure, les yeux plissés
Sombres et obscures sont mes idées
J'suis là, j'suis frais, ouais, j'suis Damso
Romantique malgré moi
Elles s'mettent à côté quand je peura
Pour entendre le bruit des backs, car j'ai trop d'flow
Bordel homie
J'n'arrête pas de boire des litres, car j'ai peur d'assumer sa vraie physionomie
J'l'a lui mets dans le dar et je gicle, elle s'devait de goûter à la Damsodomie
Défoncé, la réalité je fuis
Si c'est ça la mort elle vaut bien mieux qu'la vie faite d'embrouilles à minuit
[Pré-refrain]
Absorbé par une drogue absurde, j'pense qu'à fuir le monde
Sur les ondes j'me réfugie, j'pense qu'au fond j'ai peur d'être sobre
Tant d'blessures, éraflures
A vive allure, je vis, j'évacue
Tise et verdure, vices et vertus
Négro, sans quoi c'est la mort

[Refrain]
Comment font-ils pour ne pas boire autant que moi ?
Comment font-ils pour ne pas fumer autant que moi ?
Comment font-ils pour ne pas boire autant que moi ?
Comment font-ils pour ne pas fumer autant que moi ?
La drogue dure dans les vaisseaux sanguins
J'suis vulgaire façon Mérovingien
L'alcool pur dans les vaisseaux sanguins
J'ai peur d'être sobre7Embed"
