artist,id,lyrics_owner_id,primary_artist_id,primary_artist_name,song_art_image_thumbnail_url,title,url,pageviews,lyrics
Lil Wayne,105686,137171,4,Lil Wayne,https://images.genius.com/15f2a63514b5538d41faac7d38160b2e.300x300x1.png,Love Me,https://genius.com/Lil-wayne-love-me-lyrics,3027355,"Love Me Lyrics[Pre-Chorus: Future]
I'm on that good kush and alcohol (Mike WiLL Made-It)
I got some down bitches I can call (What's hatnin'?)
I don't know what I would do without y'all
I'ma ball 'til the day I fall (I'ma ball, ball, ball)

[Chorus: Drake & Future]
Yeah, long as my bitches love me (Yeah, yeah; yeah, yeah)
I can give a fuck 'bout no hater
Long as my bitches love me (Yeah, yeah; yeah, yeah; yeah, yeah)
Yeah, I can give a fuck 'bout no nigga
Long as these bitches love me

[Verse 1: Lil Wayne]
Uh, pussy-ass nigga, stop hatin'
Lil Tunechi got that fire
And these hoes love me like Satan, man
Yeah, fuck with me and get bodied
And all she eat is dick
She's on a strict diet, that's my baby
With no makeup, she a ten
And she the best with that head
Even better than Karrine
She don't want money
She want the time that we could spend
She said, ""'Cause I really need somebody
So tell me you're that somebody""
Girl, I fuck who I want, and fuck who I don't
Got that A1 credit, that's that filet mignon
She said, ""I never want to make you mad
I just want to make you proud""
I said, ""Baby, just make me cum
Then don't make a sound""
Slick Tunechi
[Pre-Chorus: Future & Lil Wayne]
I'm on that good kush and alcohol (Yeah)
I got some down bitches I can call (What's hatnin'?)
I don't know what I would do without y'all
I'ma ball 'til the day I fall (I'ma ball, ball, ball)

[Chorus: Drake, Future, & Lil Wayne]
Yeah, long as my bitches love me (My bitches love me) (Yeah, yeah; yeah, yeah)
I can give a fuck 'bout no hater
Long as my bitches love me (My bitches love me, my bitches love me, my bitches love me) (Yeah, yeah; yeah, yeah; yeah, yeah)
Yeah, I can give a fuck 'bout no nigga
Long as these bitches love me

[Verse 2: Lil Wayne]
Uh, real nigga, fuck these haters
These hoes got pussies like craters
Can't treat these hoes like ladies, man
Pussy, money, weed, codeine
She said my dick feel like morphine
I hope my name taste like sardines to these niggas
She wake up, eat this dick
Call that breakfast in bed, 69, 96
I feel her heartbeat, I chest-to-chest with this bitch
Now turn around, face down; I'm arrestin' this bitch
Yeah, all my bitches love me, and I love all my bitches
But it's like as soon as I cum, I come to my senses
And I would say these hoes' names
But then I would be snitchin'
And these haters try to knock me
But they can't knock me off the hinges
Lil Tunechi
[Pre-Chorus: Future & Lil Wayne]
I'm on that good kush and alcohol (Yeah)
I got some down bitches I can call (What's hatnin'?)
I don't know what I would do without y'all (I don't know what I would do without y'all)
I'ma ball 'til the day I fall (I'ma ball, ball, ball) (I'ma ball)

[Chorus: Drake, Future, & Lil Wayne]
Yeah, long as my bitches love me (My bitches love me) (Yeah, yeah; yeah, yeah)
I can give a fuck 'bout no hater
Long as my bitches love me (My bitches love me, my bitches love me, my bitches love me) (Yeah, yeah; yeah, yeah; yeah, yeah)
Yeah, I can give a fuck 'bout

[Bridge: Lil Wayne]
I lost a few good bitches, met some more bad bitches
And I be schooling them niggas, pose for your class picture
Now kiss my ass if you hatin', I'm getting ass, or I'm skatin'
I lost a few good bitches, met some more bad bitches
And I be schooling them niggas, pose for your class picture
Now kiss my ass if you hatin', I'm getting ass, or I'm skatin'
Bitch

[Pre-Chorus: Future, Lil Wayne, & Both]
I'm on that good kush and alcohol (Tunech)
I got some down bitches I can call (What's hatnin'?)
I don't know what I would do without y'all (I don't know what I would do without y'all)
I'ma ball 'til the day I fall (I'ma ball, ball, ball) (I'ma ball)
[Chorus: Drake, Future, & Lil Wayne]
Yeah, long as my bitches love me (My bitches love) (Yeah, yeah; yeah, yeah)
I can give a fuck 'bout no hater
Long as my bitches love me (My bitches love me, my bitches love me, my bitches love me) (Yeah, yeah; yeah, yeah; yeah, yeah)
Yeah, I can give a fuck 'bout no nigga (Yeah)
Long as these bitches love me244Embed"
Lil Wayne,3075914,3390361,4,Lil Wayne,https://images.genius.com/0607dab9ef83679f9e3939ffb215a1a0.300x300x1.png,Mona Lisa,https://genius.com/Lil-wayne-mona-lisa-lyrics,2083040,"Mona Lisa Lyrics[Intro: Kendrick Lamar]
I got a story to tell, you know that I cherish thee
Hope it ain't too many feelings involved

[Refrain: Lil Wayne]
I see niggas in this bitch stuntin', poppin' bottles
Gettin' drunk with these bitches, and when they leave they get followed
Fall asleep with that bitch and really don't know much about her
Then she let us in, we take all of your shit, and when you wake up, she help you try to find it, I love it

[Verse 1: Lil Wayne]
I be with bitches that be with bitches that be with niggas with riches
I tell her, ""Get him,"" she say, ""I got you,"" I say, ""No, bitch, I said get him""
And they so pretty, and they hair lengthy, he hit it and sleep on her titties
Then she give us the word, we come through with AKs, it's a stick-up, she scream like a victim
Now you feelin' so silly, I smoke color purple, I'm up in here feelin' like Celie (Ooh)
Nappy-ass dreads, what's that you say? Watch your mouth, Milli Vanilli (Ooh)
You can get snaked, you can get faked out by the bitch that you feelin'
'Cause you thought that she was an angel, that bitch ain't no angel, I treat her halo like a frisbee
And you tellin' your business, she tell me your business, you tell that bitch what you feelin'
All of the beans you be spillin', to you, she lie through her teeth cavities, fillin's
She know where you hide it tell me where it's hidden, she know when you're gone, tell me when to visit
We break in your home and take the specifics, and meanwhile, the bitch is on vacation with him
So she don't get blamed, we don't snatch chains, we find out addresses, and we don't leave messes
You'll only know that it's gone when you checkin', then your first thought is to start second guessin'
She say, ""What's wrong?"" He say, ""Nothin', keep restin',"" she say, ""What's missin'?"" ""How you know somethin' missin'?""
He scratch his head, she say, ""Get back in bed,"" and she gave him some head
Boy, you can't trust them bitches, and then she say, ""Ooh""
[Refrain: Lil Wayne]
I see niggas in this bitch stuntin', poppin' bottles
Gettin' drunk with these bitches, then when they leave they get followed
I be with bitches that know the bitches that's with the niggas we followin'
Get them on the line, stay two cars behind and tell them hoes, ""Don't be so obvious!""
Mona Lisa, long hair, don't care
She handle the business and don't ever tell, she bite the bullet and cough up the shells
She tell 'em, ""Ooh, daddy, let's go to your place,"" and if he say yeah, then we meet him there
She feed him lies with his silverware, she don't want love, she just want her share

[Verse 2: Lil Wayne]
I know a bitch named Liz, this nigga think she his 'cause she tell him that it is
So he tell her all his secrets, he tell her all his fears, and then she tell me and I be all ears
And then I go and tell my people, and they already know him, and then I call Liz, and she say he comin' over
I say, ""Good girl, just remember what I told you,"" she gave me the salute, I say, ""Girl, you're a soldier""
We're waitin' outside, watch him pull up, walk up to the door and right before he knock
She open the door naked, she left it unlocked, they started French kissin' so he didn't see moi
And then she let him in, they stopped on the couch, music up loud with his head in the clouds
Turn that shit down, and I scared the piss out of him, piss a nigga off, put a gun to his frown
""Nigga, turn around, I ain't here to fuck around, I ain't here to fuck around, caught you wit' your pants down
You know what it is, put your fuckin' hands up, Liz, that's enough, you can put your hands down""
And then he looked dead at her and he shook his head at her, she a good actress, and you a dead actor
You'll be dead after we get what we're after, if Liz call you daddy, she about to be a bastard, oh
I got way too many bitches that do anything for me, nigga, but think for me, nigga
Send her to you like she ain't for me, nigga, I hope you alone like bankruptcy, nigga
She pour you a drink, that drank on me, nigga, she slip somethin' in it, now faint for me, nigga
Mona Lisa, I done painted the picture, Mo-Mona Lisa, out the frame on these niggas
Pussy got you out of character, nigga, you fall for these hoes off your ladder, my nigga
Take everythin' that you have 'til you don't even have an opinion, we have your attention
And now you're lookin' down a barrel though, nigga, now she lookin' for her pantyhose, nigga
We just lookin' for the casserole, nigga, but she gon' show us where you stash it though, nigga (Mona)
[Verse 3: Kendrick Lamar & Lil Wayne]
Ah, every day she wake up with a different color makeup and a promise he gone take her to the movie and the mall
Chillin' with the Laker, on the floor, fourth quarter, four minute on the clock, Black Mamba with the ball
Paparazzi lookin' at 'em both poppin' up and take a picture, uh, probably on a Internet blog
In a minute, he gon' be admittin' that he love her on his mother, man, he want to meet her mother by tomorrow
(Mona Lisa) Pussy good enough, it got him sinnin' in the walls
And he diggin' in it like he livin' in it, make a new religion with it, man a nigga 'bout to go against God
Poetry in a pear tree, sweet tone like a hummingbird when she asked him
Did he want to make love in a yellow taxi? Never gave two fucks, jumped in the backseat
Woke up in the mornin' to The Great Gatsby, then he dogged it again like the bitch Lassie
I'm a dog in the wind, I'm a pit laughin', I'ma call up again like I did last week
Make good with the friend and I'm all jazzy, Britney with the twin and the girl Ashley
Found out that I fucked, he was unhappy, bitch, I never let the bullshit get past me
Better yet, I wanna break up, don't you ask me 'bout a motherfuckin' double standard, actin'
Fuckin' on another nigga, that's a negative alone, but you sucked his dick? That's just nasty
Matter of fact, bitch, gimme your phone! (No) You fuckin' with Wayne's? (No!)
Bitch, gimme your phone! (No! Let me, let me take this call real quick) (… lick me like a lollipop)
He on your fuckin' ringtone? Is that the shit that you do? Touchin' yourself, lookin' at Kendrick videos
Jump on the internet, watchin' his interviews, I don't know what the fuck lately got into you
Tell me who love you, I bet I love harder, forgot all the shit that I did for your daughter?
The Pampers, the Pedialyte and my momma, daycare after school and she never did charge you
You scandalous as fuck and I hope you blow up, you know what? I give up, let me go get my gun
I got one in the chamber I'm plannin' on aimin', goddammit, you know that the damage is done
Bitch, I'm emotional 'cause I'm in stress, I'm not supposed to go through this, I guess
So in conclusion, since you like rappers that's killin' that pussy, I'm killin' myself
[Outro: Lil Wayne and Kendrick Lamar]
She say, ""Ooh, Daddy, ooh,"" Mona Lisa, Mona Lisa
Ooh, fake smile (Ooh), Mona Lisa, Mona Lisa
She say, ""Ooh,"" no emotion (Ooh), Mona Lisa, Mona Lisa
Now he get the picture, Mona Lisa, Mona Lisa, yeah197Embed"
Lil Wayne,419570,104344,4,Lil Wayne,https://images.rapgenius.com/8540a54d6dddddea744734f3aa5b73cc.300x300x1.jpg,Believe Me,https://genius.com/Lil-wayne-believe-me-lyrics,2059509,"Believe Me Lyrics[Produced by Boi-1da and Vinylz]

[Chorus: Drake]
I'm the only one that get the job done
I don't know a nigga that could cover for me
Yeah, got some game from my dad
He said she might say she love me
She don't love me like she say she love me
Believe me, believe me
I'm that nigga, boy they love me in the streets
I'm not tryna find nobody else to beat
I'm the one they come to see because they all
Believe me

[Verse 1: Drake]
Yeah, rip, rip rip
It's been me and Young Tune off the rip
That's the man that put me in this shit
If a nigga fuck with him, I'll put him down quick
Got a verse for anybody wanna talk about the clique
I've been takin' shit light, you don't wanna hear me trip
God damn, do y'all really know who y'all fuckin' with?
Yeah, I mean you can't blame me for wonderin'
Doesn't matter, could be winter or the summer
On the road, I do One Direction numbers, I don't fuckin' miss
Yeah, Stunna and Mack know
When Wayne was gone for eight months, we put this thing up on our back
And I was snappin' off on every single track though
Collect call from the boss like where we at though
I was like, ""Hah, it's our time, nigga""
He left Rikers in a Phantom, that's my nigga
And I'll been rockin' with the team 'til Carter IX
And we YMCMB, waitin' on somebody to try us, nigga
Yeah
[Chorus: Drake]
I'm the only one that get the job done
I don't know a nigga that could cover for me
Yeah, got some game from my dad
He said she might say she love me
She don't love me like she say she love me
Believe me, believe me
I'm that nigga, boy they love me in the streets
I'm not tryna find nobody else to beat
I'm the one they come to see because they all
Believe me

[Verse 2: Lil Wayne]
Lord knows I'll murk one of these niggas, yeah
His and hers Ferraris, nigga
One for me, one for my daughter, nigga
Waitin' for someone to test me like a Harvard nigga
I tote a 223, two Michael Jordans, nigga
Come on, fight these shell cases like a lawyer, nigga
Find out where you stay, and act like we found some oil, nigga
Out of duct tape so when he prayin' I ignore the nigga
All I gotta say is ""sayonara, nigga""
Drop dead gorgeous but the bitch ain't dyin' for a nigga
Where the real queens at? Shout out Capone and Noreaga
We can shoot it out and see who live to tell the story later
Diamonds in my Rollie face cannot be exfoliated
They think I'm associated, I'm the one that orchestrated
Yayo get her ass whipped, whip that ass like horses racin'
Ain't 'bout what you walk away from, it's 'bout what you walk away with
Dead Presidents, them coffins vacant
I must be doin' somethin'
[Chorus: Drake]
I'm the only one that get the job done
I don't know a nigga that could cover for me
Yeah, got some game from my dad
He said she might say she love me
She don't love me like she say she love me
Believe me, believe me
I'm that nigga, boy they love me in the streets
I'm not tryna find nobody else to beat
I'm the one they come to see because they all
Believe me

[Verse 3: Drake]
Had to get it poppin' off the rip
Rich young nigga that ain't never had to trick
Slim Thug flow but you know I like 'em thick
If she get a job at DOA, I drop her off a tip
I had to get it poppin' off the rip
I'm the one they tell yah been reppin' in the 6
Come into the city and yah niggas get to trippin'
We'll take yah to the Scarborough Bluff and drop you off a cliff
Well damn, just be happy for the man
Nirvana, Coldplay, nigga got bands
Ink from the money, got it all over my hands
Goin' out to Houston, spendin' all of my advance
V Live just took me for a cheque
""Drake you know I love you, you just took me outta debt""
Yes, right now you are lookin' at the best
Mothafuck award shows and mothafuck the press like that
[Verse 4: Lil Wayne]
Mothafuck the rest
When they jumped off the porch, I was stumblin' up the steps
I'd give what I collect before I give up my connect
It'd be a cold day in Hell, icicles made of sweat
One finger, slidin' 'cross my neck
Niggas know what that mean like they deaf
Nigga I'll fire this nina like it's her first day
On the job and the bitch overslept
Tune stay humble, nigga I'm a king
Need a horn and a drumroll
They throw mothafuckin' roses at my feet, nigga
I don't step on one rose
I'm the only one that get the job done
I don't know a nigga that can cover for me
Tape a couple kilos to the bitch stomach
She look like she got a bun in the oven from me
Preheat, believe me
All you gotta do is pay me every week
I had these bitches havin' babies every week
I'm the nigga, see me skatin' in the streets
Gone

[Outro: Drake]
Rip rip, nigga1.7KEmbed"
Lil Wayne,2635,12,4,Lil Wayne,https://images.genius.com/92ba1ce8cea6ee8072d676b11dda1d0c.300x300x1.jpg,6 Foot 7 Foot,https://genius.com/Lil-wayne-6-foot-7-foot-lyrics,1835633,"6 Foot 7 Foot Lyrics[Chorus: Harry Belafonte]
Six-foot, seven-foot, eight-foot bunch
Six-foot, seven-foot, eight-foot bunch

[Verse 1: Lil Wayne]
Ahem, excuse my charisma, vodka with a spritzer
Swagger down pat; call my shit Patricia
Young Money militia and I am the commissioner
You no wan' start Weezy ‘cause the 'F' is for finisher
So misunderstood, but what's a world without enigma?
Two bitches at the same time; synchronized swimmers
Got the girl twisted ‘cause she open when you twist her
Never met the bitch, but I fuck her like I missed her
Life is the bitch, and death is her sister
Sleep is the cousin—what a fuckin' family picture
You know Father Time, and we all know Mother Nature
It's all in the family, but I am of no relation
No matter who's buyin', I'm a celebration
Black and white diamonds; fuck segregation
Fuck that shit, my money up, you niggas just Honey Nut
Young Money runnin' shit, and you niggas just runner-ups
I don't feel I done enough, so I'ma keep on doin' this shit
Lil Tunechi or Young Tuna Fish

[Chorus: Harry Belafonte]
Six-foot, seven-foot, eight-foot bunch
Six-foot, seven-foot, eight-foot bunch
[Verse 2: Lil Wayne]
(I'm goin' back in…)
Okay, I lost my mind, it's somewhere out there stranded
I think you stand under me if you don't understand me
Had my heart broken by this woman named Tammy
But hoes gon' be hoes, so I couldn't blame Tammy
Just talked to Moms, told her she the sweetest
I beat the beat up; call it self-defense
Swear, man, I be seein' through these niggas like sequins
Niggas think they He-Men, pow, pow, the end
Talkin' to myself because I am my own consultant
Married to the money, fuck the world; that's adultery
You full of shit, you close your mouth and let yo' ass talk
Young Money eatin', all you haters do is add salt
Stop playin', bitch, I got this game on deadbolt
Mind so sharp I fuck around and cut my head off
Real nigga all day and tomorrow
But these motherfuckers talkin' crazy like they jaw broke
Glass half empty, half full, I'll spill ya
Try me and run into a wall; outfielder
You know I'ma ball 'til they turn off the field lights
The fruits of my labor, I enjoy 'em while they still ripe
Bitch, stop playin', I do it like a king do
If these niggas animals, then I'ma have a mink soon
Tell 'em bitches I say put my name on the wall
I speak the truth, but I guess that's a foreign language to y'all
And I call it like I see it, and my glasses on
But most of y'all don't get the picture 'less the flash is on
Satisfied with nothin', you don't know the half of it
Young Money, Cash Money
Paper chasin', tell that paper, ""Look, I'm right behind ya""
Bitch, real Gs move in silence like lasagna
People say I'm borderline crazy, sorta kinda
Woman of my dreams, I don't sleep so I can't find her
You niggas are gelatin, peanuts to an elephant
I got through that sentence like a subject and a predicate
Yeah, with a swag you would kill for
Money too strong; pockets on bodybuilder
Jumped in a wishin' well, now wish me well
Tell 'em kiss my ass, call it kiss and tell
[Verse 3: Cory Gunz]
Word to my mama, I'm out of my lima bean
Don't wanna see what that drama mean
Get some Dramamine
Llama scream, hotter than summer sun on a Ghana queen
Now all I want is hits, bitch, Wayne signed a fiend
I played the side for you niggas that's tryna front, and see
Son of Gun, Son of Sam, you nigga's the son of me
Pause for this dumber speech, I glow like Buddha
Disturb me, and you'll be all over the flo' like Luda
Bitch, I flow like scuba, bitch, I'm bold like Cuba
And I keep a killer ho, she gon' blow right through ya
I be mackin', 'bout my stackin', now I pack like a mover
Shout to ratchet for backin' out on behalf of my shooter
Niggas think they high as I, I come laugh at your ruler
Cash Money cold, bitch, but our actions is cooler
Wayne, these niggas out they mind
I done told these fuck niggas so many times
That I keep them bucks steady on my mind
Tuck these, I fuck these on your mind, pause
To feed them, on my grind, did I get a little love
Keep throwin' my sign in the middle
Hit 'em up, piece on my side
‘Cause ain't no peace on my side, bitch
I'm a man, I visit urinals abroad
Tune told me to, I'm shootin' when the funeral outside
I'm uptown, thoroughbred, a BX nigga, ya heard? Gunna180Embed"
Lil Wayne,54727,28180,4,Lil Wayne,https://images.rapgenius.com/bfcc114fb9fc4d79987c96df2f12a688.300x300x1.jpg,Mirror,https://genius.com/Lil-wayne-mirror-lyrics,1448349,"Mirror Lyrics[Intro: Lil Wayne]
Uh, with everything happening today
You don't know whether you're coming or going, but
You think that ya on your way
Life lined up on the mirror, don't blow it

[Verse 1: Lil Wayne]
Woah, look at me when I'm talking to you
You looking at me but I'm looking through you
I see the blood in your eyes
I see the love in disguise
I see the pain hidden in your pride
I see you're not satisfied
And I don't see nobody else
I see myself, I'm looking at the

[Chorus: Bruno Mars & Lil Wayne]
Mirror on the wall (Woah)
Here we are again (Yeah)
Through my rise and fall (Uh)
You've been my only friend (Yeah)
You told me that they can
Understand the man I am
So why are we here
Talking to each other again?
[Verse 2: Lil Wayne]
Uh, I see the truth in your lies
I see nobody by your side
But I'm with you when you're all alone
And you correct me when I'm looking wrong
I see the guilt beneath the shame
I see your soul through your window pane
I see the scars that remain
I see Wayne, I'm lookin' at the..

[Chorus: Bruno Mars & Lil Wayne]
Mirror on the wall
Here we are again (Yeah)
Through my rise and fall (Uh-huh)
You've been my only friend (My only friend)
You told me that they can't
Understand the man I am (They can't understand)
So why are we here (Misunderstood)
Talking to each other again? (Woah)

[Verse 3: Lil Wayne]
Looking at me now I can see my past
Damn, I look just like my fucking dad
Light it up, that's smoke and mirrors
I even look good in a broken mirror
I see my mama smile, that's a blessing
I see the change, I see the message
And no message coulda been any clearer
So I'm starting with the man in the...
[Chorus: Bruno Mars & Lil Wayne]
Mirror on the wall (MJ taught me that)
Here we are again
Through my rise and fall (Uh)
You've been my only friend (Take 'em to Mars, man)
You told me that they can
Understand the man I am
So why are we
Talking to each other again? (Uh)
Mirror on the wall (Woah)
Here we are again (Yeah)
Through my rise and fall
You've been my only friend (Any questions?)
You told me that they can (I come to you)
Understand the man I am (You always have the answer)
So why are we here
Talking to each other again?

[Outro: Bruno Mars & Lil Wayne]
Mirror on the wall
Hey B.P, looks like I did take 'em to Mars this time
So why are we
Talking to each other again?126Embed"
