artist,id,lyrics_owner_id,primary_artist_id,primary_artist_name,song_art_image_thumbnail_url,title,url,pageviews,lyrics
Lil Wayne,2023398,1706849,4,Lil Wayne,https://images.rapgenius.com/e4cad6fd89a8bf683f612bc1ef21a38e.300x300x1.jpg,Glory,https://genius.com/Lil-wayne-glory-lyrics,418811,"Glory Lyrics[Produced by Avenue Beatz, Infamous and Onhel]

[Intro]
(Glory)

[Verse 1]
Woo, this that shit they didn't want me on
I'm 'bout to act a badonkadonk, shamone, shamone
Don't need sugar, I need cream, I'm dark and strong
The garbage man puttin' on cologne, aroma wrong
I'm on, I'm on, this that shit they didn't want
I act a ass and shit a skunk, I will, I won't
Black your eye like will.i.am, you Willy Wonka
That's me in the Lamb', I'm disappearin' like Jimmy Hoffa
AK-47 my business partner, business is swell
French kiss a bitch, she don't speak French, can't kiss and tell
I push his ass in a wishin' well, then wish him well
Sippin' syrup like ginger ale, but I'm the quickest snail
From here to Hell, I hear them hail, I give them hell
I'm spittin' hail, I'm Clinton, well, I did inhale
These niggas frail, they Chip and Dale, they little gals
Watch me act a donkey, then pin a tail, spit out your nails

[Interlude]
Uh, glory, hallelujah
Holy shit, I'm the holy shit, I'm God's manure
I know how to hack a jeweler ward and not computers
I meditate like a Buddhist, holy ramen noodles
And now you sleep, I'm inside your room wit' a lot of shooters
You wake up to this chopper tool, it's like, ""cock-a-doodle""
I'm awkward, cuckoo, I turn your Froot Loop to chocolate Yoo-Hoo
I'm hotter than Honolulu, glory unto you (Glory)
Glory
[Verse 2]
I'm awkward, cuckoo, I turn your Froot Loop to chocolate Yoo-Hoo
I'm hotter than Honolulu, my clothes and socks and shoes new
I been a boo-boo since ga-ga goo-goo and Dada, FUBU
Make everybody that knew you boo-hoo, I got them spooked too
I drive in neutral, shock the future like Dr. Luther
I'm not a chooser, your mom a cougar, I'll sock it to her
My cocaine white as a white beluga, I like bazookas
I'm high as lunar, I'm wilder than tigers, Nikes, Pumas
Woo, this that shit you didn't want me on
My weed louder than underarms and car alarms
Cheers, I said, ""Surprise,"" but couldn't party long
I got to get back to the grind and the drawin' board
But all this fuckin' artist drawin' is the art of war
These niggas soft as teddy bears, talk to Marky Mark
I wet your block, leave it a waterpark, broad or dark
I whip the work like tartar sauce, you want it hard or raw, huh?

[Interlude]
Uh, glory, hallelujah
Holy shit, I'm the shit, Porta-Potty Tunechi
Unload the Glock profusely when sortin' out confusion
Your motor mouth keep vroomin', I'm goin' Tony Stewart
I'm on the fluid, I'm ruined, I'm cold as Boston Bruins
Lost in the shoo-shoo and who's who and I lost influence
Lost my point of view 'til I find a mirror, start talkin' to it
It told me the truth, it said I'm the shit and you party poopin'
Lord, oh, Lord
[Verse 3]
Am I talkin' crazy? Too much coffee maybe
I smell like money, I know broke niggas feel nauseated
The broads elated, my boys are faded, my car's the latest
My bars the greatest, they rated X like Marvel made it
She caught the babies, she barfed the babies, they orphans maybe
We got that white girl like in the '80s, that Marcia Brady
I dicked Tracy like Warren Beatty, I'm warm as Haiti
I'm armed and lazy, I'm sprayin' until my arms is lazy
Pardon my mental, I'm higher than Continental
Went from flyin' cockroaches to flyin' without credentials
That's private, tell the pilot, ""Be quiet, we need our privacy""
Throw you off this bitch if you wired, justifiably
Hustle wit' a motive, you know this, I'm wit' my whoadies
No snakes, no rodents, no ad-libs, no chorus
No stress, no worries, hook you to a respiratory
It's self-explanatory, the glory is mandatory, glory

[Interlude]
Uh, glory, hallelujah
Holy shit, I can't hold this shit, my bowel's looser
My towel's newer, my powder room is for powder-users
You see rolled up dollar bills filled wit' snot and mucus
My tires Lucas, my driver's cruisin', my partner's ruthless
My flower's rootless, my pocket's roofless, she poppin' roofies
I'm not a student, I'm not assumin' I'm not a human
You are not immune to this kind of music, you got 'em, Tunechi
You got 'em, Tunechi, I got 'em
[Outro]
Glory, hallelujah (I got 'em)
(Glory)
I got 'em
(I got 'em)
I got 'em360Embed"
Lil Wayne,492278,672397,4,Lil Wayne,https://images.rapgenius.com/c16c4f9af39f92eb2ae06323afcb141b.300x300x1.jpg,Grindin’,https://genius.com/Lil-wayne-grindin-lyrics,388094,"Grindin’ Lyrics[Intro]
Grindin’, grindin’
Grindin’, grindin’
Grindin’, grindin’
Grindin’, grindin’

[Verse 1: Lil Wayne]
I’m grindin’, I’m grindin’, I’m grindin’ I promise
I fuck her until I get tired, retire and then come out retirement
My girl like it rough she said “find me a diamond”
Her body be grindin’
Lord we be on every kind of narcotic
That make us believe, when we lyin’, we honest, I love you
Pick, Michael Jackson to Jordan to Tyson to Myers
Too much dirty money when the colors
Are washing the whites in the dryer my nigga
It ain’t rocket science just rockets
I sleep in pussy not pajamas, grindin'
I got this shit down to a science, I turn in my project, A minus
Whew, I ain’t crazy, I’m krazy and all of my niggas chaotic
Dressed in all black like they gothic
Music too loud to hear sirens, we pop, pop, pop up where you stay
Knock, knock, knock, anyone home?
Pop, pop, pop, pop then we outtie
I need a bitch like Naomi to take off her clothes like Leilani for niggas that’s grindin’
[Chorus: Lil Wayne]
Nigga I’m grindin’ for all my shit
Grindin’ for all my shit
Yeah, I’m grindin’ for all my shit
I put time into all this shit
Man, I’m grindin’ for all my shit
I’m grindin’ for all my shit
Perfect timing with all my shit
I’m grindin’ for all my shit

[Verse 2: Lil Wayne]
The feds be spying on all of us nigga
These hoes be lying to all of us nigga
I got news for the monogamous niggas
Yo' bitch fucking anonymous niggas
I done seen it all my nigga
'Cause these hoes seeing all of my niggas
'Cause what’s the hottest shit on these corners?
That’s me and all my niggas
Grind for all this shit, I ain’t ever fall for that bitch
'Cause picking up the feather from a lovebird
Is like a medicine ball to that bitch
We'll bring Gucci bag in this bitch
And you know what's stashed in that bitch
These niggas walk around with they chests out
Like Janet Jackson and shit
I’m sweatin’ grindin’ this bitch, I need a shrine in this bitch
Fuck double O seven, I work twenty-four seven
Ain’t got time to bond with no bitch
Heard Jay Z got a new Cognac, where to find that shit?
The weed sticky, grind that shit
Where I got it from? Nevermind that shit
Nigga, I'm grindin'
[Chorus: Lil Wayne]
Nigga I’m grindin’ for all my shit
Grindin’ for all my shit
Yeah, I’m grindin’ for all my shit
I put time into all this shit
Man, I’m grindin’ for all my shit
I’m grindin’ for all my shit
Perfect timing with all my shit
I’m grindin’ for all my shit

[Verse 3: Drake & Lil Wayne]
Yeah
I got a new vision for all my shit (for all my)
I don’t know what to call that shit (don’t know what to call it)
I know, I’m selling all of my cars
I’m selling all of my watches
I’m selling diamonds and all of that shit
Realized I don’t need that shit (don’t need it)
I’m a different breed with this shit (yeah)
I’m tryna turn M’s to B’s in this bitch (yeah)
And I ain’t ever pay to be with no bitch (woo!)
I, I, I want that Brigitte Bardot hanging over my bed
Fifty mill' in one room (huh?)
You, you could ask anyone out here who running the game?
And they’ll tell you the truth, man, they tell you (and they tell you)
Oh look, they fuck with me now (hey)
I think they’re hearin' me now (yeah)
Someone said, ""Nigga, they takin' you seriously now""
I’m like, ""I think they just might be scared of me now"" (might be scared of me now)
But it’s all good, niggas wrong every day (every day), niggas wrong every day (true)
Gone, goin' to LA where I’m tryna get high and do a song every day
Safe, we ain’t ever have to play it safe (nope)
I would rather stack it up and put it in a safe
Then peek inside the safe and see I’m runnin' out of space
Mothafucka, that’s grindin'
[Chorus: Lil Wayne]
Nigga I’m grindin’ for all my shit
Grindin’ for all my shit
Yeah, I’m grindin’ for all my shit
I put time into all this shit
Man, I’m grindin’ for all my shit
I’m grindin’ for all my shit
Perfect timing with all my shit
I’m grindin’ for all my shit

[Bridge: Lil Wayne]
(Grindin’, grindin’) Perfect timing
(Grindin’, grindin’)
(Grindin’, grindin’)
I would rather stack it up and put it in the safe
Then peek inside the safe and say I’m running out of space
Believe that

[Verse 4: Lil Wayne]
Scoob, find another oo-wop
Tell them niggas cool out
'Cause it can be a mohafucking shoot-out
Kidnap a nigga, beat the truth out
Moms pick the suit out
Top floor, window he get threw out
Deuce out, pussy bitches, deuce out
Flying out the crew out, they flew out
Invite 'em to my new house, my new house
I’m fucking every night up in my new house
'Cause bitch I worked too hard for this new house, grindin’
I’m fucking every night up in my new house
'Cause bitch I worked too hard for this new house, I'm grindin’
I’m fucking every night up in my new house
'Cause bitch I worked too hard for this new house, I’m grindin’

[Outro]
Twap, twap!
Twap, twap!
In the new house, we got the twap208Embed"
Lil Wayne,49157,28696,4,Lil Wayne,https://images.genius.com/4f426f2c10fcf7bcf51dc09125368d74.300x300x1.png,It’s Good,https://genius.com/Lil-wayne-its-good-lyrics,383881,"It’s Good Lyrics[Intro: John Miles]
You who are rich and whose troubles are few
May come around to see my point of view
What price the crown of a king on his throne
When you’re chained in the dark all alone?

[Verse 1: Jadakiss]
I’m real as they come, I follow the rules
I’m still in the hood but I probably should move
Made enough money, I don’t fuck around
I just felt they needed me so I stuck around
Feds got my man, shit is real son
'Cause my godson just became my real son
Think life is a game but all you get is a turn
You live and you learn, either you freeze or you burn
Kush in the air, I’m pushin' the gears
Love turned into hate, hate turned into fear
If it ain't right, I don’t sign the deal
Shoot me in the watch, I got time to kill
Gasoline, propane
Ain't no salary cap in the dope game
Ain't no collective bargainin' on cocaine
So in other words, nigga, do your thing

[Verse 2: Drake]
Mind in one place, heart in another
Please pardon my brother, he’s just angry at you niggas
Who don't have your heart in your rap shit
And got too fuckin' comfy
'Cause we still fuckin' hungry, Young Money, got the munchies
Faded, fuckin' faded, aw yeah I'm fuckin' faded
They tellin’ lies about me, aw yeah, I must've made it
Rikers Island on this flow, eight months for that pistol
But at least they had some bad bitches workin’ in that shit hole
Three visits later, I went and did it major
So fuck the judge, and the jury, and the litigator
Watchin' all these kids who thought they had it figured out
And then November came, they let my nigga out
[Verse 3: Lil Wayne]
Uh, stop playin', I ain't with that bullshit
Niggas act like bitches, Sheneneh, oh my goodness
This is Wayne’s world, and y’all are just some tourists
Give me three wishes, I wish, I wish, I wish you would bitch
Brand new pussy, pussy good as baby powder
Two Glock .40's, nigga, you got 80 problems
Swimmin’ in the money, I'ma need some fuckin' goggles
It's better to give, but we don't give a fuck about 'em
I just came home, shit done got real, ho
Lil' Weezyana, the boot nigga, steel toe
I ain't workin' with a full deck but I deal, ho
I just touched down, kick the motherfuckin' field goal
Talkin ’bout baby money? I got your baby money
Kidnap your bitch, get that ""how-much-you-love-your-lady"" money
I know you fake, nigga, press your brakes, nigga
I’ll take you out, that’s a date, nigga
I'm a grown-ass Blood, stop playin' with me
Play asshole and get an ass whippin’
I think you pussy cat, ha, Hello Kitty
I just throw the alley-oop to Drake Griffin
I lay 'em down, Tempurpedic
This shits a game of chess, you niggas think it's cleavage
Its Young Money, yeah, tis the season
I give you the business, bitch this a business meetin'
My niggas hungry, my bitches greedy
Will I die a bloody murder? Dear Mr. Ouija
Nigga, I'm straight, my girl a faggot
Potato on the barrel, pop-pop-potato salad17Embed"
Lil Wayne,49158,27455,4,Lil Wayne,https://images.genius.com/4f426f2c10fcf7bcf51dc09125368d74.300x300x1.png,How to Hate,https://genius.com/Lil-wayne-how-to-hate-lyrics,377808,"How to Hate Lyrics[Produced by Andrew Lloyd and Young Fyre]

[Verse 1: T-Pain]
She owes me everything and she knows it
I've seen all the scenes in this movie, and she blows it at the end
She keeps talking to me, cause she knows that I'm a friend
But I can't keep hearing it over and over again
I was the one that you came to
When you broke up with your boyfriend, man, fuck him
Girl I was the one, that told you fuck them other niggas
And you still went and fucked them other niggas
Most people learn from the bad things
I hope that you learn and don't crash and burn in the fast lane
But if you read this letter then you caught me
This should explain all the ways that you taught me

[Hook: T-Pain]
How to hate a bitch that owe you everything
At least a wedding ring, moving on to better things
So don't you call me talking bout them other fools
I'm not good enough for you, I thought that we was cool
If you need a shoulder to cry on, girl I won't listen
I'm through fucking with these bitch ass bitches

[Verse 2: Lil Wayne]
And I don't love them hoes
But don't fuck up with Wayne cause when it ""Waynes"" it pours
No really, I'm on my ""fuck that bitch"" shit
You used to be the shit, but now you ain't shit, bitch
I had a red bone, but she be tripping though
All that bullshit is for the birds, she was pigeon toed
She used to always say, fuck my niggas
And when I went to jail, she fucked my niggas
Well, I guess I'm single for the night
And you can sit right on my middle finger for the night
And if I sound mad, then you caught me
But this shit explains that you're the one that taught me
[Hook: T-Pain]
How to hate a bitch that owe you everything
At least a wedding ring, moving on to better things
So don't you call me talking bout them other fools
I'm not good enough for you, I thought that we was cool
If you need a shoulder to cry on, girl I won't listen
I'm through fucking with these bitch ass bitches

[Verse 3: Lil Wayne]
Coconut Ciroc
Forgive and forget, bitch I already forgot
I'm over the bitch, and she over the top
They say love is the key, somebody changed the lock
Well, and I wish I never met ya
And I heard you're doing you, and you heard I'm doing better
And all I had to do was put two and two together
But that just makes four, but not forever, damn
So much for being the perfect couple
I put in overtime, I was working doubles
I wish you the best, good luck boo
Weezy F, for ""Fuck you""

[Bridge: T-Pain]
No ain't nothing going on
Girl I'm moving on, just take your ass home
Get away from here girl, I'm so glad you're gone
This is the last song I'm writing for you
Now I see how you can be
I don't want you 'round me all you do is down me girl
How many years I tried to get ya
Don't even text my phone when it hit ya, cause girl done taught me
[Hook: T-Pain]
How to hate a bitch that owe you everything
At least a wedding ring, moving on to better things
So don't you call me talking bout them other fools
I'm not good enough for you, I thought that we was cool
If you need a shoulder to cry on, girl I won't listen
I'm through fucking with these bitch ass bitches18Embed"
Lil Wayne,49156,670,4,Lil Wayne,https://images.genius.com/4f426f2c10fcf7bcf51dc09125368d74.300x300x1.png,President Carter,https://genius.com/Lil-wayne-president-carter-lyrics,363892,"President Carter Lyrics[Produced by Angel ""Onhel"" Aponte and Infamous]
[Intro]
God bless america...
- Carter, are you prepared to take the constitutional oath?
- I am...
- Will you place your left hand on the Bible and raise your right hand and repeat after me, I...

[Chorus]
President Carter, Pre-President Carter
President Carter, Pre-President Carter
President Carter, Pre-President Carter
President Carter, Pre-President Carter

[Verse 1]
Sitting on the world, I got life in my hand
So these days I try to think twice when I can
Money on my mind as God as my witness
Love don't live here and it don't even visit
I do this for my Uptown politicians
Walked in the kitchen and found a pot to piss in
Niggas ain't satisfied until they mama missin'
Niggas ain't satisfied until they mama miss 'em
Uh, I'm a monster, exorcisms
Tote tools like mechanics, mechanisms
Uh, detrimental on any instrumental
I say you rappers sweet I pay the incidentals
I'm beneficial, I've been official
I say you rappers sweet, tiramisu
I like my short cake shorter
Ain't no motherfucker harder than
[Chorus]
President Carter, Pre-President Carter
President Carter, Pre-President Carter
President Carter, Pre-President Carter
President Carter, Pre-President Carter

[Verse 2]
Nobody gives you a chance, you gotta take chances
Your family tree, I will break branches
Cause I don't give a fuck, I put the ass in assassin
Smoke you like a blunt then it's ashes to ashes
The future is born, put the past in the casket
If real shit is dead then nigga I'm a bastard
Uh, appetite for disaster
I want a full plate then another plate after
Uh, yesterday just died
Tomorrow never cried, the days of our lives
When shit get deep I'm never afraid to dive
Let the money pile up until I'm buried alive
Ask who the fuck want it, I bring it to your doorbell
Have niggas in ya yard like a yard sale
Smoking weed, getting head in the oval office
I changed the stars on the flag into crosses

[Interlude]
Amen, so now instead of pledge, we pray, yeah
[Chorus]
President Carter, Pre-President Carter
President Carter, Pre-President Carter
President Carter, Pre-President Carter
President Carter, Pre-President Carter

[Verse 3]
Ya dead to me, brown grass nigga
I just stand still and let the ground pass nigga
Bullshit for lunch, brown bag nigga
Reality’s a bitch and I'mma dance with her
140 pounds, 5'6 from the ground
Bitch I'm in the building you ain't even in the lounge
I tried to fuck the world and couldn't even get aroused
I ain't looking for the beef but I ain't seen it in a while
Uh, and we all want world peace
Murder show, I give your ass good seats
Shit, I'm much more than a good speech

[Outro]
Gorillas in suits
The holy war, the spiritual troops
Fighting over the mythical truth
Drowning in the political soup
They shoot missiles and nukes
Taking out such a pivotal group
The body count is the physical proof
And they thought drugs were killing the youth, [chuckles]
Thank you, thank you all, I am President Carter55Embed"
Lil Wayne,212834,149650,4,Lil Wayne,https://images.genius.com/aa4f93cf953aad46ecd13d3027b59fff.300x300x1.jpg,I’m Good (Dedication 5),https://genius.com/Lil-wayne-im-good-dedication-5-lyrics,361675,"I’m Good (Dedication 5) Lyrics[Intro: The Weeknd]
Everything I said I'd do, I did
I'm good, I'm good
Everything I said I'd do, I did

[Verse 1: The Weeknd]
But baby lets face it, I'm not into dating
I haven't been patient
Ever since I been famous my time has been racing
My motives are basic, this life I've been chasing
These hearts I've been breaking
And these girls I been tasting don't never get naked
They like it in a head lock fuck 'em from behind
Fuck 'em with their clothes on, put it to the side
Feelings to the side like a don do
Get 'em wet, let it slide like a sunroof
Got goals, got dreams, got a hotel-crib
Got niggas that'll die for the prince
Got my city on lock, XO 'til the death
Left town in a coach came back in a jet

[Bridge: The Weeknd]
I'm good, I'm not living like I did before
I'm good, I'm good, I said I'm good
Everything I said I'd do, I did
I'm good, said I'm good
Oh, I been good
I've been out there puttin' down that work
I'm good, said I'm good, I said I'm good
Everything I said I'd do, I did
I'm good, motherfucker I'm good
[Outro: Lil Wayne]
This is dedicated to everybody who forgot
Forgetful motherfuckers
Remember, don't you remember?
I been good, we good54Embed"
Lil Wayne,685086,104344,4,Lil Wayne,https://images.genius.com/c84ee812d9e99028d560054b386d4d9d.300x300x1.jpg,CoCo,https://genius.com/Lil-wayne-coco-lyrics,350246,"CoCo Lyrics[Intro]
(Juice808)
Look what you made me do
Me! That's who

[Pre-Chorus]
I'm sorry for the wait, I'm sorry for the wait (Tell 'em, tell 'em!)
Tha Carter gon' be late so I cooked up a tape (Tell 'em!)
The garden's full of snakes so I had to escape
Lil homie gon' be straight, lil homie gon' be straight!
Woo! OW!

[Chorus 1]
And this that Sorry 4 The Wait 2
Yeah, and I'm sorry for the wait, too
I told myself to save yourself
'Cause I can't save you (I can't save you)
I send my goons to kill somebody
I need head proof (I need head proof)
Fuck it (fuck it!) This that Sorry 4 The Wait 2
I ain't trippin', I got Barbie, I got Drake too (I ain't trippin'!)
I send my goons to kill somebody, I need head proof (Mula!)
Then they come through and sit it on my coffee table
Boop!

[Verse 1]
Who kept this shit together? Nigga, me, that's who (nigga, me!)
Who was there when niggas left us? Nigga, me, that's who
Cash Money is an army, I'm a one man army (yeah)
And if them niggas comin' for me, I'm goin' out like Tony
(Bap-bap-bap-bap)
Now I don't want no problems
I just want my money (want my money)
Ain't gotta hold no conversation
Nor my luggage (nor my luggage)
Tell whoever's countin' that I'm on a hundred
Woo, Birdman Junior – more like Ugly Duckling
[Bridge]
Takin' over, now I'm takin' over, yeah (now I'm takin' over)
Think it over? Bitch, I'm thinkin' forward, ta
I'm sippin' lean out a glass, nigga
All I got is Young Money – no more Cash, nigga, ayy!

[Hook 2]
And this that Sorry 4 The Wait 2
No more am I my brother's keeper – Cain and Abel
Young Money sharp, I'm still eatin'
I just chipped my tooth (Mula!)
Tell them niggas – no love lost, 'cause I ain't got shit to lose
I told myself to save yourself
'Cause I can't save you (I can't save you)
I send my goons to kill somebody
I need head proof (I need head proof)
I found the needle in the haystack, put the thread through
I tried to stitch the wound back up, but I just bled through

[Verse 2]
Yeah, it's compensation over conversation (no more conversation)
Lord, I must got blurry vision, a nigga's got two faces (amen)
Lord, this game is a vampire (woo!)
Blood, you gotta protect your neck
It'll suck you dry like raisins, Lord
But fuck that, nigga, got it drawn out
Fuck that nigga, I'ma ball out
The day you met me is the day Hell froze
On the day I left is when it thawed out (ayy!)
I'm still in the buildin'
I just had to knock a couple walls down, had to kick y'all out (ayy)
Life is a movie, but sometimes a nigga get too tired of watchin'
And walk out
[Bridge]
Takin' over, Lord I'm takin' over
Dropped the Sorry 4 The Wait until the wait is over
Sippin' lean out a flask, nigga
And all I do is smoke, fuck, and thrash, nigga, ayy!

[Hook 3]
And this that Sorry 4 The Wait 2 (sorry for the wait)
Fuck these haters, throw your board up if you skate too
I send my goons to kill somebody, I need head proof
Then they come through and sit it on my coffee table
Tunechi – niggas don't appreciate you (don't appreciate you)
You've been down since day one
It meant nothin' on day two (damn)
Sometimes the truth is hard to swallow, and to say, too
But I graduated from that bullshit, now I hate school

[Outro]
And now I'm takin' over, now I'm takin' over (takin' over)
The old me dead and gone, that's who I'm prayin' over
Might have to go back to slangin' yola 'til the wait is over
If so, then I got bakin' soda, I got bakin' soda...220Embed"
