artist,id,lyrics_owner_id,primary_artist_id,primary_artist_name,song_art_image_thumbnail_url,title,url,pageviews,lyrics
Lil Wayne,107498,30483,4,Lil Wayne,https://images.genius.com/1b99b69b978dc8af710fc38b538bc93c.300x300x1.png,Curtains,https://genius.com/Lil-wayne-curtains-lyrics,191300,"Curtains Lyrics[Intro: Lil Wayne]
I ain't nervous
I swear to God I ain't nervous, nah, nah
And I'm laughing at them pussy niggas
And that pussy shit they doin'
I'm getting cake like I'm Jewish
My nigga Drake he Jewish
I swear to god I ain't nervous, nah, hahah
Okay I swear to God I ain't nervous
I swear to God I ain't nervous
I say, I swear to God I ain't nervous
I got her workin, twerkin and slurping my serpent
Ain't got no problems in this bitch, for certain
I see you turnin up but your turn up ain't workin
Just want some mouth and lip service
And I got all my niggas in that truck like an Excursion

[Verse 1: Lil Wayne]
Okay I'm straight at you, no ricochet
That pussy boneless, that's Chick-fil-a
I fuck with real riders and they tickets paid
For them dead presidents, we will start digging graves
I swear my momma trust my work
So I give these hoes that work
They say the best things in life are free
That's why it cost for you to get murked
And my pants sagging like fuck it - I'm still on my business
Spent my birthday in jail, I was making bad decisions
Saw my enemy at the light, shot him up before it turned green
Mane my niggas got them birds, you ain't even got bird seeds
Your bitch ride me like a go kart, I play that pussy like Mozart
I Mozart these hoes hearts then after that they worthless
[Hook: Lil Wayne]
Man, I swear to God I ain't nervous, uh-uh
I said I swear to God I ain't nervous
I don't know, I swear to God I ain't nervous
And that pussy don't get purchased, ho
Ain't got no problems in this bitch for certain
I see you turnin up but your turn up ain't working
I like em long haired and curvy
And if niggas think it's a game
I'll leave they brains on their jerseys

[Verse 2: Lil Wayne]
She say she love me, that's the molly talking
She about to blow me, like a signing bonus
She got a nigga but he ain't me bitch
I'm the original gangster, he the remix
Girl, do you use that same mouth to kiss yo momma?
I say, only God can judge me, fuck your honor
And her birthday suit is her pajamas
She say, I didn't know your dick was a recliner
I'll punch your man in his eye, give him a shiner
I'll blind him, him and whoever cosign him
I get Adam like Yolonda
Young Money Cash Money, Obama
It's fuck the world, no condom
If he twisted, I'll unwind him
And this pistol came with a silence
[Hook: Lil Wayne]
But I swear to God he heard it, yeah
And I swear to God I ain't nervous, nah
I swear to God I ain't nervous, uh-uh
Bitch I'm the God, I should be rapping in a turban
Ain't got no problems in this bitch and that's for certain
I see you turning up but your turn up ain't working
Baby, I just want some mouth and lip service
She gone ride this dick like the Kentucky Derby

[Verse 3: Boo]
On that Pat-ron, I'm swerving, game tight like virgins
I got a bad bitch, she Persian, call her AK when she's squirting
You see the niggas I'm with, that boy Boo the shit
As long as I got a face, yo bitch got a place to sit
Yea, I'm wilding off them shroomies
Ain't got no worries like Tunechi
All my chicks be bougie
Wanna hold hands then watch movies
I be goddamned, make a nigga lose it
Ain't no talking- lets get to it
Real niggas winning, fake niggas losing
Bitch I'll leave that pussy with bruises

[Outro: Lil Wayne]
Girl, I swear to God I ain't nervous, uh-uh
I swear to God I ain't nervous
No, you know I swear to God I ain't nervous
I got her workin, twerkin and slurping, my serpent
Ain't got no problems in this bitch and that's for certain
You fuck with Tunechi, you'll end up a missing person
She got Lil Tunechi on her booty, in cursive
I'm getting head behind the Maybach curtains
Ya13Embed"
Lil Wayne,2164016,599242,4,Lil Wayne,https://images.genius.com/08560ecbf6155316bfd325b03583ae6e.300x300x1.jpg,London Roads,https://genius.com/Lil-wayne-london-roads-lyrics,190565,"London Roads Lyrics[Intro]
Weed and syrup, yeah
(We got London on da Track)

[Verse 1]
All I know is paper, I don't know these hoes
I like mouth in my lap and pussy on my nose
And I'm bringin' home the bacon, it's fryin' on the stove
You hoes can't drive me crazy, keep your eyes on the road
Got the money on my mind, and bodies on my nine
And I swear every day, I'm on my Ariana grind-de
I got that yay, I got that la-di-da-di-da
And a kamikaze squad, and you chicken parmesan
Lord, I'm a free man like I come from Amistad
No, I come from Hollygrove, turnin' Os to octagons
I get money while I'm 'sleep, I dream that I'm in Heaven
I dream I saw Lil Beezy and smoked a 'gar with Wessy
All my niggas, rest in peace, and my enemy, rest pleasant
So when my niggas creep, they catch him when he least expect 'em
Mama told me ""If you run these streets, run these streets correctly""
Well, feet don't fail me now; I never knew my feet to test me
Lord knows I wear new clothes to the mall
Two hoes on my arm
Fur boots when it's warm
Church shoes to play ball
I'm spittin' this shit like bird food to a dog
Urkel to big Carl, y'all don't hear me
All I love is paper, I don't love these hoes
Boy, that vest won't save you, neither will heroes
Lord, they better hope you save him, better catch the holy ghost
Holy moly, hockey mask like Halloween like OVO
Lord, all I know is strippers, all they know is poles
All they sell is pussy 'cause they been sold they soul
Boy, you go zero to sixty, I go one-and-two-zeros
Pedal to the metal, I call it rose gold
Lord, all I know is paper, big fat money rolls
Look at how big my safe is, that bitch got double doors
I was runnin' outta patience 'til I heard ""All aboard""
They mad 'cause I be skatin' at home on marble floors
Lord knows I drive fast in my driveway
I pop tags and throw 'em down and make the ground shake
Goddamn, a pint of lean almost 5K
I be spendin' 25K every 5 days
I sent my girl on a spa day
'Cause Hood just came with them chickens
I don't want you in the house, bae
Plus we need the kitchen
Lord, trap house in abundance
We got trap houses in London, y'all don't hear me
[Interlude]
(We got London on da Track)

[Verse 2]
Hol' up, had to switch the flow up
Had to pour up, roll some more up
Watch me go up, my doors go up
When I show up, why you show up?
Pick my bro up, pick a O up
Hit the store up, get a soda
Get us four cups, split a four up
Then we slow up, yeah, you know us
Then we toast cups and we post up
Don't approach us, we got toasters
That's my slime, like we ghostbust
And we both bust, give no fucks
Take no stuff and take your stuff
Then ho hunt for some chocha
I know a ho who'll rock the boat
But I row her, I'm Noah, Lord
I remember when I was no one, Lord
When I couldn't find jack in no one's cards
Ms. Cita, I remember goin' in your gun drawer
Puttin' it to my chest and missin' my heart by centimeters
Oh Lord, I remember dyin' on her room floor
And wakin' up in some police's arms, he died recent
So I hope Heaven made more room for him, and I hope he see me
'Cause if he didn't save that lil boy, there'd be no Weezy
Oh Lord56Embed"
Lil Wayne,3971593,7060172,4,Lil Wayne,https://images.genius.com/0607dab9ef83679f9e3939ffb215a1a0.300x300x1.png,Famous,https://genius.com/Lil-wayne-famous-lyrics,187471,"Famous Lyrics[Chorus: Reginae Carter]
Welcome to your name in lights
All the lighters in the sky (Yeah)
You must be famous
This is how you live your life, different city every night (Yeah)
You must be famous, famous

[Verse 1: Lil Wayne]
I'ma be on the TV, mama, Pac voice
People point at me, say, ""Oh my God""
They got a point
Tried to blow my nose and blew my mind
It's mind-blowing
And gold diggers dig until they find oil
And I'm sittin' here reading what was written 'bout what I do, what I didn't
I ruined relationships before my image, but
All I ever wanted was everybody's attention
'Cause most people are nobody 'til somebody kill 'em
Probably thought that my career be short and sweet
Wishin' I was in your shoes, I'd take them off and find a beach
And superstars don't sparkle, we high-beam
And you can't spell fame, without me
And may my Hall of Fame speech be short and sweet
Like, ""Thank God, fuck fame, and thank me""
'Cause superstars don't sparkle, superstars beam
I was your main man, 'til I went mainstream
I'ma be on the TV, mama
[Chorus: Reginae Carter & Lil Wayne]
Welcome to your name in lights (Woo!)
All the lighters in the sky (I must be famous)
You must be famous (Yeah, oh my God I must be famous)
This is how you live your life (Yeah)
Different city every night (I must be famous)
You must be famous, famous

[Verse 2: Lil Wayne]
Rich and famous, it's better to be rich and famous
Message to my lawyer: ""Don't let me make these bitches famous""
You know entertainers, sex, drugs and entertainment get so instantaneous
Simultaneous, miscellaneous, party long and hard
And pray death is quick and painless
Livin' in the spotlight, twist the light bulb when it's blinking
I'm never alone
I got my demons and my angels
Can't talk to myself, 'cause mama said don't talk to strangers
Relatives; ain't seen 'em since the grass been greener
And some people say I changed but they can't hear me jingle
I want Tina and Nancy, I get Nancy and Tina
Never question myself, unless I ask, ""Am I dreamin'?""
The fan mail and subpoenas, jail cells to arenas
Car wash to the cleaners, Walmart to Neiman's
They told me time would tell
I told time to kiss my ass
And I heard, ""Can you look this way? Can you look this way?""
Flash! I must be famous
[Chorus: Reginae Carter & Lil Wayne]
Welcome to your name in lights (Yeah!)
All the lighters in the sky (You must be famous)
You must be famous (I'ma be on the TV, mama!)
This is how you live your life (Yeah, yeah)
Different city every night (Oh my God, I must be famous)
You must be famous, famous

[Refrain: Lil Wayne]
You probably thought that my career, be short and sweet
You wish that I was in your shoes, I'd take them off 'cause life's a beach
And superstars don't sparkle, we shine deep
And you can't spell fame, without me
And may my Hall of Fame speech be short and sweet
Like, ""Thank God, fuck fame, and thank me""
'Cause superstars don't twinkle, superstars gleam
I was your main man, 'til I went mainstream
I'ma be on the TV, mama

[Chorus: Reginae Carter & Lil Wayne]
Welcome to your name in lights
All the lighters in the sky (Oh my God, I must be famous)
You must be famous (Oh my God, I must be famous)
This is how you live your life
Different city every night (Oh my God, I must be famous)
You must be famous, famous
[Outro: Lil Wayne]
I'ma be on the TV, mama
Kiss my motherfuckin' ass14Embed"
Lil Wayne,6209991,5748418,4,Lil Wayne,https://images.genius.com/63ff6143fbe54719a22f2f4634fc5e2e.300x300x1.png,B.B. King Freestyle,https://genius.com/Lil-wayne-bb-king-freestyle-lyrics,186578,"B.B. King Freestyle Lyrics[Verse 1: Drake]
Ayy, the blues is now kickin', and dinner is three Michelin
I don't eat red meat, but still got beef sizzlin'
Know that I need discipline
I keep singin' for all these hoes, they keep listenin'
Niggas love to bro up with the boy and dap fists-es
But we are not equivalent, dawg
I been an only child, don't need siblings
And I'm past them like the times that he's livin' in, okay
Man, if you saw what I flew here, you'd be like, ""He's sickenin'""
If you not runnin' some top, we not gon' keep kickin' it
Classics, I keep scribblin', lights in the Universal building just keep flickerin'
Money just keep comin' in, you would think I'm Irish the way that it stays doublin'
I could feed a country with the tax that I pay governments
Whatеver they're doin' with my cash is vеry troublin'
Okay, February came around, I used to get paid shovelin'
Sold clothes, walked dogs, trust me, I stay hustlin'
When it came to school, there's no way that I'm A-plus-in' it
So I just dropped out of it, trust me, I'm not proud of it
Niggas get too comfy in they spot, they get knocked out of it
Niggas get a gun just so they can make props out of it
Shawty make a scene in the house, she get locked out of it
Yeah, you not 'bout to be chillin' in this bitch with kicked feet up
I'ma make you bounce out this ho like Big Freedia
Pete O. used to throw a purple tint on a two-liter
First private plane I ever rode was a eight-seater
Before that, I got the bedroom hot with a space heater
On top of that, I didn't have shit to my name either, that's real
But now I'm givin' house tours 'til it's back to world tours
Play that ""Mask Off"" when they find the real cure
I might not be good for her, but I'm real to her
Got no time for her, but give Richard Mille to her
That's the only way I know how to express love
My dawgs love sticks and drums like they Questlove
All them jokes about Aubrey, they got me messed up, for real
I come with a lot of complications inside me
It's always people misleadin' me that are tryna guide me
Everyone wants to try me, but no one wants to buy me
Everyone wants to meet me, but no one wants to keep me
Everyone talkin' lemons when everything is peachy
Everyone got they hands out, and it ain't to reach me
[Verse 2: Lil Wayne]
Mhm, yeah, mhm
Everyone got they glass out, let's drink to Weezy
Every nigga that stare me down just came to see me
Choppin' up a lil' cash cow, that's steak I'm eatin'
Check deposits, high-risers with extra closets
The sex platonic, I talk intelligent, text Ebonics
The electronic guitars whinin', that's just Nirvana
Tommy gun on the counter, I call it Mr. Thomas
That'll keep niggas honest
I'm dozin' off in the driver seat 'cause the seat give massages
Decimal point money, these numbers too steep for commas
I'm eye to eye with niggas, I can't help but to see beyond 'em
Got a two-seater problem
Niggas thinkin' they cold, I knock the flu-season out 'em
Bitches forget they hoes, and that's when Tunechi remind 'em
I used to fuck Gucci models, I'm fuckin' Gucci designers
I keep it too G regardless, I'm gettin' too deep for divers
Let me resurface, I'm flexin' on purpose
She especially curvy, bet she be servin' every purpose, perfect
I'm better than perfect, I'm sick, I need to see a medical person
Eatin' all of these rappers with these edible verses
All I gotta be is all that I can possibly
She really, really into me, then suck it all up out of me
I'm proud of me, I don't know how to be sorry, apologies
You fuckin' with my math, you better know some trigonometry
'Cause I'ma be bustin', leave your lima bean at your mama feet
I flip the economy like Dominique Dawes
They say I'm trippin', I guess they wishin' I finally fall
I don't need war, I need a bitch that know I'ma need yours
I'ma need more, niggas is shifty like Honda Accords
Fire alarm, ain't got no ceilings, we climbin' the walls
Higher than yours, I fuck your bitch and she die in my arms
Lion has roared, No Ceilings 3 with my mind on the fourth
Holla at your boy7Embed"
Lil Wayne,49159,26017,4,Lil Wayne,https://images.genius.com/4f426f2c10fcf7bcf51dc09125368d74.300x300x1.png,So Special,https://genius.com/Lil-wayne-so-special-lyrics,186007,"So Special Lyrics[Intro: John Legend]
Oohh, ooh
So special, you're so special
So special, you're so special
Oohh, ooh
So special, you're so special
So special, you're so special

[Verse 1: Lil Wayne]
Uh, boy shorts, wife beater
Now let me see it, I'm a sightseer
She was sleeping on me, but she's a light sleeper
I make her cum first, then I follow the leader
I talk shit, I hope it matters
We climax, without the ladder
Can't desert the future, no Nevada
Her body is a weapon, ratatat her
I spent the night in heaven, I slept with an angel
And when we finish, I swear that pussy said thank you
I said, ""You're Very Welcome"" I'm so well mannered
And I go down south, Louisiana

[Chorus: John Legend]
Baby won't you spend the night
Darling I don't want to wake up, and you are not by my side
(So special, so special,so special, so special)
And if you promise me tonight, Yeah
Baby that you'll let me in, then I'mma make you feel so special girl
(So special, so special,so special, so special)
[Verse 2: Lil Wayne]
Then we take a shower together, and wash each others back
And if she kick it off, I'ma run it back
And then she say my name, like I forgot it
She crazy about that dick, Lorena Bobbitt
Love be the pilot, but it's kamikaze
Yeah, body language, girl let's talk about it
Freedom of speech, Weezy a beast
Open her up like a book, read it and weep

[Chorus: John Legend]
Baby won't you spend the night, uh
Darling I don't want to wake up, and you are not by my side
(So special, so special,so special, so special)
And if you promise me tonight, Yeah
Baby that you'll let me in, then I'mma make you feel so special girl
(So special, so special,so special, so special)
So special

[Verse 3: Lil Wayne]
Yeah, thinking bout you girl got my mind on E
You know them other niggas ain't me
Girl I got that 12 play for ya, that 12 play for ya
Just sit on my grill, that's that tailgate for ya
I, put it together, common denominator
I tear it up like loose leaf paper
I got drinks on chill, my bedroom huge
I knock her lights out, I blow her fuse
See we don't even fuck no more, we make love
And now shes on the tip of my tongue, my taste buds
Cause she my honey bee, yeah, buzz buzz
And now I'm itching and scratching, that's that love bug
[Chorus: John Legend]
Baby won't you spend the night
Darling I don't want to wake up, and you are not by my side
(So special, so special,so special, so special)
And if you promise me tonight, Yeah
Baby that you'll let me in, then I'mma make you feel so special girl
(So special, so special,so special, so special)

(Girl I got that 12 play for ya)
(So special girl, so special to me)13Embed"
Lil Wayne,376199,104344,4,Lil Wayne,https://images.genius.com/d40bbdaffd60cf1a4f4b991aaf8cc36a.300x300x1.jpg,Moment,https://genius.com/Lil-wayne-moment-lyrics,184678,"Moment Lyrics[Intro]
Turn the music on
They say baby how you do it
Never question greatness, never question greatness
Tell 'em never question greatness
I just do it
I'm so high I feel weightless
All my shooters are courageous, and

[Hook]
Ain't a moment 'til I make it
It ain't a moment 'til I make it
Have my cake and eat it too, I want a bakery
And see lately
All I've been doin' is celebratin'
Don't even know what I'm celebratin'
I know why you ain't celebratin', cause you ain't sellin' nathin'
They got niggas catchin' cases, while we out here catchin' breaks
And I'm gon' shoot it if I wave it, shoot it if I wave it
(Shoot it if I wave it)
Do yourself a favor, save yourself cause I can't save yah

[Verse 1]
Know you see me in that Rolls Royce, glass house, that nigga, hands down
No givin' up, no layin' down, all red, ant pile
My oldest son just turned five, I said ""Lil nigga, you a man now""
Ride around with that strap out cause my Rolls Royce, glass house
I just got a text that said ""Baby I just cashed out""
Whack weed get ashed out, put Persian rugs in the crack house
All y'all that lashed out, I'll come see what that's 'bout
But you don't need to call the fireman, to put a mothafuckin' match out
I can't remember my last drought, all my niggas' smashmouth
Got pure coke, brand new birds, we get 'em as soon as they hatch, slime
And you know the driveway too big when you ain't gotta back out
Paper chase like cat mouse, my nigga it
[Hook]
Ain't a moment 'till I make it
It ain't a moment 'till I make it
Have my cake and eat it too, I want a bakery
And see lately
All I've been doin' is celebratin'
Don't even know what I'm celebratin'
I know why you ain't celebratin', cause you ain't sellin' nathin'
They got niggas catchin' cases, while we out here catchin' breaks
And I'm gon' shoot it if I wave it, shoot it if I wave it
Do yourself a favor, save yourself cause I can't save yah

[Verse 2]
Know you see me cause my roof all in my trunk
Know he dead when the horn honk
Niggas say they kings, they lyin', boy you talkin' to a card shark
I already made my mark, please don't think I just pop corks
Got these voices in my head screamin', can't believe they're not hoarse
Bitch I've been a beast since cartoon sheets
It's real on the field, I need new cleats, outgrew these
Catch you while you sleep, turn your sheets to maroon sheets
Them choppers turn your homeboys into amputees
And that's not a good look, momma was a chef, but daddy cooked the work
Said ""I know it stank but it's good""
Look, we treat them triggers like repeat buttons
Leave it all out there, or leave nothin'
Like the world a crystal ball, I keep rubbin' it
[Hook]
Ain't a moment 'till I make it
It ain't a moment 'till I make it
Have my cake and eat it too, I want a bakery
And see lately
All I've been doin' is celebratin'
I don't even know what I'm celebratin'
I know why you ain't celebratin', cause you ain't sellin' nathin'
They got people catchin' cases, while we out here catchin' breaks
And I'm gon' shoot it if I wave it, shoot it if I wave it
Do yourself a favor, save yourself cause I can't save yah

[Verse 3]
Can't nobody save yah
New Orleans pride and savior
Nigga this that Carter 5
I feel like, feel like I'm on my final caper
Uh, and I'm about to smoke one, pass out, OG kush, hashed out
She only want alcohol and trees, fuck that, you gotta branch out
I camp out by a rat house, wait 'till he turn the lamp out
Still drownin' in the fuckin' money, y'all niggas look like y'all swam out
In this bitch, gats out in this bitch
She say she can come and help my fat wallet get fit
I told her that's not in this script, I don't see that in the script
I'm smokin', gettin' head, lookin' down tryna read lips
[Hook]
Ain't a moment 'till I make it
It ain't a moment 'till I make it
Have my cake and eat it too, I want a bakery
And see lately
All I've been doin' is celebratin'
Don't even know what I'm celebratin'
I know why you ain't celebratin', cause you ain't sellin' nathin'
Niggas I had you catchin' cases, while we out here catchin' breaks
And I'm gon' shoot it if I wave it, shoot it if I wave it
(Shoot it if I wave it)
I tell myself

Ain't a moment 'till I make it
It ain't a moment 'till I make it
Have my cake and eat it too, I want a bakery
And see lately
All I've been doin' is celebratin'
Don't even know what I'm celebratin'
I know why you ain't celebratin', cause you ain't sellin' nathin'154Embed"
