artist,id,lyrics_owner_id,primary_artist_id,primary_artist_name,song_art_image_thumbnail_url,title,url,pageviews,lyrics
Lil Wayne,87068,1035,4,Lil Wayne,https://images.genius.com/1cca3a7cb35e2d8b6baa82593cc9844d.300x300x1.jpg,Green Ranger,https://genius.com/Lil-wayne-green-ranger-lyrics,239821,"Green Ranger Lyrics[Intro: DJ Drama]
You know I've been talkin shit for a generation now
'Bout that time for me to kick my feet up
Y'know? Move on to other endeavors
Who's ready to take the torch?
Somebody? Anybody?
Haven't I taught you everything?

[Verse 1: J. Cole]
When this shit dropped, I was like 16
Tryna get some head from a mixed thing, big dreams
Say goodbye to ripped jeans, nigga got a job
Had my little wad, worst fear was getting robbed
For my last 50 dollars that I had left over
Five dollars and they pop a nigga in his left shoulder
Minimum wage, $5.15
13s on the whip, kept my shit clean, uh
Actually that was my mama shit
But I’m drivin' 'round town on my Obama shit
Middle-class my ass, just to get a tank of gas
Had to run the guns up the street and pawn the shit
But yeah, I’m headed for a scholarship
Little scrap game but I got a lot of lip
That's why them niggas don’t like me and always wanna fight me
A dumb nigga hate a smart mouth most likely
Uh, I know the game, I’m an expert
Nigga, how you gonna jump me if my legs work?
Nigga I'm gone, showed up at the crib tryna bone
And I ain't fuck yet 'cause her mama always home
God damn, L-Lord have mercy
Please God, don’t let this little broad have herpes
My nigga say she fast like Jackie Joyner-Kersee
Gold medals if we gave hoes medals
No rose petals on a bed in the ghettos
Spiderman sheets, got her singing falsetto
Tall white tee’s, can’t believe we used to wear those
White folks looking at us like we’re weirdos
But we was only kiddos
Grabbing titties in the club, pocket full of Skittle
Tryna get the kitty was like tryna solve a riddle
Tryna get to Diddy cause I murder instrumentals
This that good old fashioned Mark Jackson
Fucked then I’ll pass, y’all Utah Jazz-in'
Ya borin’, I don’t play nigga, I’m Mark Madsen
That's why my knots thick like a fucking Kardashian
I’m not askin', my nigga I don’t need favors
I’m in the streets with the fiends, I done seen danger
My team major, we party like teenagers
I’m in the green Range, nigga I’m the Green Ranger
I fucking ran outta breath, heh
Team major, we party like teenagers
I’m in the green Range, nigga I’m the Green Ranger
Cole
[Interlude: Lil Wayne]
Yeah, yeah, yeah
I don't even like this beat but fuck it
I'ma only spit a few bars 'cause I don't like this beat, let's go

[Verse 2: Lil Wayne]
Uh, bitch I’m not old news, I’m more like gold shoes
She eat my whole dick, she like Whole Foods
They say I’m old school, but I dropped out
Drop ya body off, at a cop's house
They throwin' up them bricks, you better box out
My niggas got enough white to build Barack house
I got my drawers on, Sam Rothstein
.44 on my waist, Rick Ross jeans
I’ve been faded, stone wash jeans
New pussy, new money, New Orleans
50 up in that uzi, G-G-G-G-Unit
I murk you with that bitch, scratch the serial number, re-use it, uh
I’m from the N-O, stretch niggas out like limo’s
Uzi go zit-zit-zit-zit-zit-zit-zit, that's pimples, uh
I’m bout to go banana puddin’, hehe
You a dyke 'cause your man a pussy
Hit you from the blindside, no Sandra Bullock
Never bite the hand that feeds you
Always watch the hand that’s cookin'
Tunechi
[Outro: Lil Wayne]
Hahaha, yeah man, D4 ho
Shout out Cole, you already know what it is
Cole World, Wayne’s World
We in this bitch ho
Special delivery at your front door
Hahahahahahaha, redbone biatch!11Embed"
Lil Wayne,131848,4533,4,Lil Wayne,https://images.genius.com/1b99b69b978dc8af710fc38b538bc93c.300x300x1.png,Gunwalk,https://genius.com/Lil-wayne-gunwalk-lyrics,238912,"Gunwalk Lyrics[Chorus: Lil Wayne]
(Yeah ho!) I'm strapped up, nigga, fuck a gun law
(Yeah ho!) See me walking with a limp, that's my gun walk
(Yeah ho!) I don't do no arguin', I let the gun talk
(Yeah ho!) Yeah, I'm strapped up, nigga, fuck a gun law
(Yeah ho!) See me walking with a limp, that's my gun walk
(Yeah ho!) I don't do no arguin', I let the gun talk
(Yeah ho!) And there's no talking back when my gun talk

[Post-Chorus: Lil Wayne]
See me walking with a limp, that's my gun walk
That's my gun walk, nigga, that's my gun walk
Yeah, see me walking with a limp, that's my gun walk
That's my gun walk, nigga, that's my gun walk

[Verse 1: Lil Wayne]
Uh, fuck that nigga, ho-ass nigga
Leave that nigga with a toe tag, nigga
Barrel so long you can pole dance, nigga
Run up in ya house, where the dope at, nigga?
Murder she wrote on a notepad, nigga
Light that nigga up, smoke that nigga
Stomp that nigga, roast that nigga
I walk around with this shotgun
And this bitch bigger than me, nigga
Don't open up your fuckin' mouth
'Cause I'll pull the trigger like teeth, nigga
Shoot 'em up then leave, nigga, I smell Summer's Eve, nigga
We shoot first, it's better to give than receive, nigga
[Chorus: Lil Wayne]
I'm strapped up, nigga, fuck a gun law
See me walking with a limp, that's my gun walk
I don't do no arguin', I let the gun talk
Yeah, I'm strapped up, nigga, fuck a gun law
See me walking with a limp, that's my gun walk
I don't do no arguin', I let the gun talk
And there's no talkin' back, when my gun talk

[Verse 2: Lil Wayne]
Keep that ho shit over there (Yeah ho!)
And we don't shoot in the air
I can't fuck with these niggas, man, these niggas gummy bears
Hair trigger on the gun, I pull that motherfucker's hair
It's like, man, you can't trust nobody
I don't even have a trust fund
Don't buck, nigga, don't stunt, nigga
Don't duck, nigga, 'cause I duck hunt
Bitch, rock with me, that Glock with me
That chopper with me, obviously
I'mma empty this motherfucker
That's fifty shots, approximately
Now fuck with me, get fucked over
Emergency room, rushed over
Hollow tips, in the clip
My gun loaded, yours sober
I pull your card like a lawn mower
Fall back or I'm goin' forward
I see you got your gun drawn
I'll send you back to the drawin' board
Lil Tunechi
[Post-Chorus: Lil Wayne]
See me walking with a limp, that's my gun walk
That's my gun walk, nigga, that's my gun walk
See me walking with a limp, that's my gun walk
You don't talk back, when I cock back
That's my gun walk, nigga, that's my gun walk
Yeah!

[Verse 3: Gudda Gudda]
Walking 'round this motherfucker limpin'
'Cause the nose on the pistol 'bout as long as Scottie Pippen's
On the molly and I'm twisted, throw your body with the fishes
Double back around that corner and embodyin' the witness
Uh, real niggas don't talk much, do drive-by's and walk-up's
Lame rappers that talk tough get a broke jaw, star-struck
I don't fuck with lame niggas, I got good aim, nigga
Pop a pill, pop you, my nickname is Pain Killer
I'm still that same nigga; Eastside, I rep that
Pussy niggas better get right, or where I see you, you get left at
Use the rifle as my crutch, that's my gun walk
Or we can hold a conversation, let the guns talk
Gudda

[Bridge: Juicy J & Lil Wayne]
I'm strapped up, nigga, fuck a gun law
See me walking with a limp, that's my gun walk
I don't do no arguin', I let the gun talk
And it's no talkin' back when it go off
You speechless, you speechless
I'm strapped up, nigga, fuck a gun law
You speechless, you speechless
See me walking with a limp, that's my gun walk
You speechless, you speechless
I don't do no arguin', I let the gun talk
You speechless, you speechless - when I cock back
[Post-Chorus: Lil Wayne]
See me walking with a limp, that's my gun walk
That's my gun walk, nigga, that's my gun walk
See me walking with a limp, that's my gun walk
That's my gun walk, nigga, that's my gun walk36Embed"
Lil Wayne,3355248,1507505,4,Lil Wayne,https://images.genius.com/6f08c2694cfdf42a9d4d885d2a1e6f76.300x300x1.jpg,Bank Account,https://genius.com/Lil-wayne-bank-account-lyrics,233941,"Bank Account Lyrics[Intro]
On God, Dedication 6
On God, Dedication 6
On God, yeah

[Chorus]
25 million on a nice big ol' mansion
And, bitch, I still haven't invited your family
When you walk in you see the art and gold Grammys
I'ma just kill that pussy, now it's just a closed casket
25 million on a mansion, so precious
Bitch, be careful when you're bringin' your besties
Satin sheets, I ain't got time for no messes
That exorcist told me my wifey possessive
Adderall just so we can go restless
We fuckin' all, all night long, no breakfast
No confessions, no questions, we both professionals
Now ride me like an open road, no pedestrian

[Verse]
You bought a car for the bitch
I buy the narcs for the bitch
You buy apartments and shit
It's nice, I just walked in this bitch
You buy the art for the bitch
Y'all argue too often and shit
You always startin' some shit
That should come off of the bench
Shout out my homies I miss
Nino and Tony and Mitch
This ain't no cordial shit
She wan' come snort all this shit
She wan' go hard with a bitch
She know what happens today
She know we always forget
And she just posted the shit
And he just saw his lil bitch
Tell him I want him to trip
Tell him my guns gettin' skinny
Tell him they're starvin' for this
Give me the check, give me the throne
My hair is a minute too long
My bitch look like Vivica-Berry
Your bitch look like Rosetta Stone
I made my bitch go get a clone
Fuck 'em together and then on they own
When they catch feelings, I’m gone
I'm whippin' the Winnie the Coupe
I'm drivin' and sippin' the soup
The shit made me drift in the coupe
As long as I get to the stu'
Ruler clip, Rick the Ruler slick
Pull up on your bitch, you just called your bitch
Got that ""Who is this?"" She don't know you exist
She on her Mula shit, that's that truer shit
Make you eat your words, make you chew your shit
Then we knockin' out every tooth you pick
Nigga, fuck you, and fuck who you with
Yeah my bitch broke, but her booty fixed
Wait, I just popped a Perc, another for dessert
I washed it down with syrup
I just left planet Earth, ran into Captain Kirk
I pop a Perc, I'm trippy, call me Perc Nowitzki
Just call her Lewinsky; blurry, blurry vision
Blrrp— ""Hello, who is this?"" I just hit the line
I got a bitch in mind, I call her anytime
She taller, but it's fine, together we 6-9
I hit her other line, he like, ""What other line?""
She like, ""Never mind,"" and she can tell a lie
And I can tell she's lyin', that's no lie
That's my awesome lil bitch
Got me a saucy lil bitch
Got me a bossy lil bitch
Left her for a bossier bitch
It cost me a arm and a dick
I got me a naughtier bitch
She suck on the balls and the stick
I'm about to play golf with the bitch
I'm way on Mars with the bitch
She fuckin' with Martians and shit
You shoppin' at Marshall's and shit
And yeah, your bitch gettin' trippy with me
Want a quickie with me
Say she wish that I had Nicki with me
Say she'd lick her with me
Wish you wish I had my nigga with me
Bitch, you washy-wishy, y'all can't trick me
She said ""God, forgive me""
I say ""Nah, I'm busy""
[Bridge]
I got 1, 2, 3, 4, 5, 6, 7, 8, 9, 10 bank accounts
Plus a main account, with insane amounts
That's somethin' to think about
Plus the drank in route, now I'm hangin' out
With 1, 2, 3, 4, 5, 6, 7, 8 bitches ready to drink me down
Ready to drink me down, ready to drain me out
Plus my main in town, and she came around
Said they ain't her style

[Chorus]
25 million on a nice big ol' mansion
And bitch, I still haven't invited your family
When you walk in you see the art and gold Grammys
I'ma just kill that pussy, now it's just a closed casket
25 million on a mansion, so precious
Bitch, be careful when you're bringin' your besties
Satin sheets, I ain't got time for no messes
That exorcist told me my wifey possessive
Adderall just so we can go restless
We fuckin' all, all night long, no breakfast
No confessions, no questions, we both professionals
Now ride me like an open road, no pedestrians
(Err!)

[Outro]
Six shit, on God
Dedication 6 on God
Dedication 6 on God
That's some sick shit
Oh Lord
Dedication 6 oh Lord
Dedication 6 oh Lord
Yes Lord
Dedication 6 yes Lord
Dedication 6 yes Lord22Embed"
Lil Wayne,534,183,4,Lil Wayne,https://images.genius.com/4a183c010cf184b2a9fecdfcb8e16142.300x300x1.jpg,Watch My Shoes,https://genius.com/Lil-wayne-watch-my-shoes-lyrics,231650,"Watch My Shoes Lyrics[Verse]
OK, No Ceilings, motherfucker, good morning
Dick in your mouth while you're yawning, I'm going in
Gudda, why they started me? Marley, why they started me?
I bring it to your front door like you ordered me
Back in this bitch, but a lot more rich
On my Papa Bear shit, need hot porridge
Got a lot more shit than you can ever fathom
A big-head nigga couldn’t even imagine
The shit I do, most doers never done
I'ma fuck this beat, you bitch, ooh, you better cum
Bet I run this shit, I don't run from shit
I still b—beat your ass like a fucking drumstick
Weezy Fucking Baby, baby, make the ladies come quick
The money can’t fit in my pockets, but I bet that gun fit
And I’m so unfit 'cause all I eat is rappers
And these rappers ain't shit, I like my fast food faster
Syrup got me slow like a turtle 'round this ho
And I'm flyer than the highest-flying bird around this ho
What's the word around this ho? You get served around this ho
Yeah, you get served like a fucking hors d'œuvre around this ho
I don’t splurge around no ho, no, I don’t shine in front of no bitch
'Cause after she get off my dick, I be like ""Find the front door, bitch""
I don't know why in the fuck your bitch keep coming by
I done fucked your bitch a hundred times
What the fuck your bitch got on her mind? My fucking dick
I call her ""dickhead,"" spicy like a Big Red
Strike you like a Bic head—your flow sick? My shit dead
Sillier than V.I.C. said, Soulja Boy and Arab
You should see my eleven-year-old daughter do they dance
I call it the Nae-Nae dance, proud to be Nae-Nae’s dad
Gun on the waistline, leave you in the wasteland
We are not the same, I am a Martian, this is Space Jam
No Ceilings, R.I.P., Amen
Motherfucking caveman, beating on my chest
Young Money, Cash Money, and I'm eating all the rest
Nigga, no offense, sorry if you're offended
Riding high like I'm on 54 inches
Man, I'd rather chill with 54 bitches
Ch—Chill like— Ch—Chill like an Eskimo
L—Let's get more— Let's get more bitches
And I be like, ""Let's get more bitches""
Mr. Officer, stop arresting your bitches
Stop letting the messy hoes mess with your business
Mickey Mouse cheese, hip-hop Walt Disney
Sheesh, gosh, Oshkosh B’gosh
Smoking on that Bob Marley, listening to Pete Tosh
I—I—I do me; no, I do three
At a T... I-M-E
Why, when we say we Young Mula
The bitches leave y'all and relay-run to us
And payday comes sooner than later 'round here
And you see my sharks like they got some bait around here
Hey, you better stop the hate around there
Before Tommy, Mac, and Nina debate around there, yeah
You see it in my face, I don’t care
Whole court hearing, trial, and the case around there
I'm the best thing yet, I know I got that thing wet
Everybody wan' be fly but don’t know where their wings at
Huh, had to pause for a minute
Now, I'm right back in it, like the drawers of the women
On a scale of one to ten'n, my girl be a twenty
My girl so bad, make a nigga think he sinning
My goons so gritty, my goons is so with me
Haters gotta go on iTunes to go get me
Gators, matadors, baboons, and those grizzlies
All come out me when I'm on the micropho-N-E
Mic check, two-three; I'm different like blue pee
And my girls be half naked like Betty Boop be
Like a hoopty, man, the boy been riding
And I ain't gassed up, 'cause I'm more like a hybrid
You think I'm stunting, but no, I'm just surviving
And I been here, but my soul is just arriving
Look up in the air, it's a crow, it's a robin
No Ceilings, full dose, I'm prescribing
Medication free, and for meditation, we
Smoke some better tastin' weed that you’ll ever taste or see
S-H-A-R-P as a tack, hotter than
Riding through the desert on a camel back, I done been
Riding through wherever with the hammer strapped, I ain't lying
I can do whatever if I'm planning that
So I got my guns, let's dance, like FannyPack
And we cook the hard, cut the soft, and bring the whammys back
Mafio, bitch, where your motherfucking family at?
Call my nigga Gudda if you trying to get your mammy back
All up in another nigga woman, I be ramming that
Seeing through these see-through niggas like they're laminate
Hip-hop so contaminate, I swear, just examine it
And I'm such a philanthropist, the God to these evangelists
I dress so Los Angeles, but I love Miami, though
I act so New Orl-e-ans, yes, I go pistachios
That means I go nuts on any beat they throw at me
And the bitches is so at me, and you know what they throw at me
Hahaha!
[Outro]
No—No Ceilings37Embed"
Lil Wayne,350,7,4,Lil Wayne,https://images.genius.com/4a183c010cf184b2a9fecdfcb8e16142.300x300x1.jpg,Swag Surf,https://genius.com/Lil-wayne-swag-surf-lyrics,227372,"Swag Surf Lyrics[Intro]
KE on the Track
No Ceilings
Ah...
O—OK

[Verse]
I got this chrome on this Bugatti, I'm strong in this Bugatti
Two V8s, ain't no such thing as driving calm in this Bugatti
Bitch, I’m bad, I'm worse, I'll pass the purp
Don't fuck with me 'cause right now, I'm higher than Captain Kirk
I swear, I be the sickest nigga, you can ask the nurse
And if you throw it in a bag I bet I'll snatch her purse
OK, I spaz, I curse; you last, I'm first
I'm on your ass, like dirt; behind that cash, get murked
I'm talking big shit, nigga, join my hit list, nigga
What's the matter? Check your bladder, I'm the shit, piss, nigga
Shoot the witness, nigga
Hold court in the streets and convict this nigga
Ol' dickless nigga
Man, I'm running with the blocka, Young Money, motherfucker
You think we gon' do our thing? Well, ain't it sunny in the summer?
And we coming for the commas, and whoever among us
And you know I'ma bust my ass until my crew very humongous
I said, T.I., hold your head, and Mack, hold your head
Wish I could but I can't say some other names 'cause of the Feds
And to my Bloods, code red, man, you know how we play it
And if it costs to be the boss, oh well, I guess I gotta pay
I—I'm a New Orleans nigga, I don't take no shit
Take the brain off the whip; now, it don't make no sense
Stunt hard on these bitches, I ain't promised tomorrow
Now, women kicking it with me like Nomar Garciaparra
Fuq' roll them killer plants, the Little Shop of Horror
And we roll them bitches thick, make 'em look like Toccara
Man, I'm too much for these niggas and three much for these hoes
The world is in my hands, and I keep my hands closed
I love my baby mamas, they get my highest honor
Gotta take care of them kids, man, I know you heard Obama
And I live on an island, Atlantic in my backyard
I just tell my pilot to land it in my backyard
Quarterback, shotgun, you don’t get any sack yards
Bitch, I ball hard, breaking all the backboards
Pretty Boy Floyd, step up, I will crack yours
And even at the White House, we pull up at the back doors
Walk around like I'm 30 feet tall
Tiger Woods, all these hoes tryna birdie these balls
In the Porsche 911, like emergency calls
Man, I just be chilling, I'm cool like Lou Rawls
Young Money in the building, I'm putting up new walls
Nigga take your Mrs. Officer and set some new laws
My flow is like rubbing two logs
Young Mula, we the new shit, new drawers, ugh
Now, get off my dick, I ain't fucking with you
Watch me shoot to the bank, I'm a money pistol
Weezy beat the beat up like Sonny Liston
Redbone do me good, then her friend assist her
I mean, a bitch she never met, her best friend, or sister
I leave the pussy micro-soft like Windows Vista
Young Tunechi, pop that coochie for a goon, ho
Bullet in you boys' memory, now you act like you don't know
Eastside who I do it for, Eagle Street, right by the store
Katrina wiped the city out but couldn't fuck with Hollygrove
Lost some real niggas I knew from a long time ago
But Heaven or Hell, I'm hoping that they be where I'ma go
Take a nigga gal and make her come give me a private show
Still ""long hair, don't care"" like a Navajo
I'm the hardest shit, go in your ass and search
I smash this verse, and I swag and surf
[Outro]
No Ceilings!
Hahahaha!37Embed"
Lil Wayne,685108,411563,4,Lil Wayne,https://images.genius.com/c84ee812d9e99028d560054b386d4d9d.300x300x1.jpg,HollyWeezy,https://genius.com/Lil-wayne-hollyweezy-lyrics,224760,"HollyWeezy Lyrics[Intro]
To Hollygrove to go Hollywood
Uhh

[Chorus]
Hollygrove, Hollywood, Hollygrove, Hollywood
Too Hollygrove to go Hollywood

[Verse 1]
Find out where your parents stay
Tell my goons to go straight to your momma room
What's in your pockets? What's in your pocketbook?
We think the Bible's a comic book
Bitch this Hollygrove, too far from Hollywood
Too Hollygrove to go Hollywood
I got cocaine that's so good, need a name? Call it ""Milk""
Because milk does the body good
I got this heat on my waist
So somebody better monitor the thermometer
I just eat pussy and pussy-ass niggas all day
And I ain't even kinda full

[Chorus]
Hollygrove, Hollywood, Hollygrove, Hollywood
Too Hollygrove to go Hollywood
[Verse 2]
Woo! I went from Bourbon to Beverly Hills
Show me your tits
I'll show you my weapon and grill and heaven is real
I get an actress into my bedroom
She lay down and say, ""Let's make a film""
I be like, ""Action,"" I hold her head down by her neck
This how breathtaking feel
Family first, you'll get your family killed, that's if you squeal
Pop-pop, close range, hold that gun
Like the photographer hold the camera still
Bad bitch riding my dick
She swerve 'cause another bitch grabbing the wheel
I ask 'em to chill, they both look at me, say ""Shut up""
I say ""My lips are sealed...""
Oooh! I come from Hollygrove, I done went Hollywood
I was a match made in Heaven
When Hell was a pile of wood
I run through Hell with gasoline drawers on
Stop, tell the Devil that God is good
Entrepreneur in a Bentley droptop Azure
Vagina connoisseur out the hood
I come from Hollygrove, every day Halloween
We shoot your block up and just say we shot a scene
This is a robbery, I let the chopper squeeze
Turn you to cottage cheese
Been on my beast since I was wearing Wallabees
Where paparazzi? I need my privacy
Fuck your photography, I react violently
Make sure your camera get my good side of me, Lord!
I come from Hollygrove
Hollywood should make a movie 'bout Hollygrove
Woo! Whoever play me
Should get a Oscar and a Golden Globe
This ain’t no movie, this is real shit
I don’t need a script 'cause I know my role
My Hollywood bitch just overdosed
All she could snort, more coke than Pinocchio
I come from the streets
But got ""superstar"" written all over my face
That's why these hoes in my face
I come from Hollygrove
I moved to Hollywood just to Californicate
Bop-bop-bop-bop-bop-bop-bop
I ain't finished shooting, tell 'em don't check the gate
[Chorus]
Hollygrove, Hollywood, Hollygrove, Hollywood
Too Hollygrove to go Hollywood
Hollygrove, Hollywood, Hollygrove, Hollywood
Too Hollygrove to go Hollywood
Fall asleep to the gunshots
Wake up and smell the embalming fluid
I come from Hollygrove, my bitch from Hollywood
When I fuck her she say ""Hallelujah!""
Hollygrove too far from Hollywood
Ohh, but I done went Hollywood

[Verse 3]
Hollygrove, Hollywood, Hollygrove, Hollywood
Hollygrove ain't far from H-Town
We used to drive back and forth with the work praying
""Lord please don’t let this car break down""
Hahahaha
H-Town! Lord, I done went from Hollygrove to H-Town
Hollygrove to Houston
Got a bad 5th Ward bitch that be boostin'
Sometimes she doze off, that’s the lean, I excuse it
She said ""If it ain't ch-chopped and screwed, it ain't music""
She say I never take her out, we went to eat at Houston's
Sometimes I doze off, that's the lean, I'm just snoozin'
I still got Actavis, nigga, that's exclusive
Kill you for a pint, that's a PT Cruiser
I see way too many hoes in my future
I'm gon' nail all them hoes, I'm Freddy Krueger
Grew up on Bun B, Pimp C was my tutor
Pimp Squad for life, had to do this for Houston
Hollygrove ain't far from H-town
We used to drive back and forth with the work
Praying the car don’t break down
Ohhh, Hollygrove ain’t far from H-town
We used to drive back and forth
With, codeine, cocaine, the pills, and pounds
Yeah, and we got back home safe and sound
If you got pulled over you don't give police no names
Or get killed and never found
Word, but I kept some money to bail out
Momma used to say if I ever get caught
They gon' put me under the jailhouse
Damn, I'm too Hollygrove to go Hollywood
One to the chest with this chopper
Leave you with just arms and a head like a octopus
I got this chopper protecting my livelihood
I'm so good, I'm so straight, I'm secure
[Chorus]
Hollygrove, Hollywood, Hollygrove
Too Hollygrove to go Hollywood

[Outro]
Cut15Embed"
