artist,id,lyrics_owner_id,primary_artist_id,primary_artist_name,song_art_image_thumbnail_url,title,url,pageviews,lyrics
Tory Lanez,2396831,1726587,1632,Tory Lanez,https://images.genius.com/caf0d9ecf4c8b4b97b1d4a0b7c67f858.300x300x1.jpg,Makaveli,https://genius.com/Tory-lanez-makaveli-lyrics,104620,"Makaveli Lyrics[Intro: DJ Drama & Tory Lanez]
Gangsta Grillz, yeah
Years in the making, New Toronto
And when I go, they gon' remember me like motherfuckin' Makaveli
You know I've been there in the winter time
These niggas started
I would finish I came back and finished like I am Makaveli
It's quite cold outside, let's warm this bitch up
Bandana round my head like I’m Makaveli
Ya ready?

[Chorus]
I pull out the Porsche, I jump in the Mazi
Then it's the Wraith again, we'll be rich forever
I pull out the Porsche, I jump in the Mazi
Then it's the Wraith again, I told them that we could be rich together
And when I go they gon' remember me like motherfuckin' Makaveli
These niggas thought that I was finished
I came back like I am Makaveli
Bandana round my head like I’m Makaveli
I pull out the Porsche, I jump in the Mazi
Then it's the Wraith again, we'll be rich forever
I pull out the Porsche, I jump in the Mazi
Then it's the Wraith again, I told them that we could be rich together
I pull out the Porsche, I jump in the Mazi
Then it's the Wraith again
Nigga's left me out for dead, now I'm Makaveli
Reincarnated Makaveli
[Verse 1]
Real money, call the lawyer for the deal money
Way a nigga laughin' to the bank, you would think the checks are lookin' real funny
Know a couple niggas that would kill for me, couple bitches that would steal for me
Nigga's still love me, women still love me 'cause they only get it true and real from me
I'm a full time jaw dropper, pardon nigga, but I give it to 'em
All this Actavis up in the Sprite, this shit was gettin' to it, I was sippin' through it
I was with the ruger, nigga really shootin', puttin' bitches all up in the Bentley coupe
It's Birkin to the, to the, to the, titty too, I rode Aventador like it's a rented coupe
Boy, we the other side when them other guys talkin' down
Talkin' 'bout how we run shit, talkin' 'bout how we shut it down
Came in the with the whole thing of the old thing, roll chain with the SoulTrain
With the white girl, baby, cocaine and you know the name and you know the name
Lord, on God, boy, right now, parked outside, straight black Masi
On God, boy, right now, I own heat, no Pat Riley
Made a million dollars rap tourin', I ain't talkin' no Kyle Lowry
Young nigga like the ten commandments, always got ten thous on me

[Chorus]
I'm Makaveli
I pull out the Porsche, I jump in the Mazi
Then it's the Wraith again, we'll be rich forever
I pull out the Porsche, I jump in the Mazi
Then it's the Wraith again, I told them that we could be rich together
I pull out the Porsche, I jump in the Mazi
Then it's the Wraith again
Nigga's left me out for dead, now I'm Makaveli
Reincarnated Makaveli
Verse doesn't appear on mixtape version
[Verse 2]
All I want that pit, shit, hoppin' in it like the governor
Hoppin' in it with the cover, then jump in the whip and the trunk it go dan-da-da-dan-da-da
When I step in, I'm fresh and updated
And my women get fresher, the fragrance
Niggas definitely is the greatest
Barely when I'm faded, pay this in the makin'
Had to talk what the team made me
You be sellin' a dream, ain't it?
When my niggas was starvin', you niggas was out buyin' bitches Celine, ain't it?
We can make it a ting, ain't it
We should make it a ting, ain't it
Yeah we know you a star player, only one on your team with a ring, ain't it huh fuck nigga?
Level legit, tell a sucker nigga settle the bet
You ain't got it, niggas double or dead
Used to have to work a double a day
Now I get up and go up and away
I go up on a plane and go fuck with LA
Fuck what you say, I go dope with the k-k-k-k-k-k-k
Clap that nigga, that nigga got something to say
I started day to day, like fuck what a hater say
I know it hurt them to see my commercial all over the AMAs
Or maybe it killed them to know that we number one up on the Airwaves
I'm careless nigga, I'm fearless
Mama these niggas gon' hear me, Fargo
[Pre-Chorus]
And when I go, they gon' remember me like motherfuckin' Makaveli
These nigga's started I would finish
I came back like I am Makaveli
Bandana around my head like I’m Makaveli

[Chorus]
I pull out the Porsche, I jump in the Mazi
Then it's the Wraith again, we'll be rich forever
I pull out the Porsche, I jump in the Mazi
Then it's the Wraith again, I told them that we could be rich together
I pull out the Porsche, I jump in the Mazi
Then it's the Wraith again
Nigga's left me out for dead, now I'm Makaveli
Reincarnated Makaveli24Embed"
Tory Lanez,4222009,193365,1632,Tory Lanez,https://images.genius.com/3fcde11a762313dc5dc755687b0a114b.300x300x1.png,Still Waiting,https://genius.com/Tory-lanez-still-waiting-lyrics,101557,"Still Waiting Lyrics[Verse 1: Tory Lanez]
I really hope you never ever get to love me
I'm thinkin' of all the times that you dubbed me
Now that I'm poppin', you got me right where I wanna
Right where I wanted to be when you would love me
Caught you slippin' in LIV and sippin' bubbly
You took a look at these niggas, ain't none above me
I tried to give you my heart, but girl, you don't know
I tried to show you affection, but no, it won't show
I told you, ""Baby, just wait, we need some time and all""
I told you just love me, give me some time to ball
The way you lookin' is like a thousand dollars
With my confidence, took every ounce to holler
I really hope you never get to love me
I wanna be somewhere stuntin', sippin' on bubbly
Not even a thought of you in my mind
Visions of you went blind
Ooh, you used to call just to tell me
That you ain't all the way get it, but, girl, you felt me
Part of that reason why I always try to tell you
You held it down, I'ma get you the bag with the Chanel C's
'Cause it was us against the world, fuck what they tell me
I figured they was hatin' on us and it was jealousy
But I should've listened to the shit they was tellin' me
I thought you was takin' a W, it was just an L on me
Now I'm caught up in this situation where L-O-V got the best of me
I'm tryna find somethin', tryna align somethin'
Still hopin' and prayin' that you'll be my somethin'
Out layin', and hopin' prayin' that you done datin' me
I know I treat you better than your man, yeah, fuck that nigga
Tryna treat you better than he can
[Verse 2: Trey Songz]
I know you that you ain't really 'bout to dub me
I know you wanna tell me that you love me
Girl, I know you wanna ride it like a Harley
Know you wanna let me swim in that tsunami
Swear I never felt like this way 'bout nobody
Swear I never felt this way 'bout nobody
Girl, you got me doing things that's just not me
Sprung over you, girl, I cannot be
Girl, I know some things have changed (Things have changed)
But you see, you and me, we still a thing (Oh)
I can't get you out my mind, girl
You know you've been actin' out of line, girl
Don't say, ""Not today,"" 'cause today I got the time, girl
I been actin' like I'm fine, girl
Goin' insane, losin' my brain
You playin' these games, but you know I ain't
I don't be trippin' off bitches, this strange
Not to call you out your name, you know you my main
Man, fuck this fame
How they came in our world, changed everything?
Right away, in a day
Niggas hate, bitches hate
Niggas fake, bitches fake

[Interlude]
Hey, look at him, man
I hope he doesn't hurt you too bad
[Refrain: Trey Songz]
Girl, I know some things have changed (Things have changed)
But you see, you and me, we still a thing (Oh)

[Verse 3: Tory Lanez]
Really, baby, you should never get to love me
Pillow talkin' with niggas and tryna dub me
You really got the audacity to discuss me
You really got some audacity, you disgust me
And it'd kill me to say these things about you but
I know the way you think about the two of us
I know the way you think about movin' on
But me, girl, I'm not used to maneuverin' much
Tell me I'm doin' enough
Tell me I'm doin' too much
Tell me that you've been in love
Girl, you not doin' enough
I threw the towel in twenty times, I threw it too much
Baby, this shit been a lot
Plus you've been doin' enough
You can't lie, you got time
You heard stories about my drip
Why does it take for me to do somethin' good
For you to come around? That's why I drift
And I know (Know), you's a pro (Pro)
Known for heartbreak after the sheets
I'm tryna keep my composure, I'm a soldier
And deep down, I'm still a G, so (Yeah)
[Outro: Tory Lanez & Trey Songz]
I'm gon' raise my glass to this (Raise it up)
Fly back to Los Angeles (Back to Hollywood)
Won't forget you were scandalous (Won't forget)
Won't forget you were scandalous, yeah (No)
I'm gon' raise my glass to this (Raise it up)
Fly back to Los Angeles (Fly on back)
Won't forget you were scandalous (Won't forget)
Won't forget you were scandalous, yeah (Yeah)3Embed"
Tory Lanez,2437651,187199,1632,Tory Lanez,https://images.rapgenius.com/e34c60b51d500615c56f8e1bd4d6565d.300x300x1.jpg,Real Addresses,https://genius.com/Tory-lanez-real-addresses-lyrics,100071,"Real Addresses Lyrics[Chorus]
Whippin' all this dope up in the trap house
We fuck all you bitches at a trap house
I can't trust you hoes, can't give you real addresses
I can't trust you hoes, can't give you real addresses
And I'm in that bitch like Jerry Stackhouse
I might fall in love with my trap house
I can't trust you hoes, can't give you real addresses
I can't trust you hoes, can't give you real addresses

[Verse 1]
Wait, shit
Fargo, whippin' all this dope look like I'm sellin' phony
All that nigga want that Rollie with the bezel on it
I see niggas change from friends into them tellin' on me
I see niggas go from friends to gettin' jealous on me
I see niggas call their shooters and their felons on me
I see niggas get religious when their hell was comin'
I had to trust the plug sometimes I had no scale up on me
Whip a couple litres now
Trap house got too hot and now I'm trappin' out my fiend's house
Had to break the lease though
And I pay my little nigga just to watch out for police now
'Cause it look like a four in my kitchen
It look like I'm cookin' with them zoes in my kitchen
I'm water whippin', whippin' four with my kitchen
My nigga Trey, he pack a four for you niggas, yeah
[Chorus]
Whippin' all this dope up in the trap house
We fuck all you bitches at a trap house
I can't trust you hoes, can't give you real addresses
I can't trust you hoes, can't give you real addresses
And I'm in that bitch like Jerry Stackhouse
I might fall in love with my trap house
I can't trust you hoes, can't give you real addresses
I can't trust you hoes, can't give you real addresses

[Verse 2]
Uh, when my grandma kicked me out the house
I said, ""Fuck it dawg, I'm 'bout to bounce""
I said, ""Fuck it dawg, I gots to make it""
I said, ""Fuck it"", started hustlin' and got that 'cedes
Uh, my nigga Shadow, he come with that ladder
I know some scammers that come with that data
Gotta ask 'em how we pull up in a Lambo
Shout go out to Dream that Bathing Ape and Camo
Fashion bitch, I'm in the latest
I put all my baddest bitches in their favorite fragrance
I might fuck a country bitch that got that diner, diner
I might make a movie with 'em like I'm Damon Wayans, ya' feel?
I might whip the four in my kitchen
It look like a nigga sellin' Os in my kitchen
I'm whippin', my wrist, it feel cold in this kitchen
And I'm flippin' again, where it goes in this kitchen?
[Chorus]
Whippin' all this dope up in the trap house
We fuck all you bitches at a trap house
I can't trust you hoes, can't give you real addresses
I can't trust you hoes, can't give you real addresses
And I'm in that bitch like Jerry Stackhouse
I might fall in love with my trap house
I can't trust you hoes, can't give you real addresses
I can't trust you hoes, can't give you real addresses27Embed"
Tory Lanez,6537983,126836,1632,Tory Lanez,https://images.genius.com/49278979817c9ea4b28d39251a032c03.300x300x1.jpg,And This Is Just the Intro,https://genius.com/Tory-lanez-and-this-is-just-the-intro-lyrics,97407,"And This Is Just the Intro Lyrics[Part 1]

[Verse]
I hope you find somebody more toxic
And y'all go through way more arguments than we did
Y’all go through way more arguments than needed
You better give him the same fuckin' treatment
I know it's just the intro and this shit get deep, but
I’ve got my reasons
I put my work in, it wasn't worth it
My stresses turned you to the person for somebody else
I made you worth it for somebody else
I endured all of your flaws 'til I broke through all the walls of your guard
Now you're perfect for somebody else
I'm ‘bout to call her, bruh, I ain't gon' lie
I know she's somewhere with a good guy, no
She’s out with a guy who push a pretty penny
Her friend just let me know, she said he gets more paper than me, yeah (Damn)
There goes my ego
This shit is weak though
My heart is cold, this shit is brick
My shit is Shaq at the free-throw
Tryna get you back with all these cheap hoes
And you don’t even peep though
I let you take 'til there was nothing left of me
I seen it all ’til there was nothing left to see
I know she would leave me, what you telling me?
‘Cause when it's said and done, all I got is these melodies
You wasn't there when I was selling CDs
Juggin' at the TD, I was making CiCi’s
Money comin' out, I'm watchin' it in 3D
You told me I'd be nothing, now I'm on the TV
Fast forward, couple years later, see me, yeah
Come and see me, yeah
Come and see me, bitch
Car futuristic, shit, it come with three seats
Took the last feedback, it don't come with TVs
I stopped wearin' Chrome Hearts and AMIRI jeans
Gettin' too much money and it's bustin' out the seams
Shawty, don't act like I didn't meet you on the scene
I only slept on you because you started sellin' dreams
Oh my God, I don't even know, I'm so ashamed right now
[Part 2]

[Intro]
She been fuckin' rich niggas since nineteen (Since nineteen)
No money inside her bags, just drugs and Maybelline (Maybelline)
Seems like money's got you doing anything
Anything, anything
Servin' looks, you deaded me all for the finer things
Fuck me good and then you tellin' me all kinda things
It's like money's got you doing different type of things
Honestly, like I don't know why I did that, but I did, yeah
Girl, I heard you fucked that nigga in some shit I bought you
It hurts to know that that's some different shit I taught you
You left me for someone that was icy
With all that ice, don't you forget you gotta

[Chorus]
Come and see me, come and see me, yeah
Come and see me, come and see me, yeah
If it's on the ‘Gram, on the TV, yeah
Gonna see me, gonna see me, yeah
Come and see me, come and see me, yeah
Come and see me, come and see me, yeah
If it's on the ‘Gram, on the TV, yeah
Gonna see me, gonna see me, yeah
[Verse]
What it's hittin' for? I'm toxic, you know it (You know it)
Even your friends say I'm not shit, and you know it (You know it)
She hops in my double-R, she'd rather cry tears in the stars
And she knows them other guys in the double-R ain't like us
They ain't doing it like us
Movie is playin' and they ain't queuing it like us
Maybe I'm toxic, maybe I'm not shit
You went and found yourself another option
Liquor, I'm gon' sip
Sip until I get depressed in this bitch
Then I'ma call you right up on the flip
Fifty reasons why your nigga ain't shit
Fuck them niggas if I'm not at the top
I go crazy, I'ma make this shit hot
DM your nigga and blow up your spot
Fuck up the relationship that you've got
Fucked it up and now I'm calling you mine
There's no real intention of making you mine
I just don't wanna see you with no one else
Like I'm the only one allowed to move on
(I told you)
I'm a fuckboy for sayin' that shit, girl, I know it
I don't deserve you for playin' that like that, I know it (I know it)
But through these toxic eyes, I see potential
Took advantage of the fact you gotta
[Chorus]
Come and see me, come and see me, yeah
Come and see me, come and see me, yeah
If it's on the ‘Gram, on the TV, yeah
Gonna see me, gonna see me, yeah
Come and see me, come and see me, yeah
Come and see me, come and see me, yeah
If it's on the ‘Gram, on the TV, yeah
Gonna see me, gonna see me

[Outro]
Want me to call, don't you? Don't you?
Every time that I sing, every time that I sing
You-ooh-ooh-ooh-ooh
You-ooh-ooh-ooh
Every time that I see you, every time that I see you
Why don't you return my calls?
You trip 'bout, where I be
But you don't come and see me
No, you don't come and see me2Embed"
Tory Lanez,5439315,126836,1632,Tory Lanez,https://images.genius.com/60e201d65840f8adc656d6ba03f6b15c.300x300x1.png,Stupid Again,https://genius.com/Tory-lanez-stupid-again-lyrics,94725,"Stupid Again Lyrics[Intro: Conor McGregor]
I just wanna say from the bottom of me heart
I'd like to take this chance to apologize to absolutely nobody
The double champ does what the **** he wants

[Chorus]
Uh, woo, ayy
'Bout to go stupid again
She out the roof of the Benz
I'm 'bout to do her to get her
I'ma fuck two of her friends
Just made a flip off the wop
Fuck the Franck Mueller, I jump out the jeweler again
I fucked my money up on the re-up
But I got it right back and I blew it again
Uh, ayy

[Verse]
Bag full of bricks
Back sellin' Knicks like Ewing again
Trap ain't bump like this since '06, Soulja Boy shit, start you-in' again
Clear it out
Grrrr, stick 'em
Air it out
Brrrr, flip 'em
Whereabouts
I ain't never 'bout to give 'em
Fair amounts
I ain't never finna hit 'em with
Triple in it, double-up the stash, caught a brick
Another half, finna got another twenty on the vision
Spatula, flippin' it, a Caddy from the kitchen
I'ma hustle 'til the car came with another brick in it
Crib came with another bitch in it
If you ain't gettin' litty with the shitty, I'ma put another bitch in it
Bitch better hit me with deep throat (Oh)
And no, I ain't talkin' 'bout Michigan, ayy
Oh, uh, damn, shit
I'm goin' stupid and shit (Woo)
She play the flute with my dick
Wrist, sick, I got the flu on a bitch
I play it cool on a bitch
Hit, stick, that's how I do on your bitch (Uh)
What I'ma do in this bitch
Pussy was great, flew out and flew in this bitch
.40, shinin' and shinin'
Way in the hills, I'm high in the climate
Niggas is trickin' and niggas is simpin'
Payin' for heels, and winin' and dinin'
Jewish lawyers on the phone call
I said I'ma sign that lil' shit when I sign it
I got these Benjamin Frank on my body
Ain't finna fuck if this shit ain't exotic, woo
Ten trap phones 'cause the bitch keep on callin'
Sleepin' on the floor, I be scammin', gettin' it all in
Do the money dance when the money fall
Nigga, fuck my ex, I'm uninvolved
You can suck my dick and lick a nut too (Woo)
Yeah, you don't like me, nigga, fuck you, fuck you, fuck you
(Fuck you, nigga)
Damn, he runnin' through all his paper
That's what I do to a hater
Don't touch two things, my hair or my paper (Woo)
Passin' that bitch and she hot
Pass her like hot potato
I grind, I skate her (Uh)
And she look good, I might date her
Pussy was good and I ate it
Lil' bitch, I'm Bajan, woo
[Interlude]
Wait, hold the fuck up, hold the fuck up, hold up
So we both at the function, you know what I'm sayin'
You pull up with your bitch in the 458
I pull up with my bitch in the 488
You pull up beside my shit, like, ""Yo, what's the difference between  my 458 and your 488?""
'Bout like eighty to hundred thousand, cock sucker, beat it
Woo, ayy

[Chorus]
'Bout to go stupid again
She out the roof of the Benz
I'm 'bout to do it her to get her
I'ma fuck two of her friends
Just made a flip off the wop
Fuck the Franck Mueller, I jump out the jeweler again
I fucked my money up on the re-up
But I got it right back and I blew it again

[Outro]
Hahaha
We don't wanna hear no sucker shit after this shit either, nigga
Know what I'm sayin'?
Oh, you worried 'bout your bitch?
Yeah, yeah, yeah-yeah, she's here
Know what I'm sayin'?
Oui, oui, parlez-vous français and all that good shit
Ha, straight off the runway in Paris, nigga
Give ten fucks about a bitch4Embed"
Tory Lanez,4697942,126836,1632,Tory Lanez,https://images.genius.com/b41406394744329e553cb54af08b363a.300x300x1.jpg,Forever,https://genius.com/Tory-lanez-forever-lyrics,91387,"Forever Lyrics[Intro]
Run that shit up, Cas'
Grrrah! Ayy, crack
One Umbrella
Any Cash on you?
Ayy
That boy Cas

[Chorus]
If you my dawg, then nigga, my dawg
Then we gon' get money together
You go through a trial, you duckin' the law
So fuck it, we duck 'em together
When shit gettin' wild and you kill a nigga
We bury the shovel together
I got you forever and ever
I got you through every endeavor
If you my dawg, then nigga, my dawg
Then we gon' get money together
You go through a trial, you duckin' the law
So fuck it, we duck 'em together
When shit gettin' wild and you kill a nigga
We bury the shovel together
I got you forever and ever
I got you through every endeavor
[Verse 1]
I got you through every endeavor
Fuckin' with you through whatever and ever
'Cause we were freezin' in the cold, my nigga
And we were starvin' in the desert together
And you was quick to pull a Desi whenever
So I was quick to pull the lever whenever
And we was down to bust maneuvers
If you pump fakin', we blockin' the hesi together
I'm whippin' a four in the five, my nigga
These bitches blowin', goin' live
My nigga, we came up out the situation
Niggas sayin' we was supposed to cut the ties with niggas
And I was tryna coincide with 'em
But he trippin' so I let the .9 hit him
If he trippin' on me, I can lie with him
Movin' different on me, I should slide on him
Nigga, I don't take no pills or the Perc'
My piss got Ts on me
We duckin' hoes and the Ds on me
I can't let these hoes put no disease on me
I'm a real nigga from the streets
Homie, I'ma pull up to the top, nigga
Niggas hate to see you when you real
Gettin' and you get it off
For all you dawgs, nigga, I'ma keep shit real
[Chorus]
If you my dawg, then nigga, my dawg
Then we gon' get money together
You go through a trial, you duckin' the law
So fuck it, we duck 'em together
When shit gettin' wild and you kill a nigga
We bury the shovel together
I got you forever and ever
I got you through every endeavor
If you my dawg, then nigga, my dawg
Then we gon' get money together
You go through a trial, you duckin' the law
So fuck it, we duck 'em together
When shit gettin' wild and you kill a nigga
We bury the shovel together
I got you forever and ever
I got you through every endeavor

[Verse 2]
Through every endeavor
It don't matter the weather, whenever
It's a reason niggas still level together
Pot of gold, we set 'em together
Never settle, we get to the cheddar
No intention of dissin' you ever
We did it together, we better than ever
If a waitress a 100, then you throw a 50
My nigga, we better together
Met that bitch, fucked the walls in it
I'ma a beast, shawty, I'ma dog in it
I can't fall for it, but I fall in it
She a dog with it and she stay shadin'
And I play the game
But lil' mama know a nigga ball in it
I be smokin' pussy like a backwood
Or I'm raws in it, I be gone in it
It's me and my dawgs
Knowin' it's a lot of fuck niggas hatin' on me
Yeah, niggas love seein' me fall
Knowin' I can't fuck no lil' bitty bitches
I have bitches screenin' my call
Know it's a lot of y'all seein' me ball
'Cause if he my dawg, then the nigga gon' shoot it out with me, no legal involved (Yo Tory!)
[Chorus]
If you my dawg, then nigga, my dawg
Then we gon' get money together
You go through a trial, you duckin' the law
So fuck it, we duck 'em together
When shit gettin' wild and you kill a nigga
We bury the shovel together
I got you forever and ever
I got you through every endeavor
If you my dawg, then nigga, my dawg
Then we gon' get money together
You go through a trial, you duckin' the law
So fuck it, we duck 'em together
When shit gettin' wild and you kill a nigga
We bury the shovel together
I got you forever and ever
I got you through every endeavor, yeah8Embed"
