artist,id,lyrics_owner_id,primary_artist_id,primary_artist_name,song_art_image_thumbnail_url,title,url,pageviews,lyrics
Tory Lanez,2945668,193365,1632,Tory Lanez,https://images.genius.com/d48bcbe809effc317a2cb93c897a25fb.300x300x1.jpg,Slow Grind,https://genius.com/Tory-lanez-slow-grind-lyrics,149040,"Slow Grind Lyrics[Chorus: Tory Lanez & Pretty Ricky]
Uh, uh
Uh, uh
Uh, uh, uh, oh, hey
(Baby) Good love 'til your body gets weak
(Baby) Good love 'til your body gets weak
(Grind on me) 'Til your body gets weak
(Grind on me) 'Til your body gets
(Baby) 'Til your body gets weak
Good love 'til yo', good love 'til yo'
'Til your body gets weak
'Til your body gets (Baby)

[Verse 1: Tory Lanez & Pretty Ricky]
Ooh, oh, got the feelin' that you know (Grind on)
The way I'm 'bout to get deep (Grind on)
The way I dive in that sea
And I won't hold back from you, baby
From the slow to the fast on you, baby
And ain't nobody lacking, no, baby

[Chorus: Tory Lanez]
Good love 'til yo', good love 'til yo'
Good love 'til your body gets weak
'Til your body gets weak
'Til your body gets weak
[Verse 2: Jacquees & Pretty Ricky]
(Baby) Grind on me (Baby, grind)
Relax your mind, take your time on me (Take your time)
Girl, spread your legs, dutty whine on me (On me)
I got you wet, now you slidin' on me (On me)
I'm thinking 'bout you in the condo
Baby, I pull up on you solo (Solo)
Not with the gang, girl, I swear I'm rollin' dolo
I ease the pain off your body, girl you don't know
And I won't hold back from you, baby
And I won't go back on you, baby (Grind on me)
In and out, all your tracks going crazy (Oh)

[Chorus: Tory Lanez & Pretty Ricky]
'Til your body gets weak
Good love 'til yo', good love 'til yo'
'Til your body gets weak
'Til your body gets (Baby)

[Bridge: Tory Lanez]
I'm tryna get freaky, baby
All on your body, yeah
And when we're freaking, baby
Foreplaying, anticipating
Good love, oh, ooh, yeah
We're breaking, baby, oh, yeah, yeah, yeah
[Chorus: Pretty Ricky]
Baby, grind on me
Relax your mind take your time on me
Let me get deeper, shorty ride on me
Now come and sex me 'til your body gets weak
With slow grindin', baby

[Outro: Tory Lanez]
You blow my mind, more than all the time
You know how, baby
Kissing on the floor and I still got it for her
Panties on the floor and condoms in the drawer
Cashed apple stones and I gassed in your Rover
Pull up to my house, sit that ass on my sofa
She know I'm in love, she wanna get over
She wanna get more than anyone before her
Body so curvy, I can't ignore her
Gotta get it in for this time, 'cause she
She don't want love
Grind on me, baby
Back it up, sound for me, baby
Oh Lord, sound for me
Yeah time's up, oh time
You blow my mind, more than all the time
You know how, baby11Embed"
Tory Lanez,5165350,9736166,1632,Tory Lanez,https://images.genius.com/54057ef969769997773d7803706f5651.300x300x1.jpg,Broke In A Minute,https://genius.com/Tory-lanez-broke-in-a-minute-lyrics,145415,"Broke In A Minute Lyrics[Intro]
Yeah, word to Mazii, nigga (ah)
Fuck these niggas talkin' 'bout, nigga?
Haha
When they swing that way to the right, you swing to the left, you heard?
Papiyerr

[Verse]
Woo, damn
I ain't been broke in a minute, don't get offended
Tore off the bow in a Bentley, fucking your ho in her kidney
Fuck up the city, I do not dance, I jiggy
Gun is tucked under this Fendi
I like it, I spend it, I just came right out the jeweller
The ice on my neck, and my wrist, and my fist, I ain't finished
I was just workin' at Denny's, came back and counted some millions
I ain't no regular civillian
Red, yellow, green, look like my neck a chameleon
Ugh, okay, spin it, ugh
Damn, I ain't been broke in a minute
I hit his bitch, he offended
I'm in Givenchy and Fendi
They let me finish
I cut that Chevy for four day
My scammer bussing bottles off the '08
I cannot cuff, she fucking on my brozay
I'm just gon' fuck her, treat her like a throwaway
Ooh, damn, I ain't been broke in a minute
I'm at the mall out in Venice
I need it, swiping the digits
Calling up Kelz, he did 250 on biddie
It ain't no biggie, uh
Moncler, kick it
Fucked that lil' bih, made a viddie
She wanna leak it
She wanna send it
Ayy, fuck that bitch, my face wasn't in it
Damn, bitch do scams on bitty
Bands in my hands look pretty
Hit another band on the 'gram, I'm litty
When I was broke, man, she fronted, but then I got rich and I hit it
Homie, I don't dance, I jiggy
Weed is so strong, I feel like I'm Popeye off the spinach
I cut the corner and bend it
Bitch, I'm a menace like Dennis
Don't sell me pussy, I need a percentage
If you gon' fuck me, this shit is expensive
Nordstrom Rack, swipe my gift
Damn, I ain't been broke in a minute, ayy (Woo, woo, woo)
[Outro]
I ain't been broke in a minute, damn (Woo)
I ain't been broke in a minute (Woo, woo, woo)
Damn, I ain't been broke in a minute (Woo)
Damn, I ain't been broke in a minute, damn15Embed"
Tory Lanez,185026,231976,1632,Tory Lanez,https://images.genius.com/f7143bfe5aac027c2a2e655b51b7f950.300x300x1.jpg,Know What’s Up / The Take,https://genius.com/Tory-lanez-know-whats-up-the-take-lyrics,144630,"Know What’s Up / The Take Lyrics[Part 1: Know What's Up]

[Intro: YG]
(Mustard on the beat, ho)

[Verse 1: Tory Lanez]
She drop that damn thing on me
I stand up throwin' bands up, girl, everything on me
You know I'm in this bitch with my niggas, long thing in my jeans
It's gettin' late and these niggas rowdy, don't leave without it on me
I got them stones all in my chain (Whoa)
Big dollar my bank (Roll)
Said that she ain't cuttin', I said ""What the fuck did you came for?"" (What the fuck you came for?)
T.O. nigga, it's T.O. bitch
I'm headin' to wherever I'm gon' see your bitch
If niggas hatin' on me, put the hammer all in my hands
When she see me up in that three, she went magic all on her man
'Cause she know what's up
Oh yeah, she know what's up

[Chorus: Tory Lanez]
You ain't got a man? Come fuck wit' me (Uh-huh)
Roll up in that Benz, that AMG (Uh-huh)
You know I got them bands, they all on me (Uh-huh)
I know you wanna roll, so, you can tell me no
But I know your body know what's up
But I know your body know what's up
But I know your body know what's up
But I know your body know what's up
[Verse 2: Kirko Bangz]
Say you ain't got a man, sure enough
I pull up in that Lamb', hold up (Hold up)
We both want it, we can't blame no one
And I ain't tryna play no one
But he can't make you famous like this
No, he don't got you feignin' like this
Say, he might had your body but tonight I'm in yo' soul (Yo' soul)
Girl, just keep playin' my shit
Lo-love the way I talk, I make you love the way I sing (Sing)
Love the way I walk, I'll make you love the way I swang (Swang)
Girl, I make you (Make you)
Love everything that you don't love about these niggas
Girl, I love you naked (Love you naked)

[Chorus: Tory Lanez]
You ain't got a man? Come fuck wit' me (Uh-huh)
Roll up in that Benz, that AMG (Uh-huh)
You know I got them bands, they all on me (Uh-huh)
I know you wanna roll, so, you can tell me no
But I know your body know what's up
But I know your body know what's up
But I know your body know what's up
But I know your body know what's up

[Bridge: Tory Lanez]
'Cause when you drop that thing on me
Like it's the end of the night
I swear if niggas hate, you know I got that thing on me
No need for no fight
[Chorus: Tory Lanez]
You ain't got a man? Come fuck wit' me (Uh-huh)
Roll up in that Benz, that AMG (Uh-huh)
You know I got them bands, they all on me (Uh-huh)
I know you wanna roll, so, you can tell me no
But I know your body know what's up
But I know your body know what's up
But I know your body know what's up
But I know your body know what's up

[Part 2: The Take]

[Verse: Tory Lanez & Kirko Bangz]
Hop in, oh, what's up?
When I seen that body go down
And your friends at the club
Me, I'm really tryna go
Now that I got you, it's goin' down
So girl, don't you run from me
'Cause what I like, you like, we gon' like
I'ma feel up, feel down, feels alright
Might have to fly your ass to Toronto
(Hold up, why?)
'Cause shawty got that ass like a model, oh
And all these other women ain't got nothin' on her
You know that ass stop me from leavin' here tonight and tomorrow
I officially laid it down
Oh, I laid it down
She has been taken since the the day I laid it down, down, down, down
Taken, told you not to pull up wit' your shawty, taken19Embed"
Tory Lanez,3363393,193365,1632,Tory Lanez,https://images.genius.com/3b479fd3e12e5997c34af4da332aa154.300x300x1.jpg,B.I.D,https://genius.com/Tory-lanez-bid-lyrics,139894,"B.I.D Lyrics[Intro]
Yeah, oh yeah, oh yeah
Got it on smash
Alright cool
OG Parker

[Pre-Chorus]
Jumped in the 'What-the-fuck-is-that'
Took a shot of Henny out the back
Girl you know it's real, I ain't tryna brag
I just wanna take you to the back while you let a nigga

[Chorus]
Bust it, down, bust it, down
Bust it, down, oh yeah
Bust it, down, bust it, down
Bust it, down, oh yeah, yeah

[Verse 1]
Wait, in the trap with the top and the cash, ayy
I won't tolerate a bitch talkin' back, ayy
'Less she lookin' at me, throwin' that shit back, ayy
20 motherfuckin' racks on a bad day
Jumped in the 'What-the-fuck-is-that'
Drunk and it ain't no comin' back
Pussy nigga don't get hit up with the .30
Sendin' bullets lookin' all across the map, ayy
T.O niggas don't know how to act
I fucked up the re-up, got it back
Shooter right beside me with the Curry
You gon' let me ride 'cause I
[Pre-Chorus]
Jumped in the 'What-the fuck-is-that'
Took a shot of Henny out the back
Girl you know it's real, I ain't tryna brag
I just wanna take you to the back while you let a nigga

[Chorus]
Bust it, down, bust it, down
Bust it, down, oh yeah
Bust it, down, bust it, down
Bust it, down, oh yeah, yeah

[Verse 2]
Wait, cracked that Hennessy and now I'm drunk, ayy
We don't know you, you can't smoke the blunt, ayy
Yeah, I see the opps in the front but
I got a Glock in my Louis V draws
Jumped in the 'What-the-fuck-is-that'
Drunk and it ain't no comin' back
I might pull up to her block, 7:30
And fuck her once, I know I'll get attached
She mad I keep pullin' on her tracks
Bought her Uber here but I didn't buy it back
Fuck a 'lac, all of this is facts
She just wanna throw that ass back when I
[Pre-Chorus]
Jumped in the 'What-the-fuck-is-that'
Took a shot of Henny out the back
Girl you know it's real, I ain't tryna brag
I just wanna take you to the back while you let a nigga

[Chorus]
Bust it, down, bust it, down
Bust it, down, oh yeah
Bust it, down, bust it, down
Bust it, down, oh yeah, yeah22Embed"
Tory Lanez,2154007,199349,1632,Tory Lanez,https://images.genius.com/561b650ea374801ebdee3f26db9f3ca4.300x300x1.jpg,Honda Civic,https://genius.com/Tory-lanez-honda-civic-lyrics,139250,"Honda Civic Lyrics[Verse 1]
You got, somethin' that I do want, somethin' that you do got
You, so fly, I'll fly your ass, I'll fly you to Dubai
Move round the blue sky, drive in a new ride
You so bad you can't come, round my niggas
'Cause all us thirsty, really though
We be goin' in, like we all got curfews, really though
By the way, who the fuck, is knock-knockin' at the function?
Man, I hate when a nigga cockblockin' at the function
I'm tryna get laid tonight
Tryna find a group of all girls who down for their ladies night
'Cause you know it's on when I come
Pullin' up clean in my Nike Airs
Nightmares at the bottom
Got up mobbin' through the city of the eve
In my Yves Saint Laurent shirts and palm sleeves
But you know, that it's all for you
And when I'm down on the ground and fucked up
Girl, I'll call for you
Know that you're needed, know that you're needed
'Cause when these hoes hoed out and these niggas sold out
Girl, you still down

[Chorus]
You're always down
You're always down
You're always down
You're always down
Don't, don't go
Don't stay
Don't, can we go?
Don't, don't go
Don't stay
Don't, can we go?
[Verse 2]
I swear you been down since 6th grade
Down with all my shit, I didn't even have shit straight yet
You remember them days?
Nigga probably wouldn't eat
If it wasn't for you workin' at the Micky D's real late
Girl I, thuggin', hustlin', strugglin'
Tryna bring money in, you know you were there for that
I remember that day, you lent me your Civic
It ran outta gas but I ain't have money to pay but
Fuck it, I'm on now, my money is long now
Got drivers to open the door now
Put diamonds in both of your drawers now
And you know this shit for you
Fuck with your nigga, baby
I been that nigga since day 1
The one that you talk to when shit is crazy
Lately I feel like we lost touch, wanna gain that back
I wanna lean on you without havin' to drink that Act'
Girl, you know, don't wanna think that back
I wanna give my trust but, don't wanna take that back

[Bridge]
Girl, let me know if, you are down for this
'Cause I'm so, so down
Oh it will go down
And when it does go, and when it does go
Just know I love you, and you know its true
Fuck with me tonight, I think this shit right
I did this shit right
I think this feel right
I think this feel right
I think this feel right
[Chorus]
You're always down
You're always down
You're always down
You're always down
Don't, don't go
Don't stay
Don't, can we go
Don't, don't go
Don't stay
Don't, can we go33Embed"
Tory Lanez,4027855,508401,1632,Tory Lanez,https://images.genius.com/946340da8daac47d1c3840fbabc9a8ad.300x300x1.png,FeRRis WhEEL,https://genius.com/Tory-lanez-ferris-wheel-lyrics,137932,"FeRRis WhEEL Lyrics[Chorus: Trippie Redd]
We stay lit, all that shit
Damn, lil' baby, what you call that shit?
That's the red nose shawty, you a dog, lil' bitch
Touch the damn floor with your paws, lil' bitch
Shake that fat ass on my balls, lil' bitch
Damn, lil' baby, what you call that shit?
Shaking all off the wall, what you call that shit?
Damn, lil' baby what you call that shit? Yeah

[Verse 1: Trippie Redd]
Baby, come and get some cash
Damn, lil' baby, that's a whole lotta ass
Got me feeling like Steve Nash
With a milk mustache, damn, I'm MVP, yeah
Baby, why you take up two seats? Yeah
Don't clap your hands, baby, clap them cheeks, yeah
Going brazy on the motherfucking D, yeah
Keep dancing, Happy Feet

[Interlude]
This is a speech to all you Instagram girls thinking it's cute when you twerking, 'kay?
I don't want to see your ass jiggling everywhere, do you Jenny?
No, I just text

[Chorus: Trippie Redd]
We stay lit, all that shit
Damn, lil' baby, what you call that shit?
That's the red nose shawty, you a dog, lil' bitch
Touch the damn floor with your paws, lil' bitch
Shake that fat ass on my balls, lil' bitch
Damn, lil' baby, what you call that shit?
Shaking all off the wall, what you call that shit?
Damn, lil' baby what you call that shit? Yeah
[Verse 2: Tory Lanez]
Lil Tory!
Girl, you look good when you back that ass up
Know I look good when I bag the cash up
Shawty from the hood and I'm back in the trap house
Talk that shit 'til you back to your dad's house
I'm a real nigga from the T and O
I got a bad little bitch that let me beat on the floor
I remember nights I used to sleep on the floor
I see them days, I don't ever wanna go back no more
Now my little bitch wanna fuck my bitch and I'ma let her fuck her
Pull up in a new estate, I got a Bentley truck
Got Ciroc, in the shot, like it came from Diddy
Got a hundred wild niggas that won't change for pussy
How you doin'? How you like it? Let me whisper in your ear
Tell you a lil' something you might like to hear
You know I be with star niggas like Trippie Redd
And if I whip this dick out, girl, you're giving me head, hey

[Chorus: Trippie Redd & Tory Lanez]
We stay lit, all that shit (Lil' shorty)
Damn, lil' baby, what you call that shit?
That's the red nose shawty, you a dog, lil' bitch
Touch the damn floor with your paws, lil' bitch
Shake that fat ass on my balls, lil' bitch
Damn, lil' baby, what you call that shit?
Shaking all off the wall, what you call that shit?
Damn, lil' baby what you call that shit? Yeah8Embed"
Tory Lanez,2144329,172030,1632,Tory Lanez,https://images.rapgenius.com/4aae77311a6e78054e3d44b10597b9ba.300x300x1.jpg,Karrueche,https://genius.com/Tory-lanez-karrueche-lyrics,135873,"Karrueche Lyrics[Produced By: Xaphoon Jones]

[Verse 1]
I don't know if you belong to someone else
I know that I want you to myself
They might say I ain't shit for this
Just know that I meant everything I said to you for sure
If in fact that you decide
Well I wanna take it all up off of your body, for sure
If in fact that you'll be mine
I wanna take it all up off of your body

[Chorus]
Pretty miss Karrueche, I'm sippin' on this D'usse
I ain't throwin' no shade, I just want you to myself
Pretty miss Karrueche, I'm sippin' on this D'usse
I ain't throwin' no shade, I just want you to myself

[Bridge]
If I'm wrong then let me be wrong, let me be wrong, baby
For thinkin' that you don't need someone
I can make you feel like your heart won't do
Like it's you first time goin' strong, I want you to be mine for sure

[Verse 2]
Now if you decide, you'll say you'll be mine
Sit that ass by my side, ohh
Shawty, don't deny, I ain't askin' for a reply
Just hard to say goodbye, oh baby
[Chorus]
Pretty miss Karrueche, I'm sippin' on this D'usse
I ain't throwin' no shade, I just want you to myself
Pretty miss Karrueche, I'm sippin' on this D'usse
I ain't throwin' no shade, I just want you to myself

[Bridge]
If I'm wrong then let me be wrong, let me be wrong, baby
For thinkin' that you don't need someone
I can make you feel like your heart won't do
Like it's you first time goin' strong, I want you to be mine for sure
Make you feel like your heart won't do
Like it's you first time goin' strong, I want you to be mine

[Verse 3]
At the top sippin', baby
If I'm wrong, let me know, I gotta know
At the top sippin', baby
Can we smoke one more time? I gotta know
At the top sippin', baby
Just to go back to that night, all I want

[Outro]
I know what to do with it, I'ma keep it true with it
I know, I know what to do with it
A man can only dream of it, so I'ma dream of you
I know what to do with it, I'm not being rude with it
This ain't for Teyana, this one here for you, ohh baby
Bring your ass to Toronto, all I wanna do is
Bring you to the condo
So we can smoke
And you can let your stresses go
How personal15Embed"
Tory Lanez,3795037,3390361,1632,Tory Lanez,https://images.genius.com/5fb9ad73271e54c329bac708d1e17a3f.300x300x1.jpg,KeeP IN tOUcH,https://genius.com/Tory-lanez-keep-in-touch-lyrics,127063,"KeeP IN tOUcH Lyrics[Verse 1: Bryson Tiller]
I took the 95 to get from West Palm
Think I need a break from everything
Yes, I'm stressed way more than usual
I'm gettin' things back in order
Getting things back to how they used to be
Back to when the scrutiny had no effect on you and me
I miss driving with you in the passenger (Driving, yeah)
Feet up on my dash, we would see the sun lapse
Take you home, you would come see me before class
Makes more sense for you to crash with me but you never ask, oh why
Told you there's no need to be shy, oh why
I be waiting in the meantime, oh why
You always got me on stand by
When you know I need love
I'm missing when we was us
Miss when I wasn't famous, that's when we could be us
Kiss right in the street, fuck if anybody sees
Just friends, I don't think anybody believes
Hard to keep it PG with a nigga like me, goddamn

[Chorus: Bryson Tiller]
I fell in love with you, I fell in love, girl
I miss us
Nah, I won't front, got me so sprung
'Cause you, you're one of one (Hey)
It's no rush (Yeah, miss it)
I'm missing your touch (Your touch)
I'm missing your touch, oh
Missing when you kept in touch, oh-woah-oh (Oh, yeah)
When you kept in touch
[Interlude]
Phone ringing

[Verse 2: Tory Lanez]
I took the 401 to get from Yorkdale
You're still looking like the baddest thing I done seen
Deflated before it started flattening
Way before the singer-rapper thing started happening
We were playing checkers, I was just tryna get back to king
I miss black tinted windows on your whip looking Amish
I'm just tryna put it down
You can put it on my tab
I'm putting you on your back
Then putting it in you slow
Then putting it in on a track, oh yeah
And I always tried to fall through
Ain't no Ws and dubbing me when I call you
I'm in first class
Thinking 'bout how you would get me right
Damn near made me miss the flight
Fucking you and get it right, yeah
You gon' bring me to that first time we fucked on the futon
Back then, I would do anything to get you alone
You would know me, all bullshit aside
So hit my line, I miss us
[Chorus: Bryson Tiller & Tory Lanez]
I fell in love with you, I fell in love, girl
I miss us (Baby, oh yeah)
Nah, I won't front, got me so sprung
'Cause you, you're one of one (You're one of one)
It's no rush (Yeah, miss it)
I'm missing your touch (Your touch)
I'm missing your touch, oh
Missing when you kept in touch, oh-woah-oh (Oh, yeah)
When you kept in touch4Embed"
Tory Lanez,2297506,199349,1632,Tory Lanez,https://images.rapgenius.com/3a903a24db15edfa153f4f4874a306cc.300x300x1.jpg,Initiation,https://genius.com/Tory-lanez-initiation-lyrics,125072,"Initiation Lyrics[Intro]
I got it in the worst way
Got me trapped in your love cage
Listen, listen
Your eyes don't glisten, glisten
Like they used to
And this ain't something that I'm used to, no

[Verse 1]
Uh, I landed in Miami with the top
Tryin' spend a lil time with a bad one
I got a lil motto, any bitch that you fuck
Make her badder than the last one
I'm pullin' in a S50, pullin' in a fuckin' S50, shawty
Stuntin' in a S50, stuntin' in a fuckin' S50

[Bridge]
Like oohwee, who's he?
These niggas is talkin' and if they don't like it, sue me
I'm too deep, I'm too deep
But not with my niggas, with two freaks, yeah

[Chorus]
Look I need somebody
So do you want to be somebody, yeah?
I'm tryna see some shawty
That's what you need to do to be down for it, ah
Initiation, initiation
Initiation, initiation
You wanna get down with a nigga, you gotta be patient
Initiation, initiation
[Interlude]
I know the way you operate
It's much easier than falling again
I know you won't cooperate
But I know far too much to buckle now

[Verse 2]
Pullin' up the cameo in Miami
She steppin' out the Maserati eyein' at me
I'm pourin' up, I'm with a Dirty Diana
Shawty get it poppin', shawty called Keiyanna
Okay, well okay
I heard you goin' both ways, you don't say
I know your friends tryna do it off a Dolce
And when I’m walking' in she acting out a role play

[Bridge]
Like oohwee, who's he?
These niggas is talkin' and if they don't like it, sue me
I'm too deep, I'm too deep
But not with my niggas, with two freaks, yeah

[Chorus]
Look I need somebody
So do you want to be somebody, yeah?
I'm tryna see some shawty
That's what you need to do to be down for it, ah
Initiation, initiation
Initiation, initiation
You wanna get down with a nigga, you gotta be patient
Initiation, initiation
[Interlude]
I know the way you operate
It's much easier than falling again
I know you won't cooperate
But I know far too much to buckle now

[Verse 3]
She hopped off the plane and she said her name
I wanna get ya, bitch, I wanna tame
Baby, you know you a piece for the P, nigga
One Umbrella, mad love, it's so hard to compete with us
Hop in the rari', I hijack the streets nigga
I'm all in the trap house, I'm duckin' the Dee's with her
I work out the work and she workin' for me, nigga
She'll do anything for some new Céline
All on the highway, all on the highway
My whip be smokey like it's from Friday
This shit amazin', this feel amazin', yeah
Grills in my mouth and I fucked her with Bathing Ape on
Holla at a real nigga shawty 'cause I know you need somebody
I'm not soundin' too insane, insane, insane
Hope what I'm sayin' don't sound insane, insane, insane15Embed"
