artist,id,lyrics_owner_id,primary_artist_id,primary_artist_name,song_art_image_thumbnail_url,title,url,pageviews,lyrics
Tory Lanez,2945695,126836,1632,Tory Lanez,https://images.genius.com/d48bcbe809effc317a2cb93c897a25fb.300x300x1.jpg,1 Call,https://genius.com/Tory-lanez-1-call-lyrics,67780,"1 Call Lyrics[Intro]
Nah-nah-nah-nah-nah-oh, oh yeah
Oh-oh-oh-oh-oh-oh
And I'm still up runnin', lookin' for you, yeah

[Verse 1]
And I met her, hard time sweat up
It was in the game and that wasn't your thing and you in some Margiela
I was just another nigga tryna holla, figured, I would politic ya
So I tried that on the low, baby
I know you deny that, keep it low with a nigga
And I still roll in Miami with the side, run the time back
You got a nigga but I'm still your nigga on the low 'cause

[Pre-Chorus]
I've been gone for way too long
Down Miami, been up waiting
Girl, this feeling's way too strong

[Chorus]
I'm one call away
If you wanna go, oh-oh, yeah
Girl, I'm just one call away (One call, baby, I'm one call)
Girl, I'm just one call away (One call, baby, I'm one call)

[Verse 2]
Still on her, still want her, still get her
Still kick the melody when I sing up
Hit record all about you, I figure
You would have to hear it some way
Girl, I've been searching and searching, ain't found it
All of the things that you do just remind me
Where did you go? Girl, you were just beside me
All of the signs, girl, I'm out of time, but I guess I
[Pre-Chorus]
I've been gone for way too long
Down Miami, been up waiting
Girl, this feeling's way too strong

[Chorus]
I'm one call away, baby
I just wanna sing to you, woah, yeah, yeah
Girl, I'm just one call away (One call, baby, I'm one call)
Girl, I'm just one call away (One call, baby, I'm one call)

[Outro]
One call, baby, I'm one call
One call, baby, I'm one call
'Cause I just wanna sing to you
Break it down, baby
Woah, let me break it down for you, babe
Break it down for you
Break it, break it down for you17Embed"
Tory Lanez,2945751,1686632,1632,Tory Lanez,https://images.genius.com/d48bcbe809effc317a2cb93c897a25fb.300x300x1.jpg,Slow Down,https://genius.com/Tory-lanez-slow-down-lyrics,67575,"Slow Down Lyrics[Chorus]
Slow down, it's for you
Slow down, nigga wanna know you
Slow down, when I fall through
(Slow down, when I fall through)

[Verse 1]
Can't nobody put it on me, the way you put it on me (Yeah)
I said can’t nobody put it on me, way you be doing that, the way you did it on me, uh
Could've had ya, I did it wrongly
Could've bagged ya, I bidded on it
Even back when my niggas was sippin' Henny on me
He was like ""I betcha can't bag Maggie"", I had to go on in
She was gwanin', pretty darkskin, pulled up on it
Got the number, now I'm scorin', Mike Jordan
Fuck them niggas, you know them niggas type boring
Fly with me, 'cause you know a nigga type soaring
Get in that pussy and I'm like Gordon
Sex in the air and the dirty Sprite pouring
Got a nigga feelin' like we on a night flooring
Even if we on the ninth floor but
Hit the department stores in the mall and buy everything ya like sportin'
Shawty, you know ain't no price on ya
Shawty, you know ain't no price on ya
Shawty, you know ain't no price on ya
[Interlude]
Shit, I guess
Yeah, I guess I just feel like
This shit is supposed to be the way it used to be like
You make it like mine for the winter and you could be yours for the summer, summers with me, for spring, summer, you feel?
Nah for real, though
You see me, you know I'll allow it

[Verse 2]
And when I put it on you
Tell me you gon' let me put it on you
Tell me you gon' let me pull up on you
Tell me you'll hop in that brand new coupe
Songs like this remind me of Keisha
Times like this remind me of Teisha
Used to sneak in, while yo' mom's sleepin'
We would play it off, like it's on TV
Riskin' it all up in these dark streets
Tellin' you I love you for the wrong reasons
Tellin' you I love you when they start squeezing
But really I just need somewhere to come creeping
I never meant wrong, but I could've been honest, I
I know I'm wrong but I, the 4 o'clock fall ins, all in the morning
Have me gwanin' and goin' in all for you, baby
I fell halfway for you, I did that thing for you
Made this pathway for two
How you gon' act like it ain't for you? No
We can change, winter to the summer on a cruise, oh
Turn around, look up by the pool
Starin' down, looking at my view while you look up at the views, ooh
[Outro]
Slow down
Slow down
Slow down3Embed"
Tory Lanez,2397560,104344,1632,Tory Lanez,https://images.genius.com/caf0d9ecf4c8b4b97b1d4a0b7c67f858.300x300x1.jpg,Woods,https://genius.com/Tory-lanez-woods-lyrics,67244,"Woods Lyrics[Intro]
Think y'all niggas know what it is
We all the way live
Shout out to my bitches that do the postal, yeah

[Chorus]
I get Céline for my bitch that do the postal
I get that brick, I get that bird from coast to coastal
I hit the papi then them bitches screamin', ""Ay""
I mix then pump my wrist and whip until it's dry
I threw that dope and all that dodi in the bushes
I heard the feds were lookin' for me, got to book it
I know you're sellin' but you need to cut the price
I get that pack and run that bitch like Jerry Rice

[Verse 1]
Yeah, I got that A1 perico
Connect and I call me a Hector
I got ones that want the wholesale
I got ones that want the sectors
I got love for all my niggas
That'll come around and break it down in sections
Funny all these niggas pussy
Only time I'm walkin', I don't need protection
I got a check on me right now
My ring lookin' like a lighthouse
All of them bitches you seen on their Instagram flexin'
Be fuckin' at my house
Trappin' all out of the B
Play Picasso on the beat
Niggas pissy just to get me out
They know it's 50 thousand for the feat, sheesh
Let me tell you somethin' 'bout this chick that I got
I'ma buy her new Céline if she keeps mixin' my pot
She stay all up in the kitchen in that trap, in the B
She don't twerk but with that work I swear that ass is a beast
[Chorus]
I get Céline for my bitch that do the postal
I get that brick, I get that bird from coast to coastal
I hit the papi then them bitches screamin', ""Ay""
I mix then pump my wrist and whip until it's dry
I threw that dope and all that dodi in the bushes
I heard the feds were lookin' for me, got to book it
I know you're sellin' but you need to cut the price
I get that pack and run that bitch like Jerry Rice

[Verse 2]
Yeah, for the apologies
I made so much money this year
These niggas could never ever say they copied me
Ed Sheeran covers on my shit
These niggas could never ever say they're stoppin' me
Fuck the apology
I got some bad bitches rollin', you know that they gotta be
All of my money colored like Monopoly, yeah
Tell all them bitches
I'm rollin', I'm smokin', I'm sippin' on Hennessy, yeah
Beside them bitches that came up from Memphis
My chick only 10 I see, yeah
Energy, energy, I got that bitch off the Hennessy
All my diamonds white like they in supremacy
All my bitches 10s like that's just the Tennessee
[Chorus]
I get Céline for my bitch that do the postal
I get that brick, I get that bird from coast to coastal
I hit the papi then them bitches screamin', ""Ay""
I mix then pump my wrist and whip until it's dry
I threw that dope and all that dodi in the bushes
I heard the feds were lookin' for me, got to book it
I know you're sellin' but you need to cut the price
I get that pack and run that bitch like Jerry Rice11Embed"
Tory Lanez,3282663,126836,1632,Tory Lanez,https://images.genius.com/bd6b7c0f7e31741502260c92aae92c51.300x300x1.jpg,48 Floors,https://genius.com/Tory-lanez-48-floors-lyrics,65237,"48 Floors Lyrics[Part I]

[Verse 1: Tory Lanez]
I can't make no dinner, but a nigga whip the breakfast
We can smoke, we can fuck, what's your preference?
Wrote to Santa just to put you on my sex list
You got that million dollar on at the Craigslist
Aw yeah, and you know who I am
All these bitches in the crib, they just go there to dance
And I'm in and out the bank like I go there to scam
We can go to Miami, girl, we can go get some tan, oh yeah
Liquor poured up, women called up, fuck it all up, oh yeah
In the condo, you know how it go, give it up slow

[Chorus: Tory Lanez]
48 floors, that's the way we going
Open up the Wraith doors, oh yeah
And don't make me wait for ya
Pussy so good, I should have to pay for it, oh yeah
48 floors, that's the way we going
Open up the Wraith doors, oh yeah
And don't make me wait for ya
Pussy so good, I should have to pay for it, yeah
So good, I should have to pay for it

[Verse 2: Tory Lanez]
Saved you under peach emojis in my contact
So when you hit me, you remind me just to call back
Tell them niggas like the Summer coming, fall back
She cashing out at 4 A.M., I'm 'bout to fall in, okay
We found love in the club, what you call that?
We wound up in the tub, and I bossed that
We still fuckin' on the bed, to the left, Tory
We still got this shit lit, 48 floors
[Chorus: Tory Lanez]
48 floors, that's the way we going
Open up the Wraith doors, oh yeah
And don't make me wait for ya
Pussy so good, I should have to pay for it, oh yeah
48 floors, that's the way we going
Open up the Wraith doors, oh yeah
And don't make me wait for ya
Pussy so good, I should have to pay for it, yeah
So good, I should have to pay for it

[Part II]

[Verse: Mansa]
Portuguese girl from Paris, that my French baby
I'm just tryna win, can you let me win, baby?
Mixing up Patron with the gin, baby
I don't see nothing wrong, even though I know it's a sin, baby
I'm a 7 figure nigga, still riding the scrape
Still drop a bitch off if she don't drop on the tank
I can never lose the flavor that I got from the Bay
And I still got it, if you need it, you can cop it today, ooh yeah
On the 48th floor, keep that body on Dasani like it's off a lakeshore, yeah
Grindin' on me like a skateboard, tryna push a nigga buttons, this is not a GameBoy, no
Uh, on the 48th floor, the condo 'bout the bando, where I used to stay before
Now I'm poppin' in Toronto, I go state to state, foreign whip
Whippin' like I'm tryna make a getaway for it, oh yeah
[Outro: Mansa]
Uh, oh yeah
Ooh, ooh, ooh
Oh
Ooh, ooh6Embed"
Tory Lanez,2153966,199349,1632,Tory Lanez,https://images.genius.com/280139263184cbf84cdb1031a3918595.300x300x1.jpg,Fallback,https://genius.com/Tory-lanez-fallback-lyrics,64058,"Fallback Lyrics[Intro]
I like that. I know, I do say shit sometimes and you'll look at me like, ""Yo, ahile."" Ahile, I'ma tell. It's no lie. Ahile. Hold up. Yeah

[Verse 1]
She bad, ahlie? Ahlie
You should bring a couple friends to the bed tonight, ahlie
She only stuck up when she talkin' to Fargo
Got a nina, but I don't ever gas her though
I just tell her, she got it, she got it, she got it
And I need that, nigga, need that
All up in her ear like the feedback
Gucci, Louis, Prada, you could keep that
It's first class, put your seat back
Look, I need that
The baddest out my city and I mean that
I'ma buy lil mama the new Celiné bag
I'ma spend 'em commas up on her mean ass
Drama, any nigga fuckin' with lil mama
Tone up, how to fit it, gon' and still gone love her
10 on the Rollie
Zip lock, no tick tock on the Rollie
Nigga still walkin' with the .40

[Bridge]
Still in and out the door like the Fruit Loop
Big money everywhere, young rich nigga in a new coupe
I see the money everyday
I'm talkin' 'bout how I came up just a lil nigga
With this dough everywhere
And I finally got it, they see me and they nodded
[Chorus]
She got it, she got it, she got it
She bad, ahlie, ahlie and I need that
If a man get's that, he'll be glad, ahlie, ahlie and I need that
Girl, put that body in focus, yeah

[Interlude]
Lay down. Nah, I'm not talkin' too fast, you just listenin' too slow, feel me. Fargo

[Verse 2]
And you noticed, girl stay focused
Fuck all that slow shit, I keep it honest
Back in Miami, she see me in Phantom's and now she lay down
And she came dancin' up on me and kept me up
Actin' like she was the motherfuckin' lay down
And you know how they do
You're outta line, you're outta line, you're outta line
And my nigga Pain once said, he say, ""You're outta line""
That's why I know you're outta line, lay down

[Bridge]
Still in and out the door like the Fruit Loop
Big money everywhere, young rich nigga in a new coupe
I see the money everyday
Talkin' 'bout how I came up just a lil nigga
With this dough everywhere
And I finally got it, they see me and they nodded, Fargo
[Chorus]
She got it, she got it, she got it
She bad ahlie, ahlie14Embed"
Tory Lanez,5004079,3390361,1632,Tory Lanez,https://images.genius.com/3fcde11a762313dc5dc755687b0a114b.300x300x1.png,Beauty in the Benz,https://genius.com/Tory-lanez-beauty-in-the-benz-lyrics,62879,"Beauty in the Benz Lyrics[Intro]
(To thank you, to thank you)
(To thank you, to thank you)

[Verse 1: Tory Lanez]
Keep it real, this how I'm comin' in it from the jump
You're so beautiful, I kiss and hit it from the front
Take you everywhere with me 'cause I love to stunt
Money everywhere, baby, 'cause you love to stunt
Hit the strip club with me, make ten G's
We'll be runnin' up the bag 'til it empties
Got a temper 'cause she bad, don't tempt me
Shawty, I'm a different man off the Hennessy
Tryna hit it so good you remember me
Pussy good like
Fuckin' your body, I let it go down
I make it ring like the Neptunes song
You hold it down like a stunner, you done cleaned that
You hold it down every summer in Celine bag
Oh, when you're givin' me love, you never keep that
You never give me enough, knowin' I need that
We gon' fuck up the sheets, send 'em to the cleaners
We might smoke weed on the way and catch a misdemeanor
I'm a young nigga that wanna get with you and beat it
My ex hate when I'm with you, it's gettin' her heated
[Chorus: Tory Lanez]
'Cause you're so beautiful
Oh, oh, oh, oh
Said you're beautiful
Oh, oh, oh

[Verse 2: Snoop Dogg]
What can I say to you that you ain't never heard?
I'm breakin' it down, shawty, I'm talkin' 'bout every word
Observe how I splizz-erve, slick like a iceberg (What?)
Cold with the wizz-ords and lit like my izz-erd (Ah)
Of course it all matters if you with it or not
'Cause if you don't, you won't, but if you get it, you got
Ain't nothin' wrong with this, now peep it out
And if it's too hard, then go ahead and bleep it out
See, I'ma tell you what I see 'cause what I see is all I know
I'll wrap you up with a bow, lay you out on the floor
And let Tory tell the story 'cause you know how it go
Then hit the switch in my blue '64, mmh-mmh

[Chorus: Tory Lanez]
Beautiful
Oh, oh, oh, oh
Said you're beautiful
Oh, oh
[Verse 3: Tory Lanez]
You know how to let me know if I done enough
Touch down in it, put them numbers up
You wanna leave 'cause he don't make you cum enough
Well, guess what? I'm the next runner-up
Big bank, baby, and I spend it all on you
Fuck it up in here, that's what we ought to do
A lot of options, I could call 'em through
I switch her option like an audible
Bentley Bentayga, girl, you gets paper
They be pocket watchin' the money you get paid
I wanna fly you to the sand in Jamaica
You damaged your makeup, still managed to make it, yeah
Humble as ever, but stunt with the cheddar, yeah
You grind with me, we gon' come up together, yeah
Pretty days, we gon' stunt it together
'Cause the Rolls Royce I drive, it come with umbrellas
I don't talk no shit 'cause I just back that shit up
I'ma flip lil' shawty like the spatula
I'ma sink my teeth in it deep, Dracula
Pretty Rick when I hit it, have you spectacular, uh

[Chorus: Tory Lanez]
Beautiful
Oh, oh, oh, oh
Said you're beautiful
Oh, oh, oh
Yeah
[Outro]
Something about you
There's something about you (To thank you, to thank you)
There's something about you (To thank you, to thank you)
(To thank you, to thank you)
(To thank you, to thank you)
(To thank you, to thank you), beautiful
(To thank you, to thank you), I just wanted you3Embed"
Tory Lanez,5368469,498964,1632,Tory Lanez,https://images.genius.com/d3b5959c30c605127d51c6dfa662857a.300x300x1.png,Do the Most,https://genius.com/Tory-lanez-do-the-most-lyrics,62233,"Do the Most Lyrics[Intro]
Foot on necks
Yeah, yeah
Ayy, ayy, ayy

[Verse 1]
I say word to my ex, I might never fall in love again (What?)
Chase nothin' but the liquor in the cup again (Uh)
I did a show, I'm leavin' with a hunnid bands
And I ain't stut—, stut—, stu-stutter, man
Yeah, I got two birds (Brrr), like Stunna, man
Hotline bling (Brrr), that's a hunnid bands
In the night club, they be like ""You done it, man"" (Oh yeah)
In the night, chain lookin' like ""Duh-duh-duh-duh-duh""
Got the house party all tilted (It's lit)
I fuck that girl, said, ""Fuck my girl"", I feel guilty
Gotta feel me (Oh yeah), I'm filthy (Oh yeah)
I call a lot of women, ""Bae"", but you my real bae
She got that ice cream, she supersize it, nigga (Supersize)
Swimmin' in it feelin' like a scuba-diver, nigga (Scuba dive)
Say you got my point, this besides it, nigga
You can't even sit that ass beside a nigga
Woah (Go)
I'm in your city on some hot shit
I fuck, her, her, her, I'm on some thot shit
My outfit is brazy, this shit a mosh pit
And all you hatin' ass niggas, get off my dick
Ayy, I do my own stunts
And I ain't passin' shit, I smoke my own blunts
If ain't lil' mami ain't into me, then you on some (On some)
Stack up then throw somethin'
Girl, let me poke somethin' (Pour somethin')
Lil' Tory, ayy
[Chorus]
Everybody lit, take a toast (Take a toast)
I feel alive when I'm goin' ghost (Goin' ghost)
I gotta keep my niggas real close (Real close)
'Cause if I don't, they gon' do the most (Oh yeah)
Everybody lit, take a toast (Take a toast)
I feel alive when I'm goin' ghost (Goin' ghost)
I gotta keep my niggas real close (Real close)
'Cause if I don't, they gon' do the most (Oh yeah)

[Verse 2]
Play me wrong, shit, I might fuck it up (Shit, I might fuck it)
You lookin' good in them jeans, shit, I might touch and nut (I might touch and nut)
Shit like, this one chick back in the day, she tried to put me out
I put on her knees and I put it in her mouth
I got a fresh outfit and I must say
When I step in that bitch, don't touch me (Touch me)
When I'm starin' in the mirror, don't be rushin' my shit (Don't be rushin')
See my hairline fresh, don't be touchin' my shit (Ha, ha)
'Cause I'ma get my ex bitch back (Back)
Have her on some, ""How you got it like that?"" (Like that)
From the air, girl, you see me at the ware'
I'm a boss, throwin' salt, kill a snail, not a player (I'm not a player)
One Umbrella on my underwear (My underwear)
Somebody call for the sauce, I appear (I'm here)
In the club, shawty standin' right here
Like Chingy, I hit right there, right there, right there, ayy
[Chorus]
Everybody lit, take a toast (Take a toast)
I feel alive when I'm goin' ghost (Goin' ghost)
I gotta keep my niggas real close (Real close)
'Cause if I don't, they gon' do the most (Oh yeah)
Everybody lit, take a toast (Take a toast)
I feel alive when I'm goin' ghost (Goin' ghost)
I gotta keep my niggas real close (Real close)
'Cause if I don't, they gon' do the most (Oh yeah)8Embed"
Tory Lanez,5757523,9736166,1632,Tory Lanez,https://images.genius.com/a82d0375fa3456015bfa8bd64a4389f2.300x300x1.jpg,SKAT,https://genius.com/Tory-lanez-skat-lyrics,62032,"SKAT Lyrics[Intro: Tory Lanez]
Okay
Okay
Okay
Yeah, yeah, okay

[Verse 1: Tory Lanez]
Wrist so wet I might drown
Bitch, don't talk, you goin' downtown (Okay)
I done made 6 half for the whole week
Plug want a player then I'm goin' O.T (Okay)
I just made 457 on Wok
I'll hop in that Scat and I'm bendin' your block (Okay)
Nigga wanna scrap, well, then, let it go rock
My lil' nigga got it, I bet he gon' pop (Okay)
I can make 10 on face no fillin'
6 dot like Krillin, I'm smokin' gorilla (Okay)
Couple of my niggas just caught that nigga that was runnin' off
Dawg, I know they gon' kill him (Okay)
Smokin' on killer and takin' your bitch on a trip
And we fucked on the floor of my villa (Okay)
I ain't got time for two things, what?
These stupid ass hoes and they feelings, ayy (Okay)
All independent, my bitches just call and they get it
They know that this ballin' authentic (Okay)
Chocolate vanilla get hot so I hopped out the dealer
I copped a new car and I tint it (Okay)
Won't lie, lil' bitch had a nigga down
But now that I'm out of my feelings (Okay)
I'ma stack the money so tall in the crib
It be lookin' like the roof came out of my ceiling (Okay)
Soon as I hop in I zoom
Scoopin' that bih like a spoon (Okay)
I got this FN, it sing like that bitch is in tune
Look at his face when we walked in the room (Okay)
Ayy, 35 MAC-10s
Ayy, I'll kill him he play with my back end (Okay)
Fuckin' that shorty and I'm makin' her back bend
After my niggas walk in, we tagged in, ayy (Okay)
Ayy, right off the bat
Shorty, she know that I'm black but I'll Doja that cat (Okay)
She wear that thong I like
Them tights keep pullin' that pussy to show that it's fat (Okay)
Maybach to back with the double R
Copped the new Duffle, it came with the double star (Okay)
Then I put the trunk inside the front so when I'm backin' up
I still front on every one of y'all niggas (Okay), it's Tory
[Chorus: Tory Lanez]
Hopped in the Scat, bitch, I'm back, where have you been? (Okay)
Fifty thousand dollars on my jack', goin' stupid (Okay)
Back outside, every time, it's a new fit (Okay)
Niggas love to lie, gotta tell 'em what the truth is (Okay)
Hopped in the Scat, bitch, I'm back, where have you been? (Okay)
Fifty thousand dollars on my jack', goin' stupid (Okay)
Back outside, every time, it's a new fit (Okay)
Niggas love to lie, gotta tell 'em what the truth is (Okay)

[Verse 2: DaBaby]
I whip wrap the Scat the same color the Lambo (Wrap it)
I pull up orange and brown, they both look like Reece's (Okay)
I get in that mode where I fuck niggas' hoes (Mode)
And I break 'em off and send 'em back home in pieces (Okay)
Got a bitch from the 6, cut her off, don't know how to suck dick (6)
Had to smack her head, like, ""Watch the teeth"" (Okay)
I be givin' the Holy Ghost to hoes, they see me (Ah! Oh my God!)
They get to passin' out and screamin' out, ""Jesus!"" (Okay)
I'ma keep it real, I don't really fuck with police (Woop)
I don't know shit, when I see 'em, I'm speechless (Shh)
I don't really wanna fuck with rap niggas, they bitches
I'd rather chill with my daughter, my nieces
Actin' like he love me, I don't need no new brothers (Nope)
I don't want advice, nigga, keep it
Let a nigga touch me, I'ma have to show you somethin'
I'ma have your family talkin' to the preacher
I'm not affiliated with no gang
But my Rollie face blue, look like it's out the freezer (Vewm)
I'm makin' niggas' bitches say my name
She ain't know how to fuck so Baby had to teach her
Oops, I ain't mean it (Oops), I put it on her face
And gave her an all-white towel so she could clean it (Ew)
I'm Baby Jesus, sometimes I wear it once and give it away
Sometimes I hit the cleaners (Go!)
Who wanna get knocked out?
I'ma come burn a nigga, hot sauce
I'ma hoo, knock a nigga socks off
'Bout to cop a new drop, take the top off
Should I go get the 'Vette or the double R?
My momma gon' say, ""Goddamn, that's another car"" (Damn)
I got so many square feet inside of my mansion
There room in the bed for every one of y'all
Like fuck it, let's have a sleep over
Got your bitch suckin' dick, got her deep throatin'
No, we ain't doin' shows 'til Corona over
'Bout to take the trap back over, we open
I can make 50 songs 'fore the week over
Keep your bitch ass asleep if you sleep on me
Tryna figure which car I'ma drive today
Hit the gas 'til they call the police on me
Yeah, bitch, I—
[Chorus: Tory Lanez]
Hopped in the Scat, bitch, I'm back, where have you been? (Okay)
Fifty thousand dollars on my jack', goin' stupid (Okay)
Back outside, every time, it's a new fit (Okay)
Niggas love to lie, gotta tell 'em what the truth is (Okay)
Hopped in the Scat, bitch, I'm back, where have you been? (Okay)
Fifty thousand dollars on my jack', goin' stupid (Okay)
Back outside, every time, it's a new fit (Okay)
Niggas love to lie, gotta tell 'em what the truth is (Okay)4Embed"
