artist,id,lyrics_owner_id,primary_artist_id,primary_artist_name,song_art_image_thumbnail_url,title,url,pageviews,lyrics
Young Thug,622394,104344,20503,Young Thug,https://images.genius.com/2b1dcde62657935e97ccf20a99636263.300x300x1.png,Never Made Love,https://genius.com/Young-thug-never-made-love-lyrics,137296,"Never Made Love Lyrics[Intro: Young Thug]
Umm (Never made love, never made love)
I'm sorry, you know that
I can't even explain it 'cause I'm wrong (Never made love, never made love, ayy)
So, ahem

[Verse 1: Young Thug]
She caught me creepin' with my old ho
She ran up like ""yeah, yeah,"" I was like ""no, no""
My lookout man was my right hand but he was wrong, though
Then I seen some diamonds come off of my neighbor's porch
And it was her, she had a Louis Vuitton purse clean as detergent
She had the same exact face as my brother's nurse
And he in a hearse, I never looked at it for what it's worth

[Chorus: Young Thug & Rich Homie Quan]
So I never made love, never made love (Ayy)
Never made love, never made love (Ayy)
Never made love, never made love
Never made love, never made love (Never made)
Never made love, never made love
Never made love, never ever ever ever made love
Never made love, never made love
I ain't never made love (Ayy)

[Verse 2: Young Thug]
Never made love, never made love (Ayy)
When she open up, I'ma taste her (Try)
X out everyone and then erase her (Ayy)
I'm sorry for lyin' to your face, yeah (Sorry)
I'ma marry her and I bouquet her (Ayy)
Leavin' out the house drunk and she stumbles (Woah)
Be all on her mind, she can't even think of (Drunk)
She walkin' off, I look at her like cable (Ayy)
Boolin' with your partners at a party, ayy (Fuckin' round)
They don't even know what the fuck love means, ayy (They gon' fuck with me)
She say she never waste time on me (Ahh)
Yeah that came out of your jaws, baby (I heard it)
I heard it, even though I suck it 'til she lockin' up (Ayy)
Lockin' up like handcuffs
Give me all your time, every day (Woo)
Girl how come we never made love at your spot? (Why?)
Cause you ain't want your other rich homie be findin' out (Ayy)
She want it so I spent twelve thousand on a lil' rug (Racks)
I'm just tryna tell you, ain't tryna make you look low
[Chorus: Young Thug & Rich Homie Quan]
Even though you've never made love, never made love (Ayy)
Never made love, never made love, never made love (Ayy)
She never made love, never made love (Ayy)
Never made love, never ever ever (Never made love, ayy)
She never made love, never made love
Never made love
Never made love, never made love
Never made
Never felt love, never felt love
Never made love, never made love, never made love

[Verse 3: Young Thug]
Well I'ma change that there
I just might wake up and buy you everything rare (Woo)
I'm not cheatin' on you no more, I don't care (Swear to God)
You wanna be with me, I'ma roll the dice now (Roll it)
Roll it, I buy a Rollie, I'ma buy that bitch a Rollie (Roll it)
That pack keep rollin', I'ma buy that bitch some more shit
'Cause I fucked her sister then I fucked on all her cousins
Bitch, I'm a Blood, you know I fucked on your bousins
She smiling in your face, but tellin' me she love it (Ayy)
She like the way my pants don't sag even though they're stuffy (Racks)
She won't T.I. on me, she don't care 'bout no money (Sorry)
Hey, hey (Swear to God)
Wait, wait, don't leave (Ayy)
Hey, hey (Swear to God, baby)
Ayy, ayy, hey (I love you like [?], baby)
[Verse 4: Young Thug]
They trip out all the time, tellin' you I'm on some bullshit
Parallel parkin' that pussy, they like my motion (Skrrt)
Put that on my mama, now Stunna know that I'm loaded (Loaded)
When my partner see it he stand up like he on Folgers (Woo)
I ain't like that shit so I hit him right in his shit
Then I told him, ""Don't ever do that shit there again"" (What?)
How you feel if I see your ho and fuck on the kid? (What?)
I'ma catch a body if she leave me, I'm not playin'
Yes, I said I'm the best and I put that on the red
When you make me mad I tried to get back and get some head
And I know that's wrong, but my dumbass still did it instead
Then I put the strap to my own head like boy I'm on one, woah
Then I told her don't ever do it again (Uh huh)
Every guy you look at, I'll turn him to wind (Ayy)
Yeah, then I looked up at God like yeah

[Chorus: Rich Homie Quan & Young Thug]
Then I realized I'd never made love, never made love (Woo)
Never made love, never made love
Never made love, never made love
Never made love, never made love
She never made love, never made love
Never made love, never made love
Never made love, never made love
She never ever made love
I swear to God I never made love, never made love
Never made love, never made love
Never made love, never made love
Never made love, never made love
Hey, never made love, never made love
Never made love, never made love
Never made love, never made love
Never made love, never made love
Never made love14Embed"
Young Thug,3911420,43360,20503,Young Thug,https://images.genius.com/159bae9f7766ccdf7a4d96233616a360.300x300x1.png,High,https://genius.com/Young-thug-high-lyrics,136745,"High Lyrics[Chorus: Elton John, Young Thug & Both]
And I'm gonna be high (hi-i-i-i-i-i-igh)
I'm a rocket man, I'm a rocket man, hey!
And I'm gonna be hi-i-i-i-i-i-igh
I'm a rocket man (hi-i-i-i-i-i-igh)

[Verse 1: Young Thug & Elton John]
Atlanta by my side
Different land for my kind (Thugger!)
Spend ol' bands for my pa (racks)
Spend ol' bands for my mother (I'm a rocket man)
Got a plan for my brother (hey)
Chanel bag for my lover (hey)
Fuck them ol' niggas, they ol' suckas (hey)
They tellin' on one another (and I'm gonna be-)
I want a train, let's run a train (okay)
If she wan' bang, then let her bang (hey)
He said he bleeding, where the stain? (where is it?)
My bitch at the top of food chains (I'm a rocket man)
They local, I don't even know they name (no)
I been fresh since a kid, ain't never plain
I just picked up a bag in Rotterdam
I'ma whip out the MAC and pop ya brain
(And I'm gonna be-)
I do what I want and shawty can't (yeah)
I do what I feel and shawty cannot
I'm diggin', I digg and shawty layin' (Thugger)
And all of the bitches say they digg that (I'm a rocket man)
From Maine way to Spain (woo)
All I got is a chicken for the thots (yeah)
I take off like a plane-
[Chorus: Elton John, Young Thug & Both]
And I'm gonna be high (super geeked!)
Like a rocket man, hey, like a rocket man, he-ey!
And I'm gonna be hi-i-i-i-i-i-igh
I'm a rocket man (hi-i-i-i-i-i-igh)
High as a plane! From Spain to Maine, you know what I'm sayin'? Damn

[Verse 2: Young Thug & Elton John]
On a private order (yeah)
I'm a rocket launcher (yeah)
It gotta be the pride of something (bet)
I walked out Magic stumbling (I'm a rocket man, woah)
I stumble upon a mil' (yeah)
I stumble upon a million five
I spent a fortune all on double seals
If I tell you the numbers you'll probably cry (And I'm gonna be-)
If I tell you you fake then you'll probably die
These days if he say that he hit then he probably lyin'
(I'm a rocket man, woah)
If you say you got wings and some fish then you probably fried (that's deep)
Got my karats out of Bonnie & Clyde (woo! And I'm gonna be-)
She let me back in like she never cried
She let me back in like I never lied
I look like a cat with 11 lives
I really kick shit you can ask a fly (I'm a rocket man)
I'm steady chasing like I'm never tired
I'm living scary like a haunted house
Lil mama sexy, I got butterflies, hey
[Chorus: Elton John, Young Thug & Both]
And I'm gonna be high (hi-i-i-i-i-i-i-i-i-igh)
I'm a rocket man, I'm the rocket man, hey! (yeah! yeah!)
And I'm gonna be hi-i-i-i-i-i-i-i-igh-igh, yea-yeah
I'm a rocket man
Hi-i-i-i-i-i-i-i-igh (ye-yea-yea-yeaah, yeah, yea-ah)

[Outro: Elton John]
And I'm gonna be high
I'm a rocket man31Embed"
Young Thug,2418031,104344,20503,Young Thug,https://images.genius.com/4bb84ee8525c5babc0635f6b0b479a1e.300x300x1.png,King TROUP,https://genius.com/Young-thug-king-troup-lyrics,136527,"King TROUP Lyrics[Intro]
I just asked God why he called for Troup
When it's time to ride, if you love 'em, nigga, prove it
(Wheezy Beats)
You know all your lil' niggas gon' shoot shit up for you
I thought I seen a ghost because your son look like you, fool
King Troup

[Chorus]
Action (Thugga!)
I hop out, I'm dabbin' (Hop out, I'm dabbin')
My old lady classy (My old lady clean)
We on to this fashion (Yes, we drippin')
My coupe sittin' on Davins (Skr-skr, skrr)
Hop out with a bad bitch (Hop out with a bad bitch)
My faculty braggin' (What?)
My briefs, they high fashion (Swear)
She naked, I walk through the door (I swear)
I promise, I promise she know (I promise)
I pour up a four and got more (Lean-lean)
I'm cold as the North fuckin' Pole (Brr)
I came a long way from the stove (Long way)
I hop in the foreign, go slow (I hop in the- skrrrrr)
Iced out, ain't no time in it, oh
Oh-oh-oh
[Verse 1]
Thugga!
I just beat the case (Just beat the case)
I hopped out the Benz (Hopped out the- skrr)
I just fucked some twins (I just fucked 'em bitches)
Had the jewelry in (I did)
I hopped out again (I hopped out and what?)
Pulled up in the Range (Pull up and skrr)
Got drank in my cup (Got drank in my- lean-lean)
Like I'm Kirko Bangz (Get)
From ashy to classy (Ashy)
Keep up with my ice and my fashion (Yeah)
I take care of my kid with a passion (Yah)
I pray to God that they stay happy (God)
Lil Roscoe, he sleep where it's nasty (I swear)
They could've freed him 'cause he grew up with no daddy (Forreal)
But instead, they took advantage and did him badly (Fuck)
Ain't give no fucks 'cause we were saddened
Got a camera from the club and that's all they had (Free the goat)
They also knew that lil' nigga didn't have a wagon (Free the goat)
Damn

[Chorus]
Action (Yeah, yeah)
I hop out, I'm dabbin' (Hop out, I'm dabbin')
My old lady classy (My old lady clean)
We onto this fashion (We onto these drips)
My coupe sittin' on Davins (My coupe sittin' on- skrr)
Hop out with a bad bitch (Hop out with a bitch)
My faculty braggin' (Brag)
My briefs, they high fashion
She naked, I walk through the door (Ayy)
I promise, I promise she know (Yeah)
I pour up a four and got more (Yeah)
I'm cold as the North fuckin' Pole (Yah)
I came a long way from the stove (Yah)
I hop in the foreign, go slow (I hop in the- skrrrrr)
Iced out, ain't no time in it, oh
Oh-oh-oh
[Verse 2]
Stop it (Stop it), stop the killin' (Stop the killin')
We (We), we get millions (We get millions)
We together (We together), get the cheddar (Get them racks)
Fuck them niggas (Fuck 'em, fuck 'em)
Keep a Beretta (Keep a Beretta)
Let 'em have it (Let 'em have it)
Ask God for forgiveness for them babies (Sorry God)
You know Slimes with it, baby, baby (Baby, baby)
Stack them racks up to the ceiling, hey, hey (Hey, hey)
Fuck you a nigga's old lady
Keep 'em mad and that's how you know you doin' good (Keep 'em mad)
Keep embarrassin' them with racks that look like books (You keep some racks)
I'm so finished (Finished with what?)
With these bitches (With these hoes)
I need me a real one (Need me a real)
I need commitment (Where ya at?)

[Chorus]
Action
I hop out, I'm dabbin' (I hop out, I'm dabbin')
My old lady classy (My old lady classy)
We onto this fashion (We onto this fashion)
My coupe sittin' on Davins (My coupe sittin' on Davins)
Hop out with a bad bitch (Hop out with a bad bitch)
My faculty braggin' (My faculty braggin')
My briefs, they high fashion (Versace!)
She naked, I walk through the door (She know it)
I promise, I promise she know (I promise, I promise)
I pour up a four and got more (I pour up the lean)
I'm cold as the North fuckin' Pole (I'm cold I swear)
I came a long way from the stove (I came a long way)
I hop in the foreign, go slow (I hop in the- skrrrr)
Iced out, ain't no time in it, oh
Oh-oh-oh
[Outro]
She know it, she know it
She know it, yah, she know it
She know it, she know-oh
She know it, yeah, she know it
She know it
She know it, yeah-ayy
She know it, know it, know it, know it, know it, know it
King Troup13Embed"
Young Thug,2304318,104344,20503,Young Thug,https://images.genius.com/2b1dcde62657935e97ccf20a99636263.300x300x1.png,She Notice,https://genius.com/Young-thug-she-notice-lyrics,136460,"She Notice Lyrics[Intro]
Wheezy Beats
The beat is produced by my nigga Wheezy
That's one of my newest engineers
I mean, one of my newest producers
I'm high, sorry, yeah

[Refrain]
I pulled up outside in that new big coupe body Benz (Skrt)
When I dress myself I'm the topic, yeah the trend (Trend)
Unlike a needle I don't never wanna see the pen (Uh-uh)
Pile all my yays and I better not never see the lens (Lens)
Fresh start, I wanna play, baby (Play)
Come love a boss, you my babe, baby (Play)
I'm eatin' like I ain't ate (Ate, ate, late)
And I'm workin' like a maid

[Verse 1]
Come through, won't you see me with my lenses, I'ma trap it (Yea)
Pitch it, I'ma I press it, then I tint it, I got falcons (Yea)
In the Honda Civic, I'ma get it (Rrrr), I got dolphins (Yea)
In the fuckin' fender and they bending
Help me eat (Help me)
Baby don't let me sit here and bleed (I got)
I got Halloween, trick or treats up my sleeve
You can't-you can't Future me because she know this me (What?)
[Chorus]
She notice me, she notice me (Ayy, ayy, ayy-ayy-ayy, ayy)
She know Young Thugger-Thugger (What? Yeah)
She notice me, she notice me (Ayy, ayy, ayy-ayy-ayy, ayy)
She know Young Thugger-Thugger (Yeah, yeah)
She notice me, she notice me (Ayy, ayy, ayy-ayy-ayy, ayy)
She know Young Thugger-Thugger (Yeah)
She notice me, she notice me (Ayy, ayy, ayy-ayy, yeah)
She know Young Thugger-Thugger (Yeah)

[Verse 2]
I am the truth (Yeah) and these bitches they know
My right hand on it, bitch suck on my dick (Ooh)
I'ma pull my dick straight outta my boxers
Then she gon' start suckin' like tick (Yeah)
She be the truth when she suckin' that dick
And she wanted my milk like a W.I.C (Ooh)
She don't play games and she don't go no kids
But lil' mama say that I'm it (Yeah)
Ice is drippin' like a faucet
I am hotter than a Taki
Fifth pocket, look like a wallet
Woah, woah no Kemosabe (Woah)
I got Ms like talkin' Molly
And I'm still hot like a pocket
Baby girl suck on my balls like a basket
Get a nigga out of dental, tragic
Lil' mama my money stretch like elastic (Yeah)
No rubber, I might just use plastic (Yeah)
I'm a real boss, I'ma fuck her and leave her in dirt
Like a muh'fuckin' Maverick (Yeah)
And I got lucky, I'm lucky muh'fucka
I might just go play for the Celtics (I'm a Celtic)
I'ma run up with no helper
If I get dealt with, get dealt with (Fuck it)
Bitch I'm a muh'fuckin' killer (I said)
Earring bigger than a pillow (Who is?)
Eat your main bitch like a Skittle (Eat it)
Buy my Burberry at Dillard's (Bhrr)
Boy you know that you not realer, a thriller (Uh-uh)
Boy you know that you're not built like that
Hit you with 3 like Reggie Miller, mama askin' how he kill like that
Big old body Benz
She wanna fuck me in my (Yeah) big old body Benz
She need to suck me in my (Yeah) big old body Benz (Hey, yeah)
I won't stop and I won't end
I swear, I promise
[Refrain]
I (Woo) pulled up outside in that new big coupe body Benz (Skrt)
When I dress myself I'm the topic, yeah the trend (Trend)
Unlike a needle I don't never wanna see the pen (Uh-uh)
Pile all my yays and I better not never see the lens (Lens)
Fresh start, I wanna play, baby (Play)
Come love a boss, you my babe, baby (Play)
I'm eatin' like I ain't ate (Ate, ate, late)
And I'm workin' like a maid (Ay, ayy)8Embed"
Young Thug,2303378,282633,20503,Young Thug,https://images.genius.com/64f6039518c484a44fb83386742b91d5.300x300x1.png,Problem,https://genius.com/Young-thug-problem-lyrics,133576,"Problem Lyrics[Intro]
Okay, okay, so, YSL
We're YSL AKA private flight gang, you know?
Yeah, man, we're the private flight gang, you know?
Join in bitch

[Chorus]
Bitches in love with these slimers, how many now?
Lil' nigga money long as a Greyhound
Smokin' that shit out the pound
We never lost it, it ain't nothin' to be found
These bitches come and go 'round and go 'round
I took the booty, nailed her like a mount
These bitches gon' cover me, I call them gowns
Boy that's your problem
I might fuck her but boy that's your problem
Gettin' extorted, then boy, that's your problem
No need for abortions, I'll nut on your momma
Send him up to God with no problem
Got icin' on icin' on boogers on boogers, lil' bit', that's my problem (Bling bloaw)
Boy check out that Rollie it shine like a motherfuckin' Prada

[Verse 1]
In a Bentley burnin' loud and I'm gassin'
I got hundreds sittin' on hundreds, that blue cheese, I'm not ranchin'
I done took off on a boot now I’m Paris Hilton dancing'
And I feel like Marilyn Manson and I want a fucking GRAMMY
Pass me that mud, please just pass me that mud
Sticky white birds, call 'em doves
Implants up under my girls
Please no-no fallin' in love, no (Never)
I'm runnin' round with a bitch, mouth 'bout thick as a cup
Meanwhile, they hatin', I done spent me some dubs
And I'ma lie to that ho like a rug
Gettin' money of course
Blatt! Cookin' white like the Porsches
Shout out to Nelly Air Forces
Hop in that ‘Ghini ran right on your porch
Hop out like motherfuck the doors
Yeah, I'ma go 'head and free Offset, yeah, he a Migo (Free Offset, nigga)
[Chorus]
Bitches in love with these slimers, how many now?
Lil' nigga money long as a Greyhound
Smokin' that shit out the pound
We never lost it, it ain't nothin' to be found
These bitches come and go 'round and go 'round
I took the booty, nailed her like a mount
These bitches gon' cover me, I call them gowns
Boy, that's your problem
I might fuck her but boy that's your problem
Gettin' distorted lil' boy, that's your problem
No need for abortions, I'll nut on your momma
Send him up to God with no problem
Got icin' on icin' on boogers on boogers, lil' bit', that's my problem
Boy, check out that Rollie it shine like a motherfuckin' Prada

[Verse 2]
Damn, we gon' try you in these streets
We don't G her with no sheets
How long ago? 'Bout a week
All my attires are neat
All of her friends are unique
I wanna fuck at least three
Can I? (Yeah, sheesh)
He playin'? I pop him like pop tarts
I'ma demon, only see when dark
I look like I got a Visa card
Private flight gang, yeah, agree with us
Dinosaur B's and some C's with us
I like that cat bald like an eagle, bruh
Since I ran up my racks ain't no tamin' us
Damn, it's Friday, I need angel dust
I fuck that bitch if she starin' (Yeah)
Pull up and hop out McLarens
Don't say I won't cause that's darin'
I'll shoot him with a bow and arrow
Yeah, my bitch is a motherfuckin' horse with no saddle
Yeah, shoot that bitch one time with a double barrel
[Chorus]
Bitches in love with these slimers, how many now?
Lil' nigga money long as a Greyhound
Smokin' that shit out the pound
We never lost it, it ain't nothin' to be found
These bitches come and go 'round and go 'round
I took the booty, nailed her like a mount
These bitches gon' cover me, I call them gowns
Boy that's your problem
I might fuck up a boy that's your problem
Gettin' extorted, lil' boy, that's your problem
No need for abortions, I'll nut on your momma
Send him up to God with no problem
Got icin' on icin' on boogers on boogers, lil' bit', that's my problem
Boy, check out that Rollie it shine like a motherfuckin' Prada

[Outro]
Yah, yeah
Yah, yeah18Embed"
Young Thug,3158333,282633,20503,Young Thug,https://images.genius.com/522f107ace115b7ac20e8491dbc93399.300x300x1.jpg,Big B’s,https://genius.com/Young-thug-big-bs-lyrics,128714,"Big B’s Lyrics[Intro: Young Thug]
Hah, big business
Like the opps say big business, you know what I'm saying, fucks, hahaha
Yeah, now watch me

[Verse 1: Young Thug]
Handful of hundreds, real big Bentley
Hublot, nigga, get some business
Whole lotta hoes, nigga, get your women, huh
Stuff 'er with the pole, come and get your women, nigga
Big business, talk shit Wendy Williams, ooh
Catch 'em at the club sipping
Fuck around, now you missing, hold on (Swoop), hold on
Big pimping, iced out my crew now my mission complete, huh
Pimp C, I ain't doing that, I'ma fuck her on the sheets, yeah, huh
And all my niggas loyal like Bun B, hold on
Fuck you thought? YSL 'til we d-i-e, hold on, hold on, hol' on
Fuck around and set the bitch off like Queen Latifah, hold on, hold on, yeah
Going all out 'bout my dog like Scooby-ee, huh
And a nigga trap door swinging like busy bee, woah (Busy bee)
Outdated temporary tag on a Bentley B (Bentley B)
Two-tone wire bag, double R, park it on the streets, yeah, hold on
Two-tone wire bag, big tires tear up the streets, rwar
Looking at your kid, I might be the papi (Sheesh)
Sixty-five pointers in the Cuban, sheesh (Damn, woo, sheesh)
Diamonds on the backside tearing up my skin, sheesh
Uh, your old man tryna do it like me (Sheesh)
[Bridge: Chance The Rapper]
Please, please
Treat me like you know who I am
Please, please
Bitch, I know who I am, uh

[Verse 2: Chance The Rapper]
I got money on my card
Put some money on they books, that's a yard
I declare war on the beast for my God, sheesh
Gross 3 mil' off the new hat
If I could go back, I'd make a ""2"" cap
Love me in my city like Cusack
Get a little beat and I'll loop that
Get a little money, I'll oop that
Split it with my niggas in the group chat
Left for a minute then I flew back
Had to ask Bruce, ""Where the truth at?""
Had to ask Rahm, ""Where the truth at?""
Now I can't ride with the roof back
Tell 'em I don't play around with other people's kids
Got an office in the steakhouse, gotta bid for the ribs
Got a meeting at the Ritz, gave a crib to my rib
'Cause she leaving where I live but I see her in a min'
Got a Michael prayer card for the good luck, ayy
Bra push up when I pull up, ayy
Got a little money from the tour, yeah
Spend it all on baby pull-ups, ayy
Big old Bentley, bitch I mix the Henny with the Simply
Lemonade exterior, Lorenzos under Bentleys
Put you in the friend zone if you start acting too friendly
Bought a baby Benzo and some Kenzo just for Kensli
Wake up real early but I eat late
Go and hit the streets with that briefcase
Time to shake down another cheapskate
You could tell he's lying, cheesecake, uh
[Verse 3: Young Thug]
Make a nigga bitch tap out, then put 24's on a real big body
Bitch-ass nigga need to stop it
Got a hundred racks on me, can't fit in my pocket
I'm a street nigga, I'ma eat me some soup, I'ma let my bitch eat pasta (Eat that, ho)
Told y'all niggas I ain't stopping
Black card in my wallet, I'ma feed my partner (Feed partner)
I was at one of my shows feeling like Cam'ron with the pink Margielas (Margielas)
We was tryna beat a murder capital, riding 'round the town with the pink Beretta (Beretta)
When I got in touch with the money, me and shawty fucked around and filled my schedule (My schedule)
Mama just sent me a picture, got Indian in my family through my goddamn nana (Through my nana)
Young nigga fucked 'round, dropped out school, learned it all through the ID channel ('D channel)
Young nigga fucked around and ran out of bullets in the .40, gotta get a banana (Banana)
These young niggas go brazy, done got that money, they still might pop (Brrat)
So many blue faces on me right now, young nigga still gamble
Thirty-five racks for the factories, I steal mammals, sheesh
I ain't no rat but, nigga, I cheese up
I'm a big dog, no Pedigree, I eat racks
Boomerang your bitch, swee, she coming back

[Bridge: Chance The Rapper]
Please, please
Treat me like you know who I am
Please, please
Bitch, I know who I am, uh18Embed"
