artist,id,lyrics_owner_id,primary_artist_id,primary_artist_name,song_art_image_thumbnail_url,title,url,pageviews,lyrics
Young Thug,2844780,104344,20503,Young Thug,https://images.genius.com/d8d116d2cb677afa9d142daced7903e8.300x300x1.png,Harambe,https://genius.com/Young-thug-harambe-lyrics,381941,"Harambe Lyrics[Intro]
Mafia
Billboard Hitmakers
Yeah, AP gang, bitch, you know what I'm sayin'?
Level up
Yeah, AP gang
(Big ice)

[Verse 1]
Yeah, catch him down bad
Beat him with the bat, hashtag that (Yeah)
I copped a new Jag', yeah, yeah
Bitch, I got a blue Jag', yeah (Ha, ha)
I make that cash talk, nigga (Bitch)
I got a new house
You wanna get in, need a passcode, nigga (What?)
Two-twenty-five on the dashboard, nigga (Skrrt)
Stack it up and then you get that foreign, nigga
Step it up and take care of your daughter, nigga (Ha, ha, ha)
Stack it up and take care of your son, nigga
Step it up and take care of the money (Hey)
You know I ran it all up by myself
And now your bitch is drinking cum, nigga (Yeah)
My diamonds yellow like a corn, nigga (Yeah)
Double R at the prom, nigga (Skrrt, skrrt, skrrt)
Got some hitters, all of 'em my cuz, nigga (Ayy)
Girl, I know you love me (Love me)
I know, I know, I know you love me (You love me, hey)
[Chorus]
Bentley wheelin' nigga, bad killer nigga, back it up (Bitch, get down)
Bands kill a nigga fast, will a nigga back it up? (Tick tick tack)
Apeshit, nigga, Godzilla, nigga, act up (Ha, ha, ha)
Go apeshit, go Godzilla, bae, back it up (Yeah)
I just wanna have sex (Hey), I just wanna have a baby out you, girl (Hey)
I just wanna go brazy about you, girl (Hey)
Don't make a nigga act crazy, oh-ooh, girl (Ayy)
'Cause you know I will, and I'm on a Perky pill (Hey)

[Verse 2]
This shit can get ugly for you (Yeah)
I'll pull up and bust your mama (Brrat)
I'll pull up and bust your brother (Yeah)
I aim at your fuckin' family (Brrt)
I aim at your whole clique (Brrt)
I aim at your motherfuckin' mama
I aim at your fuckin' dad (Brrt)
I aim at your daughter, son, nigga (What?)
I aim it at everything (Hey, pop out)
I aim at the baby (Hey)
I got devil inside of me (Hey)
Got the devil inside me (What?)
God tryna provide me (God)
God tryna decide (What?)
Do he wanna leave me or sign me? (Who that?)
Um, okay, I know He frustrated 'bout a nigga
And everything I take or do, yeah (Pablo shit)
I know I did a lot of sins
And I hope you still let me make it through, ah (Hey)
Just 'cause I got me a spot in LA
That don't mean I'ma change the crew (Fuck)
My bitch trying to figure out
How she can tell me to chill without changin' you (Woo)
Fuck it, I'm changin' up on 'em (Yeah)
But my fans, not changin' on 'em (Yeah)
Makin' a band, I'm sangin' on 'em (Hey)
Whip out that bag, syringin' on 'em (Hey)
Hey, hey, we locked that bitch out with no passcode (Huh)
I bought her some of those
Damn, she already had 'em though
[Chorus]
Bentley wheelin' nigga, bad killer nigga, back it up
Bands kill a nigga fast, will a nigga back it up?
Apeshit, nigga, Godzilla, nigga, act up
Go apeshit, go Godzilla, bae, back it up
I just wanna have sex, I just wanna have a baby out you, girl
I just wanna go brazy about you, girl
Don't make a nigga act crazy, oh-ooh, girl
Ayy, 'cause you know I will, and I'm on a Perky pill70Embed"
Young Thug,760593,104344,20503,Young Thug,https://images.genius.com/271db73c3867ea37008e1a0a309aa195.300x300x1.png,Constantly Hating,https://genius.com/Young-thug-constantly-hating-lyrics,358382,"Constantly Hating Lyrics[Intro: Young Thug]
Pour that shit up fool, it's ours
Ha
Monster!
Man so you ain't gon' pour?
Oh, so you're gonna make a nigga beg you to pour?
Okay bool, you dig?
(Wheezy Beats)
Uh

[Verse 1: Young Thug]
Hopped out my mothafuckin' bed
Hopped in the mothafuckin' coupe (Skrrt)
Pulled up on the Birdman (Brr)
I'm a beast, I'm a beast, I'm a mobster (Ayy)
You got 50 whole bands, you'll be my sponsor (Just for the night)
Them snakes on the plane, me and Kanye-conda (Anacondas)
Yeah (Them anacondas)
I might piece him up and let my partner smoke him (Triple cross)
Chuck-E-Cheese him up, I pizza him, I roll him (Cross)
I'm a gangster, I don't dance, baby I poke
Right now I'm surrounded by some gangsters from Magnolia
I heard I put it in the spot, yessir she told me
My niggas muggin', these niggas YSL only
I heard my Nolia niggas not friendly, like no way
But we not friendly either, you know it
Ha!
Yeah, thumbs up
I've seen more holes than a golf course on Donald Trump's course
My bitch a tall blooded horse, nigga, bronco
And if you catch us down bet you're not gon' trunk us (No)
You got a body, lil' nigga, we got a ton of 'em (Yeah)
You got some Robin's, lil' nigga, we got some Batmans
I let that choppa go ""blocka, blocka,"" get back, son (Back)
You got them MJs, nigga, I got them Jacksons (Racks)
[Chorus: Young Thug]
But really what is it to do
When the whole world constantly hatin' on you?
Pussy niggas hold their nuts, masturbatin' on you
Meanwhile the fuckin' federal baitin' on you
Nigga tell me what you do
Would you stand up or would you turn to a pussy nigga?
I got a hundred things to do
And I can stop rappin' but I can't stop stackin' fuckin' figures

[Verse 2: Birdman & Young Thug]
Yeah, I'm from that mothafuckin' 'Nolia, nigga ('Nolia, nigga)
Birdman'll break a nigga nose, lil' nigga (Nose, lil' nigga, ah)
You need to slow your fuckin' roll, lil' nigga (Roll, lil' nigga, Thugger)
We created Ks on shoulders, nigga (Shoulders, nigga)
I'm a scary fuckin' sight, lil' nigga (Sight, lil' nigga, ah)
We won a hundred mil' on fights, lil' nigga (Fights, lil' nigga, hey)
A hundred bands, sure you're right, lil' nigga (Right, lil' nigga)
I keep some AKs on my flights, lil' nigga (My flights, lil' nigga, I do)
Birdman Willie B (What?)
Smoke some stunna blunts, now my eyes Chinese (Chinese)
Hundred K on private flights overseas (Overseas)
Choppas City nigga, free BG (BG)
Bentley with the doors all 'round, not a Jeep (Jeep)
Rich nigga shit, smoke two pounds in a week (In a week)
Can't find a bitch that don't know we them streets (We them streets)
Bitches know that I am Birdman, that's OG, brrat
[Chorus: Young Thug]
But really what is it to do
When the whole world constantly hatin' on you?
Pussy niggas hold their nuts, masturbatin' on you
Meanwhile the fuckin' federal baitin' on you
Nigga tell me what you do
Would you stand up or would you turn to a pussy nigga?
I got a hundred things to do
And I can stop rappin' but I can't stop stackin' fuckin' figures

[Verse 3: Young Thug]
Nigga, I'm a crack addict
Thought about lettin' them get a cut
Then I went and snagged at it
Yeah, the new Boosie Badazz at it
I'ma drop a nigga life, just like a bad habit
I stick to the ground like a mothafuckin' rug
I'm a big dog, lil' fuck nigga, you a pup
Lil' bitch, clean your drawers before you think you're a thug
Before I be in front your shows, just like your pub
I ain't even lyin', baby
I swear to God I ain't lyin', baby, no
First I'll screw you without these pliers, baby, or
I might dap you like, ""good try, baby""
Big B livin', baby
Them boys on my left throwin' up Cs
I promise their mama see them this week
And I don't break promises with my Ds (Them my dogs)
I want Ms and cheese, mister Mickey Ds
She know I am a beast, I am so obese (Rrar)
In Miami I swear they don't got good weed
Wiz Khalifa can you send me some weed please?
[Outro: Birdman]
Yeah, overseas, nigga, top floor, clear windows, nigga
Glass house, drankin' GT, you understand?
We in that Red Light District, you understand?
We 3 and 1, that mean 3 on me, nigga, you understand me?
Just livin' the life, boy, ayy, Thug, just a dollar for a 1, nigga
We can blow a mil', boy
Rich Gang, YSL, blatt!69Embed"
Young Thug,542248,104344,20503,Young Thug,https://images.genius.com/fc013670d5fa8f813674ec9970ce2bd7.300x300x1.jpg,Take Kare,https://genius.com/Young-thug-take-kare-lyrics,344970,"Take Kare Lyrics[Intro: Lil Wayne & Young Thug]
(Take care of her)
Now
Young Moo–, Young Moolah, baby
(Take care of her)
Young Moo–, Young Moolah, baby
(Take care of her)
Rich Gang
(Take care of her)
We got London on da Track
Hey!

[Verse 1: Young Thug]
Boolin' at the basketball game (Boolin')
Dressed in Balmain (Fresh)
Dropped a hundred on the whole thing (And what?)
Inside cost a whole thing (And what?)
And I'ma give you my all, first my whole name (Oof)
I'm in her mouth just like Colgate (Ahh)
I'm really feelin' super, like eight (Whew)
Ayy, hey (Hey)
Like or hate, ladies man like bait (Woo)
Hop inside a Bentley with a red paper plate
Every time they hate, I throw them bands like a bouquet (Woo)
I ain't Ray J but you can be my Kim K (K)
Feelin' like Lil Flip, in love with green, don't look gay (Ooh)
I'll never believe what Lil' Kim say (Ooh)
Water like Phelps and you can jump in my league (Hey)
Run into my head like a deer when it's late (Gah)
Man, everywhere she go, she ballin' (Boy)
Yeah she got Xans, she like, ""Where Tar at?"" (Geek)
She don't gangbang, she say she bang gangs (Bang)
And she'll fight, might knock 'em out the ring (Bang)
Out of cold Pepsi, she'll whip it like a waiter (Woo)
I just wanna nut, she say that's easy like a baker (Woo)
She just want a nigga, I don't serve but I love maple (Woo!)
And therefore she gon' watch me like cable, ayy (Hey)
[Chorus: Young Thug]
Take care of her!
If, if I don't do nothin' in the world, swear to God I'll take care of her (And what?)
Take care of lil' mama, take care of baby mama (And what?)
Take care of her (And what?)
Take care of her, take care of her (And what?)
Take care of her (And what? And what? And what?)
Ooh-aah (Woo!)

[Verse 2: Young Thug & Birdman]
On a million, goin' to meet a billion (Chasin', chasin' racks!)
Brand new Bentley, you could keep the ceiling (Skrrt skrrt, woo)
(Rich Gang) Ooh! (Ahh!)
Take a trip to Peru
Baby suck my dog like Snoop (Hey)
Blood gang, big ups, suwoo (Blatt)
Dinosaur bankroll, woo, woo (Big racks)
H&M ballin',  hundred ten (Ahh, ahh!)
Throw my boy 6, bim bim (Ahh, ahh!)
Baby keep that pussy (Ahh, ahh, ahh!)
Baby keep that pussy clean trimmed (Woah)
Bought a castle with my last deal (Woah)
Boy don't talk about no fast deal (Ahh)
Lil' nigga, you late (What?)
Okay (Get it)
I'ma put the pedal to the Wraith (Skrrt)
I'ma pull the pedal, not the brake (What)
Ice inside my ring, you can skate (Skate)
Yeah, this shit cold like a case (Nigga, what?)
That a nigga went and snitched, dealing with (Ooh, ooh)
All these mothafuckin' bitches (Main bitch)
I'm the shit, girl, I'm the shit (Grr)
I'ma build a hole for a snitch, not a ditch, shit
[Verse 3: Lil Wayne]
(Moolah, Moolah)
They be hatin' on my girl, though
And they wish they was the bitch they hatin'
Salutations to my old hoes
And thank you for your participation
No chaser for my girl, though (Rich girl)
She go harder than me on occasion
Gettin' wasted with my girl
Then we sixty-nine 'til we need ventilation
You don't know about it
Gotta open new accounts 'cause the others overcrowded
Gotta open up the stores when they're closed when we shoppin'
For my girl, wear the clothes that ain't nobody rockin'
She so bad, I don't know what to do with her
I know just what to do in her
My homies hit me up, they said they're goin' out tonight
I said, ""I'm with my girl tonight, I can't fuck with you niggas""
I'ma take care of her

[Interlude: Young Thug & Birdman]
(Aah!)
Rich Gang
Don't get scared now, pussy nigga
Ayy
[Chorus: Young Thug & Lil Wayne]
Take care of her! (Her, I'ma take care of her)
If, if I don't do nothin' in the world, swear to God I'll take care of her (Yeah, I'ma take care of her)
Take care of lil' mama, take care of baby mama (Take care of baby mama)
Take care of her (Take care of lil' mama)
Take care of her (Take care of my mama), take care of her (I'ma take care of baby mama)
Take care of her (Take care of lil' mama, take care of my mama)
Ooh-aah!

[Outro: Lil Wayne & Birdman]
Young Moo–, Young Moolah, baby
Rich Gang109Embed"
Young Thug,2416069,2694943,20503,Young Thug,https://images.genius.com/6aee6ca408228065fcab8fcd1e189705.300x300x1.jpg,Feel It,https://genius.com/Young-thug-feel-it-lyrics,335238,"Feel It Lyrics[Intro]
Wheezy

[Verse 1]
I want that pussy in a Wraith
I'ma make sure lil mama feel it
Every eyeball that look at me, she wanna kill it (On spot)
We make love, and it hot just like a skillet (Woo, woo)
I don't wanna buy your love, I wanna build it
(Yeah, oh...) Build that bitch up from the ground, never gon' tear that bitch down
(Yeah, oh...) Yeah, you know that this dick ain't no clown, you know this dick make you make sounds, swea (Yeah)
(Ohh, oh...) I fuck that bitch good, I don't tease her, nigga, that's why she not leavin' (And what?)
(Ohh, oh...) And you know that I smoke on that kush, no Khalifa, and I do it for my people (I swear)
Yeah, I never ever met a girl like you (What?)
I'm lovin' every single curve about you
Ooh, you know I would smoke the whole world 'bout you
Put on my suit, go get my boots, I'll go to jail 'bout you (Let's go)
You know who you with, lil baby, stop playin', darlin', you know who you with (You know who you with)
Man, I'm so for real, I copped you a coupe baby, I'ma chauffeur it (Skrrt, skrrt)
Man, I'm so for real, these niggas be talkin', we bust it so for real (For real)
I'm so geeked up on your lovin', I don't need no Mollies, so for real (For real)
Behind closed doors it gets drastic (Hey)
Pussy wet, I done worked magic (Yeah)
I am the truth so don't answer (Yeah)
I shoot FNs and they plastic (What?)
Yeah, I only call lil mama baby when she say daddy (And what?)
[Pre-Chorus]
If that's your man, you better hold him down
Marriage she wrote
She held my little pack, she was wit' it
And she was popular way before me
Now that I'm popular, I'ma still be the old me

[Chorus]
(Yeah, oh...) I swear to God she wanna feel it
(Yeah, oh...) When I do wrong, bae make me feel it
(Ohh, oh...) I only get it when I feel it
(Ohh, oh...) Yeah, yeah

[Verse 2]
Make me feel it, make me feel it (Yeah)
Make me feel it, make me feel it (Hey)
Oh, I wan' feel it, I wan' feel it (Yeah)
I wan' feel it, I wan' feel it (Hey)
Baby, I'll give you head, give me ceilings (Woo)
Come here bae, I'm appealin' (Woo)
I'm locked down, all metal (Hey)
Horseshoe, True Religion (Woah, Thugger)
I'm dabbin', I'm dabbin'
I'll hop in your car, and I'll smash it, I'll smash it (Skrrt)
I'm buyin' gold Rollies, yeah I'm Trinidad-in' (Yeah)
They look like they don't wanna fuck, but they actin' (Woo)
I'm pourin' up purple, that purple, yeah, Actavis (Lean, lean, lean)
And I think I'm tough, you look tough, so let's clash it (Let's clash, let's clash)
War ready, I'm goin' steady (Hey)
I fuck with Keshia, not the one from Belly (Woah)
I wanna fuck and not talk and I said it (What?)
I want that cat like a leopard (Grrrr)
Let's go to Germany, no Shepherd (Woah)
She don't need no hand, I'ma help her
She barely keep it, so I kept her
Watch me tell her
[Pre-Chorus]
If that's your man, you better hold him down
Marriage she wrote
She held my little pack, she was wit' it
And she was popular way before me
Now that I'm popular, I'ma still be the old me

[Chorus]
(Yeah, oh...) I swear to God she wanna feel it
(Yeah, oh...) When I do wrong, bae make me feel it
(Ohh, oh...) I only get it when I feel it
(Ohh, oh...) Yeah

[Bridge]
Yeah, oh...
Yeah, oh...
Ohh, oh...
Ohh, oh...
[Chorus]
(Yeah, oh...) I swear to God she wanna feel it
(Yeah, oh...) When I do wrong, bae make me feel it
(Ohh, oh...) I only get it when I feel it
(Ohh, oh...) Yeah, yeah28Embed"
Young Thug,4786045,3390361,20503,Young Thug,https://images.genius.com/33c52a00b694afff704c64a80dad42c2.300x300x1.png,Bad Bad Bad,https://genius.com/Young-thug-bad-bad-bad-lyrics,312710,"Bad Bad Bad Lyrics[Intro]
Wheezy outta here

[Chorus: Young Thug]
Rose gold seats on a fuckin' helicopter
Double C, no Chanel, 'cause she bad, bad, bad
Ridin' Kawasaki, and I could cop you a new 'Rari
Let you ride it, know your route and you're bad, bad, bad
No playin', no Atari, I won't play with you for nothin'
I can eat you like Hibachi 'cause you bad, bad, bad
I just took the doors off the 'Ghini, now I'm ridin'
And I'm slidin' in her sideways, now she call me her zaddy

[Verse 1: Young Thug]
Rich nigga shit, I bought my thottie a new Patek
Got a model, got a thickie, got a BM, got a stallion
Got a billion dollar corporation, fuck a Xanny
I got millions to go get and a couple bitches to–uh, yeah
You my dawg 'til we dead, not a question
But I can't fuck with you like I want 'cause you ratted
Got a million dollars in the wall, in the band'
And got it stepped-on, got it hard, got it crackin' on her
Half a million, I just did a warm up for half a million, uh, uh, mmm
I can buy the buildin'
I can rent this shit out or save it for the children
I can dead this shit out or give it to the villains
Somewhere they can hide when they do some killin'
All of the rides got grenade ceilings
Loaded with a ride, cost a cool million
[Chorus: Young Thug]
Rose gold seats on a fuckin' helicopter
Double C, no Chanel, 'cause she bad, bad, bad
Ridin' Kawasaki, and I could cop you a new 'Rari
Let you ride it, know your route and you're bad, bad, bad
No playin', no Atari, I won't play with you for nothin'
I can eat you like Hibachi 'cause you bad, bad, bad
I just took the doors off the 'Ghini, now I'm ridin'
And I'm slidin' in her sideways, now she call me her zaddy

[Verse 2: Lil Baby]
Paper tag, peanut butter seats, I'm ridin'
I be in the foreign, fuck with slime, we tied in (Slatt)
Different color Diors on my feet, I couldn't decide which
Never talked about it, she done made herself my side bitch
Trash bag gang, I can put that on Elijah
Street chose me, I ain't never had to sign up
Then we hittin' bitches in the group, I make 'em line up
Beep, beep, beep, that's me, nigga, get back
Real dopeboy, don't know how to work a CashApp
How many you got? I'll send it 'lone, bring the cash out
I been sippin' lean, 'bout to pee 'til I pass out
Went to sleep 'partment, woke up in the paradise
Niggas stealin' drip but it don't matter, they don't wear it right
They don't even speak but I can see I got 'em terrified
Double R truck, come through, shit on everybody
Bad, bad, bitch, good head, hit her every night
[Chorus: Young Thug]
Rose gold seats on a fuckin' helicopter
Double C, no Chanel, 'cause she bad, bad, bad
Ridin' Kawasaki, and I could cop you a new 'Rari
Let you ride it, know your route and you're bad, bad, bad
No playin', no Atari, I won't play with you for nothin'
I can eat you like Hibachi 'cause you bad, bad, bad
I just took the doors off the 'Ghini, now I'm ridin'
And I'm slidin' in her sideways, now she call me her zaddy

[Outro: Young Thug]
Take the four doors off of the Jeep (Bad, bad, bad)
I ain't doin' no swaps with a freak, uh (Bad, bad, bad)
We can handle this shit out in the streets, yeah (Bad, bad, bad)
I ain't goin' to a house for a meetin', yeah (Bad, bad, bad)
Pull up in a truck, any season
Niggas never comin' out, then we leavin'
How could nigga take a loss if he leavin'?
Quickly take off like I'm LeBron29Embed"
Young Thug,3121329,324645,20503,Young Thug,https://images.genius.com/553f94982011ff60c094a5cb30e78da8.300x300x1.png,Family Don’t Matter,https://genius.com/Young-thug-family-dont-matter-lyrics,295021,"Family Don’t Matter Lyrics[Intro: Young Thug & Millie Go Lightly]
Yeah, what up? (Ooh)
I'm tryna put my dick inside of your panties, yeah (Ooh)
You bet' not take this shit for granted

[Verse 1: Young Thug (with Millie Go Lightly)]
I'm at Rolling Loud, right there rolling out
Smokin' Backwoods and holdin' bae
(Wheezy Beats)
I was gettin' protected by my savages
Yellow school buses, that's a Xanny
Causin' me to sleep and I ain't plan it (Yeehaw)
I got some jobs all day (Jobs all day, yeah)
Roll out the jar all day (All day)
I be on Mars all day (All day, yeah)
I'm with the stars all day, uh (All day)
Boss all day (Boss all day, yeah)
Roll up the raw all day (All day)
Babysit your dog all day (All day, yeah)
'Bout to watch you jog all day

[Chorus: Young Thug (with Millie Go Lightly)]
Like family don't matter (Oh, oh)
What's poppin', what's the deal? (Oh, oh, oh, woah)
What's poppin', what's the deal? (Woah, woah, woah, woah)
What's poppin', what's the deal? (Woah, oh, oh, oh, hmm)
What's poppin', what's the deal? (Oh, oh)
[Verse 2: Young Thug]
Bagged a bad bitch, I got a foreign son
Tommy gun, found a real Tommy gun
I dropped a milli' on my chain like I know Barry Bonds
And I got a head full of hair like I'm from Amazon, uh
Glaze that ass like a candle honey, uh
Ferragamo shower shoes for me, uh
Lightbulb, neck got jewels on it, uh
Like an old school, I got some pull, don't I?
Huh?
Sayin', abracadabra
Abracadabra, kill all you bastards
I don't want no wrassle
The bread ambassador
No nothin' else matter to him
I'm ballin' like Patrick Ewing
Turn up on you bastards
I'm in a Ghost like Casper
Everything go smooth for me like I got my Masters
Fubu Platinum up, birds in the Acura
Albums platinum and up, I'm killin' these bastards

[Chorus: Young Thug]
Like family don't matter (Oh, oh)
What's poppin', what's the deal? (Oh, oh, oh, woah)
What's poppin', what's the deal? (Woah, woah, woah, woah)
What's poppin', what's the deal? (Woah, oh, oh, oh, hmm)
What's poppin', what's the deal? (Oh, oh)
[Verse 3: Young Thug]
Country Billy made a couple milli'
Tryna park the Rolls Royce inside the Piccadilly
Oh, he had a couple stripes actually (Of course)
Got another half a milli' in white tees, of course (Don't you panic)
Don't you take this shit for granted, don't you panic
When I put my D in your pants, don't you panic
When I catch up with your bitch, you know I'm smashin'
I can put her on her feet, oh, oh head gasket
You gotta tell me what's wrong
I can't wait to deep stroke to the mornin'
'Bout to put my dick in your mouth right when you yawn
You gotta put that puss' on my lips whenever I'm on one
I thank the red doll, so I whip my bum bum
I'm 'bout to fuck somebody girl off this rum, rum (Go 'head)
I'm chasin' all of these rats like I was Tom, yeah
But it ain't even matter, I was tryna kill these bastards

[Chorus: Young Thug]
Like family don't matter (Oh, oh)
What's poppin', what's the deal? (Oh, oh, oh, woah)
What's poppin', what's the deal? (Woah, woah, woah, woah)
What's poppin', what's the deal? (Woah, oh, oh, oh, hmm)
What's poppin', what's the deal? (Oh, oh, oh, oh)
What's poppin', what's the deal? (Oh, oh, oh, woah)
What's poppin', what's the deal? (Woah, woah, woah, woah)
What's poppin', what's the deal? (Woah, oh, oh, oh, hmmm...)
What's poppin', what's the deal? (Oh, oh)
[Bridge: Millie Go Lightly, Young Thug & Both]
(Ooo, baby)
Rollin' through the W6 (Ooh, nana nana)
You feelin' me, I'm feelin' you (I'm feelin' you)
Fallin' deep, too deep, purple dreams to catch myself (To catch myself, yeah)
I be havin' nightmares shaped like you (Havin' nightmares)
You be blowin' smoke clouds shaped like me (You be blowin' smoke clouds)
I be havin' nightmares shaped like you (I be havin' nightmares)
You be blowin' smoke clouds shaped like me (I just thought that you should know)
Two cups, can I drown in my mind, too? (Can I drown in my mind?)
Hear the track, spin it back, catch a vibe, too (Ooh, baby)
This the shit that be bad, so bad it's good for you, ayy (I just thought that you should know)
Take a hit, we can sip like it's medicine
Chemistry, remedy, there's no better than
This the shit that be bad, so bad it's good for you, hey (So bad)

[Chorus: Young Thug]
Like family don't matter (Oh, oh)
What's poppin', what's the deal? (Oh, oh, oh, woah)
What's poppin', what's the deal? (Woah, woah, woah, woah)
What's poppin', what's the deal? (Woah, oh, oh, oh, hmm)
What's poppin', what's the deal? (Oh, oh, oh, oh)
What's poppin', what's the deal? (Oh, oh, ooh, what's the deal? Oh, woah)
What's poppin', what's the deal? (Woah, woah, what's poppin', what's the deal? Woah, woah)
What's poppin', what's the deal? (Woah, oh, what's poppin'? Oh, oh, hmm)
What's poppin', what's the deal? (Oh, oh)

[Outro: Young Thug]
My heart so cold, I need a icebox
My heart so cold, I need a icebox
Icebox Jewelry
I need help, come and rescue me33Embed"
