artist,id,lyrics_owner_id,primary_artist_id,primary_artist_name,song_art_image_thumbnail_url,title,url,pageviews,lyrics
Young Thug,2165110,1101903,20503,Young Thug,https://images.genius.com/73b90d38ebec550375f5e12f42eba071.300x300x1.png,Best Friend,https://genius.com/Young-thug-best-friend-lyrics,1808969,"Best Friend Lyrics[Intro]
Ricky Racks, I see you!
Thugger!
YSL for life, bitch
Yeah fuck you, your momma and everything else
Yung Shad, you killed this track
Free the GOAT!

[Chorus]
That's my best friend, that's my best friend, flexin'
Big ol' booty bitch missus from Texas, what's next is
I'm gon' skeet off, lil' nigga come catch me, catch me
And that's my bestie, my bestie, my best friend, go best friend
Nigga livin' TTG and everything is still on fleek
Bad bitch rollin' wit' me, she gon' smile 'cause she on fleek
Hundred thousand dollars inside my pants, my shit on fleek
Hey-yeah! Yeah

[Verse 1]
Take them boys to school, swagonometry
Bitch I'm bleedin' bad, like a bumble bee
Hold up! Hold it, hold it, nigga proceed
I'ma eat that booty just like groceries
Eat on that coochie, lay that bitch down like ""let's do it""
No Tiger, bitch, eat that wood, eat that wood
Supplier, bitch, I got pistols, no wood
I want them tacos that are Meagan Good
Helicopter choppin' with the buzz
Stuff them racks inside them if they nudge
Bang that other side, nigga curb
And my reefer louder than a speaker
Yeah my niece is hangin' with The Beatles
If you ever find her, better keep her
37 cameras for the sneakers
Goin' out like Ox or Beanie Sigel
Send a cop, I can't wait to mistreat 'em
Forcin' your ho, I can't wait to mislead 'em
And beat 'em, they ain't my people
[Chorus]
That's my best friend, that's my best friend, flexin'
Big ol' booty bitch missus from Texas, what's next is
I'm gon' skeet off, lil' nigga come catch me, catch me
And that's my bestie, my bestie, my best friend, go best friend
Nigga livin' TTG and everything is still on fleek
Bad bitch rollin' wit' me, she gon' smile 'cause she on fleek
Hundred thousand dollars inside my pants, my shit on fleek
Hey-yeah! Yeah!

[Verse 2]
Let me tell you how I spent a couple hundreds today
I done cut back on that lean, I'm on that Hen' and D'ussé
Don't do no talkin', when you see him, you better shoot in his face
I got a hundred bitches that can't wait to replace
Michael Jackson, nigga, Thugger Jackson moon walkin'
The S.L.I.M.E. army tool shoppin'
Me a horny goat, I'm boolin' at the bull stop
No I can't get arrested 'cause I'm talkin' 'bout my necklace
I'ma put that bitch in the buck, I'm a dog, let's get stuck
My lil' sister Dora, eat them Lucky Charms and give me luck
Waddup cuz? Here yo cup, call my Bloods, bring my bup
Your crew suck, don't got bucks, these ain't drugs, nigga

[Chorus]
That's my best friend, that's my best friend, flexin'
Big ol' booty bitch missus from Texas, what's next is
I'm gon' skeet off, lil' nigga come catch me, catch me
And that's my bestie, my bestie, my best friend, go best friend
Nigga livin' TTG and everything is still on fleek
Bad bitch rollin' wit' me, she gon' smile 'cause she on fleek
Hundred thousand dollars inside my pants, my shit on fleek
Hey-yeah!118Embed"
Young Thug,4549336,7060172,20503,Young Thug,https://images.genius.com/a648bd49565f7fb70a88deb9ec930214.300x300x1.png,The London,https://genius.com/Young-thug-the-london-lyrics,1447758,"The London Lyrics[Intro: J. Cole]
Yeah, yeah, yeah
Oh, oh, woah
Woah, woah
Oh
(You good, T-Minus?)
Oh

[Chorus: Travis Scott]
Me-meet me at The London
If you find time, we can run one
Talk about some things we can't undo
You just send the pin, I can find you
6'1"", on the money, 9'2""
You just say the word and I'll run through
Two texts, no reply, that's when I knew
I knew, I knew, yeah, I knew

[Verse 1: J. Cole]
Yeah, circumnavigate the globe as the cash grows (Grow)
Get a nigga whacked like you get the grass mowed (Mowed)
I'm talkin' slick when I'm with the Big Slime, nigga (Slime)
Could hit your bitch, you could never hit mine, nigga (Mine)
In my DM, they electric slide, nigga (Huh, slide)
No catfishin', this is not a fish fry, nigga
Never switch sides on my dog
Catch a contact, hitch a ride, go to Mars
Everybody sing
How could you come up out your face
And say I ain't the hardest nigga you done ever heard?
I left a flock of rappers dead and buried
A verse from me is like eleven birds
Just did the math, that's like two thousand dollars every word
I'm on the verge, I'll beat the charge
I killed some niggas and I walked away from it
Then I observe, just how you curve
Then told the nigga that they gotta wait for it
""I know—I know you in high demand""
I'm ballin' on a pussy nigga like Juwanna Mann
I'm drownin' all inside the pussy like I never swam
Ayy, fuck your IG, I put somethin' on your sonogram
I'm the man, ayy, ayy
[Chorus: Travis Scott]
Me-meet me at The London
If you find time, we can run one
Talk about some things we can't undo
You just send the pin, I can find you
6'1"", on the money, 9'2""
You just say the word and I'll run through
Two texts, no reply, that's when I knew
I knew, I knew, yeah, I knew

[Verse 2: Young Thug]
Pimp talk, church talk, I can make a brick walk (Woo)
Up north, down south, Bankhead to Rachel Walk (Ayy)
Hit it with a little water, stretch it like a vocal cord
STD, I run my ward, fuck a fed and his daughter (Let's go)
I'ma run the compound (Yeah)
I supply the cigarettes and bread (Woo)
I got a main and she gon' ride (Uh-huh)
She took a quarter and she fled (Uh)
I'm in the Lamb', so she gon' ride (Yeah)
I see the pain in shawty's light brown eyes (Ooh)
I'm at The London with some big thots
No fries, she eat steaks with the fish sides
Didn't your mama tell you when something on fire, stop, drop and roll? (Aw yeah)
I've been on the road like a pair of spinners at Stop-N-Go's (Yeah)
I could charge 'em like a Dodge Hemi Demon
Got your broad in the garage eatin' semen
Every time a nigga go back to the ward
Niggas act like they want start
And we leave them on the cement (Grra, grra)
[Chorus: Travis Scott]
Me-meet me at The London
If you find time, we can run one
Talk about some things we can't undo
You just send the pin, I can find you
6'1"", on the money, 9'2""
You just say the word and I'll run through
Two texts, no reply, that's when I knew
I knew, I knew, yeah, I knew

[Outro: Travis Scott]
I, crash down, we get money (Hey)
For the full town (Woah, when you won't play, I)
I decided, for the full side (Hoes will say)
And they know, I might (And fly, I...)
Get down, might (Don't play)
See the whole town every time, I... (Oh, every day)
Yeah, they know what's up (Folks will say)128Embed"
Young Thug,737615,282633,20503,Young Thug,https://images.genius.com/8dac472f8f5680f65fa734460aab832d.300x300x1.jpg,Check,https://genius.com/Young-thug-check-lyrics,1115348,"Check Lyrics[Intro: Young Thug & Skooly]
I can see that bullshit from a mile away (See it)
You can stack my money 'bout a mile away (Stack it)
I got three white bitches like it's powder day (White)
Mink coat with the rolls like a Shar Pei
And all of my bitches sexy, call them Barbies (Sexy)
She lookin' back like I'm flexin', baby, no way (Uh-uh)
And lately, I been on that D'usse, yee
(We got London on the track)

[Chorus]
Got me a check, I got a check
Yeah, I done got me a check, I got a check (Sheesh, sheesh)
Yeah, I done got me a check, I got a check (Sheesh)
Yeah, I done got me a check, oh, got a check (Yeah, yeah-yeah!)

[Post-Chorus]
Money on my mind, I got money on my brain
Money in my pants, I got money I call change
20, 50, 100, 500 millions made
Big hunna Thugga, screamin' free that Gucci Mane

[Verse 1]
If I need some racks, I'ma flip me some packs
I talk like I want and she don't say nothin' back
If cops pull up, I put that crack in my crack
Or I put that brack in my brack
Call little shawty, made her fuck on my brodie
If you don't owe me, bitch, still act like you owe me
I promise I won't ever quit, bitch, I'm Kobe
And I whip that white, you can snow me
Stoner Young Thugger
I whip it, that bitch, yeah, she know me, Young Thugger
Yeah, she shinin' like butter
The bitch from Chicago, I call her young Cutler
Leave it to Beaver
I pull up in Bentleys with London, they all want to meet him
Yeah, they all wanna greet him
They pull down they pants and they all wanna eat him, uh
No, they won't tease on that dick, they won't read on that dick
They won't leash on that dick, don't Felicia that dick
Mamacita that dick, they gon' snitch on that dick
And she screamin' loud, she can't secret that dick
Mama a beast on that dick
If she bad, I'ma gon' an' Four Season that bitch
Eat that, lil' bitch, I'ma feast that lil' bitch, mm
[Chorus]
I got me a check, I got a check
Yeah, I done got me a check, I got a check (Sheesh, sheesh)
Yeah, I done got me a check, I got a check (Sheesh)
Yeah, I done got me a check, oh, got a check (Yeah, yeah-yeah!)

[Post-Chorus]
Money on my mind, I got money on my brain
Yeah, I'm like, baby, baby, baby, I need racks
Money in my pants, I got money I call change
Baby, baby, baby, baby, baby, I need racks
20, 50, 100, 500 millions made
Baby, baby, baby, baby, baby, I want racks
Big hunna Thugga, screamin' free that Gucci Mane
Baby, baby, baby, baby, baby, I need racks, hey!

[Verse 2]
Bitch, I'm a Migo, I play with kilo
When I put ice on, I am Sub-Zero
All of my niggas, they hard, call 'em beetles
Niggas was fake so I kept me a Ruger in Regals
Droppin' the top on the Bentley
I'm with the Birdman, yeah, the eagle
Geeked out my mind, man, I'm tripping out
I don't know none of these people
Make my little shawty go get me a four and bring back me a liter
Yes, I got threats, I'm not worried 'bout that
They know they can get whacked and I swear I done
[Chorus]
Got me a check, I got a check
Yeah, I done got me a check, I got a check (Sheesh, sheesh)
Yeah, I done got me a check, I got a check (Sheesh)
Yeah, I done got me a check, oh, got a check (Yeah, yeah-yeah!)

[Post-Chorus]
Yeah, I'm like, baby, baby, baby, I need racks
Baby, baby, baby, baby, baby, I need racks
Baby, baby, baby, baby, baby, I want racks
Baby, baby, baby, baby, baby, I need racks, hey!

[Outro]
We got London on da Track!316Embed"
Young Thug,1792009,1077840,20503,Young Thug,https://images.genius.com/e7c67a01f872ff7f8c60b34a636ec3f4.300x300x1.jpg,Power,https://genius.com/Young-thug-power-lyrics,1023957,"Power Lyrics[Intro]
We got London on da Track

[Chorus]
First you get that money, then you get that power
If he tune his nose up, boy, he on that powder
Now you walk around with 50 in your trousers
Diamonds boolin' on my chest, no fuckin' blouser
Bitch, I make it rain-shower, ya dig that?
They won't know a thing about you if you zip that
Hit 'em with that blocka-blocka, nigga get back
Feed that, beat that, never crack, dig that (Sheesh, sheesh)

[Verse 1]
Before I go without a sack, I swag pack (Sheesh, sheesh)
I spoiled my bitch and now she actin' like a brat (Yeah, yeah)
I met Alex, I know Jimmy, he got racks (Skrrt, skrrt)
Yeah, yeah, bitch, I'm bleedin' like a tat (Yeah, yeah)
Roll it, roll it for me on ya back (Roll it, roll it)
Just for show my diamonds yellow like a taxi (Woo, woo)
I'm a cat, I'ma chase all them pussy rats (Argh)
Yah (Argh, argh), pussy nigga better not look back
Or, or else I'm killin' 'em, hey, and that's a fact (Sheesh)
There's blood all on my Timberlands
She make a nigga say, ""What?"" (What?)
I swear to God she feelin' 'em
She sucked like eight dicks, I call her octagon (Hey)
[Chorus]
First you get that money, then you get that power
If he tune his nose up, boy, he on that powder
Now you walk around with 50 in your trousers
Diamonds boolin' on my chest, no fuckin' blouser
Bitch, I make it rain-shower, ya dig that?
They won't know a thing about you if you zip that
Hit 'em with that blocka-blocka, nigga get back
Feed that, beat that, never crack, dig that (Sheesh, sheesh)

[Verse 2]
Bitch, I dig it, I eat ice cream with my chickens
Bitch, I'm rich just like a Simmons, not Lil Diggy (Real Simmons)
If I got legs, bitch you know I'm gonna get it
She got good head, so she welcome to my Bentley
Big bid-ness in that big Bentley, Bentley (What? What?)
Ridin' 'round with that semi, 'cause I know these niggas envy (Hah)
Is you mad 'bout Instagram or how I kick my pimpin'? (Pimp)
You keep that Ace of Spades, I'm sippin'
I'm a rocket, rocket, I can't stop it, stop it
I'm a GTV, boy, bitch, I'm poppin', poppin'
I need coke, need coke like, ""Where the fuck is papi?""
If you try to run off (What?), you know we popped your noggin
(Pop-pop)

[Chorus]
First, you get that money, then you get that power
If he tune his nose up, boy, he on that powder
Now you walk around with 50 in your trousers
Diamonds boolin' on my chest, no fuckin' blouser
Bitch, I make it rain-shower, ya dig that?
They won't know a thing about you if you zip that
Hit 'em with that blocka-blocka, nigga get back
Feed that, beat that, never crack, dig that (Sheesh, sheesh)80Embed"
Young Thug,761242,199349,20503,Young Thug,https://images.genius.com/271db73c3867ea37008e1a0a309aa195.300x300x1.png,With That,https://genius.com/Young-thug-with-that-lyrics,911720,"With That Lyrics[Intro: Young Thug & Skooly]
Yeah
I'm so through with that
I'm so through with that
(We got London on da Track)

[Chorus: Young Thug]
Hundred bands, hundred bands dropped on the head of any nigga want it, man (Woo)
Pop me a Xanny, I'm fast, I'm so fast, I'm so faster than Sonic, man (Woo)
True the man, true the man, true to my nigga True Religion Buddha man (Woo)
My money stack tall as Ludacris afro and I swear I'ma shoot with that (Woo)
I just hit for nine birds, what I'ma do with that?
Pull up on the curb, then you hop out and be through with that (Ooh)
I'm so fresh like dish detergent, if you not fresh, you so through with that (So fresh)
If you are a nerd, everything here, you not cool with that

[Verse 1: Young Thug]
Yes, you not cool
No, you not bool (What?)
I don't give no damn, I'm not calling you boo (Uh-uh)
My bitch, she a jewel (Whoa)
You can't prove a point, boy, you know you so doomed (You dig?)
You know you so doomed (Yeah)
I swear I'm so lost with no clue, don't know what to do (What?)
Over loud, over loud (Yeah)
I over loud on these niggas
Ain't know how to milk these cows
She made that dick grow, now it's big like a tower
Yow, front pockets filled up with bands, no Bible
[Chorus: Young Thug & Lil Duke]
Hundred bands, hundred bands dropped on the head of any nigga want it, man (Woo)
Pop me a Xanny, I'm fast, I'm so fast, I'm so faster than Sonic, man (Woo, woo)
True the man, true the man, true to my nigga True Religion Buddha man (True it, woo)
My money stack tall as Ludacris afro and I swear I'ma shoot with that (Sheesh, sheesh)
I just hit for nine birds, what I'ma do with that? (Sheesh, sheesh)
Pull up on the curb, then you hop out and be through with that (Skrrt)
I'm so fresh like dish detergent if you not fresh, you so through with that (Clean)
If you are a nerd, everything here, you not cool with that (Hey, dork)

[Verse 2: Lil Duke]
Pull up, hop out the block, they tuck in they tail, I go, ""Who the clan?"" (Cacaw, cacaw)
We dressed in all-black, I'm always on the road just like a Uber man (I'm textin')
We wrappin' and sendin' them packs, soon as they land, we movin' 'em (Wrapped, shipped)
Blame it on the OGs, they influenced me (I'm ridin' with felons)
Ain't gonna count money, nigga (Uh-uh, nah)
I ain't just met money, nigga (Ain't just met money, nigga)
I put lipstick on the 'Rari, she say that's delicious (Skrr-skrr-skrr-skrr)
Who that is in that Crown Vic? He look suspicious (Oh, him, shh)
I just jugged a hundred pounds, I made a…

[Chorus: Young Thug]
Hundred bands, hundred bands dropped on the head of any nigga want it, man (Woo, woo)
Pop me a Xanny, I'm fast, I'm so fast, I'm so faster than Sonic, man (Woo, woo)
True the man, true the man, true to my nigga True Religion Buddha man (Sheesh, woo)
My money stack tall as Ludacris afro and I swear I'ma shoot with that (Yeah, sheesh, sheesh)
I just hit for nine birds, what I'ma do with that? (Hey)
Pull up on the curb, then you hop out and be through with that (Skrrt-skrrt)
I'm so fresh like dish detergent, if you not fresh, you so through with that (Fresh)
If you are a nerd, everything here, you not cool with that
[Outro: Young Thug]
Yeah, you not cool with that
No, you not cool with that
No, you not cool with that
Yeah169Embed"
Young Thug,4786140,54639,20503,Young Thug,https://images.genius.com/33c52a00b694afff704c64a80dad42c2.300x300x1.png,Hot,https://genius.com/Young-thug-hot-lyrics,786944,"Hot Lyrics[Intro: Gunna]
Wheezy outta here
Hot, hot, hot, hot
Hot, hot, hot, hot
Hot, hot, hot, hot
Hot, hot, hot, hot

[Chorus: Gunna]
Everything litty, I love when it's hot
Turned up the city, I broke off the notch
Got some more millis, I keep me a knot
I created history and made me a lot
He tried to diss me and ended on Fox
We call them chopsticks 'cause they gonna chop
Took her out of Follies 'cause her pussy pop
I run it like Nike, we got it on lock

[Verse 1: Gunna]
Cartier eye
I'm the bossman in a suit but no tie
I can't be sober, I gotta stay high
Pour me some syrup in a Canada Dry
Ridin' in the spaceship like Bonnie and Clyde
Don't worry, baby, I keep me some fire
Shenenehs and Birkins, she cannot decide
The latest Mercedes her go-to surprise
Don't sleep on miss lady, her pussy a prize
Dick in her back while I'm grippin' her sides
Bigger Maybach, this ain't regular size
We really fly, we like pelican glide
Bitch, you ain't slick, I can tell the disguise
Upgraded my wrist, put baguettes in that Sky
She sing, I might sign her and change her whole life
I told her to gargle and work on her highs
[Chorus: Gunna]
Everything litty, I love when it's hot
Turned up the city, I broke off the notch
Got some more millis, I keep me a knot
I created history and made me a lot
He tried to diss me and ended on Fox
We call them chopsticks 'cause they gonna chop
Took her out of Follies 'cause her pussy pop
I run it like Nike, we got it on lock

[Interlude: Young Thug]
Cash, money, checks, cash
Addy, Birkin, brand new extendos
I just wanna fuck the bitch by myself
I just passed her to the dawg like my Sprite

[Verse 2: Young Thug]
I took the Bentley coupe back, then I hopped in a Cayenne (Skrrt)
I put the bitch in the front of the Bentley, in front of the driver (Skrrt)
Ayy, man, this synthetic weed, you can't smoke in the Rolls Royce, woah, woah (Yeah, yeah)
I'm still double cupped up, I'm drinkin', I shoot off your tires, huh (Doo-doo-doo-doo-doo-doo-doo-doo)
I'm in the coupe by myself
I had to kick a door when I was 5
Keep the awards on the shelf
Whole sixteen round in the fire
I'm sick and tired of these young niggas act like they firin', they tellin' these lies
Actin' like they the ones created this and they get all the drip from my guys
Yeah, Cartier eyes
Cartier coat, Cartiers the watch
Cartier love, Cartier the thot
Cartier specs, buffalo on the side
Princess cut diamonds, they Cartier, yeah
Cartier bag for the Cartier thot
Sky Wrangler coupe with two hundred the dash
Cartier jeans, ain't no way I can sag
Ain't no way I'ma ever gon' go out bad
I can't go out, no way I'ma go out
I just grip on her ass and I show out
I sit like a champ and I wait on a hold-out
I just whip up a new Chanel Patek
I whip with the wrist and I don't break the door out
Turn the whole top floor to a whorehouse
Hundred racks in ones, dude brought the flood out
[Outro: Gunna]
Hot, hot, hot, hot
Hot, hot, hot, hot
Hot, hot, hot, hot, damn
Hot, hot, hot36Embed"
Young Thug,293976,11524,20503,Young Thug,https://images.genius.com/626624fcc83587690d0dd5da90f37bc0.300x300x1.jpg,2 Bitches (Danny Glover),https://genius.com/Young-thug-2-bitches-danny-glover-lyrics,781327,"2 Bitches (Danny Glover) Lyrics[Intro]
Thugger Thugger
Thugger
Stoner Life, YSL
(808 Mafia)

[Chorus]
Okay, cool, okay, bool, I love her
I'ma save her, yes, like Danny Glover
I'ma call my papi for her, fuck the mother
I pass them a molly, now they kiss each-other (Hot)
Every time I fuck I gotta hit me least like two bitches
Boy, that dope been whipped, you need like new wrists
Foreign car outside, that bitch got two digits
Money stand like eight feet just like two midgets

[Verse 1]
Who the fuck told you that Young Thugger Thugger don't fuck up the beat?
I got six cars, and I also got rentals, and all of 'em tinted
No, I'm not Nipsey, not from L.A., but I got keys to the city
I fuck it, I suck it, I beat it down, then she beat me to the ceiling
Stoner my lifestyle
I'm livin' too wild
I came to make you proud
That money keep her around
In love with her head, I can't turn it down
Can't wait for my time to come back around
She see that you don't got Lil Haiti's style
Plus I just seen Snoop on Girls Gone Wild
I just bought a Bentley and a bitch came with it
Young rich nigga hittin' million dollar licks
Balling in New York like a motherfucking Knick
You better have them racks, you ever want to hear me spit
And everywhere I go I gotta pass like the staff
I'm goin' off top like a motherfuckin' lay up
357, six shots like Al
I left ten bands in a motherfuckin' cab
[Chorus]
Okay, cool, okay, bool, I love her
I'ma save her, yes, like Danny Glover
I'ma call my papi for her, fuck the mother
I pass them a molly, now they kiss each-other (Hot)
Every time I fuck I gotta hit me least like two bitches
Boy, that dope been whipped, you need like new wrists
Foreign car outside, that bitch got two digits
Money stand like eight feet just like two midgets

[Verse 2]
I knew I was gonna run my money up and everybody didn't
All these niggas pussy niggas, tellin' on they partner
Hope the pussy nigga get a bigger sentence
Pussy nigga play, I'm coming back with the K
And I'ma shoot that motherfucker 'til he livid
Bitches wanna see a nigga thumb through it fast
I'ma name myself Young Thug Attendant
Hundred bands at a time I fronted you bags, but you
I don't like using profanity, but the Young Thugger will cut you
All of my cups are muddy I fuck my bitches' buddies
I just want nut like Buddy, all of my bitches buddies
Panamera with the tinted roof
All the niggas dogs goin', ""Roof""
Top notch shawty, nigga ring came with karats
Young nigga rich, jewelry colder than the attic
If she ain't a virgin, then that bitch is only average
I can't even hear ya, baby, get rid of the static
I can't learn a bitch, but I learned mathematics
I just ball her down whenever she call my pattern
[Chorus]
Okay, cool, okay, bool, I love her
I'ma save her, yes, like Danny Glover
I'ma call my papi for her, fuck the mother
I pass them a molly, now they kiss each-other (Hot)
Every time I fuck I gotta hit me least like two bitches
Boy, that dope been whipped, you need like new wrists
Foreign car outside, that bitch got two digits
Money stand like eight feet just like two midgets347Embed"
