artist,id,lyrics_owner_id,primary_artist_id,primary_artist_name,song_art_image_thumbnail_url,title,url,pageviews,lyrics
Young Thug,4786041,104344,20503,Young Thug,https://images.genius.com/33c52a00b694afff704c64a80dad42c2.300x300x1.png,Sup Mate,https://genius.com/Young-thug-sup-mate-lyrics,201569,"Sup Mate Lyrics[Intro: Future]
(DY Krazy)
Yellow tape, I put that on (Yeah, yeah)
Hold up, wait, life's great (Yeah, yeah)
Hold up, wait, ice skate (Yeah, yeah)
Hold up, wait, crime pay (Yeah, yeah)
Hold up, wait, slatt, slatt (ATL Jacob, yeah, yeah)
Twenty cars, matte black (Yeah, yeah)
Surfin' at a Ritz Carlton (Yeah, yeah)
Two pink toes (Poof, poof, yeah, yeah)

[Verse 1: Young Thug & Future]
Oxycontin what I piss
(Yeah, yeah, yeah-yeah, yeah, yeah, yeah, yeah)
Flip it to the dog like a dish
(Yeah, yeah, yeah-yeah, yeah, yeah, yeah, yeah)
Accept the loss before I quit
(Yeah, yeah, accept the loss before I quit, yeah, yeah)
She slept at the house, I bought her Ruth Chris
(Yeah, yeah, yeah-yeah, yeah, yeah, yeah, yeah)

[Chorus: Future & Young Thug]
What's up, mate? Got cake, mate (Yeah, yeah)
Got cheese, mate, got bread, mate (Woo)
Got cups, mate (Woo, ooh), no fucks, mate (Woo, mate)
Give no fucks, mate (Woo, geeked, mate), I'm up, mate (Woo, outta shape, yeah, yeah)
It's up, mate, I buck, mate (Yeah, yeah)
I bleed, mate, he bled, mate (Woo, yeah, yeah)
Got cups, mate, (Woo) no fucks, mate
Let's fuck, mate (Woo)
Fucked my classmate (Woo), fuck, shit, let's splash, mate (Woo)
Or suck that shit, let's splash, hey
[Verse 2: Future]
Smokin' on loud, we don't fuck around with y'all
Wanna try this shit, let me know
We prepare first and then Columbine
Trenchcoat, under a nigga's sleeve

[Refrain: Future & Young Thug]
Wipe his nose, wipe his nose (Pussy ass nigga)
Wipe his nose, (Slatt) wipe his nose (Wipe your nose)
Wipe his nose, (Wipe your nose, slatt) wipe his nose (Slatt, wipe his nose)
Wipe his nose, (Wipe your nose), wipe his nose (Yeah, yeah)

[Verse 3: Future]
Doubled the cups and then doubled it up and I doubled it up (Yeah, yeah)
Jump in the Bentley, I jump in the truck and I trucker the truck (Woo, yeah, yeah)
Chuggin' it down, I'm smokin' a pound, I'm fuckin' around (Yeah, yeah)
Smokin' on loud, we don't fuck around with y'all

[Chorus: Future]
What's up, mate? (Woo) Got the blicky, featherweight (Woo)
Got the cash, I bake the cake, (Woo) ayy, what's brackin', mate? (Woo)
I just sniper, mate, (Woo) chain on hydrate, mate (Woo)
Get no sleep, mate, (Woo) I'm geeked, mate, pushin' weight, outta shape (Yeah, yeah)

[Verse 4: Young Thug & Future]
Red wings, red bottoms, I'm a fuckin' devil (Yeah, yeah)
Twenty tennis chains on, not no Ric Flair medal (Woo, yeah, yeah)
I don't gotta run it back, you heard what Gunna tell 'em (Yeah, yeah)
Put my diamonds in a bowl, that look like Fruity Pebbles
[Verse 5: Future]
Yeah, yeah, yeah, yeah
Bitch wanna hit her a lick, yeah (Yeah, yeah, yeah, yeah)
Bitch wanna suck on the dick, yeah
Bitch wanna get her a brick, yeah (Yeah, yeah, yeah, yeah,)
Bitch wanna fuck on a bitch (Yeah)
Bitch wanna fuck on the clique (Yeah, yeah)
Euros on euros, I'm gettin' it (Uh)
Step on the floor, now I'm lit (Woo)

[Refrain: Young Thug & Future]
Wipe his nose, wipe her nose (Woo)
Kick a door, keep the Ruger (Woo)
Put the pole in his ho, bend her over (Woo, woo, woo)
Then you buy that bitch a brand new Range Rover (Woo, woo, yeah, yeah, yeah, yeah)

[Verse 6: Future & Young Thug]
I'm so high, all I can say is ""Woo, woo, woo""
I can't talk, I barely could say, ""Woo, woo, woo""
Count a M and count another one, ooh, ooh (Ooh)
Fuck that shit, I enter the lotto, woo, woo (Fuck it, yeah, yeah)

[Verse 7: Young Thug & Future]
Count a half and another
(Woo, woo, yeah, yeah, yeah, yeah, yeah)
I can never be a facade relative
(Woo, woo, yeah, yeah, yeah, yeah, yeah)
Up to the sky with my mom, brothers
(Woo, woo, yeah, yeah, yeah, yeah, yeah)
They let it hit from the side, they were all cudders
(Woo, woo, fuck it, yeah, yeah)
[Verse 8: Future]
Oh, okay, fuck her good, make her try voodoo
Okay, my plug put me on, I call him Lou Lou
Hood nigga, pay it in full, I'm a black Jew
What's population? I come from the trenches, we pray for a brick
What's poppin', lady? Bitches love a nigga's accent (Woo, woo)
Pain pills, codeine, hydro, acid (Woo, woo)
I hang with some slimes, pullin' kick doors (Woo, woo)
Outchea, outchea, quit your reachin'
Gucci socky on my feet
Sloppy toppy, keep it neat
One, two, three, I got freaks
Ooh, four girls on fleek
Ooh, bad and saditty
Ooh, ass and her titties
Ooh, that ting litty
And my Spanish ting, she bad like J. Lo (Ooh, ooh)
I crushed up an X pill in her asshole (Ooh, ooh)
Fifty-round clip, got my Draco (Ooh, ooh)
I should, I should teach drug classes (Ooh, ooh)
I stay on my grind, Margiela ten toes (Ooh, ooh)
Money on my mind, I'm a nympho (Ooh, ooh)

[Outro: Future]
Ooh, ass and her titties (Ooh)
Ooh, that ting litty (Ooh)
Ooh, ass and her titties (Ooh)
Ooh, that ting litty (Ooh)
Ooh, ass and her titties (Ooh)
Ooh, that ting litty (Ooh)14Embed"
Young Thug,7290862,498964,20503,Young Thug,https://images.genius.com/c9d5a44065ca15d1224e3f543d4510df.300x300x1.png,Bubbly,https://genius.com/Young-thug-bubbly-lyrics,200736,"Bubbly Lyrics[Intro]
Wheezy outta here

[Verse 1: Young Thug]
My career 'bout to blast like bubbly
I'm not waitin' for her to say she love me
I can tell she fuck with me, man, trust me
I got a ten-year-old mink still ain't fuzzy
Three-twenty-five on the dashboard
Ridin' in the Porsche, rockin' Tom Ford
I ball at Barneys, new Christian Dior
I took the jet to the New York store
She lick while I'm drivin', I'm stainin' the floor
I took it off track, now I'm ridin' in sport (Yeah)
You stay in your feelings, you never my boy
I can't come to the hood, I pull a decoy
Another body drop and they screamin' my name
I'm goin' to L.A. on a private plane
Could never come back and my family straight (Grrah)
I'm touchable? No, I'm too rich and too paid
Skeleton Cartier, black diamonds face
Pull up too deep like a fuckin' parade
Old jealous-ass niggas tryna fuck up my pay (Ha)
Blast off, Rolls-Royce Cullinan rain (Broke niggas)
I put baguettes in my wrist and my neck and my ears and my motherfuckin' chains (Chains)
This drip out the trenches, I know you gon' dig it, I come through this motherfucker plain (Woah)
I cut up my wrist, soakin' wet (Yeah) and Coachella keep callin', they won't see the face
I took her to China and changed up her climate and now she ain't talkin' the same (Woah, yeah)
[Verse 2: Travis Scott]
Five nights up, still poppin' and ragin'
The SVR still livin' deranged (Yeah)
I want her, she wanted the same
Hit 'em both same time, both glad that they came (It's lit)
Keep me a vibe, but can't keep it contained
Know I keep me some dawgs, always keep 'em in training (Oh)
Tat' a logo on the back of my brain
Don't ask me what the fuck am I thinkin'
Back of these walls, I'm full of that drank
Eric came through with a little entertainment (It's lit)
Area 29, got it lookin' like space
Houston, it's a problem way we bustin' up faces and shit
I came with the snakes, no squids (Straight up)
I broke out the game with a 456
She lovin' the fest', I see it
She lovin' the fest' (Straight up, straight up)
Yeah, I see it on her face, and I'm lovin' that body
In lace, I know you lovin' Spider and Jack
Yeah, I know you got taste, if you love yourself, take shots with me
If I love you, I'll drop you a pin to a time and a place (Wait)

[Verse 3: Drake]
YSL'll put a nigga six feet
I ain't beggin' when I tell a bitch, ""Please""
Me and lil' Thugger on fleek
Now that lil' ho wanna meet, ayy
What, what, what, what?
Fuck her on beat
OVO life not cheap
I'm a young boy too T'd
Wire just hit my account, never seen that amount, oh God, I'm geeked
Been on the charts for five hundred weeks, so somebody love when I speak
Doin' this shit just to show we get down in the 6, man, it's bigger than me
Texas ranch so big, that shit is perfect for the dippin'
I don't care how wet I get her, she won't catch me—
Three-twenty-five on the dashboard
Ride in the Porsche, rockin' Tom Ford
Rockin' her bed and the headboard
What, what, what, what?
Buyin' out Louis and Christian Dior
I took the jet to the New York store
Park at the regular airport
You stay in your feelings, was never my boy27Embed"
Young Thug,4373984,4305077,20503,Young Thug,https://images.genius.com/501925372ff9e2c2da8a22073150b8eb.300x300x1.png,Lil Baby,https://genius.com/Young-thug-lil-baby-lyrics,199154,"Lil Baby Lyrics[Intro]
Yeah, yeah, yeah (Slatt)
Yeah, yeah, yeah (I'm surfin')
Woah, woah, woah
I'll totally come and shoot your shit up, know what I'm sayin'?
No cap, woah
Young SEX

[Chorus]
Fuck it, buy a pink Mercedes (Skrrt)
I made Forbes every year, lil' baby (Top the Forbes)
I don't like no long nails on my lady (Of course)
Is it you that can't reveal that I'm shady?
White toes in her heels, she the latest (Toes)
She got plastic Cartiers, think she made it (She made it)
Sucked it in the car and then my kids met the pavement
Extended pumps and F&Ns like The Matrix (Young SEX)

[Verse 1]
Diamonds on me wetter than a tub
Shoppin' every day 'cause we used to be fucked up
Keep a yellow Cinderella on the tuck
YYB's on, ain't no way I'm givin' up
Different color diamonds on me, bitch, I'm dead wrong
And my bitch in Saudi Arabia, but her redbone (She red)
I got money, niggas doubted, now I'm mad on (Mad on)
Ayy, I got Rollie-Pollies, I'm on two tone (Yeah, yeah)
These tenderoni can't get off me, I see (I see)
My slime brothers Pluto, Savage, and YB (Baby)
Quavo (XO), Takeoff (Scooter), Offset (Roddy), Uzi (RJ)
Lil Durk (Moses), Meek Mill (Nipsey), Drizzy (Travis)
More names (Juice WRLD), plenty (PnB, Young SEX)
[Chorus]
Fuck it, buy a pink Mercedes (Skrrt)
I made Forbes every year, lil' baby (Top the Forbes)
I don't like no long nails on my lady (Of course)
Is it you that can't reveal that I'm shady?
White toes in her heels, she the latest (Toes)
She got plastic Cartiers, think she made it (She made it)
Sucked it in the car and then my kids met the pavement
Extended pumps and F&Ns like The Matrix (Young SEX)

[Verse 2]
I keep exotic drinks and juices by the crates (Young SEX)
She put my cum in her cup like it was shake
I'll never fuck this bitch again, it was a mistake
I'm Teletubby, diamonds green, blue, white, and grape
I can afford these black diamonds like a spade (Oh)
I maneuver through the city with a maid
I got riches and I guard 'em like the Navy
Pin it up and let me drink it like you're naked (Let's go)
It don't matter the ho call like mine baby (It don't matter)
Got a lil' money to leave your head on the pavement
Flawless carats got these niggas stand in they places
AR'd up before I come and issue statements (Young SEX)

[Chorus]
Fuck it, buy a pink Mercedes (Skrrt)
I made Forbes every year, lil' baby (Top the Forbes)
I don't like no long nails on my lady (Of course)
Is it you that can't reveal that I'm shady?
White toes in her heels, she the latest (Toes)
She got plastic Cartiers, think she made it (She made it)
Sucked it in the car and then my kids met the pavement
Extended pumps and F&Ns like The Matrix
[Outro]
Drippin', drippin' gold (Drip), wipe a nigga nose (Wipe a nigga nose)
This year I'm goin' back thirty-two goals (On you hoes)
This year I seen thirty-two mil' (Yeah)
Last year I popped thirty-five thousand pills (No cap)
Bigger X pill like a ferris wheel (Woo)
I go Juntao, blond hair, yeah
Long living like a motherfuckin' wrestler
If I ask, I know she'll let me live like I'm a bachelor
Mercedes
Baby
My mama hate it
Reveal I'm shady
Ladies
Baby
Baby10Embed"
Young Thug,2099000,1248920,20503,Young Thug,https://images.genius.com/e7c67a01f872ff7f8c60b34a636ec3f4.300x300x1.jpg,No Way,https://genius.com/Young-thug-no-way-lyrics,197926,"No Way Lyrics[Intro]
Yeah, Thugger
London on da Track, nigga
Yeah, yeahhh
Yeah, yeah, yeah-ooh
Thugger

[Chorus]
These pussy niggas peasants, yeah (What?)
All my niggas gon' be presidents, yeah (Here)
Bitch I'm wrapped up like a present, yeah
I got credit fuck a debit (Fuck it)
And, I'm the truth this not no flexing
I got, skinny jeans with a weapon
And, I'm the future and the present
Baby, pop that pussy like a Pepsi (Pop it)
Baby (Pop it), water like a water fountain
My money colored like a clown
Show me them places like a noun
She can't, can't ride this dick without a sound

[Post-Chorus]
No, no, no way, no-no way (No way)
No, no, no way, no-no way (No way)
No, no, no way, no-no way (No way)
No-no way, no-no way, no-no way
No way, no way, no way no way, no-no way
No way, no way, no way no way, no-no way, no-no way
No way, no way, no-no way, no-no way
No way, no way, no-no way, no-no way
[Verse 1]
Uh, I flood that bitch, she pop that pussy like a handstand
I get them bricks and bales and go do the Saran dance
I told that bitch suck my vienna out the can, man
She started doing it without a command
I want you to feel this dick inside your hips
And I wanna eat that pussy creamy like a dip (Uhm)
Her pussy wetter than the bottom of a ship
And I wanna make it clap without a clip
Put your motherfucking hands in the sky
Throw it up, plus I'm too drunky to drive
Wanna put that pussy, pussy in the sky-y (Sky)
Wanna make that pussy squirt without a try-y (Try)
I might hit that pussy wrong and make it right-ight (Right)
If I start from the ground, I'll hit the sky-y (Sky)
I wear big time glasses
But I got these bands like I'm fuckin' Ray-Ban bitch

[Chorus]
These pussy niggas peasants, yeah
All my niggas gon' be presidents, yeah (Here)
Bitch I'm wrapped up like a present, yeah
I got credit fuck a debit (Fuck it)
And, I'm the truth this not no flexing
I got, skinny jeans with a weapon
And, I'm the future and the present
Baby, pop that pussy like a Pepsi (Pop it)
Baby, (Pop it) water like a water fountain
My money colored like a clown
Show me them places like a noun
She can't, can't ride this dick without a sound
[Post-Chorus]
No, no, no way, no-no way (No way)
No, no, no way, no-no way (No way)
No, no, no way, no-no way (No way)
No-no way, no-no way, no-no way
No way, no way, no way no way, no-no way
No way, no way, no way no way, no-no way, no-no way
No way, no way, no-no way, no-no way
No way, no way, no-no way, no-no way

[Verse 2]
I called my baby my shorty, I got her looking up
I told that club I need fifty bands if they're booking her
I woke up and ate it just like my chef was cooking her
Or room service, watch out she at school nerdy
What's up to Boo Dirty, walk 'round with a cool 30
I don't care where they flying I just wanna know who birdy's
Babe, don't waste no time, come on suck it's 2:30
I left my bitch 'cause I found out she was too flirty (What?)
Yeah, I designed all of my pants
I ain't give no damn I used to spending fifty bands
Yeah, green land Tarzan
I got bitches piling up like we some yams
She wish she could get my dick inside a can
I got three lil' boys which means that I'm the man
I'ma pick my carats out a rabbit
And I get mostly green like a salad
[Chorus]
These pussy niggas peasants, yeah (What?)
All my niggas gon' be presidents, yeah (Here)
Bitch I'm wrapped up like a present, yeah
I got credit, fuck a debit (Fuck it)
And, I'm the truth this not no flexing
I got, skinny jeans with a weapon
And, I'm the future and the present
Baby, pop that pussy like a Pepsi (Pop it)
Baby (Pop it), water like a water fountain
My money colored like a clown
Show me them places like a noun
She can't, can't ride this dick without a sound

[Post-Chorus]
No, no-no way, no-no way (No way)
No, no-no way, no-no way (No way)
No, no-no way, no-no way (No way)
No-no way, no-no way, no-no way
No way, no way, no way no way, no-no way
No way, no way, no way no way, no-no way, no-no way
No way, no way, no-no way, no-no way
No way, no way, no-no way, no-no way16Embed"
Young Thug,786788,172030,20503,Young Thug,https://images.genius.com/271db73c3867ea37008e1a0a309aa195.300x300x1.png,Dome,https://genius.com/Young-thug-dome-lyrics,193069,"Dome Lyrics[Intro: Young Thug]
(Wheezy Beatz)
Yeah, okay

[Pre-Chorus: Young Thug]
I got like 5 million and 12 hundred thousand hoes (Racks)
They drippin' all over my motherfuckin' clothes (Sheesh)

[Chorus: Young Thug]
Let's go off the dome (Woah), I can't make it home (No)
I fucked her, I boned her (Yeah), she leave an aroma (Skrt)
They calling my phone up (Brrt, brrt), my girl like ""What's going on?"" (Brrt, brrr)
She sucking, put me in a coma (Slurp), I nut on that fish on my sofa (Yeah)

[Post-Chorus: Young Thug]
Yeeeeeah (Yeah, yeah, yeah, yeah)
Yeeeeeah (Yeah, yeah, yeah, yeah)
Yeeeeeah (Yeah, yeah, yeah, yeah)
What's brackin'? (Yeah)

[Verse 1: Young Thug & Lil Duke]
Dickie suit, chucks
Flag hanging to the right
Put that young bitch in a bucket
Kid Cudi, fuck her all day and all night
Okay, I'm in this bitch with Lil Duke, Longway
You can be with me, you too, four way
Put that bitch off from my deuce, slow day
I'ma sell at least like two
Thugga Thugga, what it do?
Riding in the fast lane, I'm eluding (Skrrr)
All these drugs that we abusing (Drugs)
Addicting to winning, not losing
I'm in the kitchen just cooking (Cook it up)
Middle finger to a bookin' (Fuck 'em)
Fuck running off, fuck nigga I took it
Diamond so wet, I might need to douche it
Diamonds they shower, they shower me
Yes that lil' nigga I got with me
When it's war my niggas count on me
Beyoncé, bitch, I'm a bumble bee
This the beehive, this my turf, bitch, you can't sting on me
Jingle bells, baby, you can ring on me
[Chorus: Young Thug]
Let's go off the dome, I can't make it home
I fucked her, I boned her, she leave an aroma
They calling my phone up, my girl like ""What's going on?""
She sucking, put me in a coma, I nut on that fish on my sofa

[Post-Chorus: Young Thug]
Yeeeeeah (Yeah, yeah, yeah, yeah)
Yeeeeeah (Yeah, yeah, yeah, yeah)
Yeeeeeah (Yeah, yeah, yeah, yeah)
What's brackin'? (Yeah)

[Verse 2: Lil Duke, Young Thug, Both]
458 California 'Rari, I got that old money, call it Atari
Let's go off the dome, I trap by the Dome, keep a couple grams in my fifth pocket
Keep a pocket rocket on me, ain't no guessing if I'm gon' pop it
Got a lot of blood homies, and guess what? It ain't no stopping
Hop in the car and I'm wyling, I'm styling, I hop out and cuss out my driver (Skrrt, hop in)
Fuck nigga try me, no Eddie Bauer, I'ma pull up and make it rain, showers (Ahh, grah, grah)
I'm a lil' kid when it come to that pussy, I hop up like the Icy Tower (Hop up, yeah)
I would rather be a coyote than be a coward (Damn)
I creep right up on them, hit 'em with the AK, 7 in the morning (Pew, pew)
No Christmas Eve, caught him by surprise, he was still yawning (Ahh!)
I'm running the city, you riding in that loaner, I'm running with owners
I'm running with armor, I'm not even thinking I'm right off the dome
[Chorus: Young Thug]
Let's go off the dome, I can't make it home
I fucked her, I boned her, she leave an aroma
They calling my phone up, my girl like ""What's going on?""
She sucking, put me in a coma, I nut on that fish on my sofa

[Post-Chorus: Young Thug]
Yeeeeeah (Yeah, yeah, yeah, yeah)
Yeeeeeah (Yeah, yeah, yeah, yeah)
Yeeeeeah (Yeah, yeah, yeah, yeah)
What's brackin'? (Yeah)43Embed"
Young Thug,4786043,4305077,20503,Young Thug,https://images.genius.com/33c52a00b694afff704c64a80dad42c2.300x300x1.png,Ecstasy,https://genius.com/Young-thug-ecstasy-lyrics,192007,"Ecstasy Lyrics[Intro: Young Thug]
12 Hunna on the beat
DY Krazy
(Pure codeine, I need extra now
Pure codeine, I need extra now, yeah
Pure codeine, I need extra now)
Pure codeine, I need extra now, ecstasy
Pure codeine, I need extra now, ecstasy
Pure codeine, I need extra now, ecstasy (Wah, wah)
Pure codeine, I need extra now, privacy (Yeah)

[Chorus: Young Thug]
Molly, Roxies
Oxycontin (Yeah)
Jubilee, Ostrich (Uh-uh)
Ten a key, we need thousands (Okay)
I can take the stick and I can lift it up (Yeah)
I can take this bitch and I can lift her up (Ayy)
I just took a bankroll and I lift it up (Okay)
I just drunk a PT, it was double sealed up

[Verse 1: Young Thug]
Yes, it's paid for, it's pretty and classy
You look way, way, more idiot than your crushes
Icy, icy, I got baddies in my custody
I been chewin' on that chewy and this ecstasy
I been kickin', bitch, and drippin' Louis quilt
Hundred Percocets, I took like four or five off the rip
My dick hard, bitch, come get after it
Growin' up, I kept a gun like a veteran
Soul snatcher, promise you ain't comin' back from this
She bad, treat her like the principal at teacher list
Yeah, make sure that the opposites kickin' it
Yeah, jewelry kickin' bullet and we keepin' it, no cap
[Chorus: Young Thug]
Molly, Roxies
Oxycontin
Jubilee, Ostrich (Uh-uh)
Ten a key, we need thousands (Okay)
I can take the stick and I can lift it up (Yeah)
I can take this bitch and I can lift her up (Ayy)
I just took a bankroll and I lift it up (Okay)
I just drunk a PT, it was double sealed up

[Verse 2: Machine Gun Kelly]
Fuck it
Inside of my house look like Colombia, I love it
Bloody fingerprints on my fingers from countin' hundreds
Learned from watching Goodfellas to keep it in the cupboard
Guns are just like pussy, pull it out, you better bust it
I might be in traffic in rush hour like Chris Tucker
Lord, I keep that MC Hammer, no, you cannot touch it
I might go on tour and fuck a daughter and her mother
Pour some drank that's red like Robitussin, ayy
If I get pulled over, put my coke inside your crack, yeah
We get home, I pop a pill and I'll blow out your back, yeah
If I die today, like Makaveli, bring me back, yeah
If I got a problem, call my slime and he say, ""Slatt,"" yeah

[Chorus: Young Thug]
Molly, Roxies
Oxycontin
Jubilee, Ostrich (Uh-uh)
Ten a key, we need thousands (Okay)
I can take the stick and I can lift it up (Yeah)
I can take this bitch and I can lift her up (Ayy)
I just took a bankroll and I lift it up (Okay)
I just drunk a PT, it was double sealed up18Embed"
